,codigo,titulo,fecha_inicio,fecha_fin,investigadores,institucion,programa,fuente
205,ID16AM0060,Plasma rico en plaquetas de donante joven para el tratamiento de la úlcera venosa del adulto mayor,01/07/2016,01/07/2016,F. Salech,Dirección General,FONDEF,Idea Bietapa temático
206,1151297,Cellular senescence and senescence-associated secretion phenotype (SASP) involvement in the inverse association between Alzheimer disease and cancer,01/03/2015,01/03/2019,"M. Behrens / F. Salech, C. San Martín, A. Couve, M. Henríquez",Servicio de Neurología - Neurocirugía,FONDECYT,Regular
207,HJJA-1_2009,Rol de la vía Klotho -FGF23 en la disfunción linfocitaria asociada a la uremia: descripción de la vía klotho-FGF23 en linfocitos CD4+ humanos,01/12/2009,01/12/2010,"F. Salech / A. Couve, M. Alvo, L. Michea",Servicio de Nefrología,Hospital Clinico,Investigación Clínica 
208,1241622,"Study of safety, efficacy, and mechanism of action of a new cancer-based immunotherapy for Alzheimer's disease.",01/08/2023,01/08/2023,"C. San Martín / M. Behrens, O. Barajas, M. López, F. Salech",Departamento de Neurociencias,FONDECYT,Regular
209,1230064,Therapeutic strategies to improve cognitive resilience in metabolic alterations and neurodegeneration,01/07/2022,01/07/2022,C. San Martín,UAUT. Instituto de Ciencias Biomédicas (ICBM),FONDECYT,Regular
210,SA23I0059,Suplementación con vitamina D previene la disfunción cognitiva post-operatoria en personas mayores: Estudio clínico aleatorizado,01/05/2023,01/05/2023,"C. San Martín / A. Penna, M. Behrens, F. Salech, V. Rojas, D. Adjemian",Departamento de Anestesiología y Reanimación,CONICYT/MINSAL,FONIS-Proyectos I&D
211,1220851,Unraveling the role of vitamin D on cell protection in alzheimer disease: A central role of Mitochondria,01/09/2021,01/09/2021,C. San Martín / M. Behrens,Departamento de Neurología y Neurocirugía Norte,FONDECYT,Regular
212,SA22I0025,Suplementación con vitamina D previene la disfunción cognitivapostoperatoria en adultos mayores: Estudio clínico aleatorizado,01/06/2022,01/06/2022,"C. San Martín / V. Rojas, A. Penna",Departamento de Neurología y Neurocirugía Norte,CONICYT/MINSAL,FONIS-Proyectos I&D
213,1220248,Modulation of PTP1B as a novel strategy to induce cognitive resilience in Alzheimer's disease and obesity/type 2 diabetes,01/08/2021,01/08/2021,C. San Martín,UAUT. Dirección de Investigación y Postgrado,FONDECYT,Regular
214,13220013,Sensitivity to general anesthesia as the first brain stress test to early detect cognitive impairment in older adults,01/09/2022,01/09/2022,A. Penna / C. San Martín,Departamento de Anestesiología y Reanimación,Fondecyt_Anid,Proyectos de Exploración
215,ID21I10096,M@yores app: software para fomentar la práctica de una vida saludable en el adulto mayor,01/09/2021,01/09/2023,"C. Delgado / F. Salech, C. San Martín, C. Márquez, J. Velásquez, M. Behrens",Centro de Diagnóstico,FONDEF,IDEA
216,1211382,UNRAVELING THE ROLE OF VITAMIN D ON CELL PROTECTION IN ALZHEIMER DISEASE: A CENTRAL ROLE OF MITOCHONDRIA,01/08/2020,01/08/2020,"C. San Martín / N. Rogers, M. Behrens",Facultad de Medicina,FONDECYT,Regular
217,1190958,Cancer leaves a trait of diminished immune tolerance that protects from Alzheimers disease,01/04/2019,01/04/2023,"M. Behrens / C. San Martín, A. Paula Lima, F. Salech, M. López",Centro de Diagnóstico,FONDECYT,Regular
218,1171468,Effect of supplementation with a natural antioxidant (astaxanthin) on aging and cognition. Study in aged rats and patients with mild cognitive impairment. ,01/09/2016,01/09/2016,"C. San Martín, M. Hidalgo, M. Behrens",UVAL. Depto. de Fisiología,FONDECYT,Regular
219,1151297,Cellular senescence and senescence-associated secretion phenotype (SASP) involvement in the inverse association between Alzheimer disease and cancer,01/03/2015,01/03/2019,"M. Behrens / F. Salech, C. San Martín, A. Couve, M. Henríquez",Servicio de Neurología - Neurocirugía,FONDECYT,Regular
220,3140467,Estudio de un nuevo biomarcador plasmático para la detección de deterioro cognitivo leve,01/11/2013,01/11/2016,C. San Martín / M. Behrens,Programa de Biología Celular y Molecular,FONDECYT,Postdoctorado
221,1241374,Paracrine sensitization to neuronal ferroptosis by senescent glial cells through IRP1 activation,01/08/2023,01/08/2023,P. Urrutia / M. Arredondo,Dirección,FONDECYT,Regular
222,1210200,Involvement of the transcription factor Nurr1 in iron chelator-induced neuroregeneration of damaged dopaminergic neurons,01/08/2020,01/08/2020,"M. Núñez / P. Urrutia, A. Roth",Departamento de Biología,FONDECYT,Regular
223,11201141,Neuronal iron homeostasis maintenance under oxidative/nitrosative stress through mitoNEET-mediated IRP1 cluster repair,01/10/2020,01/10/2023,P. Urrutia,Departamento de Biología,FONDECYT,Iniciación en Investigación
224,3160630,Rab8 regula el establecimiento de la polaridad neuronal a través de activación de Cdc42,01/11/2015,01/11/2018,P. Urrutia / C. González,Departamento de Biología,FONDECYT,Postdoctorado
225,1240538,Integration of multi-omics data in salmonids associated with the administration of diets high in vegetable oils and probiotic supplementation,01/08/2023,01/08/2023,R. Opazo / A. Villasante,Dirección,FONDECYT,Regular
226,1240430,Unveiling Host-Microbe Interactions: Exploring the Interface Between Microbiome and miRNAome in Yellowtail Larvae Cultivated in Northern Chile,01/07/2023,01/07/2023,"J. Romero / A. Villasante, J. López",Dirección,FONDECYT,Regular
227,1231737,Nutritional programming in fish with a plant-protein diet may produce epigenetic modifications favoring production performance,01/08/2022,01/08/2022,"N. Lam, A. Villasante",UA. Escuela de Derecho,FONDECYT,Regular
228,ATE230054,"Climate change as a threat to Chilean marine aquaculture by increasing the abundance, virulence and antimicrobial resistance of marine vibrios",01/06/2023,01/06/2023,"R. Opazo, J. Romero, A. Villasante, Ã. Olivera",,Programa de Investigación Asociativa,Anillo de Investigación en Ciencia y Tecnología Temático
229,11220670,Evaluating the effect of supplementing bile salt to diet in flesh pigmentation in rainbow trout (Oncorhynchus mykiss) fed on a high plant protein diet; a potential role of bile acid-gut microbiota crosstalk?,01/03/2022,01/03/2025,A. Villasante,Dirección,FONDECYT,Iniciación en Investigación
230,11200672,Evaluating the effect of supplementing bile acids to diet in gut microbiota and flesh pigmentation in rainbow trout fed on a plant-based diet,01/05/2020,01/05/2020,A. Villasante,Dirección,FONDECYT,Iniciación en Investigación
231,PAI77200049,Fortalecimiento de la investigación y docencia interdisciplinaria en el aérea de alimentos para el desarrollo e innovación de alimentos saludables y funcionales incorporando el uso de modelos biológicos con un enfoque en nutrigenómica e interacción microbiota/hospedero,01/11/2020,01/11/2020,A. Villasante / J. Romero,Dirección,Programa de Capital Humano Avanzado,Subvención a la Instalación en la Academia
232,3160835,"Effect of dietary supplementation of a feed additive rich in polyphenols in growth, hepatic lipogenesis and gut microbiota in atlantic salmon (salmo salar) fed a high-carbohydrate diet",01/11/2015,01/11/2018,A. Villasante / J. Romero,Departamento de Producción Animal,FONDECYT,Postdoctorado
