,Autores,titulo_publicacion,ano,titulo_revistas,tipo_publicacion,link,doi
0,"Gonzalez-Espinoza, D; Camus, KP; Perez, IM; Cruz, CM",Cytohistological correlation in patients with atypical glandular cells on Papanicolaou test in a Chilean population,2020,DIAGNOSTIC CYTOPATHOLOGY,ISI/SCOPUS/UCH/VID,http://dx.doi.org/10.1002/dc.24421,10.1002/dc.24421
1,"Castellsague, X; Alemany, L; Quer, M; Halec, G; Quiros, B; Tous, S; Clavero, O; Alos, L; Biegner, T; Szafarowski, T; Alejo, M; Holzinger, D; Cadena, E; Claros, E; Hall, G; Laco, J; Poljak, M; Benevolo, M; Kasamatsu, E; Mehanna, H; Ndiaye, C; Guimera, N; Lloveras, B; Leon, X; Ruiz-Cabezas, JC; Alvarado-Cabrero, I; Kang, CS; Oh, JK; Garcia-Rojo, M; Iljazovic, E; Ajayi, OF; Duarte, F; Nessa, A; Tinoco, L; Duran-Padilla, MA; Pirog, EC; Viarheichyk, H; Morales, H; Costes, V; Felix, A; Germar, MJV; Mena, M; Ruacan, A; Jain, A; Mehrotra, R; Goodman, MT; Lombardi, LE; Ferrera, A; Malami, S; Albanesi, EI; Dabed, P; Molina, C; Lopez-Revilla, R; Mandys, V; Gonzalez, ME; Velasco, J; Bravo, IG; Quint, W; Pawlita, M; Munoz, N; de Sanjose, S; Bosch, FX",HPV Involvement in Head and Neck Cancers: Comprehensive Assessment of Biomarkers in 3680 Patients,2016,JNCI-JOURNAL OF THE NATIONAL CANCER INSTITUTE,ISI/SCOPUS/UCH/VID,http://dx.doi.org/10.1093/jnci/djv403,10.1093/jnci/djv403
2,"Alemany, L; Cubilla, A; Halec, G; Kasamatsu, E; Quiros, B; Masferrer, E; Tous, S; Lloveras, B; Hernandez-Suarez, G; Lonsdale, R; Tinoco, L; Alejo, M; Alvarado-Cabrero, I; Laco, J; Guimera, N; Poblet, E; Lombardi, LE; Bergeron, C; Clavero, O; Shin, HR; Ferrera, A; Felix, A; Germar, J; Mandys, V; Clavel, C; Tzardi, M; Pons, LE; Wain, V; Cruz, E; Molina, C; Mota, JD; Jach, R; Velasco, J; Carrilho, C; Lopez-Revilla, R; Goodman, MT; Quint, WG; Castellsague, X; Bravo, I; Pawlita, M; Munoz, N; Bosch, FX; de Sanjose, S",Role of Human Papillomavirus in Penile Carcinomas Worldwide,2016,EUROPEAN UROLOGY,ISI/SCOPUS/UCH/VID,http://dx.doi.org/10.1016/j.eururo.2015.12.007,10.1016/j.eururo.2015.12.007
3,"Alemany, L;Saunier, M;Tinoco, L;Quiros, B;Alvarado-Cabrero, I;Alejo, M;Joura, EA;Maldonado, P;Klaustermeier, J;Salmeron, J;Bergeron, C;Petry, KU;Guimera, N;Clavero, O;Murillo, R;Clavel, C;Wain, V;Geraets, DT;Jach, R;Cross, P;Carrilho, C;Molina, C;Shin, HR;Mandys, V;Nowakowski, AM;Vidal, A;Lombardi, L;Kitchener, H;Sica, AR;Magana-Leon, C;Pawlita, M;Quint, W;Bravo, IG;Munoz, N;de Sanjose, S;Bosch, FX;HPV VVAP Study Grp",Large contribution of human papillomavirus in vaginal neoplastic lesions: A worldwide study in 597 samples,2014,EUROPEAN JOURNAL OF CANCER,ISI/SCOPUS/UCH/VID,http://dx.doi.org/10.1016/j.ejca.2014.07.018,10.1016/j.ejca.2014.07.018
4,"Alemany, L;de Sanjose, S;Tous, S;Quint, W;Vallejos, C;Shin, HR;Bravo, LE;Alonso, P;Lima, MA;Guimera, N;Klaustermeier, J;Llombart-Bosch, A;Kasamatsu, E;Tatti, SA;Felix, A;Molina, C;Velasco, J;Lloveras, B;Clavero, O;Lerma, E;Laco, J;Bravo, IG;Guarch, R;Pelayo, A;Ordi, J;Andujar, M;Sanchez, GI;Castellsague, X;Munoz, N;Bosch, FX;RIS HPV TT Study Grp","Time trends of human papillomavirus types in invasive cervical cancer, from 1940 to 2007",2014,INTERNATIONAL JOURNAL OF CANCER,ISI/SCOPUS/UCH/VID,http://dx.doi.org/10.1002/ijc.28636,10.1002/ijc.28636
5,"de Sanjose, S;Alemany, L;Ordi, J;Tous, S;Alejo, M;Bigby, SM;Joura, EA;Maldonado, P;Laco, J;Bravo, IG;Vidal, A;Guimera, N;Cross, P;Wain, GV;Petry, KU;Mariani, L;Bergeron, C;Mandys, V;Sica, AR;Felix, A;Usubutun, A;Seoud, M;Hernandez-Suarez, G;Nowakowski, AM;Wilson, G;Dalstein, V;Hampl, M;Kasamatsu, ES;Lombardi, LE;Tinoco, L;Alvarado-Cabrero, I;Perrotta, M;Bhatla, N;Theodoros, A;Lynch, CF;Goodman, MT;Shin, HR;Viarheichyk, H;Jach, R;Cruz, MOLE;Velasco, J;Molina, C;Bornstein, J;Ferrera, A;Domingo, EJ;Cheng-Yang, C;Banjo, AF;Castellsague, X;Pawlita, M;Lloveras, B;Quint, WGV;Munoz, N;Bosch, FX",Worldwide human papillomavirus genotype attribution in over 2000 cases of intraepithelial and invasive lesions of the vulva,2013,EUROPEAN JOURNAL OF CANCER,ISI/SCOPUS/UCH/VID,http://dx.doi.org/10.1016/j.ejca.2013.06.033,10.1016/j.ejca.2013.06.033
6,"LAIMEV, PATRICIA; MARTÍNEZ M, CAROLINA; MARTÍNEZ R, DANIELA; MARTÍNEZ B, PAMELA; BENAVIDES C, CARLOS; MOLINA C, CARLA",Características clínicas y epidemiológicas de la colecistitis crónica xantogranulomatosa,2007,REVISTA CHILENA DE CIRUGIA,SCIELO-Chile/UCH/VID,http://dx.doi.org/10.4067/S0718-40262007000200007,10.4067/S0718-40262007000200007
