,Autores,titulo_publicacion,ano,titulo_revistas,tipo_publicacion,link,doi
227,"Meza, SEE; Arce, MAY; Diaz, CRM; Herrera, EEM; Ortega, JFO; Miranda, SAV",Growth of provenances of Cryptocarya alba during water stress and after re-watering in the nursery,2021,SCIENTIA AGRICOLA,ISI/SCOPUS/SCIELO-otros paises /UCH/VID,http://dx.doi.org/10.1590/1678-992x-2020-0292,10.1590/1678-992x-2020-0292
228,"Espinoza S.E., Yañez M.A., Martínez E.E., Carrasco-Benavides M.R., Vaswani S.A., Gajardo J., Magni C.R.",Influence of provenance origin on the early performance of two sclerophyllous Mediterranean species established in burned drylands,2021,SCIENTIFIC REPORTS,SCOPUS/ISI/UCH/VID,http://dx.doi.org/10.1038/s41598-021-85599-3,10.1038/s41598-021-85599-3
229,"Magni, C; Espinoza, S; Poch, P; Abarca, B; Grez, I; Martinez, E; Yanez, M; Santelices, R; Cabrera, A",Growth and biomass partitioning of nine provenances of Quillaja saponaria seedlings to water stress,2019,SOUTHERN FORESTS,ISI/SCOPUS/UCH/VID,http://dx.doi.org/10.2989/20702620.2018.1512789,10.2989/20702620.2018.1512789
230,"Silva, P; Acevedo, E; Martinez, E; Fuentes, JP; Pino, V",Chemical and biological properties as affected by no-tillage and conventional tillage systems in an irrigated Haploxeroll of Central Chile,2013,SOIL & TILLAGE RESEARCH,ISI/SCOPUS/UCH/VID,http://dx.doi.org/10.1016/j.still.2012.07.014,10.1016/j.still.2012.07.014
231,"Martinez, E ; Fuentes, JP ; Acevedo, E",Soil organic carbon and soil properties,2008,REVISTA DE LA CIENCIA DEL SUELO Y NUTRICION VEGETAL,ISI/SCIELO-Chile/SCOPUS/UCH/VID,http://dx.doi.org/10.4067/S0718-27912008000100006,10.4067/S0718-27912008000100006
232,"Martinez, E ; Fuentes, JP ; Silva, P ; Valle, S ; Acevedo, E",Soil physical properties and wheat root growth as affected by no-tillage and conventional tillage systems in a Mediterranean environment of Chile,2008,SOIL & TILLAGE RESEARCH,ISI/SCOPUS/UCH/VID,http://dx.doi.org/10.1016/j.still.2008.02.001,10.1016/j.still.2008.02.001
233,"Silva, CP; Lopez, DN; Naulin, PI; Estay, SA",Can suitability indices predict plant growth in the invaded range? The case of Acacias species,2023,FRONTIERS IN PLANT SCIENCE,ISI/SCOPUS/UCH/VID,http://dx.doi.org/10.3389/fpls.2023.1125019,10.3389/fpls.2023.1125019
234,"Acevedo, BM; Naulin, PI",The diversity and distribution of poroid wood-inhabiting fungi of Chile is influenced by climate and host species,2022,FOREST PATHOLOGY,ISI/SCOPUS/UCH/VID,http://dx.doi.org/10.1111/efp.12763,10.1111/efp.12763
235,"Plaza, Alvaro; Castillo, Miguel; Naulin, Paulette I.",Seed and seedling interactions in three tree species from Mediterranean forests as a knowledge base for ecological restoration,2022,JOURNAL OF ENVIRONMENTAL MANAGEMENT,ISI/SCOPUS/UCH/VID,http://dx.doi.org/10.1016/j.jenvman.2022.115241,10.1016/j.jenvman.2022.115241
236,"Vera, PC; Naulin, PI; Valdovinos, AC","VARIATION OF BARK THICKNESS IN THE STEM PROFILE OF Nothofagus obliqua IN THE MAULE FOOTHILLS, CHILE",2019,INTERCIENCIA,ISI/SCOPUS/UCH/VID,,
237,"Egas C., Naulin P.I., Préndez M.","Urban pollution by particulate matter and its effect on morpho-Anatomical characteristics of four tree species in santiago, Chile",2018,INFORMACION TECNOLOGICA,SCOPUS/SCIELO-Chile/UCH/VID,,
238,"Naulin, PI; Valenzuela, G; Estay, SA",Size matters: point pattern analysis biases the estimation of spatial properties of stomata distribution,2017,NEW PHYTOLOGIST,SCOPUS/ISI/UCH/VID,http://dx.doi.org/10.1111/nph.14305,10.1111/nph.14305
239,"Paula, S; Naulin, PI; Arce, C; Galaz, C; Pausas, JG",Lignotubers in Mediterranean basin plants,2016,PLANT ECOLOGY,ISI/SCOPUS/UCH/VID,http://dx.doi.org/10.1007/s11258-015-0538-9,10.1007/s11258-015-0538-9
240,"Chavez, RO; Clevers, JGPW; Verbesselt, J; Naulin, PI; Herold, M",Detecting Leaf Pulvinar Movements on NDVI Time Series of Desert Trees: A New Approach for Water Stress Detection,2014,PLOS ONE,SCOPUS/ISI/UCH/VID,http://dx.doi.org/10.1371/journal.pone.0106613,10.1371/journal.pone.0106613
241,"Romero, FI;Cozano, MA;Gangas, RA;Naulin, PI","Riparian zones: Protection, restoration and legal context in Chile",2014,BOSQUE,SCOPUS/ISI/SCIELO-Chile/UCH/VID,http://dx.doi.org/10.4067/s0717-92002014000100001,10.4067/s0717-92002014000100001
242,Naulin PI; Albornoz AA; Arroyo MTK; Scherson RA; Hagemann T,Variability in phylogenetic diversity (PD) estimates illustrated with plant data for the high Andes of South America,2012,NEW ZEALAND JOURNAL OF BOTANY,SCOPUS/ISI/UCH/VID,http://dx.doi.org/10.1080/0028825X.2012.665808,10.1080/0028825X.2012.665808
243,"Estay, SA ; Naulin, PI",Data analysis in forest sciences: why do we continue using null hypothesis significance tests?,2011,BOSQUE,ISI/SCOPUS/SCIELO-Chile/UCH/VID,http://dx.doi.org/10.4067/S0717-92002011000100001,10.4067/S0717-92002011000100001
244,"Toral, M ; Manriquez, A ; Navarro-Cerrillo, R ; Tersi, D ; Naulin, P","Stomata Characteristics, stomatal density and stomatic index in redwood (Sequoia sempervirens) and its variation in different plantations in Chile",2010,BOSQUE,ISI/SCOPUS/SCIELO-Chile/UCH/VID,http://dx.doi.org/10.4067/S0717-92002010000200009,10.4067/S0717-92002010000200009
245,"Fernandez, A; Leon-Lobos, P; Contreras, S; Ovalle, JF; Sershen; van der Walt, K; Ballesteros, D",The potential impacts of climate change on ex situ conservation options for recalcitrant-seeded species,2023,FRONTIERS IN FORESTS AND GLOBAL CHANGE,ISI/SCOPUS/UCH/VID,http://dx.doi.org/10.3389/ffgc.2023.1110431,10.3389/ffgc.2023.1110431
246,"Smith-Ramirez, C; Grez, A; Galleguillos, M; Cerda, C; Ocampo-Melgar, A; Miranda, MD; Munoz, AA; Rendon-Funes, A; Diaz, I; Cifuentes, C; Alaniz, A; Seguel, O; Ovalle, J; Montenegro, G; Saldes-Cortes, A; Martinez-Harms, MJ; Armesto, JJ; Vita, A",Ecosystem services of Chilean sclerophyllous forests and shrublands on the verge of collapse: A review,2023,JOURNAL OF ARID ENVIRONMENTS,ISI/SCOPUS/UCH/VID,http://dx.doi.org/10.1016/j.jaridenv.2022.104927,10.1016/j.jaridenv.2022.104927
247,"Rojas-Arevalo, N; Ovalle, JF; Oliet, JA; Piper, FI; Valenzuela, P; Ginocchio, R; Arellano, EC",Solid shelter tubes alleviate summer stresses during outplanting in drought-tolerant species of Mediterranean forests,2022,NEW FORESTS,ISI/SCOPUS/UCH/VID,http://dx.doi.org/10.1007/s11056-021-09872-z,10.1007/s11056-021-09872-z
248,"Andivia, E; Villar-Salvador, P; Oliet, JA; Puertolas, J; Dumroese, RK; Molina-Venegas, R; Arellano, EC; Li, GL; Ovalle, JF; Ivetic, V",Climate and species stress resistance modulate the higher survival of large seedlings in forest restorations worldwide,2021,ECOLOGICAL APPLICATIONS,ISI/SCOPUS/UCH/VID,http://dx.doi.org/10.1002/eap.2394,10.1002/eap.2394
249,"Ginocchio, R; de la Fuente, LM; Orrego, F; Diaz, MJ; Baez, J; Ovalle, JF",A novel fast-vegetative propagation technique of the pioneer shrub Baccharis linearis on mine tailings by adding compost,2021,INTERNATIONAL JOURNAL OF PHYTOREMEDIATION,ISI/SCOPUS/UCH/VID,http://dx.doi.org/10.1080/15226514.2021.1882383,10.1080/15226514.2021.1882383
250,"Meza, SEE; Arce, MAY; Diaz, CRM; Herrera, EEM; Ortega, JFO; Miranda, SAV",Growth of provenances of Cryptocarya alba during water stress and after re-watering in the nursery,2021,SCIENTIA AGRICOLA,ISI/SCOPUS/SCIELO-otros paises /UCH/VID,http://dx.doi.org/10.1590/1678-992x-2020-0292,10.1590/1678-992x-2020-0292
251,"Acevedo, M; Rubilar, R; Dumroese, RK; Ovalle, JF; Sandoval, S; Chassin-Trubert, R",Nitrogen loading of Eucalyptus globulus seedlings: nutritional dynamics and influence on morphology and root growth potential,2021,NEW FORESTS,SCOPUS/ISI/UCH/VID,http://dx.doi.org/10.1007/s11056-020-09778-2,10.1007/s11056-020-09778-2
252,"de la Fuente, LM; Ovalle, JF; Arellano, EC; Ginocchio, R",Does woody species with contrasting root architecture require different container size in nursery?,2018,MADERA Y BOSQUES,SCOPUS/ISI/SCIELO-otros paises /UCH/VID,http://dx.doi.org/10.21829/myb.2018.2421419,10.21829/myb.2018.2421419
253,"Bannister, JR; Vargas-Gaete, R; Ovalle, JF; Acevedo, M; Fuentes-Ramirez, A; Donoso, PJ; Promis, A; Smith-Ramirez, C",Major bottlenecks for the restoration of natural forests in Chile,2018,RESTORATION ECOLOGY,ISI/SCOPUS/UCH/VID,http://dx.doi.org/10.1111/rec.12880,10.1111/rec.12880
254,"PRENDEZ, Margarita; PENA-ROJAS, Karen; GONZALEZ, Edgardo.",Quillaja saponaria Mol. en un escenario de elevada contaminación atmosférica y bajo dos diferentes condiciones de riego,2022,INFORMACION TECNOLOGICA,SCIELO-Chile/UCH/VID,http://dx.doi.org/10.4067/S0718-07642022000300031,10.4067/S0718-07642022000300031
255,"Pinto, Antonio A.; Fuentealba-Sandoval, Veronica; Lopez, Maria Dolores; Pena-Rojas, Karen; Fischer, Susana",Accumulation of delphinidin derivatives and other bioactive compound in wild maqui under different environmental conditions and fruit ripening stages,2022,INDUSTRIAL CROPS AND PRODUCTS,ISI/SCOPUS/UCH/VID,http://dx.doi.org/10.1016/j.indcrop.2022.115064,10.1016/j.indcrop.2022.115064
256,"Hacket-Pain, A; Foest, JJ; Pearse, IS; LaMontagne, JM; Koenig, WD; Vacchiano, G; Bogdziewicz, M; Caignard, T; Celebias, P; van Dormolen, J; Fernandez-Martinez, M; Moris, JV; Palaghianu, C; Pesendorfer, M; Satake, A; Schermer, E; Tanentzap, AJ; Thomas, PA; Vecchio, D; Wion, AP; Wohlgemuth, T; Xue, TT; Abernethy, K; Acuna, MCA; Barrera, MD; Barton, JH; Boutin, S; Bush, ER; Calderon, SD; Carevic, FS; de Castilho, CV; Cellini, JM; Chapman, CA; Chapman, H; Chianucci, F; da Costa, P; Croise, L; Cutini, A; Dantzer, B; DeRose, RJ; Dikangadissi, JT; Dimoto, E; da Fonseca, FL; Gallo, L; Gratzer, G; Greene, DF; Hadad, MA; Herrera, AH; Jeffery, KJ; Johnstone, JF; Kalbitzer, U; Kantorowicz, W; Klimas, CA; Lageard, JGA; Lane, J; Lapin, K; Ledwon, M; Leeper, AC; Lencinas, MV; Lira-Guedes, AC; Lordon, MC; Marchelli, P; Marino, S; Van Marle, HS; McAdam, AG; Momont, LRW; Nicolas, M; Wadt, LHD; Panahi, P; Pastur, GM; Patterson, T; Peri, PL; Piechnik, L; Pourhashemi, M; Quezada, CE; Roig, FA; Rojas, KP; Rosas, YM; Schueler, S; Seget, B; Soler, R; Steele, MA; Toro-Manriquez, M; Tutin, CEG; Ukizintambara, T; White, L; Yadok, B; Willis, JL; Zolles, A; Zywiec, M; Ascoli, D; Rojas, KP",MASTREE plus : Time-series of plant reproductive effort from six continents,2022,GLOBAL CHANGE BIOLOGY,SCOPUS/ISI/UCH/VID,http://dx.doi.org/10.1111/gcb.16130,10.1111/gcb.16130
257,"Pena-Rojas, KA; Neira, AP; Cruz, NP; Calderon, SD; Escobar, AR; Ganges, R; Duran, S",Phenolic composition of Cryptocarya alba (Mol) Looser in different locations and seasons of the year,2021,REVISTA CUBANA DE CIENCIAS FORESTALES,SCIELO-otros paises /ESCI/UCH/VID,,
258,"Fuentealba-Sandoval, V; Fischer, S; Pinto, AA; Bastias, RM; Pena-Rojas, K","Maqui (Aristotelia chilensis (Mol.) Stuntz), towards sustainable canopy management: A review",2021,INDUSTRIAL CROPS AND PRODUCTS,ISI/SCOPUS/UCH/VID,http://dx.doi.org/10.1016/j.indcrop.2021.113735,10.1016/j.indcrop.2021.113735
259,"Gonzalez, M; Rios, D; Pena-Rojas, K; Garcia, E; Acevedo, M; Cartes, E; Sanchez-Olate, M",Effect of phosphorous and calcium concentration on morpho-physiological attributes and root growth potential of Aextoxicon punctatum plants produced by covered root during hardening stage,2020,BOSQUE,ISI/SCIELO-Chile/SCOPUS/UCH/VID,http://dx.doi.org/10.4067/S0717-92002020000200137,10.4067/S0717-92002020000200137
260,"Fernandez, MP; Preller, C; Fischer, S; Espinoza, C; Pena-Rojas, K; Menendez-Miguelez, M",Maqui (Aristotelia chilensis [Molina] Stuntz): the most antioxidant wild berry towards agricultural production,2019,FRUITS,ISI/SCOPUS/UCH/VID,http://dx.doi.org/10.17660/th2019/74.5.2,10.17660/th2019/74.5.2
261,"Venegas-Gonzalez, A; Roig, FA; Pena-Rojas, K; Hadad, MA; Aguilera-Betti, I; Munoz, AA",Recent Consequences of Climate Change Have Affected Tree Growth in Distinct Nothofagus macrocarpa (DC.) FM Vaz & Rodr Age Classes in Central Chile,2019,FORESTS,ISI/SCOPUS/UCH/VID,http://dx.doi.org/10.3390/f10080653,10.3390/f10080653
262,"Manriquez, MDRT; Cellini, JM; Lencinas, MV; Peri, PL; Rojas, KAP; Pastur, GJM",Suitable conditions for natural regeneration in variable retention harvesting of southern Patagonian Nothofagus pumilio forests,2019,ECOLOGICAL PROCESSES,SCOPUS/ISI/UCH/VID,http://dx.doi.org/10.1186/s13717-019-0175-7,10.1186/s13717-019-0175-7
263,"Pena-Rojas, K; Donoso, S; Pacheco, C; Riquelme, A; Gangas, R; Guajardo, A; Duran, S",Morpho-physiological responses of Lithraea caustica plants (Anacardiaceae) under restricted water conditions,2018,BOSQUE,ISI/SCOPUS/SCIELO-Chile/UCH/VID,http://dx.doi.org/10.4067/S0717-92002018000100003,10.4067/S0717-92002018000100003
264,"Venegas-Gonzalez, A; Junent, FR; Gutierrez, AG; Pena-Rojas, K; Filho, MT",Effects of climate variability on growth and establishment patterns of Nothofagus macrocarpa in central Chile,2018,BOSQUE,ISI/SCOPUS/SCIELO-Chile/UCH/VID,http://dx.doi.org/10.4067/S0717-92002018000100008,10.4067/S0717-92002018000100008
265,"Pena-Rojas, K; Donoso, S; Gangas, R; Duran, S; Ilabaca, D","EFFECTS OF DROUGHT ON WATER RELATIONS, GROWTH AND BIOMASS DISTRIBUTION IN Peumus boldus MOLINA (MONIMIACEAE) PLANTS GROWN IN A NURSERY",2018,INTERCIENCIA,ISI/SCOPUS/UCH/VID,,
266,"Moya, RS; Meza, SE; Diaz, CM; Ariza, AC; Calderon, SD; Pena-Rojas, K","Variability in seed germination and seedling growth at the intra- and inter-provenance levels of Nothofagus glauca (Lophozonia glauca), an endemic species of Central Chile",2017,NEW ZEALAND JOURNAL OF FORESTRY SCIENCE,ISI/SCOPUS/UCH/VID,http://dx.doi.org/10.1186/s40490-017-0091-5,10.1186/s40490-017-0091-5
267,"Donoso, S; Pena-Rojas, K; Galdames, E; Pacheco, C; Espinoza, C; Duran, S; Gangas, R","Monitoring of biosolid application trials in Eucalyptus globulus plantation, in Central Chile",2016,REVISTA DE LA FACULTAD DE CIENCIAS AGRARIAS,ISI/SCOPUS/SCIELO-otros paises /UCH/VID,,
268,"Donoso, S;Pena-Rojas, K;Pacheco, C;Duran, S;Santelices, R;Mascaro, C",The physiological and growth response of Acacia caven under water stress and the application of different levels of biosolids,2015,CIENCIA E INVESTIGACION AGRARIA,SCIELO-Chile/ISI/SCOPUS/UCH/VID,http://dx.doi.org/10.4067/S0718-162020150002000013,10.4067/S0718-162020150002000013
269,"Donoso, S;Pena-Rojas, K;Duran, S;Pacheco, C;Galdames, E;Espinoza, C","Influence of thinning over growth, water potential and photosynthetic response of Peumus boldus: guidelines for their silvicultural management proposal",2015,BOSQUE,ISI/SCIELO-Chile/SCOPUS/UCH/VID,http://dx.doi.org/10.4067/S0717-92002015000300012,10.4067/S0717-92002015000300012
270,"Donoso, SR;Pena-Rojas, K;Espinoza, C;Galdames, E;Pacheco, C","PRODUCTION, PERMANENCE AND GERMINATION OF SEEDS OF Araucaria araucana (Mol.) K. Koch IN NATURAL FORESTS, USED BY INDIGENOUS COMMUNITIES IN SOUTHERN CHILE",2014,INTERCIENCIA,SCOPUS/ISI/UCH/VID,,
271,"Donoso, S ; Pena, K ; Pacheco, C ; Luna, G ; Aguirre, A",Physiological and growth response in Quillaja saponaria and Cryptocarya alba plants under restricted water conditions,2011,BOSQUE,SCOPUS/SCIELO-Chile/ISI/UCH/VID,http://dx.doi.org/10.4067/S0717-92002011000200009,10.4067/S0717-92002011000200009
272,"Donoso, SR; Pena-Rojas, K; Delgado-Flores, C; Riquelme, A; Paratori, M",ABOVE-GROUND BIOMASS ACCUMULATION AND GROWTH IN A MARGINAL Nothofagus macrocarpa FOREST IN CENTRAL CHILE,2010,INTERCIENCIA,ISI/SCOPUS/UCH/VID,,
273,"Schmidt, A ; Poulain, M ; Klein, D ; Krause, K ; Pena-Rojas, K ; Schmidt, H ; Schulte, A ",Allometric above-belowground biomass equations for Nothofagus pumilio (Poepp. & Endl.) natural regeneration in the Chilean Patagonia,2009,ANNALS OF FOREST SCIENCE,ISI/SCOPUS/UCH/VID,http://dx.doi.org/10.1051/forest/2009030,10.1051/forest/2009030
274,"Zhou, XY; Kutchartt, E; Hernadez, J; Corvalan, P; Promis, A; Zwanzig, M",Determination of optimal tree height models and calibration designs for Araucaria araucana and Nothofagus pumilio in mixed stands affected to different levels by anthropogenic disturbance in South-Central Chile,2023,ANNALS OF FOREST SCIENCE,ISI/SCOPUS/UCH/VID,http://dx.doi.org/10.1186/s13595-023-01185-9,10.1186/s13595-023-01185-9
275,"Magni, CR; Poch, PL; Espinoza, SE; Yanez, MA; Martinez, EE; Promis, AA; Mancilla, GA",Provenance influences seed germination and phenotypic responses to water restriction in the endemic Beilschmiedia miersii (Gay) Kosterm,2023,FRONTIERS IN FORESTS AND GLOBAL CHANGE,ISI/SCOPUS/UCH/VID,http://dx.doi.org/10.3389/ffgc.2022.1039908,10.3389/ffgc.2022.1039908
276,"Kremer, K; Promis, A; Bauhus, J",Natural Advance Regeneration of Native Tree Species in Pinus radiata Plantations of South-Central Chile Suggests Potential for a Passive Restoration Approach,2022,ECOSYSTEMS,ISI/SCOPUS/UCH/VID,http://dx.doi.org/10.1007/s10021-021-00704-x,10.1007/s10021-021-00704-x
277,"Kutchartt E., Hernández J., Corvalán P., Promis A., Pirotti F.","DETECTING AND EVALUATING DISTURBANCE IN TEMPERATE RAINFOREST WITH SENTINEL-2, MACHINE LEARNING AND FOREST PARAMETERS",2022,"International Archives of the Photogrammetry, Remote Sensing and Spatial Information Sciences - ISPRS Archives",SCOPUS/UCH/VID,http://dx.doi.org/10.5194/isprs-archives-XLIII-B3-2022-913-2022,10.5194/isprs-archives-XLIII-B3-2022-913-2022
278,"Herrera, AH; Promis, A; Toro-Manriquez, M; Lencinas, MV; Pastur, GM; Rio, M",Rehabilitation of Nothofagus pumilio forests in Chilean Patagonia: can fencing and planting season effectively protect against exotic European hare browsing?,2022,NEW FORESTS,ISI/SCOPUS/UCH/VID,http://dx.doi.org/10.1007/s11056-021-09867-w,10.1007/s11056-021-09867-w
279,"Toro-Manriquez, MDR; Soler, R; Herrera, AH; Lencinas, MV; Promis, A; Blazina, AP; Pastur, GM",Inferring population dynamic trends of Nothofagus pumilio and N. betuloides in coastal and mountain forests of Tierra del Fuego: contrasting from flowering to seedling survival through several reproductive cycles,2022,TREES-STRUCTURE AND FUNCTION,ISI/SCOPUS/UCH/VID,http://dx.doi.org/10.1007/s00468-021-02195-8,10.1007/s00468-021-02195-8
280,"Donoso, PJ; Promis, A; Loguercio, GA; Beltran, HA; Casseli, M; Chauchard, LM; Cruz, G; Penalba, MG; Pastur, GM; Navarro, C; Nunez, P; Salas-Eljatib, C; Soto, DP; Vasquez-Grandon, A",Silviculture of South American temperate native forests,2022,NEW ZEALAND JOURNAL OF FORESTRY SCIENCE,ISI/SCOPUS/UCH/VID,http://dx.doi.org/10.33494/nzjfs522022x173x,10.33494/nzjfs522022x173x
281,"Huertas-Herrera, A; Promis, A; Rio, M; Toro-Manriquez, M; Lencinas, MV; Pastur, GM",Theoretical proposal for the rehabilitation of Nothofagus pumilio forests degraded by fires based on cluster plantings with Embothrium coccineum,2021,BOSQUE,ISI/SCOPUS/SCIELO-Chile/UCH/VID,http://dx.doi.org/10.4067/S0717-92002021000300285,10.4067/S0717-92002021000300285
282,"Soto, DP; Donoso, PJ; Zamorano-Elgueta, C; Rios, AI; Promis, A",Precipitation declines influence the understory patterns in Nothofagus pumilio old-growth forests in northwestern Patagonia,2021,FOREST ECOLOGY AND MANAGEMENT,ISI/SCOPUS/UCH/VID,http://dx.doi.org/10.1016/j.foreco.2021.119169,10.1016/j.foreco.2021.119169
283,"Caceres-Polgrossi, L; Promis, A; Gutierrez, AG",Leaf litter hides post-dispersed seeds from invasive alien removers in a sclerophyll forest in central Chile,2020,FOREST SYSTEMS,ISI/SCOPUS/UCH/VID,http://dx.doi.org/10.5424/fs/2020293-16845,10.5424/fs/2020293-16845
284,"Ardiles, V; Promis, A; Cortes, D",Notes on the variation of bryophytes between a swamp forest dominated by Amomyrtus luma and an anthropogenic wet prairie of Juncus procerus,2020,GAYANA BOTANICA,ISI/SCOPUS/SCIELO-Chile/UCH/VID,http://dx.doi.org/10.4067/S0717-66432020000200168,10.4067/S0717-66432020000200168
285,"Salas-Eljatib, C; Promis, A",A call to awaken the Chilean Society of Forest Science,2020,BOSQUE,ISI/SCOPUS/SCIELO-Chile/UCH/VID,http://dx.doi.org/10.4067/S0717-92002020000300209,10.4067/S0717-92002020000300209
286,"Manriquez, MDRT; Ardiles, V; Promis, A; Herrera, AH; Soler, R; Lencinas, MV; Pastur, GM",Forest canopy-cover composition and landscape influence on bryophyte communities in Nothofagus forests of southern Patagonia,2020,PLOS ONE,ISI/SCOPUS/UCH/VID,http://dx.doi.org/10.1371/journal.pone.0232922,10.1371/journal.pone.0232922
287,Promis Á.,Native or exotic plantations: Thoughts about the environmental impacts in Chile,2020,Ecologia Austral,SCOPUS/UCH/VID,http://dx.doi.org/10.25260/ea.20.30.2.0.1064,10.25260/ea.20.30.2.0.1064
288,"Promis, A; Olivares, SM; Acuna, S; Cruz, G","Early response of woody species regeneration after ""Las Maquinas"" anthropogenic fire in the Maule Region, Chile",2019,GAYANA BOTANICA,ISI/SCIELO-Chile/SCOPUS/UCH/VID,http://dx.doi.org/10.4067/S0717-66432019000200257,10.4067/S0717-66432019000200257
289,"Toro-Manriquez, M; Soler, R; Lencinas, MV; Promis, A",Canopy composition and site are indicative of mineral soil conditions in Patagonian mixed Nothofagus forests,2019,ANNALS OF FOREST SCIENCE,ISI/SCOPUS/UCH/VID,http://dx.doi.org/10.1007/s13595-019-0886-z,10.1007/s13595-019-0886-z
290,"Kremer, KN; Promis, AA; Mancilla, G; Magni, CR",Leaf litter and irrigation can increase seed germination and early seedling survival of the recalcitrant-seeded tree Beilschmiedia miersii,2019,AUSTRAL ECOLOGY,ISI/SCOPUS/UCH/VID,http://dx.doi.org/10.1111/aec.12655,10.1111/aec.12655
291,"Manriquez, MT; Promis, A; Herrera, AH; Pastur, GM",Influence of microsites and exposure in tree regeneration of Nothofagus pumilio forests affected by Castor canadensis in Tierra del Fuego: An exploratory analysis,2018,BOSQUE,ISI/SCOPUS/SCIELO-Chile/UCH/VID,http://dx.doi.org/10.4067/S0717-92002018000300431,10.4067/S0717-92002018000300431
292,"Bannister, JR; Vargas-Gaete, R; Ovalle, JF; Acevedo, M; Fuentes-Ramirez, A; Donoso, PJ; Promis, A; Smith-Ramirez, C",Major bottlenecks for the restoration of natural forests in Chile,2018,RESTORATION ECOLOGY,ISI/SCOPUS/UCH/VID,http://dx.doi.org/10.1111/rec.12880,10.1111/rec.12880
293,"Miranda, A; Lara, A; Altamirano, A; Zamorano-Elgueta, C; Hernandez, HJ; Gonzalez, ME; Pauchard, A; Promis, A",Monitoring Chilean native forest area: a pending challenge,2018,BOSQUE,ISI/SCIELO-Chile/SCOPUS/UCH/VID,http://dx.doi.org/10.4067/S0717-92002018000200265,10.4067/S0717-92002018000200265
294,"Promis, A; Allen, RB",Tree seedlings respond to both light and soil nutrients in a Patagonian evergreen-deciduous forest,2017,PLOS ONE,ISI/SCOPUS/UCH/VID,http://dx.doi.org/10.1371/journal.pone.0188686,10.1371/journal.pone.0188686
295,"Toro Manríquez M., Mestre L., Lencinas M.V., Promis Á., Martínez Pastur G., Soler R.",Flowering and seeding patterns in pure and mixed Nothofagus forests in Southern Patagonia,2016,ECOLOGICAL PROCESSES,SCOPUS/UCH/VID,http://dx.doi.org/10.1186/s13717-016-0065-1,10.1186/s13717-016-0065-1
296,"Flores, S; Promis, A; Faundez, L",Floristic and structural characterization of the southernmost natural population of Jubaea chilensis (Molina) Baill. in Chile,2016,PHYTON-INTERNATIONAL JOURNAL OF EXPERIMENTAL BOTANY,ISI/SCOPUS/SCIELO-otros paises /UCH/VID,,
297,"Promis, A;Bergh, G;Serra, MT;Cruz, G","Description of the vascular flora in the understory of a swamp forest and in an anthropogenic Juncus procerus wet prairie in the valle del rio Cisnes, Ayson Region, Chile",2013,GAYANA BOTANICA,ISI/SCIELO-Chile/SCOPUS/UCH/VID,http://dx.doi.org/10.4067/S0717-66432013000100017,10.4067/S0717-66432013000100017
298,"Promis, A",MEASURING AND ESTIMATING THE BELOW-CANOPY LIGHT ENVIRONMENT IN A FOREST. A REVIEW,2013,REVISTA CHAPINGO SERIE CIENCIAS FORESTALES Y DEL AMBIENTE,SCOPUS/ISI/SCIELO-otros paises /UCH/VID,http://dx.doi.org/10.5154/r.rchscfa.2011.09.062,10.5154/r.rchscfa.2011.09.062
299,Gartner S;Reif A;Cruz G;Promis A,"Effects of canopy gaps on forest floor vascular and non-vascular plant species composition and diversity in an uneven-aged Nothofagus betuloides forest in Tierra del Fuego, Chile",2012,COMMUNITY ECOLOGY,ISI/SCOPUS/UCH/VID,http://dx.doi.org/10.1556/ComEc.13.2012.2.3,10.1556/ComEc.13.2012.2.3
300,"Promis, A;Caldentey, J;Cruz, G",Evaluating the usefulness of hemispherical photographs as a means to estimate photosynthetic photon flux density during a growing season in the understorey of Nothofagus pumilio forests,2012,PLANT BIOSYSTEMS,ISI/SCOPUS/UCH/VID,http://dx.doi.org/10.1080/11263504.2011.650727,10.1080/11263504.2011.650727
301,"Promis A., Gartner S., Butler-Manning D., Duran-Rangel C., Reif A., Cruz G., Hernandez L.",Comparison of four different programs for the analysis of hemispherical photographs using parameters of canopy structure and solar radiation transmittance,2011,Waldokologie Online,SCOPUS/UCH/VID,,
302,"Ibarra, M;Caldentey, J;Promis, A",Litter decomposition in Nothofagus pumilio stands in Magallanes Region,2011,BOSQUE,ISI/SCIELO-Chile/SCOPUS/UCH/VID,http://dx.doi.org/10.4067/S0717-92002011000300004,10.4067/S0717-92002011000300004
303,"Promis, A ; Caldentey, J ; Ibarra, M",Microclimate within a Nothofagus pumilio forest and the effects of a regeneration felling,2010,BOSQUE,ISI/SCIELO-Chile/SCOPUS/UCH/VID,http://dx.doi.org/10.4067/S0717-92002010000200006,10.4067/S0717-92002010000200006
304,"Promis, A; Gartner, S; Reif, A; Cruz, G","Effects of natural small-scale disturbances on below-canopy solar radiation and regeneration patterns in an old-growth Nothofagus betuloides forest in Tierra del Fuego, Chile",2010,ALLGEMEINE FORST UND JAGDZEITUNG,ISI/UCH/VID,,
305,"Caldentey, J; Mayer, H; Ibarra, M; Promis, A",The effects of a regeneration felling on photosynthetic photon flux density and regeneration growth in a Nothofagus pumilio forest,2009,EUROPEAN JOURNAL OF FOREST RESEARCH,ISI/SCOPUS/UCH/VID,http://dx.doi.org/10.1007/s10342-008-0240-8,10.1007/s10342-008-0240-8
306," Promis, A ; Schindler, D ; Reif, A ; Cruz, G ",Solar radiation transmission in and around canopy gaps in an uneven-aged Nothofagus betuloides forest,2009,INTERNATIONAL JOURNAL OF BIOMETEOROLOGY,ISI/SCOPUS/UCH/VID,http://dx.doi.org/10.1007/s00484-009-0222-7,10.1007/s00484-009-0222-7
