,Autores,titulo_publicacion,ano,titulo_revistas,tipo_publicacion,link,doi
139,"Merklinger, FF; Luebert, F","Notes on the genus Ophryosporus (Asteraceae, Eupatorieae) in Chile",2020,PHYTOKEYS,ISI/SCOPUS/UCH/VID,http://dx.doi.org/10.3897/phytokeys.161.53736,10.3897/phytokeys.161.53736
140,"Moreira-Munoz, A; Scherson, RA; Luebert, F; Roman, MJ; Monge, M; Diazgranados, M; Silva, H","Biogeography, phylogenetic relationships and morphological analyses of the South American genusMutisiaL.f. (Asteraceae) shows early connections of two disjunct biodiversity hotspots",2020,ORGANISMS DIVERSITY & EVOLUTION,ISI/SCOPUS/UCH/VID,http://dx.doi.org/10.1007/s13127-020-00454-z,10.1007/s13127-020-00454-z
141,"Maul, K; Wei, YM; Nebel, M; Luebert, F; Ho, BC; Quandt, D; Kessler, M",Different Predictors Shape the Diversity Patterns of Epiphytic and Non-epiphytic Liverworts in Montane Forests of Uganda,2020,FRONTIERS IN PLANT SCIENCE,ISI/SCOPUS/UCH/VID,http://dx.doi.org/10.3389/fpls.2020.00765,10.3389/fpls.2020.00765
142,"Ruhm, J; Bohnert, T; Weigend, M; Merklinger, FF; Stoll, A; Quandt, D; Luebert, F",Plant life at the dry limit-Spatial patterns of floristic diversity and composition around the hyperarid core of the Atacama Desert,2020,PLOS ONE,ISI/SCOPUS/UCH/VID,http://dx.doi.org/10.1371/journal.pone.0233729,10.1371/journal.pone.0233729
143,"Castillo, RA; Luebert, F; Henning, T; Weigend, M","Major lineages of Loasaceae subfam. Loasoideae diversified during the Andean uplift (vol 141, 106616, 2019)",2020,MOLECULAR PHYLOGENETICS AND EVOLUTION,SCOPUS/ISI/UCH/VID,http://dx.doi.org/10.1016/j.ympev.2019.106657,10.1016/j.ympev.2019.106657
144,"Merklinger, FF; Zheng, Y; Luebert, F; Harpke, D; Bohnert, T; Stoll, A; Koch, MA; Blattner, FR; Wiehe, T; Quandt, D",Population genomics of Tillandsia landbeckii reveals unbalanced genetic diversity and founder effects in the Atacama Desert,2020,GLOBAL AND PLANETARY CHANGE,SCOPUS/ISI/UCH/VID,http://dx.doi.org/10.1016/j.gloplacha.2019.103076,10.1016/j.gloplacha.2019.103076
145,"Chacon, J; Luebert, F; Selvi, F; Cecchi, L; Weigend, M",Phylogeny and historical biogeography of Lithospermeae (Boraginaceae): Disentangling the possible causes of Miocene diversifications,2019,MOLECULAR PHYLOGENETICS AND EVOLUTION,ISI/SCOPUS/UCH/VID,http://dx.doi.org/10.1016/j.ympev.2019.106626,10.1016/j.ympev.2019.106626
146,"Bohnert, T; Luebert, F; Ritter, B; Merklinger, FF; Stoll, A; Schneider, JV; Quandt, D; Weigend, M",Origin and diversification of Cristaria (Malvaceae) parallel Andean orogeny and onset of hyperaridity in the Atacama Desert,2019,GLOBAL AND PLANETARY CHANGE,SCOPUS/ISI/UCH/VID,http://dx.doi.org/10.1016/j.gloplacha.2019.102992,10.1016/j.gloplacha.2019.102992
147,"Castillo, RA; Luebert, F; Henning, T; Weigend, M",Major lineages of Loasaceae subfam. Loasoideae diversified during the Andean uplift,2019,MOLECULAR PHYLOGENETICS AND EVOLUTION,SCOPUS/ISI/UCH/VID,http://dx.doi.org/10.1016/j.ympev.2019.106616,10.1016/j.ympev.2019.106616
148,"Munoz-Schick, M; Luebert, F","Presliophytum incanum (Graham) Weigend Loasaceae , new record for the Flora of Chile",2018,GAYANA BOTANICA,ISI/SCOPUS/SCIELO-Chile/UCH/VID,,
149,"Bohnert, T; Luebert, F; Weigend, M","Atriplex retusa, the correct name for A-deserticola (Chenopodiaceae; Amaranthaceae sensu APG)",2018,PHYTOTAXA,ISI/SCOPUS/UCH/VID,http://dx.doi.org/10.11646/phytotaxa.373.1.6,10.11646/phytotaxa.373.1.6
150,"Jeiter, J; Staedler, YM; Schonenberger, J; Weigend, M; Luebert, F",Gynoecium and Fruit Development in Heliotropium Sect. Heliothamnus (Heliotropiaceae),2018,INTERNATIONAL JOURNAL OF PLANT SCIENCES,ISI/SCOPUS/UCH/VID,http://dx.doi.org/10.1086/696219,10.1086/696219
151,"Sancho, G; Katinas, L; Barreto, JNV; Moreira-Munoz, A;Luebert, F",Phylogenetic relationships and generic reassessment of proustia and allies (Compositae: Nassauvieae),2018,TAXON,ISI/SCOPUS/UCH/VID,http://dx.doi.org/10.12705/671.7,10.12705/671.7
152,"Luebert, F",The genera of Heliotropiaceae in Argentina,2017,BOLETIN DE LA SOCIEDAD ARGENTINA DE BOTANICA,ISI/SCOPUS/SCIELO-otros paises /UCH/VID,,
153,"Luebert, F; Moreira-Munoz, A; Wilke, K; Dillon, MO",Phylogeny and evolution of achenial trichomes in the Lucilia-group (Asteraceae: Gnaphalieae) and their systematic significance,2017,TAXON,ISI/SCOPUS/UCH/VID,http://dx.doi.org/10.12705/665.11,10.12705/665.11
154,"Chacon, J; Luebert, F; Weigend, M",Biogeographic Events Are Not Correlated with Diaspore Dispersal Modes in Boraginaceae,2017,FRONTIERS IN ECOLOGY AND EVOLUTION,SCOPUS/ISI/UCH/VID,http://dx.doi.org/10.3389/fevo.2017.00026,10.3389/fevo.2017.00026
155,"Acuña R., Fließwasser S., Ackermann M., Henning T., Luebert F., Weigend M.",Phylogenetic relationships and generic re-arrangements in ¿south andean loasas¿ (Loasaceae),2017,TAXON,ISI/SCOPUS/UCH/VID,http://dx.doi.org/10.12705/662.5,10.12705/662.5
156,"Luebert, F; Couvreur, TLP; Gottschling, M; Hilger, HH; Miller, JS; Weigend, M",Historical biogeography of Boraginales: West Gondwanan vicariance followed by long-distance dispersal?,2017,JOURNAL OF BIOGEOGRAPHY,ISI/SCOPUS/UCH/VID,http://dx.doi.org/10.1111/jbi.12841,10.1111/jbi.12841
157,"Luebert F., Frohlich M.W.",Four new combinations in Argentinian Heliotropiaceae,2016,Darwiniana,SCOPUS/SCIELO-otros paises /UCH/VID,http://dx.doi.org/10.14522/darwiniana.2016.42.717,10.14522/darwiniana.2016.42.717
158,"Urbina-Casanova, R; Luebert, F; Pliscoff, P; Scherson, RA",Assessing floristic representativeness in the protected areas national system of Chile: are vegetation types a good surrogate for plant species?,2016,ENVIRONMENTAL CONSERVATION,ISI/SCOPUS/UCH/VID,http://dx.doi.org/10.1017/S0376892916000060,10.1017/S0376892916000060
159,"Luebert, F; Cecchi, L; Frohlich, MW; Gottschling, M; Guilliams, CM; Hasenstab-Lehman, KE; Hilger, HH; Miller, JS; Mittelbach, M; Nazaire, M; Nepi, M; Nocentini, D; Ober, D; Olmstead, RG; Selvi, F; Simpson, MG; Sutory, K; Valdes, B; Walden, GK; Weigend, M",Familial classification of the Boraginales,2016,TAXON,ISI/SCOPUS/UCH/VID,http://dx.doi.org/10.12705/653.5,10.12705/653.5
160,"Chacon, J; Luebert, F; Hilger, HH; Ovchinnikova, S; Selvi, F; Cecchi, L; Guilliams, CM; Hasenstab-Lehman, K; Sutory, K; Simpson, MG; Weigend, M","The borage family (Boraginaceae s.str.): A revised infrafamilial classification based on new phylogenetic evidence, with emphasis on the placement of some enigmatic genera",2016,TAXON,ISI/SCOPUS/UCH/VID,http://dx.doi.org/10.12705/653.6,10.12705/653.6
161,"Luebert, F; Muller, LAH",Effects of mountain formation and uplift on biological diversity,2015,FRONTIERS IN GENETICS,SCOPUS/ISI/UCH/VID,http://dx.doi.org/10.3389/fgene.2015.00054,10.3389/fgene.2015.00054
162,"Luebert, F; Weigend, M",Phylogenetic insights into Andean plant diversification,2014,FRONTIERS IN ECOLOGY AND EVOLUTION,ISI/SCOPUS/UCH/VID,http://dx.doi.org/https://doi.org/10.3389/fevo.2014.00027,https://doi.org/10.3389/fevo.2014.00027
163,"Luebert Bruron, Federico",Taxonomy and distribution of the genus Quillaja Molina (Quillajaceae),2014,Feddes Repertorium,SCOPUS/UCH/VID,http://dx.doi.org/10.1002/fedr.201400029,10.1002/fedr.201400029
164,"Luebert, F;Hilger, HH",Typification of Heliotropium and Tournefortia (Heliotropiaceae) species described by Ruiz and Pavon,2014,ANALES DEL JARDIN BOTANICO DE MADRID,ISI/SCOPUS/UCH/VID,http://dx.doi.org/10.3989/ajbm.2332,10.3989/ajbm.2332
165,"Weigend, M;Luebert, F;Gottschling, M;Couvreur, TLP;Hilger, HH;Miller, JS",From capsules to nutlets-phylogenetic relationships in the Boraginales,2014,CLADISTICS,SCOPUS/ISI/UCH/VID,http://dx.doi.org/10.1111/cla.12061,10.1111/cla.12061
166,"Pliscoff, P;Luebert, F;Hilger, HH;Guisan, A",Effects of alternative sets of climatic predictors on species distribution models and associated estimates of extinction risk: A test with plants in an arid environment,2014,ECOLOGICAL MODELLING,ISI/SCOPUS/UCH/VID,http://dx.doi.org/10.1016/j.ecolmodel.2014.06.003,10.1016/j.ecolmodel.2014.06.003
167,"Luebert, F;Munoz-Schick, M","Heliotropium geissei (Heliotropiaceae): new records, typification, systematic placement and conservation status",2014,GAYANA BOTANICA,ISI/SCOPUS/SCIELO-Chile/UCH/VID,http://dx.doi.org/10.4067/S0717-66432014000100006,10.4067/S0717-66432014000100006
168,"Dillon, MO;Luebert, F","Synopsis of Plazia Ruiz & Pav. (Onoserideae, Asteraceae), including a new species from northern Peru",2014,PHYTOKEYS,ISI/SCOPUS/UCH/VID,http://dx.doi.org/10.3897/phytokeys.34.6151,10.3897/phytokeys.34.6151
169,"Luebert, F;Jacobs, P;Hilger, HH;Muller, LAH",Evidence for nonallopatric speciation among closely related sympatric Heliotropium species in the Atacama Desert,2014,ECOLOGY AND EVOLUTION,SCOPUS/ISI/UCH/VID,http://dx.doi.org/10.1002/ece3.929,10.1002/ece3.929
170,"Gottschling, M;Luebert, F;Hilger, HH;Miller, JS",Molecular delimitations in the Ehretiaceae (Boraginales),2014,MOLECULAR PHYLOGENETICS AND EVOLUTION,ISI/SCOPUS/UCH/VID,http://dx.doi.org/10.1016/j.ympev.2013.12.005,10.1016/j.ympev.2013.12.005
171,"Luebert, F",(2206) Proposal to conserve the name Fontenellea brasiliensis (Quillaja brasiliensis) against Q-lancifolia (Quillajaceae),2013,TAXON,SCOPUS/ISI/UCH/VID,http://dx.doi.org/10.12705/625.35,10.12705/625.35
172,"Weigend, M;Luebert, F;Selvi, F;Brokamp, G;Hilger, HH",Multiple origins for Hound's tongues (Cynoglossum L.) and Navel seeds (Omphalodes Mill.) - The phylogeny of the borage family (Boraginaceae s.str.),2013,MOLECULAR PHYLOGENETICS AND EVOLUTION,SCOPUS/ISI/UCH/VID,http://dx.doi.org/10.1016/j.ympev.2013.04.009,10.1016/j.ympev.2013.04.009
173,"Luebert, F",A revision of Heliotropium sect. Cochranea (Heliotropiaceae),2013,KEW BULLETIN,ISI/SCOPUS/UCH/VID,http://dx.doi.org/10.1007/s12225-013-9432-6,10.1007/s12225-013-9432-6
174,"Luebert, F; Weigend, M",Three new species of Heliotropium sect. Heliothamnus (Boraginaceae) from Peru,2012,PHYTOTAXA,ISI/SCOPUS/UCH/VID,http://dx.doi.org/10.11646/phytotaxa.49.1.6,10.11646/phytotaxa.49.1.6
175,"Luebert, F",Towards a historical plant geography of the Atacama Desert,2011,REVISTA DE GEOGRAFIA NORTE GRANDE,ISI/SCOPUS/SCIELO-Chile/UCH/VID,http://dx.doi.org/10.4067/S0718-34022011000300007,10.4067/S0718-34022011000300007
176,"Luebert, F ; Hilger, HH ; Weigend, M","Diversification in the Andes: Age and origins of South American Heliotropium lineages (Heliotropiaceae, Boraginales)",2011,MOLECULAR PHYLOGENETICS AND EVOLUTION,ISI/SCOPUS/UCH/VID,http://dx.doi.org/10.1016/j.ympev.2011.06.001,10.1016/j.ympev.2011.06.001
177,"Luebert, F ; Brokamp, G ; Wen, J ; Weigend, M ; Hilger, HH",Phylogenetic relationships and morphological diversity in Neotropical Heliotropium (Heliotropiaceae),2011,TAXON,ISI/SCOPUS/UCH/VID,,
178,"Ibanez, S ; Luebert, F ; Gomez, M",First record of Heliotropium amplexicaule (Heliotropiaceae) in Chile,2011,GAYANA BOTANICA,ISI/SCOPUS/SCIELO-Chile/UCH/VID,http://dx.doi.org/10.4067/S0717-66432011000100009,10.4067/S0717-66432011000100009
179,"Luebert, F; Weigend, M; Hilger, HH",Epitypification of Heliotropium arborescens L. (Heliotropiaceae),2010,TAXON,ISI/SCOPUS/UCH/VID,,
180," Weigend, M ; Luebert, F ","Weeding the nettles I: Clarifying species limits in perennial, rhizomatous Urtica (Urticaceae) from southern and central Chile and Argentina",2009,PHYTOTAXA,ISI/UCH/VID,,
181," Luebert, F ; Wen, J ; Dillon, MO ",Systematic placement and biogeographical relationships of the monotypic genera Gypothamnium and Oxyphyllum (Asteraceae: Mutisioideae) from the Atacama Desert,2009,BOTANICAL JOURNAL OF THE LINNEAN SOCIETY,ISI/SCOPUS/UCH/VID,http://dx.doi.org/10.1111/j.1095-8339.2008.00926.x,10.1111/j.1095-8339.2008.00926.x
182," Pinto, R ; Luebert, F ","DATA ON THE VASCULAR FLORA OF THE COASTAL DESERT OF ARICA AND TARAPACA, CHILE, AND ITS PHYTOGEOGRAPHICAL RELATIONSHIPS WITH SOUTHERN PERU",2009,GAYANA BOTANICA,SCOPUS/ISI/SCIELO-Chile/UCH/VID,,
183,"Luebert, F ; Wen, J",Phylogenetic analysis and evolutionary diversification of Heliotropium sect. Cochranea (Heliotropiaceae) in the Atacama Desert,2008,SYSTEMATIC BOTANY,SCOPUS/ISI/UCH/VID,http://dx.doi.org/10.1600/036364408784571635,10.1600/036364408784571635
184,"Modak, B ; Rojas, M ; Torres, R ; Rodilla, J ; Luebert, F",Antioxidant activity of a new aromatic geranyl derivative of the resinous exudates from Heliotropium glutinosum Phil.,2007,MOLECULES,SCOPUS/ISI/UCH/VID,http://dx.doi.org/10.3390/12051057,10.3390/12051057
185,"Martínez, María José; Gajardo, Rodolfo; Luebert, Federico",Análisis de las áreas silvestres protegidas de la Patagonia Occidental según su valor ecosistémico,2006,BOSQUE,SCIELO-Chile/UCH/VID,http://dx.doi.org/10.4067/S0717-92002006000200011,10.4067/S0717-92002006000200011
186,"Luebert, F; Gajardo, R",High Andean vegetation of Parinacota (northern Chile) and a synopsis of the southern Puna vegetation,2005,PHYTOCOENOLOGIA,SCOPUS/ISI/UCH/VID,http://dx.doi.org/10.1127/0340-267X/2005/0035-0079,10.1127/0340-267X/2005/0035-0079
187,"GAJARDO, RODOLFO; LUEBERT, FEDERICO; ESTAY, MARLIS
","Ensayo de una tipología de estaciones forestales en el Parque Nacional Tolhuaca, Chile",2005,BOSQUE,SCIELO-Chile/UCH/VID,http://dx.doi.org/10.4067/S0717-92002005000200007,10.4067/S0717-92002005000200007
188,Federico Luebert; Raquel Pinto,Nota sobre la presencia de Heliotropium Krauseanumfedde (heliotropiaceae) en Chile,2004,GAYANA BOTANICA,SCIELO-Chile/UCH/VID,http://dx.doi.org/10.4067/S0717-66432004000200003 ,10.4067/S0717-66432004000200003 
189,"Magni, CR; Poch, PL; Espinoza, SE; Yanez, MA; Martinez, EE; Promis, AA; Mancilla, GA",Provenance influences seed germination and phenotypic responses to water restriction in the endemic Beilschmiedia miersii (Gay) Kosterm,2023,FRONTIERS IN FORESTS AND GLOBAL CHANGE,ISI/SCOPUS/UCH/VID,http://dx.doi.org/10.3389/ffgc.2022.1039908,10.3389/ffgc.2022.1039908
190,"Magni, C; Espinoza, S; Poch, P; Abarca, B; Grez, I; Martinez, E; Vaswani, S; Toro, N; Gomez, P",Leaf phenotypic variation in natural populations of Quillaja saponaria and its relationship with climatic variation,2022,CALDASIA,SCOPUS/ISI/UCH/VID,http://dx.doi.org/10.15446/caldasia.v44n3.90148,10.15446/caldasia.v44n3.90148
191,"Faundez, A; Magni, CR; Martinez-Herrera, E; Espinoza, S; Vaswani, S; Yanez, MA; Grez, I; Seguel, O; Abarca-Rojas, B; Quiroz, I","Effect of the Soil Matric Potential on the Germination Capacity of Prosopis chilensis, Quillaja saponaria and Cryptocarya alba from Contrasting Geographical Origins",2022,PLANTS-BASEL,ISI/SCOPUS/UCH/VID,http://dx.doi.org/10.3390/plants11212963,10.3390/plants11212963
192,"Magni, CR; Saavedra, N; Espinoza, SE; Yanez, MA; Quiroz, I; Faundez, A; Grez, I; Martinez-Herrera, E","The Recruitment of the Recalcitrant-Seeded Cryptocarya alba (Mol.) Looser, Established via Direct Seeding Is Mainly Affected by the Seed Source and Forest Cover",2022,PLANTS-BASEL,ISI/SCOPUS/UCH/VID,http://dx.doi.org/10.3390/plants11212918,10.3390/plants11212918
193,"Espinoza, Sergio E.; Quiroz, Ivan A.; Magni, Carlos R.; Yanez, Marco A.; Martinez, Eduardo E.",Long-Term Effects of Copper Mine Tailings on Surrounding Soils and Sclerophyllous Vegetation in Central Chile,2022,WATER AIR AND SOIL POLLUTION,ISI/SCOPUS/UCH/VID,http://dx.doi.org/10.1007/s11270-022-05782-8,10.1007/s11270-022-05782-8
194,"Quiroz I.A., Espinoza S.E., Yáñez M.A., Magni C.R., Martínez E.E., Gutierrez B.T., Faúndez A.F., Vaswani S.A.",Provenance causes variation on early growth and survival and sun protection on physiological responses of the vulnerable Nothofagus glauca (Phil.) Krasser in a common garden in Central Chile,2022,ENVIRONMENTAL AND SUSTAINABILITY INDICATORS,SCOPUS/ESCI/UCH/VID,http://dx.doi.org/10.1016/j.indic.2022.100192,10.1016/j.indic.2022.100192
195,"Espinoza, SE; Quiroz, IA; Magni, CR; Yanez, MA",Variation in early growth and survival of Pinus ponderosa provenances established in Southern Chile,2021,NEW FORESTS,ISI/SCOPUS/UCH/VID,http://dx.doi.org/10.1007/s11056-021-09833-6,10.1007/s11056-021-09833-6
196,"Meza, SEE; Arce, MAY; Diaz, CRM; Herrera, EEM; Ortega, JFO; Miranda, SAV",Growth of provenances of Cryptocarya alba during water stress and after re-watering in the nursery,2021,SCIENTIA AGRICOLA,ISI/SCOPUS/SCIELO-otros paises /UCH/VID,http://dx.doi.org/10.1590/1678-992x-2020-0292,10.1590/1678-992x-2020-0292
197,"Espinoza S.E., Yañez M.A., Martínez E.E., Carrasco-Benavides M.R., Vaswani S.A., Gajardo J., Magni C.R.",Influence of provenance origin on the early performance of two sclerophyllous Mediterranean species established in burned drylands,2021,SCIENTIFIC REPORTS,SCOPUS/ISI/UCH/VID,http://dx.doi.org/10.1038/s41598-021-85599-3,10.1038/s41598-021-85599-3
198,"Quiroz, IA; Espinoza, SE; Yanez, MA; Magni, CR",The use of shelters improves growth and survival of the endangered Nothofagus alessandrii after 5 years in a Mediterranean drought-prone site,2021,ECOLOGICAL ENGINEERING,SCOPUS/ISI/UCH/VID,http://dx.doi.org/10.1016/j.ecoleng.2021.106220,10.1016/j.ecoleng.2021.106220
199,"Espinoza, SE; Yanez, MA; Magni, CR; Santelices, RE; Cabrera, AM",Outplanting performance of three provenances of Quillaja saponaria Mol. established in a Mediterranean drought-prone site and grown in different container size,2020,IFOREST-BIOGEOSCIENCES AND FORESTRY,ISI/SCOPUS/UCH/VID,http://dx.doi.org/10.3832/ifor3142-012,10.3832/ifor3142-012
200,"Meza, SEE; Ivkovic, M; Arce, MAY; Diaz, CRM; Moya, RES; Ariza, AMC",Growth of radiata pine families in nursery and two years after field establishment,2020,SCIENTIA AGRICOLA,ISI/SCOPUS/SCIELO-otros paises /UCH/VID,http://dx.doi.org/10.1590/1678-992x-2018-0159,10.1590/1678-992x-2018-0159
201,"Cabrera-Ariza, AM; Tozzini, C; Espinoza-Meza, SE; Santelices-Moya, RE; Magni-Diaz, CR; Alonso-Valdes, MF",Effect of crop management intensity on energy and carbon dioxide balance of two bioenergy Sorghum bicolor hybrids,2019,ITALIAN JOURNAL OF AGRONOMY,SCOPUS/ISI/UCH/VID,http://dx.doi.org/10.4081/ija.2018.1316,10.4081/ija.2018.1316
202,"Magni, C; Espinoza, S; Poch, P; Abarca, B; Grez, I; Martinez, E; Yanez, M; Santelices, R; Cabrera, A",Growth and biomass partitioning of nine provenances of Quillaja saponaria seedlings to water stress,2019,SOUTHERN FORESTS,ISI/SCOPUS/UCH/VID,http://dx.doi.org/10.2989/20702620.2018.1512789,10.2989/20702620.2018.1512789
203,"Cabrera-Ariza, A; Santelices-Moya, R; Espinoza-Meza, S; Magni-Diaz, C",Energy balance in the first cutting cycle of three eucalyptus species with different levels of management in the Mediterranean drylands of central Chile,2019,BOSQUE,ISI/SCIELO-Chile/UCH/VID,http://dx.doi.org/10.4067/S0717-92002019000100049,10.4067/S0717-92002019000100049
204,"Kremer, KN; Promis, AA; Mancilla, G; Magni, CR",Leaf litter and irrigation can increase seed germination and early seedling survival of the recalcitrant-seeded tree Beilschmiedia miersii,2019,AUSTRAL ECOLOGY,ISI/SCOPUS/UCH/VID,http://dx.doi.org/10.1111/aec.12655,10.1111/aec.12655
205,"Moya, RS; Meza, SE; Ariza, AC; Díaz, CM","Risk management as a tool for the conservation of the forests of nothofagus alessandrii, an endangered species of central Chile",2018,INTERCIENCIA,ISI/SCOPUS/UCH/VID,,
206,"Espinoza, SE; Santelices, RE; Cabrera, AM; Magni, CR","Interactive effects of water stress, container size and fertilizer on survival, gas exchange and morphological traits of Quillaja saponaria seedlings",2017,BOSQUE,ISI/SCOPUS/SCIELO-Chile/UCH/VID,http://dx.doi.org/10.4067/S0717-92002017000200018,10.4067/S0717-92002017000200018
207,"Moya, RS; Meza, SE; Diaz, CM; Ariza, AC; Calderon, SD; Pena-Rojas, K","Variability in seed germination and seedling growth at the intra- and inter-provenance levels of Nothofagus glauca (Lophozonia glauca), an endemic species of Central Chile",2017,NEW ZEALAND JOURNAL OF FORESTRY SCIENCE,ISI/SCOPUS/UCH/VID,http://dx.doi.org/10.1186/s40490-017-0091-5,10.1186/s40490-017-0091-5
208,"Espinoza, SE; Magni, CR; Rubilar, RA; Yanez, MA; Santelices, RE; Cabrera, AM; Ivkovic, M",Field performance of various Pinus radiata breeding families established on a drought-prone site in central Chile,2017,NEW ZEALAND JOURNAL OF FORESTRY SCIENCE,SCOPUS/ISI/UCH/VID,http://dx.doi.org/10.1186/s40490-017-0093-3,10.1186/s40490-017-0093-3
209,"Espinoza, SE; Magni, CR; Santelices, RE; Ivkovic, M; Cabrera, AM",Changes in drought tolerance of Pinus radiata in Chile associated with provenance and breeding generation,2016,ANNALS OF FOREST SCIENCE,ISI/SCOPUS/UCH/VID,http://dx.doi.org/10.1007/s13595-015-0498-1,10.1007/s13595-015-0498-1
210,"Magni, CR; Espinoza, SE; Garrido, EF; Santelices, RE; Cabrera, AM",Differential adaptations in nursery seedlings from diverse Chilean provenances of Peumus boldus Mol.,2016,IFOREST-BIOGEOSCIENCES AND FORESTRY,ISI/SCOPUS/UCH/VID,http://dx.doi.org/10.3832/ifor1893-008,10.3832/ifor1893-008
211,"Espinoza, SE; Martinez, VA; Magni, CR; Ivkovic, M; Santelices, RE; Guerra, FP; Cabrera, AM","Genetic control of growth, biomass allocation, and survival under drought stress in Pinus radiata D. Don seedlings",2014,TREE GENETICS & GENOMES,ISI/SCOPUS/UCH/VID,http://dx.doi.org/10.1007/s11295-014-0741-1,10.1007/s11295-014-0741-1
212,"Espinoza, S; Magni, CR; Martinez, V; Ivkovic, M; Gapare, W",Genetic parameters for early growth and biomass traits of Pinus radiata D. Don under different water regimes,2013,SILVAE GENETICA,SCOPUS/ISI/UCH/VID,,
213,"Espinoza, SE; Magni, CR; Martinez, VA; Ivkovic, M",The effect of water availability on plastic responses and biomass allocation in early growth traits of Pinus radiata D. Don,2013,FOREST SYSTEMS,SCOPUS/ISI/UCH/VID,http://dx.doi.org/10.5424/fs/2013221-02084,10.5424/fs/2013221-02084
214,"Espinoza, S; Magni, CR; Martinez, V; Gapare, W; Cordero, C",Genetic diversity and differentiation of Chilean plantations of Pinus radiata D. Don using microsatellite DNA markers,2012,SILVAE GENETICA,ISI/SCOPUS/UCH/VID,,
215,"Magni, CR; Ducousso, A; Caron, H; Petit, RJ; Kremer, A",Chloroplast DNA variation of Quercus rubra L. in North America and comparison with other Fagaceae,2005,MOLECULAR ECOLOGY,SCOPUS/ISI/UCH/VID,http://dx.doi.org/10.1111/j.1365-294X.2005.02400.x,10.1111/j.1365-294X.2005.02400.x
216,"Magni, CR; Poch, PL; Espinoza, SE; Yanez, MA; Martinez, EE; Promis, AA; Mancilla, GA",Provenance influences seed germination and phenotypic responses to water restriction in the endemic Beilschmiedia miersii (Gay) Kosterm,2023,FRONTIERS IN FORESTS AND GLOBAL CHANGE,ISI/SCOPUS/UCH/VID,http://dx.doi.org/10.3389/ffgc.2022.1039908,10.3389/ffgc.2022.1039908
217,"Kremer, KN; Promis, AA; Mancilla, G; Magni, CR",Leaf litter and irrigation can increase seed germination and early seedling survival of the recalcitrant-seeded tree Beilschmiedia miersii,2019,AUSTRAL ECOLOGY,ISI/SCOPUS/UCH/VID,http://dx.doi.org/10.1111/aec.12655,10.1111/aec.12655
218,"Cerda C., Fuentes J.P., Mancilla G.",Can conservation in protected areas and visitor preferences converge? An empirical study in Central Chile,2018,BIODIVERSITY AND CONSERVATION,ISI/SCOPUS/UCH/VID,http://dx.doi.org/10.1007/s10531-018-1501-6,10.1007/s10531-018-1501-6
219,Papanicolaou A.N; Sanford J.T; Dermisis D.C; Mancilla G.A.,A mechanistic model to simulate rill erosion,2010,Watershed Management Conference 2010: Innovations in Watershed Management under Land Use and Climate Change - Proceedings of the 2010 Watershed Management Conference,SCOPUS/UCH/VID,http://dx.doi.org/10.1061/41148(389)98,10.1061/41148(389)98
220,"Papanicolaou, AN ; Sanford, JT ; Dermisis, DC ; Mancilla, GA",A 1-D morphodynamic model for rill erosion,2010,WATER RESOURCES RESEARCH,SCOPUS/ISI/UCH/VID,http://dx.doi.org/10.1029/2009WR008486,10.1029/2009WR008486
221,"Magni, CR; Poch, PL; Espinoza, SE; Yanez, MA; Martinez, EE; Promis, AA; Mancilla, GA",Provenance influences seed germination and phenotypic responses to water restriction in the endemic Beilschmiedia miersii (Gay) Kosterm,2023,FRONTIERS IN FORESTS AND GLOBAL CHANGE,ISI/SCOPUS/UCH/VID,http://dx.doi.org/10.3389/ffgc.2022.1039908,10.3389/ffgc.2022.1039908
222,"Magni, C; Espinoza, S; Poch, P; Abarca, B; Grez, I; Martinez, E; Vaswani, S; Toro, N; Gomez, P",Leaf phenotypic variation in natural populations of Quillaja saponaria and its relationship with climatic variation,2022,CALDASIA,SCOPUS/ISI/UCH/VID,http://dx.doi.org/10.15446/caldasia.v44n3.90148,10.15446/caldasia.v44n3.90148
223,"Faundez, A; Magni, CR; Martinez-Herrera, E; Espinoza, S; Vaswani, S; Yanez, MA; Grez, I; Seguel, O; Abarca-Rojas, B; Quiroz, I","Effect of the Soil Matric Potential on the Germination Capacity of Prosopis chilensis, Quillaja saponaria and Cryptocarya alba from Contrasting Geographical Origins",2022,PLANTS-BASEL,ISI/SCOPUS/UCH/VID,http://dx.doi.org/10.3390/plants11212963,10.3390/plants11212963
224,"Magni, CR; Saavedra, N; Espinoza, SE; Yanez, MA; Quiroz, I; Faundez, A; Grez, I; Martinez-Herrera, E","The Recruitment of the Recalcitrant-Seeded Cryptocarya alba (Mol.) Looser, Established via Direct Seeding Is Mainly Affected by the Seed Source and Forest Cover",2022,PLANTS-BASEL,ISI/SCOPUS/UCH/VID,http://dx.doi.org/10.3390/plants11212918,10.3390/plants11212918
225,"Espinoza, Sergio E.; Quiroz, Ivan A.; Magni, Carlos R.; Yanez, Marco A.; Martinez, Eduardo E.",Long-Term Effects of Copper Mine Tailings on Surrounding Soils and Sclerophyllous Vegetation in Central Chile,2022,WATER AIR AND SOIL POLLUTION,ISI/SCOPUS/UCH/VID,http://dx.doi.org/10.1007/s11270-022-05782-8,10.1007/s11270-022-05782-8
226,"Quiroz I.A., Espinoza S.E., Yáñez M.A., Magni C.R., Martínez E.E., Gutierrez B.T., Faúndez A.F., Vaswani S.A.",Provenance causes variation on early growth and survival and sun protection on physiological responses of the vulnerable Nothofagus glauca (Phil.) Krasser in a common garden in Central Chile,2022,ENVIRONMENTAL AND SUSTAINABILITY INDICATORS,SCOPUS/ESCI/UCH/VID,http://dx.doi.org/10.1016/j.indic.2022.100192,10.1016/j.indic.2022.100192
