,codigo,titulo,fecha_inicio,fecha_fin,investigadores,institucion,programa,fuente
0,1211078,Cognitive impairment in idiopathic parkinson disease and progressive supranuclear palsy: Improving early diagnosis and surrogate endpoints for preventing dementia,01/08/2020,01/08/2020,"C. Guevara / R. Villegas, M. Martínez, R. Naves, C. Garrido, J. de Grazia",Centro de Diagnóstico,FONDECYT,Regular
1,1200852,Improving diagnosis and surrogate endpoints in parkinsonian diseases: from the pathology towards novel clinical biomarkers,01/08/2019,01/08/2019,"C. Guevara / J. de Grazia, G. Farías",Centro de Diagnóstico,FONDECYT,Regular
2,SA20I0024,"Protocolo terapéutico en esclerosis múltiple recurrente remitente basado en los conceptos de no evidencia de actividad de enfermedad, atrofia cerebral y deterioro cognitivo para evaluar la efectividad de las terapias de las leyes AUGE y Ricarte Soto",01/04/2020,01/04/2020,"C. Guevara / M. Martínez, R. Villegas, R. Núñez, J. de Grazia, V. Díaz",Departamento de Neurología y Neurocirugía Norte,CONICYT/MINSAL,FONIS-Proyectos I&D
3,1190259,Improving diagnosis and prognostic indices in parkinsonian diseases: from the pathology towards novel clinical biomarkers,01/08/2018,01/08/2018,"C. Guevara / C. Garrido, G. Farías, J. de Grazia",Centro de Diagnóstico,FONDECYT,Regular
4,SA19I0012,"Protocolo terapéutico en esclerosis múltiple recurrente remitente basado en los conceptos de no evidencia de actividad de enfermedad, atrofia cerebral y deterioro cognitivo para evaluar la efectividad de las terapias de las leyes AUGE y Ricarte Soto",01/03/2019,01/03/2019,"C. Guevara / V. Díaz, J. de Grazia, M. Martínez, R. Núñez, G. Farías, C. Garrido",Departamento de Neurología y Neurocirugía Norte,CONICYT/MINSAL,FONIS-Proyectos I&D
5,1180716,Improving diagnosis and prognostic indices in parkinsonian diseases: from the pathology towards novel clinical biomarkers,01/07/2017,01/07/2017,"C. Guevara / A. Orellana, C. Garrido, G. Farías, M. Martínez, J. de Grazia, V. Díaz",Servicio de Neumología,FONDECYT,Regular
