,codigo,titulo,fecha_inicio,fecha_fin,investigadores,institucion,programa,fuente
0,1970192,La protección de la libertad de las personas en el derecho penal Chileno: balance critico y perspectivas,01/03/1997,01/03/1999,A. Bascuñán,Departamento de Ciencias Penales,FONDECYT,Regular
1,1240436,Comisiones de libertad condicional: entre la reinserción social y las demandas de seguridad ciudadana,01/07/2023,01/07/2023,"Ã. Castro / L. Contreras, G. Espinoza",Departamento de Ciencias Penales,FONDECYT,Regular
2,1210463,Hacia una superación de las limitaciones del Derecho penal chileno para hacer responsables como autores a los órganos superiores de las empresas,01/03/2021,01/03/2024,L. Contreras / Ã. Castro,Departamento de Ciencias Penales,FONDECYT,Regular
3,ID21I10255,Prototipo de gestión integrada para una reinserción social eficaz,01/09/2021,01/09/2023,"G. Sanhueza / Ã. Castro, R. Weber, M. Urquieta, T. Matus",Departamento de Trabajo Social,FONDEF,IDEA
4,1201366,Evaluación político criminal de la legislación penal chilena desde la Reforma Procesal Penal,01/08/2019,01/08/2019,"C. González, Ã. Castro",Universidad Austral De Chile,FONDECYT,Regular
5,11190355,El principio de Especialidad en la ejecución de la sanción de régimen cerrado de adolescentes. Entre el discurso y la realidad,01/10/2019,01/10/2022,Ã. Castro,Departamento de Ciencias Penales,FONDECYT,Iniciación en Investigación
6,11180209,El principio de especialidad en la ejecución de la sanción de régimen cerrado de adolescentes. Entre el discurso y la realidad,01/05/2018,01/05/2018,Ã. Castro,Centro de Estudios de la Justicia,FONDECYT,Iniciación en Investigación
7,UI_2018_14,Inspecciones carcelarias en Chile. Rol de la Fiscalía Judicial de la Corte Suprema a la luz del modelo de inspectoría de prisiones inglés,01/07/2018,01/07/2018,Ã. Castro,Centro de Estudios de la Justicia,Fondo Central de Investigación,U-INICIA
8,11170404,Las comisiones interinstitucionales de supervisión de centros privativos de libertad de adolescentes como mecanismo de protección de derechos,01/06/2017,01/06/2017,Ã. Castro,Centro de Estudios de la Justicia,FONDECYT,Iniciación en Investigación
9,11160068,Mecanismos de protección de derechos para los privados de libertad diseñados para monitorear las condiciones estructurales del sistema penitenciario chileno y comparado,01/06/2016,01/06/2016,Ã. Castro,Centro de Estudios de la Justicia,FONDECYT,Iniciación en Investigación
10,11150448,"Ejecución de la sanción privativa de libertad. Análisis normativo a la luz del derecho internacional y derecho alemán
",01/06/2015,01/06/2015,Ã. Castro,Decanato,FONDECYT,Iniciación en Investigación
11,1240436,Comisiones de libertad condicional: entre la reinserción social y las demandas de seguridad ciudadana,01/07/2023,01/07/2023,"Ã. Castro / L. Contreras, G. Espinoza",Departamento de Ciencias Penales,FONDECYT,Regular
12,1210463,Hacia una superación de las limitaciones del Derecho penal chileno para hacer responsables como autores a los órganos superiores de las empresas,01/03/2021,01/03/2024,L. Contreras / Ã. Castro,Departamento de Ciencias Penales,FONDECYT,Regular
13,11160021 ,La determinación del deber de cuidado en los delitos culposos de resultado,01/10/2016,01/10/2019,L. Contreras,Departamento de Ciencias Penales,FONDECYT,Iniciación en Investigación
14,1211319,La tipificación chilena del delito de tortura (Ley Nº 20.968 de 22 de noviembre de 2016). Algunas cuestiones problemáticas,01/08/2020,01/08/2020,C. Cárdenas,Departamento de Ciencias Penales,FONDECYT,Regular
15,1200364,Cuestiones relativas al tipo penal de tortura en el derecho chileno,01/08/2019,01/08/2019,C. Cárdenas,Departamento de Ciencias Penales,FONDECYT,Regular
16,1191236,Cuestiones relativas al tipo penal de tortura en el derecho chileno,01/08/2018,01/08/2018,C. Cárdenas,Departamento de Ciencias Penales,FONDECYT,Regular
17,1161654,¿Responsabilidad de proteger para terceros ante catástrofes humanitarias? Implicancias de invocarla para la jurisdicción penal internacional y para el derecho que regula las operaciones de paz,01/06/2015,01/06/2015,C. Cárdenas / X. Fuentes,Gabinete Centro DDHH,FONDECYT,Regular
18,1120097,"Análisis de los principales problemas que presenta la interpretación de la Ley Nº 20.375, que tipifica en Chile el genocidio, los crímenes de lesa humanidad y los crímenes de guerra",01/03/2012,01/03/2015,C. Cárdenas,Escuela de Postgrado,FONDECYT,Regular
19,1080060,El principio de la complementariedad: un cambio de paradigma en la justicia penal internacional,01/03/2008,01/03/2011,C. Cárdenas,Decanato,FONDECYT,Regular
20,1161419,Estudio dogmático crítico de la doctrina de la jurisprudencia de la corte suprema sobre recurso de nulidad en materia penal en relación al principio de trascendencia,01/06/2015,01/06/2015,M. Horvitz / L. Aguirre,Centro de Estudios de la Justicia,FONDECYT,Regular
21,1110897,Pluralidad de delitos y pluralidad de cargos en el proceso penal,01/03/2011,01/03/2011,M. Horvitz,Departamento de Ciencias Penales,FONDECYT,Regular
22,1060824,"Bases para la reforma del sistema penitenciario chileno
",01/03/2006,01/03/2006,"M. Horvitz / L. Aguirre, J. Valenzuela",Departamento de Ciencias Penales,FONDECYT,Regular
23,1040178,"Evaluación de las relaciones entre la policia y el Ministerio Público en la implementación del nuevo sistema procesal penal en la regiones II, III y VIIe 
",01/03/2004,01/03/2004,M. Horvitz,Departamento de Ciencias Penales,FONDECYT,Regular
24,1241747,El feminismo en la encrucijada entre lo nuevo y lo antiguo: hacia una nueva política criminal para enfrentar la violencia contra la mujer,01/07/2023,01/07/2023,R. Lorca,Departamento de Ciencias Penales,FONDECYT,Regular
25,1211763,Un análisis genealógico de la recepción de las neurociencias en el derecho penal chileno,01/03/2021,01/03/2024,R. Camargo / R. Lorca,Departamento de Ciencias del Derecho,FONDECYT,Regular
26,3210645,"Igualdad y control policial de trabajadores callejeros en Chile: análisis de la justicia del ""sistema legal"" del espacio público",01/03/2021,01/03/2024,P. Irarrázabal / R. Lorca,Departamento de Ciencias Penales,FONDECYT,Postdoctorado
27,IM19CUIDA,Instituto Milenio CUIDA,01/11/2019,01/11/2019,R. Lorca,Universidad Católica de Chile,Iniciativa científica Milenio,Institutos Milenios
28,IM19IMADEM,Instituto Milenio de Adaptación Institucional y Desempeño Democrático,01/11/2019,01/11/2019,"D. Pardow, M. Reyes, R. Lorca, F. Soto",Universidad Católica de Chile,Iniciativa científica Milenio,Institutos Milenios
29,11180839,"Pobreza, legalidad y castigo",01/11/2018,01/11/2021,R. Lorca,Departamento de Ciencias Penales,FONDECYT,Iniciación en Investigación
30,1170056,La conformación del derecho penal entre política y cultura,01/04/2017,01/04/2021,R. Lorca,UAI. Facultad de Derecho,FONDECYT,Regular
31,11170267,La Injusticia Penal de la Pobreza,01/06/2017,01/06/2017,R. Lorca,Departamento de Ciencias Penales,FONDECYT,Iniciación en Investigación
32,3160765,¿Impunity and punishment: An investigation on the ethics of the criminal law?,01/06/2015,01/06/2015,R. Lorca / J. Mañalich,Departamento de Ciencias Penales,FONDECYT,Postdoctorado
33,11160036 ,"La Presunción de Castigo: Hacia una Conexión entre la Justicia Penal, Económica y Política ",01/06/2016,01/06/2016,R. Lorca,Departamento de Ciencias Penales,FONDECYT,Iniciación en Investigación
34,1200235,"Azar, control y responsabilidad. Una investigación sobre la relevancia penal de la suerte moral",01/03/2020,01/03/2023,J. Mañalich / J. Ormeño,Departamento de Ciencias Penales,FONDECYT,Regular
35,3160765,¿Impunity and punishment: An investigation on the ethics of the criminal law?,01/06/2015,01/06/2015,R. Lorca / J. Mañalich,Departamento de Ciencias Penales,FONDECYT,Postdoctorado
36,1160147,La tentativa de delito como hecho punible. Una reconstrucción desde la teoría de las normas,01/04/2016,01/04/2019,J. Mañalich,Departamento de Ciencias Penales,FONDECYT,Regular
37,1140040,"Terrorismo, derecho penal y democracia. bases para un concepto jurídico de terrorismo en el derecho penal chileno y examen de núcleos problemáticos en su actual regulación",01/03/2014,01/03/2017,M. Villegas / J. Mañalich,Escuela de Ingeniería en Agronegocios,FONDECYT,Regular
38,11110274,La ontología del hecho punible. Fundamentos de teoría de las normas y teoría de la acción para la dogmática de la parte general del derecho penal,01/10/2011,01/10/2014,J. Mañalich,Departamento de Ciencias Penales,FONDECYT,Iniciación en Investigación
39,INTERD-2-5,"Prevención de la victimización secundaria en niños, niñas y adolescentes que han sido victimas de delitos sexuales",01/08/2013,01/07/2015,"C. Navarro / D. Mettifogo, E. Sepúlveda, S. Arensburg, G. Soto, C. Capella, J. Miranda, O. Grau, F. Lathrop, C. Donoso",Departamento de Psicología,Iniciativa Bicentenario Juan Gómez Millas,Fondo de investigación
40,1210455,Ley de Seguridad del Estado y conmoción social. Análisis jurídico penal de sus principales núcleos problemáticos,01/03/2021,01/03/2024,M. Villegas,Departamento de Ciencias Penales,FONDECYT,Regular
41,1170068,La Ley de control de armas y sus reformas. La eficacia de la herramienta punitiva v/s las garantías,01/04/2017,01/04/2020,M. Villegas,Gabinete Centro DDHH,FONDECYT,Regular
42,ID16I10424,Protocolo de atención con pertinencia cultural a usuarios mapuche en los tribunales de la Araucanía,01/11/2016,01/11/2018,M. Villegas,Departamento de Sociología y Ciencia política,FONDEF,IDEA Bietapa
43,1140040,"Terrorismo, derecho penal y democracia. bases para un concepto jurídico de terrorismo en el derecho penal chileno y examen de núcleos problemáticos en su actual regulación",01/03/2014,01/03/2017,M. Villegas / J. Mañalich,Escuela de Ingeniería en Agronegocios,FONDECYT,Regular
44,1110086,"Pluralismo cultural, pueblos originarios y derecho penal chileno: del derecho indiano a la administración biopolítica. Bases para una reforma penal integral.
",01/03/2011,01/03/2013,M. Villegas / E. Oyarzún,Escuela de Ingeniería en Agronegocios,FONDECYT,Regular
45,SP-3,Domeyko Sociedad y Equidad: Sujetos y actores sociales,01/11/2007,01/11/2010,"E. Oyarzún / S. Montecino, M. López, N. Yáñez, J. González, M. Villegas, R. Asun, G. Aranda, C. Zúñiga, C. Salinas, H. Stange",Departamento de Literatura,Fondo Central de Investigación,Programa Domeyko
