,Autores,titulo_publicacion,ano,titulo_revistas,tipo_publicacion,link,doi
0,"Saadati, F; Celis, S",Student Motivation in Learning Mathematics in Technical and Vocational Higher Education: Development of an Instrument,2023,INTERNATIONAL JOURNAL OF EDUCATION IN MATHEMATICS SCIENCE AND TECHNOLOGY ,ESCI/SCOPUS/UCH/VID,http://dx.doi.org/10.46328/ijemst.2194,10.46328/ijemst.2194
1,"Hilliger, I; Aguirre, C; Miranda, C; Celis, S; Perez-Sanagustin, M",Lessons learned from designing a curriculum analytics tool for improving student learning and program quality,2022,JOURNAL OF COMPUTING IN HIGHER EDUCATION,ISI/SCOPUS/UCH/VID,http://dx.doi.org/10.1007/s12528-022-09315-4,10.1007/s12528-022-09315-4
2,"Santelices M.V., Celis S.",Introduction to the Special Issue: Student Experience in Latin American Higher Education,2022,EDUCATION POLICY ANALYSIS ARCHIVES,SCOPUS/UCH/VID,http://dx.doi.org/10.14507/epaa.30.7549,10.14507/epaa.30.7549
3,"Hilliger, I; Celis, S; Perez-Sanagustin, M",Engaged Versus Disengaged Teaching Staff: A Case Study of Continuous Curriculum Improvement in Higher Education,2022,HIGHER EDUCATION POLICY,ISI/SCOPUS/UCH/VID,http://dx.doi.org/10.1057/s41307-020-00196-9,10.1057/s41307-020-00196-9
4,"Celis, S; Veliz, D",A Decade of Chilean Graduate Program Accreditation: A Push for Internationalization and Issues of Multidisciplinarity,2022,HIGHER EDUCATION POLICY,ISI/SCOPUS/UCH/VID,http://dx.doi.org/10.1057/s41307-020-00198-7,10.1057/s41307-020-00198-7
5,Andrés Bernasconi; Paulina Berríos Cortés; Pamela Guzmán; Daniela Véliz; Sergio Celis,La profesión académica en Chile: perspectivas desde una encuesta internacional,2021,CALIDAD EN LA EDUCACION,/UCH/VID,http://dx.doi.org/10.31619/caledu.n54.923 ,10.31619/caledu.n54.923 
6,"Kim J., Celis S.",Women in STEM in Chilean Higher Education: Social movements and institutional transformations,2021,"Gender Equity in STEM in Higher Education: International Perspectives on Policy, Institutional Culture, and Individual Choice",SCOPUS/UCH/VID,,
7,"Suárez Salas, Francisco; Celis Guzmán, Sergio",Caracterización de la enseñanza de matemática en educación superior técnico profesional a través del estudio de las preguntas hechas por docentes en la sala de clases,2021,ESTUDIOS PEDAGOGICOS (VALDIVIA),SCOPUS/SCIELO-Chile/UCH/VID,http://dx.doi.org/10.4067/S0718-07052021000200007,10.4067/S0718-07052021000200007
8,"Celis S., Guzmán-Valenzuela C.",Special issue: Internationalisation and the global South,2021,SOTL in the South,SCOPUS/UCH/VID,http://dx.doi.org/10.36615/SOTLS.V5I1.179,10.36615/SOTLS.V5I1.179
9,"Villaseñor T., Celis S., Queupil J.P., Pinto L., Rojas M.",The influence of early experiences and university environment for female students choosing geoscience programs: A case study at Universidad de Chile,2020,Advances in Geosciences,SCOPUS/UCH/VID,http://dx.doi.org/10.5194/adgeo-53-227-2020,10.5194/adgeo-53-227-2020
10,"Hilliger I., Aguirre C., Miranda C., Celis S., Pérez-Sanagustín M.",Design of a curriculum analytics tool to support continuous improvement processes in higher education,2020,ACM International Conference Proceeding Series,SCOPUS/UCH/VID,http://dx.doi.org/10.1145/3375462.3375489,10.1145/3375462.3375489
11,"Mathioudakis M., Castillo C., Barnabo G., Celis S.",Affirmative action policies for top-k candidates selection: With an application to the design of policies for university admissions,2020,Proceedings of the ACM Symposium on Applied Computing,SCOPUS/UCH/VID,http://dx.doi.org/10.1145/3341105.3373878,10.1145/3341105.3373878
12,"Zapata M.M.V., Celis S.",Emerging support systems for entrepreneurship education in the context of an ambitious national reform in Chilean engineering schools,2019,"ASEE Annual Conference and Exposition, Conference Proceedings",SCOPUS/UCH/VID,,
13,"Hilliger I., Celis S., Pérez-Sanagustín M., Baier J.",Work in progress: Engaging engineering teaching staff in continuous improvement process,2019,"ASEE Annual Conference and Exposition, Conference Proceedings",SCOPUS/UCH/VID,,
14,"Hilliger I., Miranda C., Celis S., Pérez-SanAgustín M.",Evaluating usage of an analytics tool to support continuous curriculum improvement,2019,CEUR Workshop Proceedings,SCOPUS/UCH/VID,,
15,"Celis S., López D., Silva J.",Analyzing the influence of online behaviors and learning approaches on academic performance in first year engineering,2019,CEUR Workshop Proceedings,SCOPUS/UCH/VID,,
16,"Droguett F., Celis S.",Influence of the institutional context on mathematics teachers' work in technical and vocational higher education in Chile,2018,ESTUDIOS PEDAGOGICOS (VALDIVIA),SCOPUS/SCIELO-Chile/UCH/VID,http://dx.doi.org/10.4067/s0718-07052018000300235,10.4067/s0718-07052018000300235
17,"Celis S., Kim J.",The making of homophilic networks in international research collaborations: A global perspective from Chilean and Korean engineering,2018,RESEARCH POLICY,ISI/SCOPUS/UCH/VID,http://dx.doi.org/10.1016/j.respol.2018.01.001,10.1016/j.respol.2018.01.001
18,"Bernasconi A., Celis S.",Higher education reforms: Latin america in comparative perspective,2017,EDUCATION POLICY ANALYSIS ARCHIVES,SCOPUS/UCH/VID,http://dx.doi.org/10.14507/epaa.25.3240,10.14507/epaa.25.3240
19,"Huang-Saad, A; Celis, S",How Student Characteristics Shape Engineering Pathways to Entrepreneurship Education,2017,INTERNATIONAL JOURNAL OF ENGINEERING EDUCATION,ISI/SCOPUS/UCH/VID,,
20,"Celis S., Aguirre M.C.",Students against the odds: First-year engineering students' strategies for improving academic achievement,2016,"ASEE Annual Conference and Exposition, Conference Proceedings",SCOPUS/UCH/VID,,
21,"Celis S., Hilliger I.",Redesigning engineering education in Chile: How selective institutions respond to an ambitious national reform,2016,"ASEE Annual Conference and Exposition, Conference Proceedings",SCOPUS/UCH/VID,,
22,"Celis Guzmán, Sergio; Huang Saad, Aileen",Students seeking different paths to entrepreneurial education,2015,"ASEE Annual Conference and Exposition, Conference Proceedings",SCOPUS/UCH/VID,,
23,"Medina, CD; Herrera, RA; Beltran, JF",Constitutive model for superelastic shape memory alloys considering strength and stiffness degradation and residual strain: An empirical approach for engineering applications,2023,ENGINEERING STRUCTURES,ISI/SCOPUS/UCH/VID,http://dx.doi.org/10.1016/j.engstruct.2023.115810,10.1016/j.engstruct.2023.115810
24,"Medina, CD; Herrera, RA; Beltran, JF",Improvement of superelasticity conditions in Cu-based shape memory alloys for seismic control applications,2023,ENGINEERING STRUCTURES,ISI/SCOPUS/UCH/VID,http://dx.doi.org/10.1016/j.engstruct.2022.115151,10.1016/j.engstruct.2022.115151
25,"Herrera R., Guerrero R., Rodriguez M.A.",Experiments and Modelling of Starred Angle Braces,2022,Lecture Notes in Civil Engineering,SCOPUS/UCH/VID,http://dx.doi.org/10.1007/978-3-031-03811-2_18,10.1007/978-3-031-03811-2_18
26,"Herrera, Ricardo A.; Muhummud, Teerawut; Ricles, James M.; Sause, Richard",Modeling of composite MRFs with CFT columns and WF beams,2022,STEEL AND COMPOSITE STRUCTURES,ISI/SCOPUS/UCH/VID,http://dx.doi.org/10.12989/scs.2022.43.3.327,10.12989/scs.2022.43.3.327
27,"Colombo J.I., Herrera R.A., Almazán J.L.",Low cycle fatigue capacity of shell-to-base connections in stainless steel thin-walled tanks,2021,ENGINEERING STRUCTURES,SCOPUS/ISI/UCH/VID,http://dx.doi.org/10.1016/j.engstruct.2021.112949,10.1016/j.engstruct.2021.112949
28,"Nunez, E; Lichtemberg, R; Herrera, R",Cyclic Performance of End-Plate Biaxial Moment Connection with HSS Columns,2020,METALS,ISI/SCOPUS/UCH/VID,http://dx.doi.org/10.3390/met10111556,10.3390/met10111556
29,"Nunez, E; Parraguez, G; Herrera, R",Bidirectional Response of Weak-Axis End-plate Moment Connections: Numerical Approach,2020,METALS,ISI/SCOPUS/UCH/VID,http://dx.doi.org/10.3390/met10070964,10.3390/met10070964
30,"Nunez, E; Aguayo, C; Herrera, R",Assessment of the Seismic Behavior of Selective Storage Racks Subjected to Chilean Earthquakes,2020,METALS,SCOPUS/ISI/UCH/VID,http://dx.doi.org/10.3390/met10070855,10.3390/met10070855
31,"Gallegos, M; Nunez, E; Herrera, R",Numerical Study on Cyclic Response of End-Plate Biaxial Moment Connection in Box Columns,2020,METALS,ISI/SCOPUS/UCH/VID,http://dx.doi.org/10.3390/met10040523,10.3390/met10040523
32,"Massone, LM; Manriquez, I; Diaz, S; Rojas, F; Herrera, R",Understanding the cyclic response of RC walls with setback discontinuities through a finite element model and a strut-and-tie model,2019,BULLETIN OF EARTHQUAKE ENGINEERING,ISI/SCOPUS/UCH/VID,http://dx.doi.org/10.1007/s10518-019-00579-3,10.1007/s10518-019-00579-3
33,"Garay, RM; Herrera, R; Mejias, C","Project shelter, Part 2: Structural verification",2019,REVISTA DE LA CONSTRUCCION,ISI/SCOPUS/SCIELO-Chile/UCH/VID,http://dx.doi.org/10.7764/RDLC.18.1.68,10.7764/RDLC.18.1.68
34,"Massone, LM; Diaz, S; Manriquez, I; Rojas, F; Herrera, R",Experimental cyclic response of RC walls with setback discontinuities,2019,ENGINEERING STRUCTURES,SCOPUS/ISI/UCH/VID,http://dx.doi.org/10.1016/j.engstruct.2018.10.054,10.1016/j.engstruct.2018.10.054
35,"Herrera R., Claverie F., Guerrero R.",Failure modes of starred angle braces,2018,"11th National Conference on Earthquake Engineering 2018, NCEE 2018: Integrating Science, Engineering, and Policy",SCOPUS/UCH/VID,,
36,"Nunez, E; Torres, R; Herrera, R",Seismic performance of moment connections in steel moment frames with HSS columns,2017,STEEL AND COMPOSITE STRUCTURES,ISI/SCOPUS/UCH/VID,http://dx.doi.org/10.12989/scs.2017.25.3.271,10.12989/scs.2017.25.3.271
37,"Herrera R., Salas C., Beltran J.F., Nuñez E.",Experimental performance of double built-up T moment connections under cyclic loading,2017,JOURNAL OF CONSTRUCTIONAL STEEL RESEARCH,SCOPUS/ISI/UCH/VID,http://dx.doi.org/10.1016/j.jcsr.2017.08.022,10.1016/j.jcsr.2017.08.022
38,"Moffat, R; Jadue, C; Beltran, JF; Herrera, R",Experimental evaluation of geosynthetics as reinforcement for shotcrete,2017,GEOTEXTILES AND GEOMEMBRANES,ISI/SCOPUS/UCH/VID,http://dx.doi.org/10.1016/j.geotexmem.2017.01.007,10.1016/j.geotexmem.2017.01.007
39,"Tremblay, R; Dehghani, M; Fahnestock, L; Herrera, R; Canales, M; Clifton, C; Hamid, Z","Comparison of seismic design provisions for buckling restrained braced frames in Canada, United States, Chile, and New Zealand",2016,STRUCTURES,SCOPUS/ESCI/ISI/UCH/VID,http://dx.doi.org/10.1016/j.istruc.2016.06.004,10.1016/j.istruc.2016.06.004
40,"Moffat, RA;Beltran, JF;Herrera, R",Applications of BOTDR fiber optics to the monitoring of underground structures,2015,GEOMECHANICS AND ENGINEERING,SCOPUS/ISI/UCH/VID,,
41,"Bravo, MA;Herrera, RA",Performance under cyclic load of built-up T-stubs for Double T moment connections,2014,JOURNAL OF CONSTRUCTIONAL STEEL RESEARCH,ISI/SCOPUS/UCH/VID,http://dx.doi.org/10.1016/j.jcsr.2014.08.005,10.1016/j.jcsr.2014.08.005
42,"Heresi, P;Herrera, RA;Moroni, MO",Testing and modelling of shape memory alloy plates for energy dissipators,2014,SMART STRUCTURES AND SYSTEMS,ISI/SCOPUS/UCH/VID,,
43,"Herrera, RA;Bravo, M;Gomez, G;Aedo, G",Performance of built-up T-stubs for Double T moment connections,2013,JOURNAL OF CONSTRUCTIONAL STEEL RESEARCH,ISI/SCOPUS/UCH/VID,http://dx.doi.org/10.1016/j.jcsr.2013.05.022,10.1016/j.jcsr.2013.05.022
44,"Gonzalez, E;Almazan, J;Beltran, J;Herrera, R;Sandoval, V",Performance of stainless steel winery tanks during the 02/27/2010 Maule Earthquake,2013,ENGINEERING STRUCTURES,ISI/SCOPUS/UCH/VID,http://dx.doi.org/10.1016/j.engstruct.2013.07.017,10.1016/j.engstruct.2013.07.017
45,Cruz E;Herrera R;Aguirre C;Millan A;Zareian F;Leon R;Beltran JF;Verdugo A,Reconnaissance Report of Chilean Industrial Facilities Affected by the 2010 Chile Offshore Bio-Bio Earthquake,2012,EARTHQUAKE SPECTRA,SCOPUS/ISI/UCH/VID,http://dx.doi.org/10.1193/1.4000049,10.1193/1.4000049
46,"Beltran, JF;Cruz, C;Herrera, R;Moroni, O",Shape memory alloy CuAlBe strands subjected to cyclic axial loads,2011,ENGINEERING STRUCTURES,SCOPUS/ISI/UCH/VID,http://dx.doi.org/10.1016/j.engstruct.2011.06.015,10.1016/j.engstruct.2011.06.015
47,Herrera R; Moroni M.O; Olea M; Sarrazin M.,Prestressed beam-to-column moment connections using Cu-based SMA rods,2010,"9th US National and 10th Canadian Conference on Earthquake Engineering 2010, Including Papers from the 4th International Tsunami Symposium",SCOPUS/UCH/VID,,
48,Beltran J.F; Cruz C; Moroni M.O; Herrera R.,Analysis and testing of cables made of CuAlBe SMA,2010,"9th US National and 10th Canadian Conference on Earthquake Engineering 2010, Including Papers from the 4th International Tsunami Symposium",SCOPUS/UCH/VID,,
49,"Sepulveda, J ; Boroschek, R ; Herrera, R ; Moroni, O ; Sarrazin, M",Steel beam-column connection using copper-based shape memory alloy dampers,2008,JOURNAL OF CONSTRUCTIONAL STEEL RESEARCH,ISI/SCOPUS/UCH/VID,http://dx.doi.org/10.1016/j.jcsr.2007.09.002,10.1016/j.jcsr.2007.09.002
50,"Herrera, RA ; Ricles, JM ; Sause, R",Seismic performance evaluation of a large-scale composite MRF using pseudodynamic testing,2008,JOURNAL OF STRUCTURAL ENGINEERING,SCOPUS/ISI/UCH/VID,http://dx.doi.org/10.1061/(ASCE)0733-9445(2008)134:2(279),10.1061/(ASCE)0733-9445(2008)134:2(279)
51,"Ricles, J., Sause, R., Herrera, R.",Experimental behavior and performance evaluation of a large-scale composite mrf system under seismic loading,2007,STRUCTURAL ENGINEERING RESEARCH FRONTIERS,SCOPUS/UCH/VID,http://dx.doi.org/10.1061/40944(249)58,10.1061/40944(249)58
52,Herrera R; Ricles J; Sause R.,Experimental study of a large-scale composite MRF system with CFT columns under seismic loading,2006,8th US National Conference on Earthquake Engineering 2006,SCOPUS/UCH/VID,,
53,Herrera R.A; Ricles J.M; Sause R.,Seismic behavior of a large-scale composite MRF system with CFT columns,2006,Proceedings of the 5th International Conference on Behaviour of Steel Structures in Seismic Areas - Stessa 2006,SCOPUS/UCH/VID,,
