,Autores,titulo_publicacion,ano,titulo_revistas,tipo_publicacion,link,doi
854,"Valdes, M; Alonso, F; Pino, P; Nazzal, C",Emergency visits and mortality caused by ischemic heart disease attributable to fine particulate matter during the COVID-19 pandemic in Chile,2021,REVUE D EPIDEMIOLOGIE ET DE SANTE PUBLIQUE,ISI/SCOPUS/UCH/VID,http://dx.doi.org/10.1016/j.respe.2021.07.005,10.1016/j.respe.2021.07.005
855,"Alcantara-Zapata, DE; Bangdiwala, SI; Jimenez, D; Kogevinas, M; Marchetti, N; Nazzal, C",Effects of chronic intermittent hypobaric hypoxia on prostate-specific antigen (PSA) in Chilean miners,2021,OCCUPATIONAL AND ENVIRONMENTAL MEDICINE,ISI/SCOPUS/UCH/VID,http://dx.doi.org/10.1136/oemed-2020-107232,10.1136/oemed-2020-107232
856,"Nazzal, C; Lefian, A; Alonso, F",Incidence of acute myocardial infarction in Chile between 2008 and 2016,2021,REVISTA MEDICA DE CHILE,ISI/SCOPUS/SCIELO-Chile/UCH/VID,http://dx.doi.org/10.4067/s0034-98872021000300323,10.4067/s0034-98872021000300323
857,"Guerra, MS; Nazal, CN",TREND ANALYSIS OF INCIDENCE AND CASE FATALITY DUE TO STROKE IN CHILE: 2001-2016,2020,INTERNATIONAL JOURNAL OF STROKE,ISI/UCH/VID,http://dx.doi.org/10.1177/1747493020963387,10.1177/1747493020963387
858,"Paredes, MC; Faustino, A; Nazzal, C",Temporal variation in the place of death in Chile from 1997 to 2014,2019,REVISTA MEDICA DE CHILE,ISI/SCOPUS/SCIELO-Chile/UCH/VID,http://dx.doi.org/10.4067/S0034-98872019000300322,10.4067/S0034-98872019000300322
859,"Sepulveda, P; Ortega, J; Armijo, G; Torres, J; Ramirez, P; Backhouse, C; Vargas, C; Lopez, L; Gonzalez, F; Puentes, A; Donoso, H; Bellet, A; Godoy, D; Araya, M; Andrade, CL; Molina, JP; Nazzal, C",Balloon pulmonary angioplasty for the treatment of chronic thromboembolic pulmonary hypertension,2019,REVISTA MEDICA DE CHILE,ISI/SCOPUS/SCIELO-Chile/UCH/VID,http://dx.doi.org/10.4067/S0034-98872019000400426,10.4067/S0034-98872019000400426
860,"Alonso, F; Nazzal, C; Cerecera, F; Ojeda, JI",Reducing Health Inequalities: Comparison of Survival After Acute Myocardial Infarction According to Health Provider in Chile,2019,INTERNATIONAL JOURNAL OF HEALTH SERVICES,ISI/SCOPUS/UCH/VID,http://dx.doi.org/10.1177/0020731418809851,10.1177/0020731418809851
861,"Nazzal, C; Alonso, F",Seasonal variation in hospital admissions due to acute myocardial infarction according to sex and age in Chile,2018,REVISTA MEDICA DE CHILE,ISI/SCOPUS/SCIELO-Chile/UCH/VID,http://dx.doi.org/10.4067/S0034-98872018001101233,10.4067/S0034-98872018001101233
862,"Sandoval, D; Nazzal, C; Romero, T","Clinical, Socioeconomic, and Psychosocial Factors Associated with Blood Pressure Control and Adherence: Results from a Multidisciplinary Cardiovascular National Program Providing Universal Coverage in a Developing Country",2018,INTERNATIONAL JOURNAL OF HYPERTENSION,ISI/SCOPUS/UCH/VID,http://dx.doi.org/10.1155/2018/5634352,10.1155/2018/5634352
863,"Nazzal, C; Shea, S; Castro-Diehl, C; Alfaro, T; Frenz, P; Rodriguez, CJ",Educational Inequalities in Cardiovascular Risk Factor and Blood Pressure Control in the Elderly: Comparison of MESA Cohort and Chilean NHS Survey Outcome Measures,2018,GLOBAL HEART,SCOPUS/ISI/UCH/VID,http://dx.doi.org/10.1016/j.gheart.2017.09.001,10.1016/j.gheart.2017.09.001
864,"Nazzal, C; Diaz, F; Cea, X",Lower educational level is most strongly associated with cardiovascular mortality compared to cancer mortality in Chilean population,2017,EUROPEAN HEART JOURNAL,ISI/UCH/VID,,
865,"Nazzal, C; Alonso, F; Ojeda, J; Cerecera, F","Younger women are more affected by seasonality in acute myocardial infarction admission than men: Chile, 2002-2011",2017,EUROPEAN HEART JOURNAL,ISI/UCH/VID,,
866,"Diaz-Toro, F; Nazzal, C; Verdejo, H",Incidence and in-hospital case fatality of acute decompensated heart failure in chile: a stratified analysis by gender,2017,EUROPEAN HEART JOURNAL,ISI/UCH/VID,,
867,"Bartolucci, J; Verdugo, FJ; Gonzalez, PL; Larrea, RE; Abarzua, E; Goset, C; Rojo, P; Palma, I; Lamich, R; Pedreros, PA; Valdivia, G; Lopez, VM; Nazzal, C; Alcayaga-Miranda, F; Cuenca, J; Brobeck, MJ; Patel, AN; Figueroa, FE; Khoury, M",Safety and Efficacy of the Intravenous Infusion of Umbilical Cord Mesenchymal Stem Cells in Patients With Heart Failure A Phase 1/2 Randomized Controlled Trial (RIMECARD Trial [Randomized Clinical Trial of Intravenous Infusion Umbilical Cord Mesenchymal Stem Cells on Cardiopathy]),2017,CIRCULATION RESEARCH,ISI/SCOPUS/UCH/VID,http://dx.doi.org/10.1161/CIRCRESAHA.117.310712,10.1161/CIRCRESAHA.117.310712
868,"Frenz P., Kaufman J.S., Nazzal C., Cavada G., Cerecera F., Silva N.",Mediation of the effect of childhood socioeconomic position by educational attainment on adult chronic disease in Chile,2017,INTERNATIONAL JOURNAL OF PUBLIC HEALTH,ISI/SCOPUS/UCH/VID,http://dx.doi.org/10.1007/s00038-017-0996-z,10.1007/s00038-017-0996-z
869,"Nazzal, C; Harris, JE",Lower incidence of myocardial infarction after smoke-free legislation enforcement in Chile,2017,BULLETIN OF THE WORLD HEALTH ORGANIZATION,ISI/SCOPUS/UCH/VID,http://dx.doi.org/10.2471/BLT.16.189894,10.2471/BLT.16.189894
870,"Diaz-Toro, F; Nazzal, C; Verdejo, P",Incidence and hospital mortality due to heart failure. Are there any differences by sex?,2017,REVISTA MEDICA DE CHILE,ISI/SCIELO-Chile/SCOPUS/UCH/VID,http://dx.doi.org/10.4067/s0034-98872017000600703,10.4067/s0034-98872017000600703
871,"Nazzal, C; Alonso, F; Cerecera, F; Ojeda, JM",Association between socioeconomic status and survival after a first episode of myocardial infarction,2017,REVISTA MEDICA DE CHILE,SCOPUS/SCIELO-Chile/ISI/UCH/VID,http://dx.doi.org/10.4067/s0034-98872017000700827,10.4067/s0034-98872017000700827
872,"Diaz-Toro, F; Nazal, CN; Verdejo, H; Rossel, V; Castro, P; Larrea, R; Concepcion, R; Sepulveda, L",Frailty in patients admitted to hospital with acute decompensated heart failure,2017,REVISTA MEDICA DE CHILE,ISI/SCOPUS/SCIELO-Chile/UCH/VID,http://dx.doi.org/10.4067/S0034-98872017000200003,10.4067/S0034-98872017000200003
873,"Nazzal, NC",Association between educational level and survival after acute myocardial infarction. Reply,2016,REVISTA MEDICA DE CHILE,ISI/SCOPUS/SCIELO-Chile/UCH/VID,http://dx.doi.org/10.4067/S0034-98872016000900022,10.4067/S0034-98872016000900022
874,"Bartolucci, J; Verdugo, FJ; Larrea, R; Abarzua, E; Goset, C; Rojo, P; Palma, I; Gonzalez, PL; Sanhueza, P; Pedreros, P; Lamich, R; Valdivia, G; Nazzal, C; Khoury, M; Figueroa, FE",Phase 1/2 randomized clinical trial of intravenous infusion of umbilical cord mesenchymal stem cells in patients with chronic cardiopathy with stable heart failure (RIMECARD),2016,EUROPEAN HEART JOURNAL,ISI/UCH/VID,,
875,"Nazzal, C; Frenz, P; Alonso, FT; Lanas, F",Effective universal health coverage and improved 1-year survival after acute myocardial infarction: the Chilean experience,2016,HEALTH POLICY AND PLANNING,ISI/SCOPUS/UCH/VID,http://dx.doi.org/10.1093/heapol/czv120,10.1093/heapol/czv120
876,"Diaz, F; Nazzal, C; Verdejo, H","Frailty in heart failure: prevalence and factors associated in elderly patients hospitalized in Santiago, Chile",2016,EUROPEAN JOURNAL OF CARDIOVASCULAR NURSING,ISI/UCH/VID,,
877,"Bartolucci, J; Nazzal, C; Verdugo, FJ; Prieto, JC; Sepulveda, P; Corbalan, R","Characteristics, management, and outcomes of illicit drug consumers with acute myocardial infarction",2016,REVISTA MEDICA DE CHILE,ISI/SCIELO-Chile/SCOPUS/UCH/VID,http://dx.doi.org/10.4067/S0034-98872016000100006,10.4067/S0034-98872016000100006
878,"Nazzal, C; Alonso, F; Cerecera, F; Ojeda, J",Improvement in one-year survival after acute myocardial infarction according to socioeconomic position in Chile: analysis of the period 2002-2011,2015,EUROPEAN HEART JOURNAL,ISI/UCH/VID,,
879,"Nazzal, C; Frenz, P; Cerecera, F; Cavada, G; Kaufmann, J",Influence of childhood socioeconomic disadvantage in the incidence of cardiovascular disease in adults in Chile,2015,EUROPEAN HEART JOURNAL,ISI/UCH/VID,,
880,"Nazzal, C; Corbalan, R; Diaz, C; Sepulveda, P; Schacht, E",Effect of educational level on the prognosis of acute myocardial infarction,2015,REVISTA MEDICA DE CHILE,SCOPUS/ISI/SCIELO-Chile/UCH/VID,http://dx.doi.org/10.4067/S0034-98872015000700001,10.4067/S0034-98872015000700001
881,"Bartolucci, J; Verdugo, FJ; Carrion, F; Abarzua, E; Goset, C; Lamich, R; Sanhueza, P; Pedreros, P; Nazzal, C; Khoury, M; Figueroa, FE",Long-term results of intracoronary transplantation of autologous bone marrow cells in dilated cardiomyopathy,2015,REVISTA MEDICA DE CHILE,ISI/SCOPUS/SCIELO-Chile/UCH/VID,http://dx.doi.org/10.4067/S0034-98872015000400001,10.4067/S0034-98872015000400001
882,"Maldonado Veas, Rodrigo; Madariaga Román, Andrea; López, Constanza; Nazzal Nazal, Carolina; Prieto Domíngez, Juan Carlos",Caracterización clínica de pacientes con Infarto Agudo al Miocardio sin lesiones coronarias significativas: Estudio GEMI 2011-2013,2014,REVISTA CHILENA DE CARDIOLOGIA,SCIELO-Chile/UCH/VID,http://dx.doi.org/10.4067/S0718-85602014000300001,10.4067/S0718-85602014000300001
883,"Nazzal, C;Alonso, F;Cerecera, F","In-hospital case-fatality and one-survival after acute myocardial infarction in Chile, 2002-2011: a national trends analysis",2014,EUROPEAN HEART JOURNAL,ISI/UCH/VID,,
884,"Nazzal, C;Corbalan, R;Sepulveda, P;Diaz, C;Schacht, E;GEMI Grp","Long term survival after acute myocardial infarction according to attained education level in the Chilean AMI Register, GEMI 2009-2012",2014,EUROPEAN HEART JOURNAL,ISI/UCH/VID,,
885,"Nazzal, C; Lanas, F; Garmendia, ML; Bugueno, C; Mercadal, E; Garces, E; Yovaniniz, P; Sanhueza, P",Universal health coverage and accomplishment of secondary prevention goals among patients with acute myocardial infarction,2013,REVISTA MEDICA DE CHILE,SCOPUS/ISI/SCIELO-Chile/UCH/VID,http://dx.doi.org/10.4067/S0034-98872013000800003,10.4067/S0034-98872013000800003
886,"Nazzal, C;Corbalan, R;Frenz, P;Sepulveda, P;Prieto, J;GEMI Grp",Differences in treatment and in-hospital mortality of acute myocardial infarction patients in public and private hospitals in Chile before and after healthcare guarantees,2013,EUROPEAN HEART JOURNAL,ISI/UCH/VID,,
887,"Oyonarte, M;Montagna, R;Braun, S;Rojo, P;Jara, JL;Cereceda, M;Morales, M;Nazzal, C;Alonso, F","Clinical characteristics, complications and mortality in 506 patients with infective endocarditis and determinants of survival rate at 10 years (vol 140, pg 1517, 2012)",2013,REVISTA MEDICA DE CHILE,ISI/SCOPUS/SCIELO-Chile/UCH/VID,http://dx.doi.org/10.4067/S0034-98872013000700018,10.4067/S0034-98872013000700018
888,Nazzal C;Alonso FT,Younger Women Have a Higher Risk of In-Hospital Mortality Due to Acute Myocardial Infarction in Chile,2013,REVISTA ESPANOLA DE CARDIOLOGIA,ISI/SCOPUS/UCH/VID,http://dx.doi.org/10.1016/j.recesp.2012.07.015,10.1016/j.recesp.2012.07.015
889,"Nazzal, C;Lanas, F",Improve in survival after myocardial infarction: the impact of a universal health care reform in a latin-american country,2012,EUROPEAN HEART JOURNAL,ISI/UCH/VID,,
890,"Nazzal, C; Acevedo, M; Rojo, ME; Burgos, S; Pizarro, N; Urzua, I; Kramer, V; Varleta, P",Cardiovascular risk awareness and knowledge in women in a middle income Latin-American country,2012,CIRCULATION,ISI/UCH/VID,,
891,"Alonso, FT;Nazzal, C",In-hospital mortality inequities in younger women with acute myocardial infarction in a middle income Latin-American country,2011,EUROPEAN HEART JOURNAL,ISI/UCH/VID,,
892,"Nazzal, C;Alonso, FT",Incidence and case fatality due to acute myocardial infarction in Chile in the period 2001-2007,2011,REVISTA MEDICA DE CHILE,ISI/SCOPUS/SCIELO-Chile/UCH/VID,http://dx.doi.org/10.4067/S0034-98872011001000002,10.4067/S0034-98872011001000002
893,"Nazzal, C ; Alonso, F","TRENDS IN INCIDENCE AND CASE-FATALITY OF ACUTE MYOCARDIAL INFARCTION IN CHILE, 2001-2007",2011,JOURNAL OF EPIDEMIOLOGY AND COMMUNITY HEALTH,ISI/UCH/VID,http://dx.doi.org/10.1136/jech.2011.142976j.50,10.1136/jech.2011.142976j.50
894,"Nazzal, C ; Lanas, F ; Garmendia, ML",SECONDARY PREVENTION IN ACUTE MYOCARDIAL INFARCTION IN CHILE,2011,JOURNAL OF EPIDEMIOLOGY AND COMMUNITY HEALTH,ISI/UCH/VID,http://dx.doi.org/10.1136/jech.2011.142976j.51,10.1136/jech.2011.142976j.51
895,"Alejandro Martínez S1,Carolina Nazzal N3, Alejandro Fajuri N1, Luis Eduardo Barra L2. Alejandro Mayerson G2, Gabriel Cavada Ch3, Pabla Campos T4, Gastón Dussaillant N3, en representación de los registros RENAC y GEMI.",Mortalidad post infarto del miocardio en Chile: Comparación de los registros de angioplastía primaria versus trombolisis,2010,REVISTA CHILENA DE CARDIOLOGIA,SCIELO-Chile/UCH/VID,http://dx.doi.org/10.4067/S0718-85602010000100003,10.4067/S0718-85602010000100003
896,"Greig, D ; Corbalan, R ; Castro, P ; Campos, P ; Lamich, R ; Yovaniniz, P ; Nazzal, C",Admission hyperglycemia and mortality of ST segment elevation myocardial infarction,2010,REVISTA MEDICA DE CHILE,ISI/SCOPUS/SCIELO-Chile/UCH/VID,http://dx.doi.org/10.4067/S0034-98872010000900004,10.4067/S0034-98872010000900004
897,"Alonso, FT ; Nazzal, C ; Alvarado, ME","Mortality from ischemic heart disease in Chile: who, how many, and where",2010,REVISTA PANAMERICANA DE SALUD PUBLICA-PAN AMERICAN JOURNAL OF PUBLIC HEALTH,ISI/SCOPUS/SCIELO-otros paises /UCH/VID,,
898,"Nazzal, C;Corbalan, R;Campos, P;Bartolucci, J;Prieto, JC;Sanhueza, P;Lanas, F;Chilean Soc Cardiology",Is it possible to reduce in-hospital mortality in women with ST segment elevation myocardial infarction (STEMI)? Impact of the Chilean health sector reform,2008,EUROPEAN HEART JOURNAL,ISI/UCH/VID,,
899,"Nazzal, C; Corbalan, R; Campos, P; Bartolucci, J; Cavada, G; Prieto, JC; Lanas, F; GEMI Grp","In-hospital mortality in diabetic and non-diabetic patients with AMI: a time trend analysis based on the Chilean National Acute Myocardial Infarction Register, 2001-2006",2008,EUROPEAN HEART JOURNAL,ISI/UCH/VID,,
900,"Lanas, F; Prieto, JC; Corvalan, R; Nazzal, C; Campos, P; Seron, P; Bartolucci, J; GEMI Study Investigators",Improved therapy and outcome for patients with acute myocardial infarction in the chilean registry of myocardial infarction,2008,EUROPEAN HEART JOURNAL,ISI/UCH/VID,,
901,"Lanas, F; Prieto, JC; Nazzal, C; Seron, P; Campos, P; Bartolucci, J; Corvalan, R",Prognosis of acute myocardial infarction in the elderly in Chile from 1993 to 2006,2008,CIRCULATION,ISI/UCH/VID,,
902,"Nazzal, CNC; Campos, PCP; Corbalan, RCR; Bartolucci, JBJ; Sanhueza, PSP; Prieto, JCPJC; Lanas, FLF",The Chilean Health Reform and its impact in the Management and Mortality of ST Segment Elevation Myocardial Infarction (STEMI) in Chilean Hospitals,2008,CIRCULATION,ISI/UCH/VID,,
903,"Prieto, JC; Sanhueza, C; Martinez, N; Nazzala, C; Corbalan, R; Cavada, G; Lanas, F; Bartolucci, J; Campos, P",In-hospital mortality after ST-segment elevation myocardial infarction according to reperfusion therapy,2008,REVISTA MEDICA DE CHILE,ISI/SCIELO-Chile/SCOPUS/UCH/VID,http://dx.doi.org/10.4067/S0034-98872008000200001,10.4067/S0034-98872008000200001
904,"Nazzal, C; Campos, P; Corbalan, R; Lanas, F; Bartolucci, J; Sanhueza, P; Cavada, GC; Prieto, JC",The impact of Chilean health reform in the management and mortality of ST elevation myocardial infarction (STEMI) in Chilean hospitals,2008,REVISTA MEDICA DE CHILE,SCIELO-Chile/SCOPUS/ISI/UCH/VID,http://dx.doi.org/10.4067/S0034-98872008001000001,10.4067/S0034-98872008001000001
905,"Bartolucci, J;Nazzal, C;Corbalan, R;Campos, P;Cavada, G;Prieto, JC;Tapia, F;GEMI Grp",Predictors of long term survival in post-myocardial infarction patients according to complex arrhytmias,2007,EUROPEAN HEART JOURNAL,ISI/UCH/VID,,
906,"Nazzal, C ; Corbalan, R ; Campos, P ; Prieto, JC ; Cavada, G",Differences in survival after Myocardial Infarction according to gender: a 5 year follow-up,2006,EUROPEAN HEART JOURNAL,ISI/UCH/VID,,
907,"Prieto Domínguez, J.C.; Corbalán R.; Chávez, E.; Lanas, F.; Cumsille, F.; Nazzal, C.",Changes in drug prescription and reduction of hospital mortality in patients with acute myocardial infarction,2003,Investigacion Cardiovascular,SCOPUS/UCH/VID,,
908,"Castro, PF; Greig, D; Perez, O; Moraga, F; Chiong, M; Diaz-Araya, G; Padilla, I; Nazzal, C; Jalil, JE; Vukasovic, JL; Moreno, M; Corbalan, R; Lavandero, S","Relation between oxidative stress, catecholamines, and impaired chronotropic response to exercise in patients with chronic heart failure secondary to ischemic or idiopathic dilated cardiomyopathy",2003,JOURNAL OF CARDIOLOGY,SCOPUS/ISI/UCH/VID,http://dx.doi.org/10.1016/S0002-9149(03)00543-5,10.1016/S0002-9149(03)00543-5
909,"Diaz-Araya, G;Nettle, D;Castro, P;Miranda, F;Greig, D;Campos, X;Chiong, M;Nazzal, C;Corbalan, R;Lavandero, S",Oxidative stress after reperfusion with primary coronary angioplasty: Lack of effect of glucose-insulin-potassium infusion,2002,CRITICAL CARE MEDICINE,ISI/SCOPUS/UCH/VID,http://dx.doi.org/10.1097/00003246-200202000-00025,10.1097/00003246-200202000-00025
910,"Castro, PF;Diaz-Araya, G;Nettle, D;Corbalan, R;Perez, O;Nazzal, C;Larrain, G;Lavandero, S",Effects of early decrease in oxidative stress after medical therapy in patients with class IV congestive heart failure,2002,JOURNAL OF CARDIOLOGY,SCOPUS/ISI/UCH/VID,http://dx.doi.org/10.1016/S0002-9149(01)02211-1,10.1016/S0002-9149(01)02211-1
911,"Castro, P; Chiong, M; Moreno, M; Perez, O; Diaz-Araya, G; Padilla, I; Nazzal, C; Lavandero, S",Ethnic differences in beta 2 adrenergic receptor polymorphisms distribution,2002,EUROPEAN HEART JOURNAL,ISI/UCH/VID,,
912,"Lavandero, S; Moraga, F; Mario, C; Diaz-Araya, G; Vukasovic, JL; Pablo, C; Perez, O; Moreno, M; Ocaranza, MP; Jalil, J; Ivonne, P; Nazal, C; Corbalan, R",beta(2)-adrenergic receptor polymorphisms are not associated with heart failure,2002,FASEB JOURNAL,ISI/UCH/VID,,
913,"Corbalan, R;Nazzal, C;Prieto, JC;Chavez, E;Lanas, F;Lamich, R;Bartolucci, J;Montano, R;Cumsille, F",Reduction of acute myocardial infarction mortality in Chilean hospitals,2002,REVISTA MEDICA DE CHILE,SCIELO-Chile/SCOPUS/ISI/UCH/VID,http://dx.doi.org/10.4067/S0034-98872002000400003,10.4067/S0034-98872002000400003
914,"Corbalan, R; Larrain, G; Nazzal, C; Castro, PF; Acevedo, M; Dominguez, JM; Bellolio, F; Krucoff, MW",Association of noninvasive markers of coronary artery reperfusion to assess microvascular obstruction in patients with acute myocardial infarction treated with primary angioplasty,2001,JOURNAL OF CARDIOLOGY,SCOPUS/ISI/UCH/VID,http://dx.doi.org/10.1016/S0002-9149(01)01676-9,10.1016/S0002-9149(01)01676-9
915,"Prieto, JC;Corbalan, R;Nazza, C;Chavez, E;Lanas, F;Bartolucci, J;Cumsille, F;Grp Estudio Multicentrico Infarto",Changes in pharmacotherapy for acute myocardial infarction. Comparison of two periods,2001,REVISTA MEDICA DE CHILE,SCIELO-Chile/SCOPUS/ISI/UCH/VID,http://dx.doi.org/10.4067/S0034-98872001000500002,10.4067/S0034-98872001000500002
916,"Castro, P; Perez, O; Nettle, D; Lavanderos, S; Diaz-Araya, G; Corbalan, R; Nazzal, C; Jalil, J; Zalaquett, R",Comparison of oxidative stress status between heart transplant and advanced chronic heart failure patients,2001,EUROPEAN HEART JOURNAL,ISI/UCH/VID,,
917,"Castro, P; Diaz, G; Lavandero, S; Nazzal, C; Perez, O; Arriagada, G; Corbalan, R; Yanez, F; Larrain, G; Jalil, J",Early decrease in oxidative stress in patients with class IV heart failure after successfull medical therapy,2000,EUROPEAN HEART JOURNAL,ISI/UCH/VID,,
918,"Irarrazaval, M; Norambuena, P; Montenegro, C; Toro-Devia, O; Vargas, B; Caqueo-Urizar, A",Public Policy Responses to Address the Mental Health Consequences of the COVID-19 Pandemic: Evidence From Chile,2021,FRONTIERS IN PUBLIC HEALTH,SCOPUS/ISI/UCH/VID,http://dx.doi.org/10.3389/fpubh.2021.590335,10.3389/fpubh.2021.590335
919,"Jara, RS; Pisani, AMO",New and old knowledge aimed at decolonising mental health: reflections and proposals from Chile,2020,INTERNATIONAL REVIEW OF PSYCHIATRY,ISI/SCOPUS/UCH/VID,http://dx.doi.org/10.1080/09540261.2020.1767042,10.1080/09540261.2020.1767042
920,"Ferdinand, Angéline S.; Oyarce, Ana María; Kelaher, Margaret; Anderson, Ian",Reflections on ethics in Indigenous health research in Chile,2018,Revista Latinoamericana de Bioetica,SCIELO-otros paises /UCH/VID,http://dx.doi.org/10.18359/rlbi.3451,10.18359/rlbi.3451
921,Oyarce A.M.,Healing systems of the mapuche people in Chile,2018,Global Psychologies: Mental Health and the Global South,SCOPUS/UCH/VID,http://dx.doi.org/10.1057/978-1-349-95816-0_12,10.1057/978-1-349-95816-0_12
922,Oyarce A.M.,From denial to collaboration: Reflections on shamanism and psychiatry based on a case study in Chile,2018,Global Psychologies: Mental Health and the Global South,SCOPUS/UCH/VID,http://dx.doi.org/10.1057/978-1-349-95816-0_17,10.1057/978-1-349-95816-0_17
923,"Munoz, MP; Iglesias, V; Saavedra, M; Saavedra, G; Yohannessen, K; Pino, P","Urinary Arsenic Concentration and Its Relationship with Bronchial Asthma in Children from Arica, Chile",2022,TOXICS,ISI/SCOPUS/UCH/VID,http://dx.doi.org/10.3390/toxics10100625,10.3390/toxics10100625
924,"Valdes, M; Alonso, F; Pino, P; Nazzal, C",Emergency visits and mortality caused by ischemic heart disease attributable to fine particulate matter during the COVID-19 pandemic in Chile,2021,REVUE D EPIDEMIOLOGIE ET DE SANTE PUBLIQUE,ISI/SCOPUS/UCH/VID,http://dx.doi.org/10.1016/j.respe.2021.07.005,10.1016/j.respe.2021.07.005
925,"Salgado, MV; Bastias, M; Schisterman, E; Pino, P; Bangdiwala, S; Iglesias, V",Structural Equation Modelling in the exploration and analysis of intrauterine environmental exposures with infant health effects,2019,ANNALS OF AGRICULTURAL AND ENVIRONMENTAL MEDICINE,ISI/SCOPUS/UCH/VID,http://dx.doi.org/10.26444/aaem/114724,10.26444/aaem/114724
926,"Salgado, MV; Schisterman, E; Pino, P; Bangdiwala, S; Munoz, MP; Iglesias, V","Is prenatal arsenic exposure associated with salivary cortisol in infants in Arica, Chile? An exploratory cohort study",2019,ANNALS OF AGRICULTURAL AND ENVIRONMENTAL MEDICINE,ISI/SCOPUS/UCH/VID,http://dx.doi.org/10.26444/aaem/104586,10.26444/aaem/104586
927,"Munoz, MP; Valdes, M; Munoz-Quezada, MT; Lucero, B; Rubilar, P; Pino, P; Iglesias, V","Urinary inorganic arsenic concentration and gestational diabetes mellitus in pregnant women from Arica, Chile",2018,INTERNATIONAL JOURNAL OF ENVIRONMENTAL RESEARCH AND PUBLIC HEALTH,ISI/SCOPUS/UCH/VID,http://dx.doi.org/10.3390/ijerph15071418,10.3390/ijerph15071418
928,"Alcantara-Zapata, DE; Gonzales, GF; Pino, P",Prostatic-Specific Antigen Levels in Men from Two Andean Cities of Peru,2018,HIGH ALTITUDE MEDICINE & BIOLOGY,ISI/SCOPUS/UCH/VID,http://dx.doi.org/10.1089/ham.2017.0141,10.1089/ham.2017.0141
929,"Barría, René Mauricio; Calvo, Mario; Pino, Paulina","Contaminación intradomiciliaria por material particulado fino (MP2,5) en hogares de recién nacidos",2016,REVISTA CHILENA DE PEDIATRIA,SCOPUS/SCIELO-Chile/ESCI/UCH/VID,http://dx.doi.org/10.1016/j.rchipe.2016.04.007,10.1016/j.rchipe.2016.04.007
930,"Paulos, A; Pino, P; Cavada, G; Lagos, C; Broussain, V; Hasbun, A",Cleft lip/palate and flour fortification with folic acid in chile. An exploratory study,2016,REVISTA MEDICA DE CHILE,SCOPUS/ISI/SCIELO-Chile/UCH/VID,http://dx.doi.org/10.4067/S0034-98872016000800008,10.4067/S0034-98872016000800008
931,"Pino, P;Iglesias, V;Garreaud, R;Cortes, S;Canals, M;Folch, W;Burgos, S;Levy, K;Naeher, LP;Steenland, K",Chile Confronts its Environmental Health Future After 25 Years of Accelerated Growth,2015,ANNALS OF GLOBAL HEALTH,ISI/SCOPUS/UCH/VID,http://dx.doi.org/10.1016/j.aogh.2015.06.008,10.1016/j.aogh.2015.06.008
932,"Castillo-Carniglia, A; Kaufman, JS; Pino, P",Geographical distribution of alcohol-attributable mortality in Chile: A Bayesian spatial analysis,2015,ADDICTIVE BEHAVIORS,ISI/SCOPUS/UCH/VID,http://dx.doi.org/10.1016/j.addbeh.2014.11.025,10.1016/j.addbeh.2014.11.025
933,Ramonda Celedón Paulina; Pino Zúñiga Paulina; Cantillana Riquelme Patricia,Formularios de baciloscopía: ¿son un instrumento adecuado para el diagnóstico oportuno y seguimiento de la tuberculosis?,2014,REVISTA CHILENA DE ENFERMEDADES RESPIRATORIAS,SCOPUS/SCIELO-Chile/UCH/VID,http://dx.doi.org/10.4067/S0717-73482014000200008,10.4067/S0717-73482014000200008
934,"Castillo-Carniglia, A;Kaufman, JS;Pino, P",Small area associations between social context and alcohol-attributable mortality in a middle income country,2014,DRUG AND ALCOHOL DEPENDENCE,SCOPUS/ISI/UCH/VID,http://dx.doi.org/10.1016/j.drugalcdep.2014.01.020,10.1016/j.drugalcdep.2014.01.020
935,Orellana Cáceres Juan J.; Kaufman  Jay S.; Pino Zúñiga Paulina,"Interacción, sinergia y antagonismo en estudios prospectivos en Epidemiología",2013,REVISTA PERUANA DE MEDICINA EXPERIMENTAL Y SALUD PUBLICA,SCOPUS/SCIELO-otros paises /UCH/VID,,
936,"Castillo-Carniglia, A;Kaufman, JS;Pino, P",Alcohol-Attributable Mortality and Years of Potential Life Lost in Chile in 2009,2013,ALCOHOL AND ALCOHOLISM,ISI/SCOPUS/UCH/VID,http://dx.doi.org/10.1093/alcalc/agt066,10.1093/alcalc/agt066
937,Sulbrandt Cabezas José; Pino Zúñiga Paulina; Oyarzún Gómez Manuel,Envejecimiento activo y saludable: investigación y políticas para el envejecimiento poblacional,2012,REVISTA CHILENA DE ENFERMEDADES RESPIRATORIAS,SCIELO-Chile/SCOPUS/UCH/VID,http://dx.doi.org/10.4067/S0717-73482012000400001 ,10.4067/S0717-73482012000400001 
938,"Ramonda C Paulina, Pino Z Paulina, Valenzuela CH Luis Iván","Diabetes mellitus como factor predictor de tuberculosis en el servicio de salud metropolitano sur en Santiago, Chile",2012,REVISTA CHILENA DE ENFERMEDADES RESPIRATORIAS,SCIELO-Chile/SCOPUS/UCH/VID,http://dx.doi.org/10.4067/S0717-73482012000400003,10.4067/S0717-73482012000400003
939,Pino P; Solimano G.,"The School of Public Health at the University of Chile: Origins, evolution, and perspectives",2011,PUBLIC HEALTH REVIEWS,SCOPUS/UCH/VID,,
940,"Iglesias, V;Steenland, K;Maisonet, M;Pino, P",Exposure to Lead from a Storage Site Associated with Intellectual Impairment in Chilean Children Living Nearby,2011,INTERNATIONAL JOURNAL OF OCCUPATIONAL AND ENVIRONMENTAL HEALTH,SCOPUS/ISI/UCH/VID,,
