,Autores,titulo_publicacion,ano,titulo_revistas,tipo_publicacion,link,doi
610,"Ollé-Espluga L., Vargas I., Mogollón-Pérez A., Soares-de-Jesus R.-P.F., Eguiguren P., Cisneros A.-I., Muruaga M.-C., Huerta A., Bertolotto F., Vázquez M.-L.",Care continuity across levels of care perceived by patients with chronic conditions in six Latin-American countries,2021,GACETA SANITARIA,SCOPUS/ISI/SCIELO-otros paises /UCH/VID,http://dx.doi.org/10.1016/j.gaceta.2020.02.013,10.1016/j.gaceta.2020.02.013
611,"Espinel-Flores, V; Vargas, I; Samico, I; Eguiguren, P; Mogollon-Perez, A; Lopez, J; Bertolotto, F; Navarrete, MLV",Effectiveness of interventions related to continuity of health care in five Latin America countries,2020,EUROPEAN JOURNAL OF PUBLIC HEALTH,ISI/UCH/VID,http://dx.doi.org/10.1093/eurpub/ckaa166.513,10.1093/eurpub/ckaa166.513
612,"Vargas, I; Eguiguren, P; Mogollon-Perez, A; Samico, I; Bertolotto, F; Lopez, J; Navarrete, MLV",Outcomes and conditions for sustaining changes of Participatory Action Research interventions,2020,EUROPEAN JOURNAL OF PUBLIC HEALTH,ISI/UCH/VID,http://dx.doi.org/10.1093/eurpub/ckaa166.503,10.1093/eurpub/ckaa166.503
613,"Vargas I., Eguiguren P., Mogollón-Pérez A.-S., Bertolotto F., Samico I., López J., De Paepe P., Vázquez M.-L.",Understanding the factors influencing the implementation of participatory interventions to improve care coordination. An analytical framework based on an evaluation in Latin America,2020,HEALTH POLICY AND PLANNING,ISI/SCOPUS/UCH/VID,http://dx.doi.org/10.1093/heapol/czaa066,10.1093/heapol/czaa066
614,"Canals, M; Cuadrado, C; Canals, A; Yohannessen, K; Lefio, LA; Bertoglia, MP; Eguiguren, P; Siches, I; Iglesias, V; Arteaga, O","Epidemic trends, public health response and health system capacity: the Chilean experience in four months of the COVID-19 pandemic",2020,REVISTA PANAMERICANA DE SALUD PUBLICA-PAN AMERICAN JOURNAL OF PUBLIC HEALTH,ISI/SCOPUS/UCH/VID,http://dx.doi.org/10.26633/RPSP.2020.99,10.26633/RPSP.2020.99
615,"Vargas, I; Eguiguren, P; Mogollon-Perez, AS; Samico, I; Bertolotto, F; Lopez-Vazquez, J; Vazquez, ML",Can care coordination across levels be improved through the implementation of participatory action research interventions? Outcomes and conditions for sustaining changes in five Latin American countries,2020,BMC HEALTH SERVICES RESEARCH,ISI/SCOPUS/UCH/VID,http://dx.doi.org/10.1186/s12913-020-05781-7,10.1186/s12913-020-05781-7
616,"Miranda-Mendizabal, A; Vargas, I; Mogollon-Perez, AS; Eguiguren, P; Mendes, MFD; Lopez, J; Bertolotto, F; Amarilla, D; Navarrete, MLV",Knowledge and use of clinical coordination mechanisms in healthcare networks in Latin America,2020,GACETA SANITARIA,SCIELO-otros paises /ISI/SCOPUS/UCH/VID,http://dx.doi.org/10.1016/j.gaceta.2018.09.009,10.1016/j.gaceta.2018.09.009
617,"Mendizabal, AM; Vargas, I; Samico, I; Eguiguren, P; Mogollon-Perez, AS; Lopez, J; Bertolotto, F; Vazquez, ML",Effectiveness of participatory interventions in improving clinical coordination in Latin America,2019,EUROPEAN JOURNAL OF PUBLIC HEALTH,ISI/UCH/VID,http://dx.doi.org/10.1093/eurpub/ckz186.348,10.1093/eurpub/ckz186.348
618,"Vargas, I; Eguiguren, P; Mogollon-Perez, AS; Samico, I; Lopez, J; Bertolotto, F; De Paepe, P; Vazquez, ML",Can clinical coordination be improved through Participatory Action Research (PAR) interventions?,2019,EUROPEAN JOURNAL OF PUBLIC HEALTH,ISI/UCH/VID,http://dx.doi.org/10.1093/eurpub/ckz186.363,10.1093/eurpub/ckz186.363
619,"Olle-Espluga, L; Vargas, I; Samico, I; Eguiguren, P; Vazquez, M",Doctors' perceived coordination of care across care levels according to country of origin in public healthcare networks of Brazil and Chile,2018,EUROPEAN JOURNAL OF PUBLIC HEALTH,ISI/UCH/VID,,
620,"Olle-Espluga, L; Vargas, I; Samico, I; Eguiguren, P; Cisneros, I; Vazquez, M","Differences in perception of continuity of care between majority population and ethnic/race minorities: a cross-sectional study with chronic patients in public healthcare networks of Brazil, Chile, and Mexico",2018,EUROPEAN JOURNAL OF PUBLIC HEALTH,ISI/UCH/VID,,
621,"Vargas, I; Garcia-Subirats, I; Mogollon-Perez, AS; Ferreira-de-Medeiros-Mendes, M; Eguiguren, P; Cisneros, AI; Muruaga, MC; Bertolotto, F; Vazquez, ML",Understanding communication breakdown in the outpatient referral process in Latin America: a cross-sectional study on the use of clinical correspondence in public healthcare networks of six countries,2018,HEALTH POLICY AND PLANNING,SCOPUS/ISI/UCH/VID,http://dx.doi.org/10.1093/heapol/czy016,10.1093/heapol/czy016
622,"Ramírez G.R., Bravo P.E., Vivaldi M.I.M., Manríquez I.P., Pérez T.G.","Adolescents' access to contraception: Perceptions of health workers in Huechuraba, Chile",2017,REVISTA PANAMERICANA DE SALUD PUBLICA-PAN AMERICAN JOURNAL OF PUBLIC HEALTH,ISI/SCOPUS/SCIELO-otros paises /UCH/VID,,
623,"Vazquez, ML; Vargas, I; Garcia-Subirats, I; Unger, JP; De Paepe, P; Mogollon-Perez, AS; Samico, I; Eguiguren, P; Cisneros, AI; Huerta, A; Muruaga, MC; Bertolotto, F",Doctors' experience of coordination across care levels and associated factors. A cross-sectional study in public healthcare networks of six Latin American countries,2017,SOCIAL SCIENCE & MEDICINE,ISI/SCOPUS/UCH/VID,http://dx.doi.org/10.1016/j.socscimed.2017.04.001,10.1016/j.socscimed.2017.04.001
624,"Vazquez, ML; Vargas, I; Garcia-Subirats, I; Unger, JP; De Paepe, P; Mogollon-Perez, AS; Samico, I; Eguiguren, P; Cisneros, AI; Rovere, M; Muruaga, C; Bertolotto, F",Degree of coordination across care levels and associated factors in Latin American health networks,2016,EUROPEAN JOURNAL OF PUBLIC HEALTH,ISI/UCH/VID,,
625,"Leal, I; Luttges, C; Troncoso, P; Leyton, C; Molina, T; Eguiguren, P",The legal framework to prevent teenage pregnancies,2016,REVISTA MEDICA DE CHILE,ISI/SCOPUS/SCIELO-Chile/UCH/VID,http://dx.doi.org/10.4067/S0034-98872016000500004,10.4067/S0034-98872016000500004
626,"Vazquez, ML; Vargas, I; Unger, JP; De Paepe, P; Mogollon-Perez, AS; Samico, I; Albuquerque, P; Eguiguren, P; Cisneros, AI; Rovere, M; Bertolotto, F",Evaluating the effectiveness of care integration strategies in different healthcare systems in Latin America: the EQUITY-LA II quasi-experimental study protocol,2015,BMJ OPEN,ISI/SCOPUS/UCH/VID,http://dx.doi.org/10.1136/bmjopen-2014-007037,10.1136/bmjopen-2014-007037
627,"Garmendia, ML;Dangour, AD;Albala, C;Eguiguren, P;Allen, E;Uauy, R",Adherence to a physical activity intervention among older adults in a post-transitional middle income country: A quantitative and qualitative analysis,2013,JOURNAL OF NUTRITION HEALTH & AGING,ISI/SCOPUS/UCH/VID,http://dx.doi.org/10.1007/s12603-012-0417-1,10.1007/s12603-012-0417-1
628,"Lozano, MD;Calvente, MMG;Rodriguez, IM;Navarro, GM;Eguiguren, AP",GENDER AND INEQUALITY IN INFORMAL HEALTH CARE,2009,GACETA SANITARIA,ISI/UCH/VID,,
629,"Calvente, MMG;Lozano, MD;Eguiguren, AP;Rodriguez, IM;Navarro, GM;Riola, RO",IMPACT OF INFORMAL CARE ON THE PERCEIVED CARE OF MEN AND WOMEN IN AN ACTIVE STATE IN ANDALUCIA,2009,GACETA SANITARIA,ISI/UCH/VID,,
630,"Encina-Zuniga, E; Agrest, M; Tapia-Munoz, T; Vidal-Zamora, I; Ardila-Gomez, S; Alvarado, R; Leiderman, EA; Reavley, N",Development of mental health first-aid guidelines for depression: a Delphi expert consensus study in Argentina and Chile,2023,BMC PSYCHIATRY,ISI/SCOPUS/UCH/VID,http://dx.doi.org/10.1186/s12888-023-04661-8,10.1186/s12888-023-04661-8
631,"Agrest, M; Tapia-Munoz, T; Encina, E; Wright, J; Ardila-Gomez, S; Alvarado, R; Leiderman, EA; Reavley, N",Development of mental health first aid guidelines for problem drinking: a Delphi expert consensus study in Argentina and Chile,2022,BMC PSYCHIATRY,ISI/SCOPUS/UCH/VID,http://dx.doi.org/10.1186/s12888-022-03749-x,10.1186/s12888-022-03749-x
632,"Minoletti A., Gutiérrez P., Poblete Ma.J., López B., Bustos J., Muñoz C., Encina E.",Design of a short personal assistance model for people with intellectual disabilities in Chile,2020,Siglo Cero,SCOPUS/UCH/VID,http://dx.doi.org/10.14201/scero202051299117,10.14201/scero202051299117
633,"Olave-Müller, Paola; Fajreldin, Valentina; Coronado-Vigueras, Lorena; López-Contreras, Natalia; Valenzuela, María Teresa","Necesidades, Creencias y Prácticas en Salud Oral de Padres y Cuidadores de Preescolares: Un Enfoque Cualitativo",2021,INTERNATIONAL JOURNAL OF ODONTOSTOMATOLOGY,SCIELO-Chile/UCH/VID,http://dx.doi.org/10.4067/S0718-381X2021000400888,10.4067/S0718-381X2021000400888
634,"Fajreldin-Chuaqui, Valentina; Borgeat-Meza, Marjorie; Danke-Hausdorf, Karen; Valenzuela-Faunes, Bárbara; Torres-Ceballos, Camila",Desafíos de la Odontología Chilena en el Contexto del Nuevo Pacto Social,2021,INTERNATIONAL JOURNAL OF ODONTOSTOMATOLOGY,SCIELO-Chile/UCH/VID,http://dx.doi.org/10.4067/S0718-381X2021000401005,10.4067/S0718-381X2021000401005
635,"Cortés Á.M.F., Ovalle M.A.C., Santander I.L.E., Gómez C.L.G., de la Roche Colorado V., Chuaqui V.F., Restrepo O.D., Barrera A.A., Sánchez S.C.C.","Determination processes of the right to oral health of postpartum women and their children. Bucaramanga and Medellín (Colombia), Santiago (Chile), 2017",2021,Revista Gerencia y Politicas de Salud,SCOPUS/UCH/VID,http://dx.doi.org/10.11144/JAVERIANA.RGPS20.PDDS,10.11144/JAVERIANA.RGPS20.PDDS
636,"Herrera, P; Fajreldin, V; Rodriguez, MF; Kraemer, P; Mendoza, C; Pineda, I; Burdiles, P; Cornejo, M; Villanueva, J; Toha, MD; Carrasco-Labra, A",Clinical practice guidelines: Qualitative study of their implementation in the Chilean health system,2017,REVISTA PANAMERICANA DE SALUD PUBLICA-PAN AMERICAN JOURNAL OF PUBLIC HEALTH,ISI/SCOPUS/SCIELO-otros paises /UCH/VID,,
637,"Carvajal, P; Carvajal, C; Fajreldin, V; Hernandez-Rios, P; Contreras, J",Qualitative Exploration of Intervention in Oral Health Guaranteed Program in Pregnant Chilean,2016,INTERNATIONAL JOURNAL OF QUALITATIVE METHODS,ISI/UCH/VID,http://dx.doi.org/10.1177/1609406915625573,10.1177/1609406915625573
638,"Avila, VS; Urbina, JMM; Chuaqui, VF; Prieto, JB; Santibanez, VV",Model of socio-cultural dimensions involved in adherence to antiretroviral therapy for HIV/AIDS in public health care centers in Chile,2016,AIDS CARE-PSYCHOLOGICAL AND SOCIO-MEDICAL ASPECTS OF AIDS/HIV,ISI/SCOPUS/UCH/VID,http://dx.doi.org/10.1080/09540121.2016.1179252,10.1080/09540121.2016.1179252
639,"Cornejo-Ovalle, Marco; Fajreldin, Valentina; Werlinger, Fabiola; Candia, Orietta; Cruces, Gerardo; Farfán, Jaime; Coronado, Lorena; Urzúa, Madeleine; Duarte, Valentina",Mesas de trabajo intersectorial y política de salud oral enfocada a la niñez,2015,"REVISTA CLINICA DE PERIODONCIA, IMPLANTOLOGIA Y REHABILITACION ORAL",SCIELO-Chile/UCH/VID,http://dx.doi.org/10.1016/j.piro.2015.09.005,10.1016/j.piro.2015.09.005
640,Misrachi Launert Clara; Manríquez Urbina José; Fajreldin Chuaqui Valentina; Kuwahara Aballay Kiyoshi; Verdaguer Muñoz Carolina,"Creencias, conocimientos y prácticas en salud oral de la población mapuche-williche de Isla Huapi, Chile",2014,REVISTA FACULTAD DE ODONTOLOGIA UNIVERSIDAD DE ANTIOQUIA,SCIELO-otros paises /UCH/VID,,
641,"Fajreldin, V",BIOETHICAL ISSUES IN BIOMEDIAL RESEARCH INVOLVING CHILEAN INDIGENOUS POPULATIONS,2010,ACTA BIOETHICA,ISI/SCOPUS/SCIELO-Chile/UCH/VID,http://dx.doi.org/10.4067/S1726-569X2010000200012,10.4067/S1726-569X2010000200012
642,"Cuadrado, C; Vidal, F; Pacheco, J; Flores-Alvarado, S",Cancer Care Access in Chile's Vulnerable Populations During the COVID-19 Pandemic,2022,REVISTA PANAMERICANA DE SALUD PUBLICA-PAN AMERICAN JOURNAL OF PUBLIC HEALTH,SCOPUS/ISI/UCH/VID,http://dx.doi.org/10.26633/RPSP.2022.77,10.26633/RPSP.2022.77
643,"Cuadrado, C; Vidal, F; Pacheco, J; Flores-Alvarado, S",Cancer Care Access in Chile's Vulnerable Populations During the COVID-19 Pandemic,2022,AMERICAN JOURNAL OF PUBLIC HEALTH,ISI/SCOPUS/UCH/VID,http://dx.doi.org/10.2105/AJPH.2021.306587,10.2105/AJPH.2021.306587
644,"Castillo-Riquelme, M; Yamada, G; Roux, AVD; Alfaro, T; Flores-Alvarado, S; Barrientos, T; Vaz, CT; Trotta, A; Sarmiento, OL; Lazo, M",Aging and self-reported health in 114 Latin American cities: gender and socio-economic inequalities,2022,BMC PUBLIC HEALTH,ISI/SCOPUS/UCH/VID,http://dx.doi.org/10.1186/s12889-022-13752-2,10.1186/s12889-022-13752-2
645,"Reyes-Madrid, Margarita; Flores-Alvarado, Sandra; Pezo-Valderrama, Patricio; Orellana-Soto, Michael; Apata, Mario; Moraga, Mauricio; Pierre, Michelle de Saint",An approach on the migratory processes in the north of Chile based on Y chromosome analysis,2022,AMERICAN JOURNAL OF HUMAN BIOLOGY,ISI/SCOPUS/UCH/VID,http://dx.doi.org/10.1002/ajhb.23736,10.1002/ajhb.23736
646,"Pezo, P; Orellana-Soto, M; de la Fuente, C; Leiva, X; Herrera, L; Flores-Alvarado, S; Galimany, J; Pierre, MD; Bravi, C; Moraga, M",Native American mitochondrial lineages in admixed populations from Chile: Detecting recent migrations during post-Columbian times using geographically restricted lineages,2022,AMERICAN JOURNAL OF BIOLOGICAL ANTHROPOLOGY,ISI/SCOPUS/UCH/VID,http://dx.doi.org//10.1002/ajpa.24513,/10.1002/ajpa.24513
647,"Abarca-Labra, V; Herrera-Soto, MJ; Flores-Alvarado, S; Ulloa-Velasquez, C; Urrutia-Alvarez, C; Falabella-Gellona, F; Sanhueza-Riquelme, L",Exploring physical activity in Central Chile during the Early Ceramic Period and Late Intermediate Period (200-1450 CE),2022,AMERICAN JOURNAL OF BIOLOGICAL ANTHROPOLOGY,ISI/SCOPUS/UCH/VID,http://dx.doi.org/10.1002/ajpa.24447,10.1002/ajpa.24447
648,"Flores-Alvarado, S; Orellana-Soto, M; Moraga, M",Ancestry and admixture of a southernmost Chilean population: The reflection of a migratory history,2022,AMERICAN JOURNAL OF HUMAN BIOLOGY,ISI/SCOPUS/UCH/VID,http://dx.doi.org/10.1002/ajhb.23598,10.1002/ajhb.23598
649,"Harden-Díaz, Natalia; Pino-León, Constanza; Orrego-Molina, Shenda; Flores-Alvarado, Sandra; Esturillo-Pinet, Javiera; Flores-Castro, Valentina; Rubio-Calero, Gabriela; Aguiar-Arias, Bárbara; Peralta-Camposano, José",Diseño y validación de un instrumento de medición de la carga académica de estudiantes de carreras de la salud,2021,REVISTA MEDICA DE CHILE,ISI/SCOPUS/SCIELO-Chile/UCH/VID,http://dx.doi.org/10.4067/s0034-98872021000600873,10.4067/s0034-98872021000600873
650,"Lardone, MC; Ortega, V; Ortiz, E; Florez, M; Piottante, A; Ebensperger, M; Flores, S; Pezo, P; Orellana, M; Moraga, M; Castro, A",Partial-AZFc deletions in Chilean men with primary spermatogenic impairment: gene dosage and Y-chromosome haplogroups,2020,JOURNAL OF ASSISTED REPRODUCTION AND GENETICS,ISI/SCOPUS/UCH/VID,http://dx.doi.org/10.1007/s10815-020-01957-6,10.1007/s10815-020-01957-6
651,"Bravo G., Fuentes-Garcia A., Arriagada M., Castellucci H.I.",Methodological considerations in the study of perceived discrimination at work: a scoping review protocol,2022,MEDWAVE,SCOPUS/UCH/VID,http://dx.doi.org/10.5867/medwave.2022.11.2650,10.5867/medwave.2022.11.2650
652,"Menegassi, B; Scagliusi, FB; Fuentes-Garcia, A; Moubarac, JC","Eating regularly and carefully, in appropriate environments and in company: An analysis between social representations and official stances on these recommendations of the Dietary Guidelines for the Brazilian Population",2022,REVISTA CHILENA DE NUTRICION,SCOPUS/SCIELO-Chile/ESCI/UCH/VID,http://dx.doi.org/10.4067/s0717-75182022000300360,10.4067/s0717-75182022000300360
653,"Uribe, FL; Arteaga, O; Bruchhausen, W; Cheung, G; Cullum, S; Fuentes-Garcia, A; Castillo, CM; Kerse, N; Kirk, R; Muru-Lanning, M; Rios, RAS; Schrott, L; Slachevsky, A; Roes, M","Dementia and COVID-19 in Chile, New Zealand and Germany: A Research Agenda for Cross-Country Learning for Resilience in Health Care Systems",2021,SUSTAINABILITY,ISI/SCOPUS/UCH/VID,http://dx.doi.org/10.3390/su131810247,10.3390/su131810247
654,"Olbrich Guzmán C., Alvarado Paiva L., Fuentes-García A., Fuentes Alburquenque M.",Translation and cross-cultural adaptation of the ¿Quality of Life in Epilepsy (QOLIE-31-P)¿ Questionnaire for Chile,2021,EPILEPSY & BEHAVIOR,SCOPUS/ISI/UCH/VID,http://dx.doi.org/10.1016/j.yebeh.2021.108169,10.1016/j.yebeh.2021.108169
655,"Berra S., Rivadero L., Ponzo J., Osorio A.G., Pasarín M.I., Leyns C., Álvarez C.V., Chávez C.A.S., Molina D., Fuentes-García A., Anzoleaga J.V.M., Plácido M.T.T., Mora F.G., Terra A., Valdata M., Borgonovo B., Salazar M., Villanueva R., Peresini V., Grupo IA-PCAT, Otros investigadores del Grupo IA-PCAT",Linguistic acceptability in the comprehension of health services assessment questionnaires in Ibero-America,2021,GACETA SANITARIA,SCOPUS/SCIELO-otros paises /ISI/UCH/VID,http://dx.doi.org/10.1016/j.gaceta.2020.04.019,10.1016/j.gaceta.2020.04.019
656,"Vio, F; Olaya, M; Fuentes-Garcia, A; Lera, L",Delphi method to reach consensus on education methods to promote healthy eating behaviors in adolescents,2020,NUTRICION HOSPITALARIA,SCOPUS/ISI/SCIELO-otros paises /UCH/VID,http://dx.doi.org/10.20960/nh.02922,10.20960/nh.02922
657,"Uribe, R; Fuentes-Garcia, A",Disclosing Product Placements of Fast Food to Children: The Importance of Reinforcing the Use of Disclosures and the Age of Children,2020,HEALTH COMMUNICATION,ISI/SCOPUS/UCH/VID,http://dx.doi.org/10.1080/10410236.2019.1636344,10.1080/10410236.2019.1636344
658,"Gajardo, J; Moreno, X; Fuentes-Garcia, A; Moraga, C; Briceno, C; Cifuentes, D",User perceptions of a public health program to reduce disability among Chilean older adults,2020,REVISTA MEDICA DE CHILE,ISI/SCOPUS/SCIELO-Chile/UCH/VID,http://dx.doi.org/10.4067/S0034-98872020000300304,10.4067/S0034-98872020000300304
659,"Pesse-Sorensen, K; Fuentes-Garcia, A; Ilabaca, J","Primary Care Assessment Tool applied to primary health care workers from Conchali, Santiago",2019,REVISTA MEDICA DE CHILE,ISI/SCOPUS/SCIELO-Chile/UCH/VID,http://dx.doi.org/10.4067/S0034-98872019000300305,10.4067/S0034-98872019000300305
660,"Ponzo, J; Berra, S; Giraldo-Osorio, A; Pasarin, MI; Leyns, C; Alvarez, CV; Soto, C; Molina, D; Fuentes-Garcia, A; Hauser, L; Magne, J; Chicaiza, V; Torres, T; Mora, FG; Terra, A; Harzheim, E; Ferre, P; Borja-Aburto, V; Fuentes, M",Ibero-American harmonization of PCAT instruments for the evaluation of the first level of care,2018,REVISTA PANAMERICANA DE SALUD PUBLICA-PAN AMERICAN JOURNAL OF PUBLIC HEALTH,ISI/SCOPUS/SCIELO-otros paises /UCH/VID,http://dx.doi.org/10.26633/RPSP.2018.80,10.26633/RPSP.2018.80
661,"Uribe, R; Fuentes-Garcia, A",Comparing children's explicit and implicit understanding of advertising and placement on TV,2017,INTERNATIONAL JOURNAL OF ADVERTISING,SCOPUS/ISI/UCH/VID,http://dx.doi.org/10.1080/02650487.2017.1384197,10.1080/02650487.2017.1384197
662,"Moreno, X; Albala, C; Lera, L; Sanchez, H; Fuentes-Garcia, A; Dangour, AD","The role of gender in the association between self-rated health and mortality among older adults in Santiago, Chile: A cohort study",2017,PLOS ONE,SCOPUS/ISI/UCH/VID,http://dx.doi.org/10.1371/journal.pone.0181317,10.1371/journal.pone.0181317
663,"Vio, F; Lera, L; Fuentes-Garcia, A; Salinas, J","Delphi method to get consensus about education methodologies in healthy eating for third to fifth school-age children, their parents and teachers",2016,NUTRICION HOSPITALARIA,SCOPUS/SCIELO-otros paises /ISI/UCH/VID,http://dx.doi.org/10.20960/nh.373,10.20960/nh.373
664,"Uribe, R; Fuentes-Garcia, A",The effects of TV unhealthy food brand placement on children. Its separate and joint effect with advertising,2015,APPETITE,ISI/SCOPUS/UCH/VID,http://dx.doi.org/10.1016/j.appet.2015.03.030,10.1016/j.appet.2015.03.030
665,"Marino, R; Albala, C; Sanchez, H; Cea, X; Fuentes, A",Prevalence of Diseases and Conditions Which Impact on Oral Health and Oral Health Self-Care Among Older Chilean,2015,JOURNAL OF AGING AND HEALTH,ISI/SCOPUS/UCH/VID,http://dx.doi.org/10.1177/0898264314533723,10.1177/0898264314533723
666,"Fuentes-Garcia, A;Albala, C;Sanchez, H;Lera, L",IS AGE A LEVELER FOR THE INEQUALITIES IN THE PROCESS OF DISABILITY OF OLDER ADULTS IN A MIDDLE INCOME COUNTRY?,2013,GERONTOLOGIST,ISI/UCH/VID,,
667,"Sanchez, H;Albala, C;Fuentes, A;Lera, L;Angel, B;Cea, X",QUALITY OF LIFE AND FUNCTIONAL LIMITATIONS IN CHILEAN OLDER PEOPLE,2013,GERONTOLOGIST,ISI/UCH/VID,,
668,"Artaza-Barrios, O;Toro-Devia, O;Fuentes-Garcia, A;Alarcon-Hein, A;Arteaga-Herrera, O",Governance of health care networks: Assessment of the health care integrating councils in the context of the health sector reform in Chile,2013,SALUD PUBLICA DE MEXICO,ISI/SCIELO-otros paises /SCOPUS/UCH/VID,,
669,"Albala, C; Sanchez, H; Fuentes, A; Lera, L; Moya, MO",IMPORTANCE OF SOCIAL SUPPORT TO COPE WITH THE BURDEN OF CAREGIVING ELDERLY PEOPLE IN CHILE,2013,GERONTOLOGIST,ISI/UCH/VID,,
670,"Fuentes-Garcia, A; Uribe, R",EVALUATING THE BEHAVIORAL EFFECT OF JUNK FOOD ADVERTISING AND BRAND PLACEMENT ON CHILDREN,2013,ANNALS OF NUTRITION AND METABOLISM,ISI/UCH/VID,,
671,"Vio, F;Lera, L;Salinas, J;Fuentes-Garcia, A","DELPHI METHOD TO IDENTIFY EDUCATIONAL MATERIALS ON HEALTHY FOOD FOR TEACHERS, SCHOOL-AGE CHILDREN AND THEIR PARENTS",2013,ANNALS OF NUTRITION AND METABOLISM,ISI/UCH/VID,,
672,"Lera, L;Albala, C;Sanchez, H;Fuentes-Garcia, A;Angel, B",VALIDATION OF CALF CIRCUMFERENCE AS A PROXY FOR BMI IN THE SHORT-FORM MINI NUTRITIONAL ASSESSMENT IN CHILEAN OLDER PEOPLE,2013,ANNALS OF NUTRITION AND METABOLISM,ISI/UCH/VID,,
673,"Fuentes-Garcia, A;Sanchez, H;Lera, L;Cea, X;Albala, C",Socioeconomic inequalities in the onset and progression of disability in a cohort of older people in Santiago (Chile),2013,GACETA SANITARIA,ISI/SCIELO-otros paises /SCOPUS/UCH/VID,http://dx.doi.org/10.1016/j.gaceta.2012.11.005,10.1016/j.gaceta.2012.11.005
674,"Lera, L; Fuentes-Garcia, A; Sanchez, H; Albala, C",Validity and reliability of the SF-36 in Chilean older adults: the ALEXANDROS study,2013,EUROPEAN JOURNAL OF AGEING,ISI/SCOPUS/UCH/VID,http://dx.doi.org/10.1007/s10433-012-0256-2,10.1007/s10433-012-0256-2
675,Lera L;Sanchez H;Albala C;Fuentes-Garcia A,Oral health-related quality of life of older people from three South American cities,2013,GERODONTOLOGY,ISI/SCOPUS/UCH/VID,http://dx.doi.org/10.1111/j.1741-2358.2012.00649.x,10.1111/j.1741-2358.2012.00649.x
676,"Albala, C; Sanchez, H; Cea, X; Fuentes, A; Marino, R",Self-assessed oral-health status and quality of life of older Chilean,2013,ARCHIVES OF GERONTOLOGY AND GERIATRICS,SCOPUS/ISI/UCH/VID,http://dx.doi.org/10.1016/j.archger.2012.12.004,10.1016/j.archger.2012.12.004
677,"Vio, F;Lera, L;Fuentes-Garcia, A;Salinas, J","Delphi method to identify education material on healthy food for teachers, school-age children and their parents",2012,ARCHIVOS LATINOAMERICANOS DE NUTRICION,ISI/SCIELO-otros paises /SCOPUS/UCH/VID,,
678,"Fuentes, A;Albala, C;Sanchez, H;Marques, L",SOCIOECONOMIC INEQUALITIES IN THE PROCESS OF DISABILITY AMONG CHILEAN OLDER PEOPLE: A LONGITUDINAL STUDY,2012,GERONTOLOGIST,ISI/UCH/VID,,
679,"Albala, C;Sanchez, H;Lera, L;Fuentes, A;Cea, X",TOTAL AND ACTIVE LIFE EXPECTANCY IN CHILEAN OLDER PEOPLE. SOCIOECONOMIC AND GENDER DIFFERENTIALS,2012,GERONTOLOGIST,ISI/UCH/VID,,
680,"Albala, C;Lera, L;Sanchez, H;Angel, B;Fuentes, A;Arroyo, P",SARCOPENIA IS MORE IMPORTANT THAN VITAMIN D DEFICIENCY AS DETERMINANT OF OSTEOPOROSIS IN CHILEAN ELDERS,2012,OSTEOPOROSIS INTERNATIONAL,ISI/UCH/VID,,
681,"Garcia, AF ; Sanchez, H ; Lera, L ; Cea, X ; Salas, F ; Albala, C",FALLS RISKS FACTORS AT HOME IN CHILEAN OLDER PEOPLE LIVING IN THE COMMUNITY,2011,JOURNAL OF EPIDEMIOLOGY AND COMMUNITY HEALTH,ISI/UCH/VID,http://dx.doi.org/10.1136/jech.2011.142976d.49,10.1136/jech.2011.142976d.49
682,"Albala, C ; Sanchez, H ; Lera, L ; Fuentes, A ; Cea, X ; Salas, F",PREVALENCE OF DEPENDENCY IN OLDER PEOPLE IN CHILE. FREQUENCY AND SOCIAL DIFFERENTIALS,2011,JOURNAL OF EPIDEMIOLOGY AND COMMUNITY HEALTH,ISI/UCH/VID,http://dx.doi.org/10.1136/jech.2011.142976c.63,10.1136/jech.2011.142976c.63
683,"Lera, L ; Albala, C ; Sanchez, H ; Fuentes, A ; Barbara, A ; Cea, X",VALIDATION OF A SINGLE QUESTION FOR QUALITY OF LIFE ASSESSMENT IN CHILEAN OLDER PEOPLE,2011,JOURNAL OF EPIDEMIOLOGY AND COMMUNITY HEALTH,ISI/UCH/VID,http://dx.doi.org/10.1136/jech.2011.142976o.86,10.1136/jech.2011.142976o.86
684,"Marques, L; Albala, C; Sanchez, H; Fuentes, A; Salas, F; Cea, XD",HEALTH RELATED QUALITY OF LIFE OF CHILEAN ELDERS AND ITS ASSOCIATION WITH FUNCTIONAL LIMITATIONS,2010,GERONTOLOGIST,ISI/UCH/VID,,
685,"Lera, L; Albala, C; Sanchez, H; Fuentes, A; Cea, X; Salas, F",IMPACT OF OSTEOPOROSIS ON HEALTH RELATED QUALITY OF LIFE (SHORT-FORM 36) IN CHILEAN ELDERS: THE ALEXANDROS STUDY,2010,OSTEOPOROSIS INTERNATIONAL,ISI/UCH/VID,,
686,"Albala, C ; Sanchez, H ; Lera, L ; Salas, F ; Cea, X ; Fuentes, A ; Arroyo, P",BODY COMPOSITION AND 5Y INCIDENCE OF OSTEOPOROSIS IN CHILEAN ELDERS,2010,OSTEOPOROSIS INTERNATIONAL,ISI/UCH/VID,,
687,"Flores-Alvarado S., Doberti Herrera T., Fuentes-Alburquenque M.",Evaluation of the traditional dimensions of residential segregation by educational level in Chile,2023,Cities and Health,SCOPUS/UCH/VID,http://dx.doi.org/10.1080/23748834.2022.2124591,10.1080/23748834.2022.2124591
688,"Jeldes-Maturana J., Ramírez-Peña R., Zúñiga-Clavijo P., Ogalde-Baeza S., Miño-Cornejo J.S., Fuentes-Alburquenque M., Pastén-Avalos M., Canals-Lambarri M.",A look at the safety of ultrasound in obstetric echotomography,2022,REVISTA CHILENA DE OBSTETRICIA Y GINECOLOGIA,SCOPUS/SCIELO-Chile/UCH/VID,http://dx.doi.org/10.24875/RECHOG.22000040,10.24875/RECHOG.22000040
689,"Pizarro-Mena, R; Duran-Aguero, S; Parra-Soto, S; Vargas-Silva, F; Bello-Lepe, S; Fuentes-Alburquenque, M",Effects of a Structured Multicomponent Physical Exercise Intervention on Quality of Life and Biopsychosocial Health among Chilean Older Adults from the Community with Controlled Multimorbidity: A Pre-Post Design,2022,INTERNATIONAL JOURNAL OF ENVIRONMENTAL RESEARCH AND PUBLIC HEALTH,ISI/SCOPUS/UCH/VID,http://dx.doi.org/10.3390/ijerph192315842,10.3390/ijerph192315842
