,Autores,titulo_publicacion,ano,titulo_revistas,tipo_publicacion,link,doi
0,"Alberts S., D치vila M., Valenzuela A.",Modernizing the State to Strengthen Democracy: Public Sector Reforms in Chile,2021,The Emerald Handbook of Public Administration in Latin America,SCOPUS/UCH/VID,http://dx.doi.org/10.1108/978-1-83982-676-420201005,10.1108/978-1-83982-676-420201005
1,"Davila, M; Maillet, A","More Money, More Problems: Quality Assurance in Higher Education in Chile (2006-2018)",2021,BULLETIN OF LATIN AMERICAN RESEARCH,ISI/SCOPUS/UCH/VID,http://dx.doi.org/10.1111/blar.13190,10.1111/blar.13190
2,"Avenda침o O., D치vila M.",Together we govern: Portfolio allocation in Chile (1990-2014),2017,Government Formation and Minister Turnover in Presidential Cabinets: Comparative Analysis in the Americas,SCOPUS/UCH/VID,http://dx.doi.org/10.4324/9781315466491,10.4324/9781315466491
3,"Letelier, LE; Davila, M",The Political Economics of Tax Reform in Chile,2015,NEW POLITICAL ECONOMY,ISI/SCOPUS/UCH/VID,http://dx.doi.org/10.1080/13563467.2015.1041475,10.1080/13563467.2015.1041475
4,"Davila M., Lavados A.O., Avendano O.",The cabinets of the concertaci칩n in Chile (1990-2010),2013,AMERICA LATINA HOY-REVISTA DE CIENCIAS SOCIALES,SCOPUS/UCH/VID,,
