,Autores,titulo_publicacion,ano,titulo_revistas,tipo_publicacion,link,doi
176,"Kolls, BJ; Sapp, S; Rockhold, FW; Jordan, JD; Dombrowski, KE; Fowkes, FGR; Mahaffey, KW; Berger, JS; Katona, BG; Blomster, JI; Norgren, L; Abramson, BL; Leiva-Pons, JL; Prieto, JC; Sokurenko, G; Hiatt, WR; Jones, WS; Patel, MR",Stroke in Patients With Peripheral Artery Disease,2019,STROKE,ISI/SCOPUS/UCH/VID,http://dx.doi.org/10.1161/STROKEAHA.118.023534,10.1161/STROKEAHA.118.023534
177,"Vargas, CG; Miranda, HF; Sierralta, F; Noriega, V; Prieto, JC",Pharmacological interaction between NSAIDS with clomipramine and risperidone in mice visceral pain,2019,DRUG DEVELOPMENT RESEARCH,ISI/SCOPUS/UCH/VID,http://dx.doi.org/10.1002/ddr.21519,10.1002/ddr.21519
178,"Miranda, HF; Poblete, P; Sierralta, F; Noriega, V; Prieto, JC; Zepeda, RJ",Interleukin-1beta in synergism gabapentin with tramadol in murine model of diabetic neuropathy,2019,INFLAMMOPHARMACOLOGY,SCOPUS/ISI/UCH/VID,http://dx.doi.org/10.1007/s10787-018-0532-7,10.1007/s10787-018-0532-7
179,"Schwartz, GG; Steg, PG; Szarek, M; Bhatt, DL; Bittner, VA; Diaz, R; Edelberg, JM; Goodman, SG; Hanotin, C; Harrington, RA; Jukema, JW; Lecorps, G; Mahaffey, KW; Moryusef, A; Pordy, R; Quintero, K; Roe, MT; Sasiela, WJ; Tamby, JF; Tricoci, P; White, HD; Zeiher, AM; Aylward, PE; Drexel, H; Sinnaeve, P; Dilic, M; Lopes, RD; Gotcheva, NN; Goodman, SG; Prieto, JC; Yong, H; Lopez-Jaramillo, P; Pecin, I; Reiner, Z; Ostadal, P; Poulsen, SH; Viigimaa, M; Nieminen, MS; Danchin, N; Chumburidze, V; Marx, N; Liberopoulos, E; Valdovinos, PCM; Tse, HF; Kiss, RG; Xavier, D; Zahger, D; Valgimigli, M; Kimura, T; Kim, HS; Kim, SH; Erglis, A; Laucevicius, A; Kedev, S; Yusoff, K; Lopez, GAR; Alings, M; Halvorsen, S; Flores, RMC; Sy, RG; Budaj, A; Morais, J; Dorobantu, M; Karpov, Y; Ristic, AD; Chua, T; Murin, J; Fras, Z; Dalby, AJ; Tunon, J; de Silva, HA; Hagstrom, E; Muller, C; Chiang, CE; Sritara, P; Guneri, S; Parkhomenko, A; Ray, KK; Moriarty, PM; Vogel, R; Chaitman, B; Kelsey, SF; Olsson, AG; Rouleau, JL; Simoons, ML; Alexander, K; Meloni, C; Rosenson, R; Sijbrands, EJG; Alexander, JH; Armaganijan, L; Bagai, A; Bahit, MC; Brennan, JM; Clifton, S; DeVore, AD; Deloatch, S; Dickey, S; Dombrowski, K; Ducrocq, G; Eapen, Z; Endsley, P; Eppinger, A; Hess, CN; Hlatky, MA; Jordan, JD; Knowles, JW; Kolls, BJ; Kong, DF; Leonardi, S; Lillis, L; Lopes, RD; Maron, DJ; Marcus, J; Mathews, R; Mehta, RH; Mentz, RJ; Moreira, HG; Patel, CB; Pereira, SB; Perkins, L; Povsic, TJ; Puymirat, E; Jones, WS; Shah, BR; Sherwood, MW; Stringfellow, K; Sujjavanich, D; Toma, M; Trotter, C; van Diepen, SFP; Wilson, MD; Yan, ATK; Schiavi, LB; Garrido, M; Alvarisqueta, AF; Sassone, SA; Bordonava, AP; De Lima, AEA; Schmidberg, JM; Duronto, EA; Caruso, OC; Novaretto, LP; Hominal, MA; Montana, OR; Caccavo, A; Vilamajo, OAG; Lorenzatti, AJ; Cartasegna, LR; Paterlini, GA; Mackinnon, IJ; Caime, GD; Amuchastegui, M; Codutti, OR; Jure, HO; Bono, JOE; Hrabar, AD; Vallejos, JA; Rodolfo, AAG; Novoa, F; Patocchi, CA; Zaidman, CJ; Giuliano, ME; Dran, RD; Vico, ML; Carnero, GS; Guzman, PN; Allende, JCM; Brasca, DFG; Labarta, MHB; Nani, S; Blumberg, EDS; Colombo, HR; Liberman, A; Luciardi, HL; Waisman, GD; Berli, MA; Duran, ROG; Cestari, HG; Luquez, HA; Giordano, JA; Saavedra, SS; Waites, JH; Collins, N; Soward, A; Hii, CLS; Shaw, J; Arstall, MA; Horowitz, J; Rogers, JF; Colquhoun, D; Flores, REO; Roberts-Thomson, P; Raffel, O; Lehman, SJ; et al",Alirocumab and Cardiovascular Outcomes after Acute Coronary Syndrome,2018,NEW ENGLAND JOURNAL OF MEDICINE,ISI/SCOPUS/UCH/VID,http://dx.doi.org/10.1056/NEJMoa1801174,10.1056/NEJMoa1801174
180,"Miranda, HF; Sierralta, F; Aranda, N; Poblete, P; Noriega, V; Prieto, JC",Synergism between gabapentin-tramadol in experimental diabetic neuropathic pain,2018,FUNDAMENTAL & CLINICAL PHARMACOLOGY,ISI/SCOPUS/UCH/VID,http://dx.doi.org/10.1111/fcp.12400,10.1111/fcp.12400
181,"Miranda, HF; Sierralta, F; Aranda, N; Poblete, P; Castillo, RL; Noriega, V; Prieto, JC",Antinociception induced by rosuvastatin in murine neuropathic pain,2018,PHARMACOLOGICAL REPORTS,SCOPUS/ISI/UCH/VID,http://dx.doi.org/10.1016/j.pharep.2017.11.012,10.1016/j.pharep.2017.11.012
182,"Miranda, HF; Sierralta, F; Aranda, N; Noriega, V; Prieto, JC","Pharmacological profile of dexketoprofen in orofacial pain (vol 68, pg 1111, 2016)",2018,PHARMACOLOGICAL REPORTS,ISI/SCOPUS/UCH/VID,http://dx.doi.org/10.1016/j.pharep.2017.08.003,10.1016/j.pharep.2017.08.003
183,"Miranda, HF; Sierralta, F; Jorquera, V; Poblete, P; Prieto, JC; Noriega, V","Antinociceptive interaction of gabapentin with minocycline in murine diabetic neuropathy (vol 25, pg 91, 2017)",2017,INFLAMMOPHARMACOLOGY,ISI/SCOPUS/UCH/VID,http://dx.doi.org/10.1007/s10787-017-0368-6,10.1007/s10787-017-0368-6
184,"Ramos, C; Brito, R; Gonzaez-Montero, J; Valls, N; Gormaz, JG; Prieto, JC; Aguayo, R; Puentes, A; Noriega, V; Pereira, G; Palavecino, T; Rodrigo, R",Effects of a novel ascorbate-based protocol on infarct size and ventricle function in acute myocardial infarction patients undergoing percutaneous coronary angioplasty,2017,ARCHIVES OF MEDICAL SCIENCE,ISI/SCOPUS/UCH/VID,http://dx.doi.org/10.5114/aoms.2016.59713,10.5114/aoms.2016.59713
185,"Miranda, HF; Sierralta, F; Jorquera, V; Poblete, P; Prieto, JC; Noriega, V",Antinociceptive interaction of gabapentin with minocycline in murine diabetic neuropathy,2017,INFLAMMOPHARMACOLOGY,ISI/SCOPUS/UCH/VID,http://dx.doi.org/10.1007/s10787-017-0308-5,10.1007/s10787-017-0308-5
186,"Miranda, HF; Sierralta, F; Aranda, N; Noriega, V; Prieto, JC",Pharmacological profile of dexketoprofen in orofacial pain,2016,PHARMACOLOGICAL REPORTS,ISI/SCOPUS/UCH/VID,http://dx.doi.org/10.1016/j.pharep.2016.06.015,10.1016/j.pharep.2016.06.015
187,"Miranda, HF; Noriega, V; Prieto, JC; Zanetta, P; Castillo, R; Aranda, N; Sierralta, F",Antinociceptive Interaction of Tramadol with Gabapentin in Experimental Mononeuropathic Pain,2016,BASIC & CLINICAL PHARMACOLOGY & TOXICOLOGY,ISI/SCOPUS/UCH/VID,http://dx.doi.org/10.1111/bcpt.12567,10.1111/bcpt.12567
188,"Valls, N; Gormaz, JG; Aguayo, R; Gonzalez, J; Brito, R; Hasson, D; Libuy, M; Ramos, C; Carrasco, R; Prieto, JC; Dussaillant, G; Puentes, A; Noriega, V; Rodrigo, R",Amelioration of persistent left ventricular function impairment through increased plasma ascorbate levels following myocardial infarction,2016,REDOX REPORT,ISI/SCOPUS/UCH/VID,http://dx.doi.org/10.1179/1351000215Y.0000000018,10.1179/1351000215Y.0000000018
189,"Bartolucci, J; Nazzal, C; Verdugo, FJ; Prieto, JC; Sepulveda, P; Corbalan, R","Characteristics, management, and outcomes of illicit drug consumers with acute myocardial infarction",2016,REVISTA MEDICA DE CHILE,ISI/SCIELO-Chile/SCOPUS/UCH/VID,http://dx.doi.org/10.4067/S0034-98872016000100006,10.4067/S0034-98872016000100006
190,"Bonaca, MP; Bhatt, DL; Cohen, M; Steg, PG; Storey, RF; Jensen, EC; Magnani, G; Bansilal, S; Fish, MP; Im, K; Bengtsson, O; Ophuis, TO; Budaj, A; Theroux, P; Ruda, M; Hamm, C; Goto, S; Spinar, J; Nicolau, JC; Kiss, RG; Murphy, SA; Wiviott, SD; Held, P; Braunwald, E; Sabatine, MS; Morin, S; Fish, MP; Dantzer, E; Acquilano, D; McGuire, RL; Gannon, JB; Gershman, E; Im, K; Ahlbom, AM; Boberg, B; Abola, MT; Ardissino, D; Aylward, P; Budaj, A; Corbalan, R; Dalby, A; Dellborg, M; Diaz, R; Dimulescu, D; Goto, S; Goudev, A; Guneri, S; Hamm, C; Hu, DY; Isaza, D; Kamensky, G; Kiss, R; Kontny, F; Lopez-Sendon, J; Medina, F; Montalescot, G; Nicolau, J; Paolasso, E; Parkhomenko, A; Ruda, M; Seung, KB; Van De Werf, F; Anderson, JL; White, HD; Verheugt, FWA; Pedersen, TR; DeMets, DL; Lowe, C; Arevalo, C; Awtry, E; Berger, C; Croce, K; Desai, A; Gelfand, E; Ho, C; Leeman, D; Link, M; Norden, A; Pande, A; Rost, N; Ruberg, F; Silverman, S; Singhal, A; Vita, J; Alvarisqueta, A; De Gennaro, N; Berli, M; Roude, AE; Di Gennaro, JA; Albisu, JF; Caccavo, A; Torres, M; Cuadrado, J; Bordoni, P; Cuello, J; Aviles, A; Glenny, A; Recoaro, R; Fernandez, R; Strada, BN; Fuentealba, V; Gallo, C; Duran, RG; Garcia, C; Hominal, M; Castoldi, M; Jure, H; Pacora, FF; Lorenzatti, A; Martinez, JM; Macin, S; Cocco, N; MacKinnon, I; Bagnato, MB; Marino, J; Cusimano, S; Arias, V; Focaccia, M; Muntaner, J; Mansilla, V; Poy, C; Prado, A; Paterlini, G; Montana, O; Camino, A; Sala, J; Luciani, C; Vico, M; Morell, Y; Dumont, C; Vottero, E; Zangroniz, P; Lescano, A; Morara, P; Marquez, LL; Patron, FR; Labarta, GB; Sivila, CD; Quiroga, AR; Maffei, L; Sassone, S; Rolandi, F; Vesentini, N; Carnero, G; Del Verme, S; Hershson, A; Figal, JC; Viso, ME; Hii, C; Smith, K; Singh, B; Acampo, M; Rogers, J; ODonoghue, M; Amerena, J; Long, A; Dart, A; Kay, S; Worthley, M; Nimmo, J; Lehman, R; Morrison, H; Dick, R; Savage, C; van Gaal, W; Park, M; Blombery, P; McCarthy, C; Oqueli, E; Hill, D; Sader, M; Vrachas, D; Purnell, P; Vibert, J; Collins, N; Gordon, A; Arstall, M; Rose, J; Aroney, C; Cleave, P; Fitzpatrick, M; Mackenzie, M; Garrahy, P; Hall, C; Nelson, G; Reid, E; Lee, A; Gibbs, J; Thompson, P; Crittenden, J; Hammett, C; Hindom, L; Antonis, P; Manzoney, A; Cross, D; Pollard, C; Brieger, D; Wu, J; Whelan, A; Tulloch, G; Taylor, A; Smith, B; Horowitz, J; Black, M; Boland, J; Malmendier, D; Celen, H; Wendelen, E; Claeys, M; Pieter, M; Cools, F; Simons, N; De Maeseneire, S; De Wolf, L; Brike, C; Dubois, P; Bolado, ACY; Foading-Deffo, B; Tahon, S; Friart, A; Arend, C; Gevaert, S; Verdegem, P; Marechal, P; Gits, F; Pierard, L; Celentano, C; Pirenne, B; Bouvy, C; Renkin, J; Huyberechts, D; Sinnaeve, P; De Velder, L; Stammen, F; Casier, T; Striekwold, H; Van den Broeck, D; Thoeng, J; Goris, R; Timmermans, P; Collard, SJ; Van De Borne, P; De Clippel, M; Wollaert, B; Jacobs, C; Vankelecom, B; Daelemans, Y; Vervoort, G; Drieghe, S; Vranckx, P; Janssen, A; Vrolix, M; Simenon, I; Wijns, W; Delacroix, H; Denie, D; Schoors, D; Lemoine, I; Cornelis, K; Willems, AM; Schroder, E; Domange, J; Greque, G; Machado, H; Armaganijan, D; Del Monaco, MI; da Silva, D; Nakazone, R; Dutra, O; Vaz, R; Daher, R; Rodrigues, D; Guimaraes, A; Teixeira, A; Saraiva, J; Costa, M; Leaes, P; Blacher, M; Maia, L; Nakazone, MA; Manenti, E; Ruschel, K; Marin-Neto, J; Pavao, R; Preto, R; Junior, AA; Oliveira, G; Rassi, S; Sampaio, D; Rossi, PR; dos Santos, L; de Souza, J; Lino, E; Filho, PP; Zucchetti, C; Gomes, M; de Paiva, A; Sousa, AC; Almeida, A; Botelho, R; da Silva, R; Giraldez, R; Franken, M; Faludi, A; Bertolami, M; Hernandes, M; Lucas, N; Carvalho, A; Bertolami, A; Precoma, D; Geralde, L; Pereira, A; Cesar, L; Mioto, B; Marino, R; Rabelo, W; dos Santos, F; Vidotti, M; Mangione, J; Mauro, M; Kormann, A; Ultramari, F; Zimmermann, S; Michalaros, Y; Fonseca, M; Sampaio, C; Eliaschewitz, F; Barbosa, E; Drews, C; de Lorenzo, A; Barros, C; Cancado, G; Neuesnchwander, F; Zimmermann, E; Chompalova, B; Denchev, S; Gocheva, N; M",Long-Term Use of Ticagrelor in Patients with Prior Myocardial Infarction,2015,NEW ENGLAND JOURNAL OF MEDICINE,ISI/SCOPUS/UCH/VID,http://dx.doi.org/10.1056/NEJMoa1500857,10.1056/NEJMoa1500857
191,"Miranda, HF; Noriega, V; Zepeda, R; Zanetta, P; Prieto-Rayo, J; Prieto, JC; Sierralta, F",Antinociceptive Synergism of Gabapentin and Nortriptyline in Mice with Partial Sciatic Nerve Ligation,2015,PHARMACOLOGY,SCOPUS/ISI/UCH/VID,http://dx.doi.org/10.1159/000370244,10.1159/000370244
192,"Miranda, HF; Sierralta, F; Lux, S; Troncoso, R; Ciudad, N; Zepeda, R; Zanetta, P; Noriega, V; Prieto, JC",Involvement of nitridergic and opioidergic pathways in the antinociception of gabapentin in the orofacial formalin test in mice,2015,PHARMACOLOGICAL REPORTS,ISI/SCOPUS/UCH/VID,http://dx.doi.org/10.1016/j.pharep.2014.10.018,10.1016/j.pharep.2014.10.018
193,"Maldonado Veas, Rodrigo; Madariaga Román, Andrea; López, Constanza; Nazzal Nazal, Carolina; Prieto Domíngez, Juan Carlos",Caracterización clínica de pacientes con Infarto Agudo al Miocardio sin lesiones coronarias significativas: Estudio GEMI 2011-2013,2014,REVISTA CHILENA DE CARDIOLOGIA,SCIELO-Chile/UCH/VID,http://dx.doi.org/10.4067/S0718-85602014000300001,10.4067/S0718-85602014000300001
194,"Rodrigo, R; Hasson, D; Prieto, JC; Dussaillant, G; Ramos, C; Leon, L; Garate, J; Valls, N; Gormaz, JG",The effectiveness of antioxidant vitamins C and E in reducing myocardial infarct size in patients subjected to percutaneous coronary angioplasty (PREVEC Trial): study protocol for a pilot randomized double-blind controlled trial,2014,TRIALS,SCOPUS/ISI/UCH/VID,http://dx.doi.org/10.1186/1745-6215-15-192,10.1186/1745-6215-15-192
195,"Miranda, HF; Noriega, V; Zanetta, P; Prieto, JC; Prieto-Rayo, JC; Aranda, N; Sierralta, F",Isobolographic analysis of the opioid-opioid interactions in a tonic and a phasic mouse model of induced nociceptive pain,2014,JOURNAL OF BIOMEDICAL SCIENCE,ISI/SCOPUS/UCH/VID,http://dx.doi.org/10.1186/s12929-014-0062-6,10.1186/s12929-014-0062-6
196,"Miranda, HF; Noriega, V; Zepeda, RJ; Sierralta, F; Prieto, JC",Systemic synergism between codeine and morphine in three pain models in mice,2013,PHARMACOLOGICAL REPORTS,ISI/SCOPUS/UCH/VID,,
197,"Nazzal, C;Corbalan, R;Frenz, P;Sepulveda, P;Prieto, J;GEMI Grp",Differences in treatment and in-hospital mortality of acute myocardial infarction patients in public and private hospitals in Chile before and after healthcare guarantees,2013,EUROPEAN HEART JOURNAL,ISI/UCH/VID,,
198,"Miranda, HF; Noriega, V; Zanetta, P; Prieto, JC",Isobolographic Analysis in Mice of the Interaction of Gabapentin and Nortriptyline in Relieving Orofacial Pain,2013,JOURNAL OF OROFACIAL PAIN,SCOPUS/ISI/UCH/VID,,
199,"Rodrigo, R;Prieto, JC;Castillo, R",Cardioprotection against ischaemia/reperfusion by vitamins C and E plus n-3 fatty acids: molecular mechanisms and potential clinical applications,2013,CLINICAL SCIENCE,SCOPUS/ISI/UCH/VID,http://dx.doi.org/10.1042/CS20110663,10.1042/CS20110663
200,"Prieto, JC; Miranda, HF; Aramburu, I; Zepeda, RJ; Brugere, S; Castillo, R; Galdames, K; Rodrigo, R; Noriega, V",Effect of Carvedilol and Nebivolol on Oxidative Stress-related Parameters and Endothelial Function in Patients with Essential Hypertension,2012,BASIC & CLINICAL PHARMACOLOGY & TOXICOLOGY,SCOPUS/ISI/UCH/VID,http://dx.doi.org/10.1111/j.1742-7843.2012.00911.x,10.1111/j.1742-7843.2012.00911.x
201,"Miranda, HF; Noriega, V; Prieto, JC",Previous administration of naltrexone did not change synergism between paracetamol and tramadol in mice,2012,PHARMACOLOGY BIOCHEMISTRY AND BEHAVIOR,SCOPUS/ISI/UCH/VID,http://dx.doi.org/10.1016/j.pbb.2012.03.008,10.1016/j.pbb.2012.03.008
202,"Miranda, HF;Noriega, V;Zepeda, RJ;Sierralta, F;Prieto, JC",Synergism Between Fentanyl and Tramadol in Tonic Inflammatory Pain: the Orofacial Formalin Test,2012,INFLAMMATION,ISI/SCOPUS/UCH/VID,http://dx.doi.org/10.1007/s10753-011-9420-7,10.1007/s10753-011-9420-7
203,"Tricoci, P;Huang, Z;Held, C;Moliterno, DJ;Armstrong, PW;Van de Werf, F;White, HD;Aylward, PE;Wallentin, L;Chen, E;Lokhnygina, Y;Pei, JL;Leonardi, S;Rorick, TL;Kilian, AM;Jennings, LHK;Ambrosio, G;Bode, C;Cequier, A;Cornel, JH;Diaz, R;Erkan, A;Huber, K;Hudson, MP;Jiang, LX;Jukema, JW;Lewis, BS;Lincoff, AM;Montalescot, G;Nicolau, JC;Ogawa, H;Pfisterer, M;Prieto, JC;Ruzyllo, W;Sinnaeve, PR;Storey, RF;Valgimigli, M;Whellan, DJ;Widimsky, P;Strony, J;Harrington, RA;Mahaffey, KW",Thrombin-Receptor Antagonist Vorapaxar in Acute Coronary Syndromes,2012,NEW ENGLAND JOURNAL OF MEDICINE,ISI/SCOPUS/UCH/VID,http://dx.doi.org/10.1056/NEJMoa1109719,10.1056/NEJMoa1109719
204,"Garcia, GG; Miranda, HF; Noriega, V; Sierralta, F; Olavarria, L; Zepeda, RJ; Prieto, JC",Antinociception induced by atorvastatin in different pain models,2011,PHARMACOLOGY BIOCHEMISTRY AND BEHAVIOR,ISI/SCOPUS/UCH/VID,http://dx.doi.org/10.1016/j.pbb.2011.08.007,10.1016/j.pbb.2011.08.007
205,"Miranda, HF; Noriega, V; Olavarria, L; Zepeda, RJ; Sierralta, F; Prieto, JC",Antinociception and anti-inflammation induced by simvastatin in algesiometric assays in mice,2011,BASIC & CLINICAL PHARMACOLOGY & TOXICOLOGY,ISI/SCOPUS/UCH/VID,http://dx.doi.org/10.1111/j.1742-7843.2011.00746.x,10.1111/j.1742-7843.2011.00746.x
206,"Gonzalez, C; Zegpi, C; Noriega, V; Prieto, JC; Miranda, HF",Synergism between dexketoprofen and meloxicam in an orofacial formalin test was not modified by opioid antagonists,2011,PHARMACOLOGICAL REPORTS,ISI/SCOPUS/UCH/VID,,
207,"Miranda, HF; Noriega, V; Sierralta, F; Prieto, JC",Interaction between dexibuprofen and dexketoprofen in the orofacial formalin test in mice,2011,PHARMACOLOGY BIOCHEMISTRY AND BEHAVIOR,ISI/SCOPUS/UCH/VID,http://dx.doi.org/10.1016/j.pbb.2010.09.017,10.1016/j.pbb.2010.09.017
208,Munoz J; Navarro C; Noriega V; Pinardi G; Sierralta F; Prieto J.C; Miranda H.F.,Synergism between COX-3 inhibitors in two animal models of pain,2010,INFLAMMOPHARMACOLOGY,SCOPUS/UCH/VID,http://dx.doi.org/10.1007/s10787-009-0019-7,10.1007/s10787-009-0019-7
209,"Guarda S, Eduardo; Prieto D, Juan Carlos; Sanhueza C, Patricio; Dauvergne M, Christian; Asenjo G, Rene; Corbalán H, Ramón",Guías 2009 de la Sociedad Chilena de Cardiología para el tratamiento del Infarto Agudo del Miocardio con supradesnivel del ST,2009,REVISTA CHILENA DE CARDIOLOGIA,SCIELO-Chile/UCH/VID,http://dx.doi.org/10.4067/S0718-85602009000200014,10.4067/S0718-85602009000200014
210," Miranda, HF; Puig, MM; Romero, MA; Prieto, JC",Effects of tramadol and dexketoprofen on analgesia and gastrointestinal transit in mice,2009,FUNDAMENTAL & CLINICAL PHARMACOLOGY,ISI/SCOPUS/UCH/VID,http://dx.doi.org/10.1111/j.1472-8206.2008.00636.x,10.1111/j.1472-8206.2008.00636.x
211," Noriega, V; Pennanen, C; Sanchez, MP; Chiong, M; Llancaqueo, M; Lavandero, S; Prieto, JC",(TTA)n Polymorphism in 3-Hydroxy-3-Methylglutaryl-Coenzyme A and Response to Atorvastatin in Coronary Artery Disease Patients,2009,BASIC & CLINICAL PHARMACOLOGY & TOXICOLOGY,ISI/SCOPUS/UCH/VID,http://dx.doi.org/10.1111/j.1742-7843.2008.00341.x,10.1111/j.1742-7843.2008.00341.x
212," Miranda, HF; Sierralta, F; Prieto, G",Synergism between NSAIDs in the orofacial formalin test in mice,2009,PHARMACOLOGY BIOCHEMISTRY AND BEHAVIOR,ISI/SCOPUS/UCH/VID,http://dx.doi.org/10.1016/j.pbb.2008.12.018,10.1016/j.pbb.2008.12.018
213,"Nazzal, C;Corbalan, R;Campos, P;Bartolucci, J;Prieto, JC;Sanhueza, P;Lanas, F;Chilean Soc Cardiology",Is it possible to reduce in-hospital mortality in women with ST segment elevation myocardial infarction (STEMI)? Impact of the Chilean health sector reform,2008,EUROPEAN HEART JOURNAL,ISI/UCH/VID,,
214,"Nazzal, C; Corbalan, R; Campos, P; Bartolucci, J; Cavada, G; Prieto, JC; Lanas, F; GEMI Grp","In-hospital mortality in diabetic and non-diabetic patients with AMI: a time trend analysis based on the Chilean National Acute Myocardial Infarction Register, 2001-2006",2008,EUROPEAN HEART JOURNAL,ISI/UCH/VID,,
215,"Lanas, F; Prieto, JC; Corvalan, R; Nazzal, C; Campos, P; Seron, P; Bartolucci, J; GEMI Study Investigators",Improved therapy and outcome for patients with acute myocardial infarction in the chilean registry of myocardial infarction,2008,EUROPEAN HEART JOURNAL,ISI/UCH/VID,,
216,Prieto J.C; Pinardi G; Zamorano J; Larrain E; Zepeda R.J; Castillo R; Espinoza J; Miranda H.F.,Lack of effect of atorvastatin or pravastatin on the endothelium-dependent relaxation in segments of human vessels,2008,INTERNATIONAL JOURNAL OF PHARMACOLOGY,SCOPUS/UCH/VID,http://dx.doi.org/10.3923/ijp.2008.208.212,10.3923/ijp.2008.208.212
217,"Lanas, F; Prieto, JC; Nazzal, C; Seron, P; Campos, P; Bartolucci, J; Corvalan, R",Prognosis of acute myocardial infarction in the elderly in Chile from 1993 to 2006,2008,CIRCULATION,ISI/UCH/VID,,
218,"Nazzal, CNC; Campos, PCP; Corbalan, RCR; Bartolucci, JBJ; Sanhueza, PSP; Prieto, JCPJC; Lanas, FLF",The Chilean Health Reform and its impact in the Management and Mortality of ST Segment Elevation Myocardial Infarction (STEMI) in Chilean Hospitals,2008,CIRCULATION,ISI/UCH/VID,,
219,"Prieto, JC; Sanhueza, C; Martinez, N; Nazzala, C; Corbalan, R; Cavada, G; Lanas, F; Bartolucci, J; Campos, P",In-hospital mortality after ST-segment elevation myocardial infarction according to reperfusion therapy,2008,REVISTA MEDICA DE CHILE,ISI/SCIELO-Chile/SCOPUS/UCH/VID,http://dx.doi.org/10.4067/S0034-98872008000200001,10.4067/S0034-98872008000200001
220,"Nazzal, C; Campos, P; Corbalan, R; Lanas, F; Bartolucci, J; Sanhueza, P; Cavada, GC; Prieto, JC",The impact of Chilean health reform in the management and mortality of ST elevation myocardial infarction (STEMI) in Chilean hospitals,2008,REVISTA MEDICA DE CHILE,SCIELO-Chile/SCOPUS/ISI/UCH/VID,http://dx.doi.org/10.4067/S0034-98872008001000001,10.4067/S0034-98872008001000001
221,"Miranda, HF; Prieto, JC; Puig, MM; Pinardi, G",Isobolographic analysis of multimodal analgesia in an animal model of visceral acute pain,2008,PHARMACOLOGY BIOCHEMISTRY AND BEHAVIOR,ISI/SCOPUS/UCH/VID,http://dx.doi.org/10.1016/j.pbb.2007.10.005,10.1016/j.pbb.2007.10.005
222,"Bartolucci, J;Nazzal, C;Corbalan, R;Campos, P;Cavada, G;Prieto, JC;Tapia, F;GEMI Grp",Predictors of long term survival in post-myocardial infarction patients according to complex arrhytmias,2007,EUROPEAN HEART JOURNAL,ISI/UCH/VID,,
223,"Prieto, JC ; Pinardi, G ; Zamorano, J ; Larrain, E ; Bermudez, C ; Castillo, R ; Cisternas, V ; Miranda, HF",Modification of phenylephrine induced contraction of human vessels rings by L-arginine and L-arginine methyl ester,2007,REVISTA MEDICA DE CHILE,ISI/SCIELO-Chile/SCOPUS/UCH/VID,http://dx.doi.org/10.4067/S0034-98872007001000001,10.4067/S0034-98872007001000001
224,"Miranda, HF ; Puig, MM ; Dursteler, C ; Prieto, JC ; Pinardi, G",Dexketoprofen-induced antinociception in animal models of acute pain: Synergy with morphine and paracetamol,2007,NEUROPHARMACOLOGY,SCOPUS/ISI/UCH/VID,http://dx.doi.org/10.1016/j.neuropharm.2006.07.025,10.1016/j.neuropharm.2006.07.025
225,"Nazzal, C ; Corbalan, R ; Campos, P ; Prieto, JC ; Cavada, G",Differences in survival after Myocardial Infarction according to gender: a 5 year follow-up,2006,EUROPEAN HEART JOURNAL,ISI/UCH/VID,,
226,"Miranda, HF; Puig, MM; Prieto, JC; Pinardi, G",Synergism between paracetamol and nonsteroidal anti-inflammatory drugs in experimental acute pain,2006,PAIN,ISI/SCOPUS/UCH/VID,http://dx.doi.org/10.1016/j.pain.2005.11.012,10.1016/j.pain.2005.11.012
227,"Prieto, JC; Quevedo, M; Miranda, HF; Pinardi, G",Hypotensive effect of dopamine: synergism induced by fenoldopam or levodopa,2005,ACTA CARDIOLOGICA,ISI/SCOPUS/UCH/VID,http://dx.doi.org/10.2143/AC.60.3.2005004,10.2143/AC.60.3.2005004
228,"Pinardi, G; Prieto, JC; Miranda, HF",Analgesic synergism between intrathecal morphine and cyclooxygenase-2 inhibitors in mice,2005,PHARMACOLOGY BIOCHEMISTRY AND BEHAVIOR,SCOPUS/ISI/UCH/VID,http://dx.doi.org/10.1016/j.pbb.2005.07.017,10.1016/j.pbb.2005.07.017
229,"Miranda, HF; Prieto, JC; Pinardi, G",Spinal synergy between nonselective cyclooxygenase inhibitors and morphine antinociception in mice,2005,BRAIN RESEARCH,SCOPUS/ISI/UCH/VID,http://dx.doi.org/10.1016/j.brainres.2005.04.068,10.1016/j.brainres.2005.04.068
230,"Prieto Domínguez, J.C.; Corbalán R.; Chávez, E.; Lanas, F.; Cumsille, F.; Nazzal, C.",Changes in drug prescription and reduction of hospital mortality in patients with acute myocardial infarction,2003,Investigacion Cardiovascular,SCOPUS/UCH/VID,,
231,"Corbalan, R;Nazzal, C;Prieto, JC;Chavez, E;Lanas, F;Lamich, R;Bartolucci, J;Montano, R;Cumsille, F",Reduction of acute myocardial infarction mortality in Chilean hospitals,2002,REVISTA MEDICA DE CHILE,SCIELO-Chile/SCOPUS/ISI/UCH/VID,http://dx.doi.org/10.4067/S0034-98872002000400003,10.4067/S0034-98872002000400003
232,"Blumel, JE; Prieto, JC; Leal, T; Cruz, MN; Gallardo, L",Cardiovascular risk factors in mid age women with acute coronary syndromes,2001,REVISTA MEDICA DE CHILE,SCIELO-Chile/SCOPUS/ISI/UCH/VID,http://dx.doi.org/10.4067/S0034-98872001000900004,10.4067/S0034-98872001000900004
233,"Prieto, JC;Corbalan, R;Nazza, C;Chavez, E;Lanas, F;Bartolucci, J;Cumsille, F;Grp Estudio Multicentrico Infarto",Changes in pharmacotherapy for acute myocardial infarction. Comparison of two periods,2001,REVISTA MEDICA DE CHILE,SCIELO-Chile/SCOPUS/ISI/UCH/VID,http://dx.doi.org/10.4067/S0034-98872001000500002,10.4067/S0034-98872001000500002
234,"Prieto, JC",Safety profile of statins,2001,REVISTA MEDICA DE CHILE,SCIELO-Chile/SCOPUS/ISI/UCH/VID,http://dx.doi.org/10.4067/S0034-98872001001100001,10.4067/S0034-98872001001100001
235,"Quevedo, M; Prieto, JC; Miranda, HF; Pinardi, G",Isobolographic analysis of the interaction between fenoldopam and levodopa on arterial blood pressure of the rat,2000,JOURNAL OF CARDIOVASCULAR PHARMACOLOGY,SCOPUS/ISI/UCH/VID,http://dx.doi.org/10.1097/00005344-200009000-00019,10.1097/00005344-200009000-00019
236,"Asenjo, René; Morris, Raimundo; Sanhueza, Eduardo; Ortíz, Mario; Cereceda, Mauricio",Diagnóstico diferencial de las taquicardias de complejo ancho: un desafío permanente,2020,REVISTA CHILENA DE CARDIOLOGIA,SCIELO-Chile/UCH/VID,http://dx.doi.org/10.4067/S0718-85602020000100055,10.4067/S0718-85602020000100055
237,"Massardo, Teresa; Pereira, Jaime; Sáez, Claudia G.; Aramburú, Ivonne; Morris, Raimundo; Aguayo, Rubén; Brugère, Solange; Pino, Angela; Hiplan, Enrique; Paillahueque, Gabriela; Alarcón, Luis; Spuler, Jane; Fernández, René; Swett, Eduardo; Sanhueza, Eduardo; Asenjo, René; Palominos, Macarena; Olivares, Nixa; Valenzuela, Guillermo; Torres, José; Garate, Javier; Karmelic, Christian",Efecto de la terapia de resincronización ventricular en los parámetros de disfunción endotelial y función sistólica izquierda en pacientes con insuficiencia cardíaca crónica y bloqueo completo de rama izquierda,2018,REVISTA CHILENA DE CARDIOLOGIA,SCIELO-Chile/UCH/VID,http://dx.doi.org/10.4067/S0718-85602018000300183 ,10.4067/S0718-85602018000300183 
