,Autores,titulo_publicacion,ano,titulo_revistas,tipo_publicacion,link,doi
0,"Asenjo, René; Morris, Raimundo; Sanhueza, Eduardo; Ortíz, Mario; Cereceda, Mauricio",Diagnóstico diferencial de las taquicardias de complejo ancho: un desafío permanente,2020,REVISTA CHILENA DE CARDIOLOGIA,SCIELO-Chile/UCH/VID,http://dx.doi.org/10.4067/S0718-85602020000100055,10.4067/S0718-85602020000100055
1,"Asenjo, René",Arritmia extrasistólica con QRS ancho: ¿Ventricular o conducción aberrante?,2018,REVISTA CHILENA DE CARDIOLOGIA,SCIELO-Chile/UCH/VID,http://dx.doi.org/10.4067/S0718-85602018000300214 ,10.4067/S0718-85602018000300214 
2,"Massardo, Teresa; Pereira, Jaime; Sáez, Claudia G.; Aramburú, Ivonne; Morris, Raimundo; Aguayo, Rubén; Brugère, Solange; Pino, Angela; Hiplan, Enrique; Paillahueque, Gabriela; Alarcón, Luis; Spuler, Jane; Fernández, René; Swett, Eduardo; Sanhueza, Eduardo; Asenjo, René; Palominos, Macarena; Olivares, Nixa; Valenzuela, Guillermo; Torres, José; Garate, Javier; Karmelic, Christian",Efecto de la terapia de resincronización ventricular en los parámetros de disfunción endotelial y función sistólica izquierda en pacientes con insuficiencia cardíaca crónica y bloqueo completo de rama izquierda,2018,REVISTA CHILENA DE CARDIOLOGIA,SCIELO-Chile/UCH/VID,http://dx.doi.org/10.4067/S0718-85602018000300183 ,10.4067/S0718-85602018000300183 
3,"Massardo, T; Pereira, J; Saez, CG; Aramburu, I; Morris, R; Brugere, S; Pino, A; Swett, E; Hiplan, E; Aguayo, R; Aguayo, R; Paillahueque, G; Alarcon, L; Torres, J; Spuler, J; Fernandez, R; Sanhueza, E; Palominos, M; Olivares, N; Valenzuela, G; Asenjo, R",Effect of resyncronization therapy on endothelial dysfunction and functional parameters in patients with chronic heart failure and left bundle branch block,2017,EUROPEAN JOURNAL OF NUCLEAR MEDICINE AND MOLECULAR IMAGING,ISI/UCH/VID,,
4,"Asenjo, René",Taquicardia de complejo ancho en paciente con fibrilación auricular permanente,2017,REVISTA CHILENA DE CARDIOLOGIA,SCIELO-Chile/UCH/VID,,
5,Barría Alberto; Vial María Jesús; Tong Ana; Prat Hernán; Asenjo René,Validación del test de troponinas en plasma a partir de una población sana. una experiencia local,2013,REVISTA CHILENA DE CARDIOLOGIA,SCIELO-Chile/UCH/VID,http://dx.doi.org/10.4067/S0718-85602013000100007,10.4067/S0718-85602013000100007
6,"Rodrigo, R;Korantzopoulos, P;Cereceda, M;Asenjo, R;Zamorano, J;Villalabeitia, E;Baeza, C;Aguayo, R;Castillo, R;Carrasco, R;Gormaz, JG",A Randomized Controlled Trial to Prevent Post-Operative Atrial Fibrillation by Antioxidant Reinforcement,2013,JOURNAL OF THE AMERICAN COLLEGE OF CARDIOLOGY,ISI/SCOPUS/UCH/VID,http://dx.doi.org/10.1016/j.jacc.2013.07.014,10.1016/j.jacc.2013.07.014
7,"Meyer, L; Concepcion, R; Zamorano, N; Armstrong, M; Castro, L; Mujica, M; Asenjo, R",Tachycardiomyopathy as a reversible cause of heart failure. Report of one case,2012,REVISTA MEDICA DE CHILE,ISI/SCOPUS/SCIELO-Chile/UCH/VID,http://dx.doi.org/10.4067/S0034-98872012000200013,10.4067/S0034-98872012000200013
8,"Ortiz, Mario; Ortiz, Elena; Morris, Raimundo; Asenjo, René; Cereceda, Mauricio",Hospitalizaciones asociadas al diagnóstico de fibrilación auricular en Chile: Tendencia creciente en la última década,2011,REVISTA CHILENA DE CARDIOLOGIA,SCIELO-Chile/UCH/VID,http://dx.doi.org/10.4067/S0718-85602011000300001,10.4067/S0718-85602011000300001
9,"Castillo, R ; Rodrigo, R ; Perez, F ; Cereceda, M ; Asenjo, R ; Zamorano, J ; Navarrete, R ; Villalabeitia, E ; Sanz, J ; Baeza, C ; Aguayo, R",Antioxidant Therapy Reduces Oxidative and Inflammatory Tissue Damage in Patients Subjected to Cardiac Surgery with Extracorporeal Circulation,2011,BASIC & CLINICAL PHARMACOLOGY & TOXICOLOGY,ISI/SCOPUS/UCH/VID,http://dx.doi.org/10.1111/j.1742-7843.2010.00651.x,10.1111/j.1742-7843.2010.00651.x
10,"Rodrigo, R; Vinay, J; Castillo, R; Cereceda, M; Asenjo, R; Zamorano, J; Araya, J; Castillo-Koch, R; Espinoza, J; Larrain, E",Use of vitamins C and E as a prophylactic therapy to prevent postoperative atrial fibrillation,2010,INTERNATIONAL JOURNAL OF CARDIOLOGY,ISI/SCOPUS/UCH/VID,http://dx.doi.org/10.1016/j.ijcard.2009.04.043,10.1016/j.ijcard.2009.04.043
11,"Ortiz, M; Gonzalez, M; Alvarez, E; Saavedra, I; Gaete, L; Asenjo, R; Morris, R; Cereceda, M",High Single Oral Dose of Amiodarone Versus Placebo: Effects on the Rate of Postoperative Arrhythmias Following Coronary Surgery and Correlation with Blood Drug Concentrations,2010,CIRCULATION,ISI/UCH/VID,,
12,"Gonzalez, RA ; Morris, R ; Cereceda, M ; Montagna, R ; Ortiz, M ; Avalos, V ; Morales, P ; Sore, L ; Mondaca, C",Transvenous Device Infection: Clinical Experience Using a Local Gentamicin Solution,2010,CIRCULATION,ISI/UCH/VID,,
13,"Ortiz, M; Asenjo, R; Morris, R; Cereceda, M",Secular Trends of Atrial Fibrillation As A Contributing Cause of Death in Chile,2010,CIRCULATION,ISI/UCH/VID,,
14,"Guarda S, Eduardo; Prieto D, Juan Carlos; Sanhueza C, Patricio; Dauvergne M, Christian; Asenjo G, Rene; Corbalán H, Ramón",Guías 2009 de la Sociedad Chilena de Cardiología para el tratamiento del Infarto Agudo del Miocardio con supradesnivel del ST,2009,REVISTA CHILENA DE CARDIOLOGIA,SCIELO-Chile/UCH/VID,http://dx.doi.org/10.4067/S0718-85602009000200014,10.4067/S0718-85602009000200014
15,"Castillo, Rodrigo; Rodrigo, Ramón; Pizarro, Rodrigo; Escobar, Matías; Cereceda, Mauricio; Asenjo, René; Larraín, Ernesto; Castillo-Koch, Rodrigo; Espinoza, Juan; Sánchez, Gina; Donoso, Paulina; Araya, Julia",Nueva estrategia de preacondicionamiento no hipóxico que atenúa el efecto de la Isquemia-Reperfusión en pacientes sometidos a cirugía cardíaca con circulación extracorpórea,2009,REVISTA CHILENA DE CARDIOLOGIA,SCIELO-Chile/UCH/VID,,
16,"Asenjo G, René",Intervalo qt prolongado: un factor de riesgo de muerte súbita frecuentemente olvidado,2009,REVISTA CHILENA DE CARDIOLOGIA,SCIELO-Chile/UCH/VID,http://dx.doi.org/10.4067/S0718-85602009000300011,10.4067/S0718-85602009000300011
17," Beca, JP; Rosselot, E; Asenjo, R; Anguita, V; Quevedo, R",Deactivating Cardiac Pacemakers and Implantable Cardioverter Defibrillators in Terminally Ill Patients,2009,CAMBRIDGE QUARTERLY OF HEALTHCARE ETHICS,ISI/SCOPUS/UCH/VID,http://dx.doi.org/10.1017/S0963180109090380,10.1017/S0963180109090380
18,"Cereceda, M; Rodrigo, R; Castillo, R; Pizarro, R; Asenjo, R; Zamorano, J; Araya, J; Castillo-Koch, R; Espinoza, J; Laggazzi, L",Prevention of Postoperative Atrial Fibrillation With the Supplementation of Omega 3 PUFA Plus Antioxidant Vitamins in Patients Undergoing Cardiac Surgery With Extracorporeal Circulation,2009,CIRCULATION,ISI/UCH/VID,,
19,"Rodrigo, R ; Cereceda, M ; Castillo, R ; Asenjo, R ; Zamorano, J ; Araya, J ; Castillo-Koch, R ; Espinoza, J ; Larrain, E",Prevention of atrial fibrillation following cardiac surgery: Basis for a novel therapeutic strategy based on non-hypoxic myocardial preconditioning,2008,PHARMACOLOGY & THERAPEUTICS,ISI/SCOPUS/UCH/VID,http://dx.doi.org/10.1016/j.pharmthera.2008.01.005,10.1016/j.pharmthera.2008.01.005
20,"Montagna, R ; Asenjo, R ; Morris, R ; Ortiz, M ; Cereceda, M",Update on the prevention of thromboembolic phenomena in atrial fibrillation,2007,REVISTA MEDICA DE CHILE,ISI/SCIELO-Chile/SCOPUS/UCH/VID,http://dx.doi.org/10.4067/S0034-98872007000800014,10.4067/S0034-98872007000800014
21,"Rodrigo, R ; Castillo, R ; Cereceda, M ; Asenjo, R ; Zamorano, J ; Araya, J",Non-hypoxic preconditioning of myocardium against postoperative atrial fibrillation: Mechanism based on enhancement of the antioxidant defense system,2007,MEDICAL HYPOTHESES,ISI/SCOPUS/UCH/VID,http://dx.doi.org/10.1016/j.mehy.2007.03.035,10.1016/j.mehy.2007.03.035
22,"Asenjo, R; Zapata, M; Aramburu, I; Morris, R; Cereceda, M; Brugere, S; Aguayo, R; Rios, J; Toro, C; Hassi, M; Gonzalez, P; Cannessa, J; Oyarzun, R; Ortiz, M; Avalos, V; Morales, P; Nicola, M; Oyonarte, M; Abufhele, A",Results of intraventricular resynchronization in patients with severe cardiac failure,2003,REVISTA MEDICA DE CHILE,SCIELO-Chile/SCOPUS/ISI/UCH/VID,http://dx.doi.org/10.4067/S0034-98872003001000001,10.4067/S0034-98872003001000001
23,"Asenjo, R; Morris, R; Oyarzun, R; Dussaillant, G; Ortiz, M; Nicola, M; Tapia, E; Valencia, M; Sandoval, M; Morales, P; Avalos, V; Pezoa, B; Von Krestschmann, L; Abufhele, A; Oyonarte, M",Results of radiofrequency ablation in focal atrial fibrillation,2002,REVISTA MEDICA DE CHILE,SCIELO-Chile/SCOPUS/ISI/UCH/VID,http://dx.doi.org/10.4067/S0034-98872002000500002,10.4067/S0034-98872002000500002
24,"Ayala, Francisco José; Espinoza, Juan; Lagazzi, Luigi; González, Mauricio; Anich, Fernanda; Soto, Gabriela; Robles, José; Araneda, Francisco; Quintas, Felipe; Poblete, Marcelo",Hipertensión Pulmonar Crónica Tromboembólica Tromboendarterectomía Pulmonar,2020,REVISTA CHILENA DE CARDIOLOGIA,SCIELO-Chile/UCH/VID,http://dx.doi.org/10.4067/S0718-85602020000100043,10.4067/S0718-85602020000100043
25,"Ayala, Francisco José; Espinoza, Juan; Ramos, Cristóbal; Rocco, Cristián; Araneda, Guillermo; Araya, Javiera; Stöwhas, Alex","Pericarditis Constrictiva, variedad fibroelástica. Nuevas técnicas diagnósticas por imágenes",2019,REVISTA CHILENA DE CARDIOLOGIA,SCIELO-Chile/UCH/VID,http://dx.doi.org/10.4067/S0718-85602019000300198,10.4067/S0718-85602019000300198
26,"Ugalde, H; Yubini, MC; Sanhueza, MI; Ayala, F; Chaigneau, E; Dussaillant, G; Garcia, S; Farias, E; Villagra, K; Inostroza, P",Tako-tsubo syndrome. analysis of 37 cases,2017,REVISTA MEDICA DE CHILE,SCOPUS/SCIELO-Chile/ISI/UCH/VID,http://dx.doi.org/10.4067/S0034-98872017001001268,10.4067/S0034-98872017001001268
27,"Rodriguez-Granillo, GA;Rodriguez, AE;Bruining, N;Milei, J;Aoki, J;Tsuchida, K;del Valle-Fernandez, R;Arampatzis, CA;Ong, ATL;Lemos, PA;Ayala, F;Garcia-Garcia, HM;Saia, F;Valgimigli, M;Regar, E;McFadden, E;Biondi-Zoccai, G;Barbenza, E;Schoenhagen, P;Serruys, PW",Quantification of scientific output in cardiovascular medicine: a perspective based on global data,2013,EUROINTERVENTION,ISI/SCOPUS/UCH/VID,http://dx.doi.org/10.4244/EIJV9I8A163,10.4244/EIJV9I8A163
28,"Prieto, JC; Rossel, V; Larrea, R; Barria, A; Venegas, JC; Verdugo, F; Potthoff, M; Gidi, C; Villablanca, A; Criollo, I; Noriega, V; Cumsille, F; Llancaqueo, M; Lanas, F",Cardiovascular complications in COVID-19 patients admitted to intensive care units in Chilean hospitals,2022,REVISTA MEDICA DE CHILE,ISI/SCOPUS/SCIELO-Chile/UCH/VID,http://dx.doi.org/10.4067/S0034-98872022000600711 ,10.4067/S0034-98872022000600711 
29,"Barría, Alberto; Dussaillant, Gastón; Espinosa, Juan; González, Mauricio; Inostroza, Paula; Castillo, Rodrigo",Estenosis aórtica y lesión severa de tronco coronario: tratamiento percutáneo exitoso,2019,REVISTA CHILENA DE CARDIOLOGIA,SCIELO-Chile/UCH/VID,http://dx.doi.org/10.4067/S0718-85602019000100064,10.4067/S0718-85602019000100064
30,Barría Alberto; Vial María Jesús; Tong Ana; Prat Hernán; Asenjo René,Validación del test de troponinas en plasma a partir de una población sana. una experiencia local,2013,REVISTA CHILENA DE CARDIOLOGIA,SCIELO-Chile/UCH/VID,http://dx.doi.org/10.4067/S0718-85602013000100007,10.4067/S0718-85602013000100007
31,Martínez Tagle M Angélica; Barría Perez Alberto; Meneses Castillo Ruth; Oyarzún Gomberoff Pamela; Sandoval Zamorano Jorge,Vulvovaginitis en la adolescencia: estudio etiológico,2003,REVISTA CHILENA DE OBSTETRICIA Y GINECOLOGIA,SCIELO-Chile/UCH/VID,http://dx.doi.org/10.4067/S0717-75262003000600008,10.4067/S0717-75262003000600008
32,"Gacitua, I; Frias, A; Sanhueza, ME; Bustamante, S; Cornejo, R; Salas, A; Guajardo, X; Torres, K; Canales, EF; Tobar, E; Navarro, R; Romero, C",Extracorporeal CO2 removal and renal replacement therapy in acute severe respiratory failure in COVID-19 pneumonia: Case report,2021,SEMINARS IN DIALYSIS,ISI/SCOPUS/UCH/VID,http://dx.doi.org/10.1111/sdi.12980,10.1111/sdi.12980
33,"Cañete, Iván; Carrillo, Felipe; Uribe, Gabriel; García, Juan; Llancaqueo, Marcelo",Insuficiencia cardíaca como presentación de sarcoma cardíaco. Caso clínico y revisión de la literatura,2021,REVISTA CHILENA DE CARDIOLOGIA,SCIELO-Chile/UCH/VID,http://dx.doi.org/10.4067/S0718-85602021000200134,10.4067/S0718-85602021000200134
34,"Asenjo, René; Morris, Raimundo; Sanhueza, Eduardo; Ortíz, Mario; Cereceda, Mauricio",Diagnóstico diferencial de las taquicardias de complejo ancho: un desafío permanente,2020,REVISTA CHILENA DE CARDIOLOGIA,SCIELO-Chile/UCH/VID,http://dx.doi.org/10.4067/S0718-85602020000100055,10.4067/S0718-85602020000100055
35,"Fosbol, EL; Park, LP; Chu, VH; Athan, E; Delahaye, F; Freiberger, T; Lamas, C; Miro, JM; Strahilevitz, J; Tribouilloy, C; Durante-Mangoni, E; Pericas, JM; Fernandez-Hidalgo, N; Nacinovich, F; Rizk, H; Barsic, B; Giannitsioti, E; Hurley, JP; Hannan, MM; Wang, A; Clara, L; Sanchez, M; Casabe, JP; Nacinovich, F; Oses, PF; Ronderos, R; Sucari, A; Thierer, J; Altclas, J; Kogan, S; Spelman, D; Athan, E; Harris, O; Kennedy, K; Tan, R; Gordon, D; Papanicolas, L; Korman, T; Kotsanas, D; Dever, R; Jones, P; Konecny, P; Lawrence, R; Rees, D; Ryan, S; Feneley, MP; Harkness, J; Jones, P; Ryan, S; Jones, P; Ryan, S; Jones, P; Post, J; Reinbott, P; Ryan, S; Gattringer, R; Wiesbauer, F; Andrade, AR; de Brito, ACP; Guimaraes, AC; Grinberg, M; Mansur, AJ; Siciliano, RF; Strabelli, TMV; Vieira, MLC; Tranchesi, RAD; Paiva, MG; Fortes, CQ; Ramos, AD; Weksler, C; Ferraiuoli, G; Golebiovski, W; Lamas, C; Karlowsky, CJA; Keynan, Y; Morris, AM; Rubinstein, E; Jones, SB; Garcia, P; Cereceda, M; Fica, A; Mella, RM; Fernandez, R; Franco, L; Gonzalez, J; Jaramillo, AN; Barsic, B; Bukovski, S; Krajinovic, V; Pangercic, A; Rudez, I; Vincelj, J; Freiberger, T; Pol, J; Zaloudikova, B; Ashour, Z; El Kholy, A; Mishaal, M; Osama, D; Rizk, H; Aissa, N; Alauzet, C; Alla, F; Campagnac, C; Doco-Lecompte, T; Selton-Suty, C; Casalta, JP; Fournier, PE; Habib, G; Raoult, D; Thuny, F; Delahaye, F; Delahaye, A; Vandenesch, F; Donal, E; Donnio, PY; Flecher, E; Michelet, C; Revest, M; Tattevin, P; Chevalier, F; Jeu, A; Remadi, JP; Rusinaru, D; Tribouilloy, C; Bernard, Y; Chirouze, C; Hoen, B; Leroy, J; Plesiat, P; Naber, C; Neuerburg, C; Mazaheri, B; Naber, C; Athanasia, S; Deliolanis, I; Giamarellou, H; Thomas, T; Giannitsioti, E; Mylona, E; Paniara, O; Papanicolaou, K; Pyros, J; Skoutelis, A; Mylona, E; Paniara, O; Papanikolaou, K; Pyros, J; Skoutelis, A; Sharma, G; Francis, J; Nair, L; Thomas, V; Venugopal, K; Hannan, MM; Hurley, JP; Cahan, A; Gilon, D; Israel, S; Korem, M; Strahilevitz, J; Rubinstein, E; Strahilevitz, J; Durante-Mangoni, E; Mattucci, I; Pinto, D; Agrusta, F; Senese, A; Ragone, E; Utili, R; Cecchi, E; De Rosa, F; Forno, D; Imazio, M; Trinchero, R; Grossi, P; Lattanzio, M; Toniolo, A; Goglio, A; Raglio, A; Ravasio, V; Rizzi, M; Suter, F; Carosi, G; Magri, S; Signorini, L; Kanafani, Z; Kanj, SS; Sharif-Yakan, A; Abidin, I; Tamin, SS; Martinez, ER; Nieto, GIS; van der Meer, JTM; Chambers, S; Holland, D; Morris, A; Raymond, N; Read, K; Murdoch, DR; Dragulescu, S; Ionac, A; Mornos, C; Butkevich, OM; Chipigina, N; Kirill, O; Vadim, K; Vinogradova, T; Edathodu, J; Halim, M; Liew, YY; Tan, RS; Lejko-Zupanc, T; Logar, M; Mueller-Premru, M; Commerford, P; Commerford, A; Deetlefs, E; Hansa, C; Ntsekhe, M; Almela, M; Armero, Y; Azqueta, M; Castaneda, X; Cervera, C; Falces, C; de-la-Maria, CG; Fita, G; Gatell, JM; Heras, M; Llopis, J; Marco, F; Mestres, CA; Miro, JM; Moreno, A; Ninot, S; Pare, C; Pericas, JM; Ramirez, J; Rovira, I; Sitges, M; Anguera, I; Font, B; Guma, JR; Bermejo, J; Bouza, E; Fernandez, MAG; Gonzalez-Ramallo, V; Marin, M; Munoz, P; Pedromingo, M; Roda, J; Rodriguez-Creixems, M; Solis, J; Almirante, B; Fernandez-Hidalgo, N; Tornos, P; de Alarcon, A; Parra, R; Alestig, E; Johansson, M; Olaison, L; Snygg-Martin, U; Pachirat, O; Pachirat, P; Pussadhamma, B; Senthong, V; Casey, A; Elliott, T; Lambert, P; Watkin, R; Eyton, C; Klein, JL; Bradley, S; Kauffman, C; Bedimo, R; Chu, VH; Corey, GR; Crowley, AL; Douglas, P; Drew, L; Fowler, VG; Holland, T; Lalani, T; Mudrick, D; Samad, Z; Sexton, D; Stryjewski, M; Wang, A; Woods, CW; Lerakis, S; Cantey, R; Steed, L; Wray, D; Dickerman, SA; Bonilla, H; DiPersio, J; Salstrom, SJ; Baddley, J; Patel, M; Peterson, G; Stancoven, A; Levine, D; Riddle, J; Rybak, M",The association between vegetation size and surgical treatment on 6-month mortality in left-sided infective endocarditis,2019,EUROPEAN HEART JOURNAL,ISI/UCH/VID,http://dx.doi.org/10.1093/eurheartj/ehz204,10.1093/eurheartj/ehz204
36,"Park, LP; Chu, VH; Peterson, G; Skoutelis, A; Lejko-Zupa, T; Bouza, E; Tattevin, P; Habib, G; Tan, R; Gonzalez, J; Altclas, J; Edathodu, J; Fortes, CQ; Siciliano, RF; Pachirat, O; Kanj, S; Wang, A",Validated Risk Score for Predicting 6-Month Mortality in Infective Endocarditis,2016,JOURNAL OF THE AMERICAN HEART ASSOCIATION,ISI/SCOPUS/UCH/VID,http://dx.doi.org/10.1161/JAHA.115.003016,10.1161/JAHA.115.003016
37,"Chirouze, C; Alla, F; Fowler, VG; Sexton, DJ; Corey, GR; Chu, VH; Wang, A; Erpelding, ML; Durante-Mangoni, E; Fernandez-Hidalgo, N; Giannitsioti, E; Hannan, MM; Lejko-Zupanc, T; Miro, JM; Munoz, P; Murdoch, DR; Tattevin, P; Tribouilloy, C; Hoen, B; Clara, L; Sanchez, M; Nacinovich, F; Oses, PF; Ronderos, R; Sucari, A; Thierer, J; Casabe, J; Cortes, C; Altclas, J; Kogan, S; Spelman, D; Athan, E; Harris, O; Kennedy, K; Tan, R; Gordon, D; Papanicolas, L; Eisen, D; Grigg, L; Street, A; Korman, T; Kotsanas, D; Dever, R; Jones, P; Konecny, P; Lawrence, R; Rees, D; Ryan, S; Feneley, MP; Harkness, J; Post, J; Reinbott, P; Gattringer, R; Wiesbauer, F; Andrade, AR; de Brito, ACP; Guimaraes, AC; Grinberg, M; Mansur, AJ; Siciliano, RF; Strabelli, TM; Vieira, MLC; Tranchesi, RAD; Paiva, MG; Fortes, CQ; Ramos, AD; Ferraiuoli, G; Golebiovski, W; Lamas, C; Santos, M; Weksler, C; Karlowsky, JA; Keynan, Y; Morris, AM; Rubinstein, E; Jones, SB; Garcia, P; Cereceda, M; Fica, A; Mella, RM; Barsic, B; Bukovski, S; Krajinovic, V; Pangercic, A; Rudez, I; Vincelj, J; Freiberger, T; Pol, J; Zaloudikova, B; Ashour, Z; El Kholy, A; Mishaal, M; Rizk, H; Aissa, N; Alauzet, C; Campagnac, C; Doco-Lecompte, T; Selton-Suty, C; Casalta, JP; Fournier, PE; Habib, G; Raoult, D; Thuny, F; Delahaye, F; Delahaye, A; Vandenesch, F; Donal, E; Donnio, PY; Michelet, C; Revest, M; Tattevin, P; Violette, J; Chevalier, F; Jeu, A; Rusinaru, D; Sorel, C; Bernard, Y; Hoen, B; Leroy, J; Plesiat, P; Naber, C; Neuerburg, C; Mazaheri, B; Naber, C; Athanasia, S; Deliolanis, I; Giamarellou, H; Tsaganos, T; Mylona, E; Paniara, O; Papanicolaou, K; Pyros, J; Skoutelis, A; Sharma, G; Francis, J; Nair, L; Thomas, V; Venugopal, K; Hannan, MM; Hurley, J; Gilon, D; Israel, S; Korem, M; Strahilevitz, J; Rubinstein, E; Strahilevitz, J; Casillo, R; Cuccurullo, S; Dialetto, G; Irene, M; Ragone, E; Tripodi, MF; Utili, R; Cecchi, E; De Rosa, F; Forno, D; Imazio, M; Trinchero, R; Tebini, A; Grossi, P; Lattanzio, M; Toniolo, A; Goglio, A; Raglio, A; Ravasio, V; Rizzi, M; Suter, F; Carosi, G; Magri, S; Signorini, L; Baban, T; Kanafani, Z; Kanj, SS; Yasmine, M; Abidin, I; Tamin, SS; Martinez, ER; Nieto, GIS; van der Meer, JTM; Chambers, S; Holland, D; Morris, A; Raymond, N; Read, K; Murdoch, DR; Dragulescu, S; Ionac, A; Mornos, C; Butkevich, OM; Chipigina, N; Kirill, O; Vadim, K; Vinogradova, T; Edathodu, J; Halim, M; Lum, LN; Tan, RS; Lejko-Zupanc, T; Logar, M; Mueller-Premru, M; Commerford, P; Commerford, A; Deetlefs, E; Hansa, C; Ntsekhe, M; Almela, M; Armero, Y; Azqueta, M; Castaneda, X; Cervera, C; del Rio, A; Falces, C; Garcia-de-la-Maria, C; Fita, G; Gatell, JM; Marco, F; Mestres, CA; Miro, JM; Moreno, A; Ninot, S; Pare, C; Pericas, J; Ramirez, J; Rovira, I; Sitges, M; Anguera, I; Font, B; Guma, JR; Bermejo, J; Bouza, E; Fernandez, MAG; Gonzalez-Ramallo, V; Marin, M; Munoz, P; Pedromingo, M; Roda, J; Rodriguez-Creixems, M; Solis, J; Almirante, B; Tornos, P; de Alarcon, A; Parra, R; Alestig, E; Johansson, M; Olaison, L; Snygg-Martin, U; Pachirat, O; Pachirat, P; Pussadhamma, B; Senthong, V; Casey, A; Elliott, T; Lambert, P; Watkin, R; Eyton, C; Klein, JL; Bradley, S; Kauffman, C; Bedimo, R; Crowley, AL; Douglas, P; Drew, L; Holland, T; Lalani, T; Mudrick, D; Samad, Z; Stryjewski, M; Woods, CW; Lerakis, S; Cantey, R; Steed, L; Wray, D; Dickerman, SA; Bonilla, H; DiPersio, J; Salstrom, SJ; Baddley, J; Patel, M; Peterson, G; Stancoven, A; Afonso, L; Kulman, T; Levine, D; Rybak, M; Cabell, CH; Baloch, K; Dixon, CC; Harding, T; Jones-Richmond, M; Pappas, P; Park, LP; Redick, T; Stafford, J; Anstrom, K; Bayer, AS; Karchmer, AW; Durack, DT; Eykyn, S; Moreillon, P",Impact of early valve surgery on outcome of staphylococcus aureus prosthetic valve infective endocarditis: Analysis in the international collaboration of endocarditis-prospective cohort study,2015,CLINICAL INFECTIOUS DISEASES,ISI/SCOPUS/UCH/VID,http://dx.doi.org/10.1093/cid/ciu871,10.1093/cid/ciu871
38,"Arnold, CJ; Johnson, M; Bayer, AS; Bradley, S; Giannitsioti, E; Miroo, JM; Tornos, P; Tattevin, P; Strahilevitz, J; Spelman, D; Athan, E; Nacinovich, F; Fortes, CQ; Lamas, C; Barsic, B; Fernandez-Hidalgo, N; Munoz, P; Chu, VH",Candida infective endocarditis: An observational cohort study with a focus on therapy,2015,ANTIMICROBIAL AGENTS AND CHEMOTHERAPY,ISI/SCOPUS/UCH/VID,http://dx.doi.org/10.1128/AAC.04867-14,10.1128/AAC.04867-14
39,"Barsic, B; Dickerman, S; Krajinovic, V; Pappas, P; Altclas, J; Carosi, G; Casabe, JH; Chu, VH; Delahaye, F; Edathodu, J; Fortes, CQ; Olaison, L; Pangercic, A; Patel, M; Rudez, I; Tamin, SS; Vincelj, J; Bayer, AS; Wang, A; Clara, L; Sanchez, M; Nacinovich, F; Oses, PF; Ronderos, R; Sucari, A; Thierer, J; Casabe, J; Cortes, C; Altclas, J; Kogan, S; Spelman, D; Athan, E; Harris, O; Kennedy, K; Tan, R; Gordon, D; Papanicolas, L; Eisen, D; Grigg, L; Street, A; Korman, T; Kotsanas, D; Dever, R; Jones, P; Konecny, P; Lawrence, R; Rees, D; Ryan, S; Feneley, MP; Harkness, J; Jones, P; Ryan, S; Jones, P; Ryan, S; Jones, P; Post, J; Reinbott, P; Ryan, S; Gattringer, R; Wiesbauer, F; Andrade, AR; de Brito, ACP; Guimaraes, AC; Grinberg, M; Mansur, AJ; Siciliano, RF; Strabelli, TMV; Vieira, MLC; Tranchesi, RAD; Paiva, MG; Fortes, CQ; Ramos, AD; Ferraiuoli, G; Golebiovski, W; Lamas, C; Santos, M; Weksler, C; Karlowsky, JA; Keynan, Y; Morris, AM; Rubinstein, E; Jones, SB; Garcia, P; Cereceda, M; Fica, A; Mella, RM; Bukovski, S; Pangercic, A; Rudez, I; Vincelj, J; Freiberger, T; Pol, J; Zaloudikova, B; Ashour, Z; El Kholy, A; Mishaal, M; Rizk, H; Aissa, N; Alauzet, C; Alla, F; Campagnac, C; Doco-Lecompte, T; Selton-Suty, C; Casalta, JP; Fournier, PE; Habib, G; Raoult, D; Thuny, F; Delahaye, F; Delahaye, A; Vandenesch, F; Donal, E; Donnio, PY; Michelet, C; Revest, M; Tattevin, P; Violette, J; Chevalier, F; Jeu, A; Rusinaru, D; Sorel, C; Tribouilloy, C; Bernard, Y; Chirouze, C; Hoen, B; Leroy, J; Plesiat, P; Naber, C; Mazaheri, B; Naber, C; Carl, N; Athanasia, S; Giannitsioti, E; Mylona, E; Paniara, O; Papanicolaou, K; Pyros, J; Skoutelis, A; Sharma, G; Francis, J; Nair, L; Thomas, V; Venugopal, K; Hannan, M; Hurley, J; Cahan, A; Gilon, D; Israel, S; Korem, M; Strahilevitz, J; Rubinstein, E; Tripodi, MF; Casillo, R; Cuccurullo, S; Dialetto, G; Durante-Mangoni, E; Irene, M; Ragone, E; Utili, R; Cecchi, E; De Rosa, F; Forno, D; Imazio, M; Trinchero, R; Tebini, A; Grossi, P; Lattanzio, M; Toniolo, A; Goglio, A; Raglio, A; Ravasio, V; Rizzi, M; Suter, F; Carosi, G; Magri, S; Signorini, L; Baban, T; Kanafani, Z; Kanj, SS; Sfeir, J; Yasmine, M; Abidin, I; Tamin, SS; Martinez, ER; Nieto, GIS; van der Meer, JTM; Chambers, S; Murdoch, DR; Holland, D; Morris, A; Raymond, N; Read, K; Dragulescu, S; Ionac, A; Mornos, C; Butkevich, OM; Chipigina, N; Kirill, O; Vadim, K; Vinogradova, T; Edathodu, J; Halim, M; Lum, LN; Tan, RS; Lejko-Zupanc, T; Logar, M; Mueller-Premru, M; Commerford, P; Commerford, A; Deetlefs, E; Hansa, C; Ntsekhe, M; Almela, M; Armero, Y; Azqueta, M; Castaneda, X; Cervera, C; del Rio, A; Falces, C; Garcia-De-LaMaria, C; Fita, G; Gatell, JM; Marco, F; Mestres, CA; Miro, JM; Moreno, A; Ninot, S; Pare, C; Pericas, J; Ramirez, J; Rovira, I; Sitges, M; Anguera, I; Font, B; Guma, JR; Bermejo, J; Bouza, E; Fernandez, MAG; Gonzalez-Ramallo, V; Marin, M; Munoz, P; Pedromingo, M; Roda, J; Rodriguez-Creixems, M; Solis, J; Almirante, B; Fernandez-Hidalgo, N; Tornos, P; de Alarcon, A; Parra, R; Alestig, E; Johansson, M; Olaison, L; Snygg-Martin, U; Pachirat, O; Pachirat, P; Pussadhamma, B; Senthong, V; Casey, A; Elliott, T; Lambert, P; Watkin, R; Eyton, C; Klein, JL; Bradley, S; Kauffman, C; Bedimo, R; Chu, VH; Corey, GR; Crowley, AL; Douglas, P; Drew, L; Fowler, VG; Holland, T; Lalani, T; Mudrick, D; Samad, Z; Sexton, D; Stryjewski, M; Wang, A; Woods, CW; Lerakis, S; Cantey, R; Steed, L; Wray, D; Dickerman, SA; Bonilla, H; DiPersio, J; Salstrom, SJ; Baddley, J; Patel, M; Peterson, G; Stancoven, A; Afonso, L; Kulman, T; Levine, D; Rybak, M; Cabell, CH; Baloch, K; Dixon, CC; Fowler, VG; Harding, T; Jones-Richmond, M; Pappas, P; Park, LP; Redick, T; Stafford, J; Anstrom, K; Athan, E; Bayer, AS; Hoen, B; Karchmer, AW; Murdoch, DR; Sexton, DJ; Chu, V; Durack, DT; Eykyn, S; Moreillon, P; Olaison, L; Raoult, D; Rubinstein, E",Influence of the timing of cardiac surgery on the outcome of patients with infective endocarditis and stroke,2013,CLINICAL INFECTIOUS DISEASES,ISI/SCOPUS/UCH/VID,http://dx.doi.org/10.1093/cid/cis878,10.1093/cid/cis878
