,Autores,titulo_publicacion,ano,titulo_revistas,tipo_publicacion,link,doi
0,"Moggia, C; Bravo, MA; Baettig, R; Valdes, M; Romero-Bravo, S; Zuniga, M; Cornejo, J; Gosetti, F; Ballabio, D; Cabeza, RA; Beaudry, R; Lobos, GA",Improving bitter pit prediction by the use of X-ray fluorescence (XRF): A new approach by multivariate classification,2022,FRONTIERS IN PLANT SCIENCE,ISI/SCOPUS/UCH/VID,http://dx.doi.org/10.3389/fpls.2022.1033308,10.3389/fpls.2022.1033308
1,"Maldonado, C; Mora-Poblete, F; Echeverria, C; Baettig, R; Torres-Diaz, C; Contreras-Soto, RI; Heidari, P; Lobos, GA; do Amaral, AT",A Neural Network-Based Spectral Approach for the Assignment of Individual Trees to Genetically Differentiated Subpopulations,2022,REMOTE SENSING,ISI/SCOPUS/UCH/VID,http://dx.doi.org/10.3390/rs14122898,10.3390/rs14122898
2,"Gardner, DJ; Bozo, A","Ten-year field study of wood plastic composites in Santiago, Chile: Biological, mechanical and physical property performance",2018,MADERAS-CIENCIA Y TECNOLOGIA,ISI/SCOPUS/SCIELO-Chile/UCH/VID,http://dx.doi.org/10.4067/S0718-221X2018005002901,10.4067/S0718-221X2018005002901
3,"Karsulovic, JT;Bozo, A;Araya, J;Vargas, Y;Gaete, V;Tejer, B",Application of sonic and ultrasonic waves as means of control of underground termites Reticulitermes flavipes (Kollar) in radiata pine wood,2008,MADERAS-CIENCIA Y TECNOLOGIA,SCOPUS/SCIELO-Chile/ISI/UCH/VID,http://dx.doi.org/10.4067/S0718-221X2008000200003,10.4067/S0718-221X2008000200003
4,"Karsulovic, JT ; Bozo-Gonzalez, A ; Araya, JE ; Vargas, Y ; Tejer, B",Ultrasonic waves as a physical barrier for damage of the subterranean termite Reticulitermes flavipes Kollar (Isoptera : Rhinotermitidae) in wood of Pinus radiata (D. Don),2007,FOREST PRODUCTS JOURNAL,ISI/SCOPUS/UCH/VID,,
5,"Rojas, RV; Magro, R; Cerda, RC","CRITICAL PRE-DESIGN FACTORS FOR CONSTRUCTIVE DURABILITY: ANGLICAN CHAPEL OF CHANARAL, IN CHILE",2021,ARQUITETURA REVISTA,ISI/SCOPUS/UCH/VID,http://dx.doi.org/10.4013/arq.2021.172.04,10.4013/arq.2021.172.04
6,"Carmona, RJ; Wiemann, MC; Baas, P; Barros, C; Chavarria, GD; McClure, PJ; Espinoza, EO",Forensic identification of CITES Appendix I Cupressaceae using anatomy and mass spectrometry,2020,IAWA JOURNAL,ISI/SCOPUS/UCH/VID,http://dx.doi.org/10.1163/22941932-bja10002,10.1163/22941932-bja10002
7,"Joly, D; Santoro, CM; Gayo, EM; Ugalde, PC; March, RJ; Carmona, R; Marguerie, D; Latorre, C","LATE PLEISTOCENE FUEL MANAGEMENT AND HUMAN COLONIZATION OF THE ATACAMA DESERT, NORTHERN CHILE",2017,LATIN AMERICAN ANTIQUITY,ISI/SCOPUS/UCH/VID,http://dx.doi.org/10.1017/laq.2016.8,10.1017/laq.2016.8
8,"Lienqueo, ME;Ravanal, MC;Pezoa-Conte, R;Cortinez, V;Martinez, L;Niklitschek, T;Salazar, O;Carmona, R;Garcia, A;Hyvarinen, S;Maki-Arvela, P;Mikkola, JP",Second generation bioethanol from Eucalyptus globulus Labill and Nothofagus pumilio: Ionic liquid pretreatment boosts the yields,2016,INDUSTRIAL CROPS AND PRODUCTS,ISI/SCOPUS/UCH/VID,http://dx.doi.org/10.1016/j.indcrop.2015.11.039,10.1016/j.indcrop.2015.11.039
9,"Carmona, R; Nunez, T; Alonso, MF",Biomass yield and quality of an energy dedicated crop of poplar (Populus spp.) clones in the Mediterranean zone of Chile,2015,BIOMASS & BIOENERGY,ISI/SCOPUS/UCH/VID,http://dx.doi.org/10.1016/j.biombioe.2015.01.004,10.1016/j.biombioe.2015.01.004
10,"Salinas, A;Vega, M;Lienqueo, ME;Garcia, A;Carmona, R;Salazar, O",Cloning of novel cellulases from cellulolytic fungi: Heterologous expression of a family 5 glycoside hydrolase from Trametes versicolor in Pichia pastoris,2011,ENZYME AND MICROBIAL TECHNOLOGY,ISI/SCOPUS/UCH/VID,http://dx.doi.org/10.1016/j.enzmictec.2011.10.003,10.1016/j.enzmictec.2011.10.003
11,"Kontturi, V ; Hyvarinen, S ; Garcia, A ; Carmona, R ; Murzin, DY ; Mikkola, JP ; Peiponen, KE",Simultaneous detection of the absorption spectrum and refractive index ratio with a spectrophotometer: monitoring contaminants in bioethanol,2011,MEASUREMENT SCIENCE AND TECHNOLOGY,ISI/SCOPUS/UCH/VID,http://dx.doi.org/10.1088/0957-0233/22/5/055803,10.1088/0957-0233/22/5/055803
12,"Garcia, AE ; Carmona, RJ ; Lienqueo, ME ; Salazar, O",The current status of liquid biofuels in Chile,2011,ENERGY,ISI/SCOPUS/UCH/VID,http://dx.doi.org/10.1016/j.energy.2010.06.005,10.1016/j.energy.2010.06.005
13,"Niklitschek, T; Salazar, O; Carmona, R; Garcia, A; Lienqueo, ME",Comparison of shf and ssf processes from forest residues pre-trated with ionic liquid to obtain bioethanol,2010,JOURNAL OF BIOTECHNOLOGY,ISI/UCH/VID,http://dx.doi.org/10.1016/j.jbiotec.2010.08.472,10.1016/j.jbiotec.2010.08.472
14,"Salazar, O; Gajardo, I; Salinas, A; Vega, M; Lienqueo, ME; Carmona, R",Heterologous expression and characterization of novel cellulases from white rot fungi,2010,JOURNAL OF BIOTECHNOLOGY,ISI/UCH/VID,http://dx.doi.org/10.1016/j.jbiotec.2010.08.473,10.1016/j.jbiotec.2010.08.473
15,"Pezoa, R; Cortinez, V; Hyvarinen, S; Reunanen, M; Hemming, J; Lienqueo, ME; Salazar, O; Carmona, R; Garcia, A; Murzin, DY; Mikkola, JP",USE OF IONIC LIQUIDS IN THE PRETREATMENT OF FOREST AND AGRICULTURAL RESIDUES FOR THE PRODUCTION OF BIOETHANOL,2010,CELLULOSE CHEMISTRY AND TECHNOLOGY,ISI/SCOPUS/UCH/VID,,
16,"Salazar, O; Salinas, A; Guerrero, A; Gajardo, I; Vega, M; Silva, R; Lienqueo, ME; Garcia, A; Carmona, R",Identification and cloning of novel cellulase genes from white rot fungi,2009,NEW BIOTECHNOLOGY,ISI/UCH/VID,http://dx.doi.org/10.1016/j.nbt.2009.06.376,10.1016/j.nbt.2009.06.376
17," Carmona, R ; Lienqueo, ME ; Salazar, O ; Garcia, A ",Bioenergy II: Biological Pretreatment with Fungi as a Tool for Improvement of the Enzymatic Saccharification of Eucalyptus globulus Labill to Obtain Bioethanol,2009,INTERNATIONAL JOURNAL OF CHEMICAL REACTOR ENGINEERING,SCOPUS/ISI/UCH/VID,,
18," Garay, RM ; Rallo, M ; Carmona, R ; Araya, J ","CHARACTERIZATION OF ANATOMICAL, CHEMICAL, AND BIODEGRADABLE PROPERTIES OF FIBERS FROM CORN, WHEAT, AND RICE RESIDUES",2009,CHILEAN JOURNAL OF AGRICULTURAL RESEARCH,ISI/SCOPUS/SCIELO-Chile/UCH/VID,http://dx.doi.org/10.4067/S0718-58392009000300014,10.4067/S0718-58392009000300014
19,"Carmona Cerda, René; Durán Farías, Andrés","Eficacia de preservantes en madera de pinus radiata d. don, frente al ataque de termitas subterráneas (reticulitermes hesperus)",2005,MADERAS-CIENCIA Y TECNOLOGIA,SCIELO-Chile/UCH/VID,http://dx.doi.org/10.4067/S0718-221X2005000100004,10.4067/S0718-221X2005000100004
20,"González, Alvaro; Carmona Cerda, René",Extractives of radiata pine tapped for Oleoresin in Chile,2004,Forest Chemicals Review,SCOPUS/UCH/VID,,
21,"Copaja, SV;Blackburn, C;Carmona, R",Variation of saponin contents in Quillaja saponica Molina,2003,WOOD SCIENCE AND TECHNOLOGY,ISI/SCOPUS/UCH/VID,http://dx.doi.org/10.1007/s00226-002-0150-8,10.1007/s00226-002-0150-8
22,"Garay-Moena, R; Castillo-Soto, M; Fritz-Fuentes, C; Ortega, CH","DEVELOPMENT OF AN INTEGRATED SUSTAINABILITYAND STRUCTURAL SAFETY INDICATOR, APPLIED TO CENTRAL CHILE FOR THE WOODEN HOUSING MARKET",2022,REVISTA HABITAT SUSTENTABLE,SCOPUS/ESCI/SCIELO-Chile/UCH/VID,http://dx.doi.org/10.22320/07190700.2022.12.01.01,10.22320/07190700.2022.12.01.01
23,"Garay-Moena, R; Castillo-Soto, M; Fritz-Fuentes, C; Ortega, CH","DEVELOPMENT OF AN INTEGRATED SUSTAINABILITYAND STRUCTURAL SAFETY INDICATOR, APPLIED TO CENTRAL CHILE FOR THE WOODEN HOUSING MARKET",2022,REVISTA HABITAT SUSTENTABLE,SCOPUS/ESCI/SCIELO-Chile/UCH/VID,http://dx.doi.org/10.22320/07190700.2022.12.01.01,10.22320/07190700.2022.12.01.01
24,"Garay R.M., Pfenniger F., Soto M.C.",Quality and sustainability indicators of the prefabricated wood housing industry,2021,"World Conference on Timber Engineering 2021, WCTE 2021",SCOPUS/UCH/VID,,
25,"Soto, MEC; Moena, RG; Estrada, JV",Exposure of infrastructure to forest fires and technical aspects for their protection. Case study in Central Chile,2021,REVISTA CUBANA DE CIENCIAS FORESTALES,SCIELO-otros paises /ESCI/UCH/VID,,
26,"Garay Moena R.M., Soto M.C., Zarricueta R.T.","Housing located at wui areas, under wildfire risk hazard. A territorial and normative analysis from chile",2021,ACE-ARCHITECTURE CITY AND ENVIRONMENT,SCOPUS/ESCI/UCH/VID,http://dx.doi.org/10.5821/ace.16.46.9523,10.5821/ace.16.46.9523
27,"Garay, R; Pfenniger, F; Castillo, M; Fritz, C",Quality and Sustainability Indicators of the Prefabricated Wood Housing Industry-A Chilean Case Study,2021,SUSTAINABILITY,ISI/SCOPUS/UCH/VID,http://dx.doi.org/10.3390/su13158523,10.3390/su13158523
28,"Castillo M., Garay R.M., Tapia R.","TECHNICAL PRESCRIPTIONS FOR HOUSING AND CRITICAL INFRASTRUCTURE IN THE WILDLAND¿ URBAN INTERFACE TO FIRES: THE CASE OF SAN JOSÉ DE MAIPO, CHILE",2020,Revista de Estudios Latinoamericanos sobre Reduccion del Riesgo de Desastres,SCOPUS/UCH/VID,http://dx.doi.org/10.55467/reder.v4i2.51,10.55467/reder.v4i2.51
29,"Garay, RM; Pino, N","Acoustic behavior in three types of housing: Brick social housing, structural insulated panel (SIP) emergency housing and mediagua emergency housing",2019,REVISTA DE LA CONSTRUCCION,ISI/SCOPUS/SCIELO-Chile/UCH/VID,http://dx.doi.org/10.7764/RDLC.18.1.96,10.7764/RDLC.18.1.96
30,"Garay, RM; Herrera, R; Mejias, C","Project shelter, Part 2: Structural verification",2019,REVISTA DE LA CONSTRUCCION,ISI/SCOPUS/SCIELO-Chile/UCH/VID,http://dx.doi.org/10.7764/RDLC.18.1.68,10.7764/RDLC.18.1.68
31,"Castillo-Soto M.E., Rose Marie Garay M., García-Chevesich P.A., Radeloff V., Espinoza P.A.",The risk of wildfires in Chile,2017,"Wildfires: Perspectives, Issues and Challenges of the 21st Century",SCOPUS/UCH/VID,,
32,"Garay, R.M.; Figueroa, W.; Pfenniger, F.;  Tapia, R.; Larenas, J.","Project shelter, Part 1: Fire resistance and thermal insulation",2017,REVISTA DE LA CONSTRUCCION,SCOPUS/SCIELO-Chile/ISI/UCH/VID,http://dx.doi.org/10.7764/RDLC.16.2.339,10.7764/RDLC.16.2.339
33,"Garay, R; Inostroza, M; Ducaud, A",COLOR AND GLOSS EVALUATION IN DECORATIVE STAIN APPLIED TO CASES OF Pinus radiata WOOD TREATED WITH COPPER AZOLE MICRONIZED TYPE C,2017,MADERAS-CIENCIA Y TECNOLOGIA,ISI/SCOPUS/SCIELO-Chile/UCH/VID,http://dx.doi.org/10.4067/S0718-221X2017005000003,10.4067/S0718-221X2017005000003
34,"Garay Moena, Rosemarie",Viviendas de emergencia: reflexiones a partir de la experiencia del terremoto del 27F,2015,REVISTA INVI,SCIELO-Chile/SCOPUS/UCH/VID,http://dx.doi.org/10.4067/S0718-83582015000100007,10.4067/S0718-83582015000100007
35,"Moena, RMG;Sandoval, FD",Effect of board density and adhesive combination on physical and mechanical critical properties of OSB made with Chilean native wood,2013,BOSQUE,SCOPUS/ISI/SCIELO-Chile/UCH/VID,http://dx.doi.org/10.4067/S0717-92002013000100003,10.4067/S0717-92002013000100003
36,"Garay, RM",LAB TESTING FOR P3 MOISTURE RESISTANT OVERLAID PARTICLEBOARDS MADE FROM WOOD RESIDUES,2012,BIORESOURCES,ISI/SCOPUS/UCH/VID,,
37,"Garay, R;Henriquez, M",CHEMICAL ACETYLATION TREATMENT IN RADIATA PINE WOOD,2012,MADERAS-CIENCIA Y TECNOLOGIA,ISI/SCOPUS/SCIELO-Chile/UCH/VID,http://dx.doi.org/10.4067/S0718-221X2012000100009,10.4067/S0718-221X2012000100009
38,"Garay, M;Silva, S",Behavior of wood based panel during ultrasonic attentuation testing,2011,REVISTA DE LA CONSTRUCCION,ISI/SCOPUS/SCIELO-Chile/UCH/VID,http://dx.doi.org/10.4067/S0718-915X2011000300005,10.4067/S0718-915X2011000300005
39,"Garay, R ; Henriquez, M",FIRE PERFORMANCE OF BOARDS AND PINE RADIATA WOOD WITH AND WITHOUT FLAME RETARDANT PAINT,2010,MADERAS-CIENCIA Y TECNOLOGIA,SCOPUS/SCIELO-Chile/ISI/UCH/VID,http://dx.doi.org/10.4067/S0718-221X2010000100002,10.4067/S0718-221X2010000100002
40,Rose Marie Garay ,Efectos de dos protectores superficiales en las propiedades de tableros de madera después de un año de exposición a la intemperie,2009,INFORMACION TECNOLOGICA,SCIELO-Chile/SCOPUS/UCH/VID,http://dx.doi.org/10.4067/S0718-07642009000400014,10.4067/S0718-07642009000400014
41,"Garay, RM ; Poblete, H ; Karsulovic, JT ",Evaluation of oriented strandboard and plywood subjected to severe relative humidity and temperature conditions,2009,FOREST PRODUCTS JOURNAL,ISI/SCOPUS/UCH/VID,,
42," Garay, RM ; MacDonald, F ; Acevedo, ML ; Calderon, B ; Araya, JE ",PARTICLEBOARD MADE WITH CROP RESIDUES MIXED WITH WOOD FROM PINUS RADIATA,2009,BIORESOURCES,ISI/SCOPUS/UCH/VID,,
43," Garay, RM ; Rallo, M ; Carmona, R ; Araya, J ","CHARACTERIZATION OF ANATOMICAL, CHEMICAL, AND BIODEGRADABLE PROPERTIES OF FIBERS FROM CORN, WHEAT, AND RICE RESIDUES",2009,CHILEAN JOURNAL OF AGRICULTURAL RESEARCH,ISI/SCOPUS/SCIELO-Chile/UCH/VID,http://dx.doi.org/10.4067/S0718-58392009000300014,10.4067/S0718-58392009000300014
