,Autores,titulo_publicacion,ano,titulo_revistas,tipo_publicacion,link,doi
182,"Emery, X","On the Existence of Mosaic and Indicator Random Fields with Spherical, Circular, and Triangular Variograms",2010,MATHEMATICAL GEOSCIENCES,ISI/SCOPUS/UCH/VID,http://dx.doi.org/10.1007/s11004-010-9282-9,10.1007/s11004-010-9282-9
183,"Emery, X",Iterative algorithms for fitting a linear model of coregionalization,2010,COMPUTERS & GEOSCIENCES,ISI/SCOPUS/UCH/VID,http://dx.doi.org/10.1016/j.cageo.2009.10.007,10.1016/j.cageo.2009.10.007
184,"Emery, X ; Hernandez, J",A computer package for modeling and simulating regionalized count variables,2010,COMPUTERS & GEOSCIENCES,ISI/SCOPUS/UCH/VID,http://dx.doi.org/10.1016/j.cageo.2009.04.013,10.1016/j.cageo.2009.04.013
185,"Emery, X",Multi-Gaussian kriging and simulation in the presence of an uncertain mean value,2010,STOCHASTIC ENVIRONMENTAL RESEARCH AND RISK ASSESSMENT,ISI/SCOPUS/UCH/VID,http://dx.doi.org/10.1007/s00477-009-0311-5,10.1007/s00477-009-0311-5
186," Emery, X ",The kriging update equations and their application to the selection of neighboring data,2009,COMPUTATIONAL GEOSCIENCES,SCOPUS/ISI/UCH/VID,http://dx.doi.org/10.1007/s10596-008-9116-8,10.1007/s10596-008-9116-8
187," Emery, X ; Silva, DA ",Conditional co-simulation of continuous and categorical variables for geostatistical applications,2009,COMPUTERS & GEOSCIENCES,ISI/SCOPUS/UCH/VID,http://dx.doi.org/10.1016/j.cageo.2008.07.005,10.1016/j.cageo.2008.07.005
188," Hernandez, J ; Emery, X ",A geostatistical approach to optimize sampling designs for local forest inventories,2009,CANADIAN JOURNAL OF FOREST RESEARCH,SCOPUS/ISI/UCH/VID,http://dx.doi.org/10.1139/X09-048,10.1139/X09-048
189," Emery, X ; Robles, LN ",Simulation of mineral grades with hard and soft conditioning data: application to a porphyry copper deposit,2009,COMPUTATIONAL GEOSCIENCES,ISI/SCOPUS/UCH/VID,http://dx.doi.org/10.1007/s10596-008-9106-x,10.1007/s10596-008-9106-x
190," Emery, X ",Change-of-support models and computer programs for direct block-support simulation,2009,COMPUTERS & GEOSCIENCES,ISI/SCOPUS/UCH/VID,http://dx.doi.org/10.1016/j.cageo.2008.12.010,10.1016/j.cageo.2008.12.010
191,"Emery, X",Statistical tests for validating geostatistical simulation algorithms,2008,COMPUTERS & GEOSCIENCES,SCOPUS/ISI/UCH/VID,http://dx.doi.org/10.1016/j.cageo.2007.12.012,10.1016/j.cageo.2007.12.012
192,"Emery, X",Uncertainty modeling and spatial prediction by multi-Gaussian kriging: Accounting for an unknown mean value,2008,COMPUTERS & GEOSCIENCES,ISI/SCOPUS/UCH/VID,http://dx.doi.org/10.1016/j.cageo.2007.12.011,10.1016/j.cageo.2007.12.011
193,"Emery, X",A turning bands program for conditional co-simulation of cross-correlated Gaussian random fields,2008,COMPUTERS & GEOSCIENCES,ISI/SCOPUS/UCH/VID,http://dx.doi.org/10.1016/j.cageo.2007.10.007,10.1016/j.cageo.2007.10.007
194,"Emery, X",Change of support for estimating local block grade distributions,2008,MATHEMATICAL GEOSCIENCES,SCOPUS/ISI/UCH/VID,http://dx.doi.org/10.1007/s11004-008-9148-6,10.1007/s11004-008-9148-6
195,"Emery, X",Substitution random fields with Gaussian and gamma distributions: Theory and application to a pollution data set,2008,MATHEMATICAL GEOSCIENCES,SCOPUS/ISI/UCH/VID,http://dx.doi.org/10.1007/s11004-007-9130-8,10.1007/s11004-007-9130-8
196,"Emery, X ; Lantuejoul, C",A spectral approach to simulating intrinsic random fields with power and spline generalized covariances,2008,COMPUTATIONAL GEOSCIENCES,ISI/SCOPUS/UCH/VID,http://dx.doi.org/10.1007/s10596-007-9064-8,10.1007/s10596-007-9064-8
197,"Emery, X ; Ortiz, JM ; Caceres, AM",Geostatistical modelling of rock type domains with spatially varying proportions: application to a porphyry copper deposit,2008,JOURNAL OF THE SOUTH AFRICAN INSTITUTE OF MINING AND METALLURGY,SCIELO-otros paises /SCOPUS/ISI/UCH/VID,http://dx.doi.org/10.1016/j.polymdegradstab.2008.06.017,10.1016/j.polymdegradstab.2008.06.017
198,"Emery, Xavier",Local and spatial uncertainty models based on ordinary kriging,2007,"Geomathematics and GIS Analysis of Resources, Environment and Hazards - Annual Conference of the International Association for Mathematical Geology, IAMG 2007",SCOPUS/UCH/VID,,
199,"Emery, X",Reducing fluctuations in the sample variogram,2007,STOCHASTIC ENVIRONMENTAL RESEARCH AND RISK ASSESSMENT,SCOPUS/ISI/UCH/VID,http://dx.doi.org/10.1007/s00477-006-0072-3,10.1007/s00477-006-0072-3
200,"Emery, X",Conditioning simulations of gaussian random fields by ordinary kriging,2007,MATHEMATICAL GEOLOGY,ISI/SCOPUS/UCH/VID,http://dx.doi.org/10.1007/s11004-007-9112-x,10.1007/s11004-007-9112-x
201,"Emery, X",Using the Gibbs sampler for conditional simulation of Gaussian-based random fields,2007,COMPUTERS & GEOSCIENCES,ISI/SCOPUS/UCH/VID,http://dx.doi.org/10.1016/j.cageo.2006.08.003,10.1016/j.cageo.2006.08.003
202,"Emery, X ; Gonzalez, KE",Probabilistic modelling of lithological domains and its application to resource evaluation,2007,JOURNAL OF THE SOUTH AFRICAN INSTITUTE OF MINING AND METALLURGY,SCOPUS/ISI/UCH/VID,,
203,"Emery, X",Simulation of geological domains using the plurigaussian model: New developments and computer programs,2007,COMPUTERS & GEOSCIENCES,ISI/SCOPUS/UCH/VID,http://dx.doi.org/10.1016/j.cageo.2007.01.006,10.1016/j.cageo.2007.01.006
204,"Emery, X",On some consistency conditions for geostatistical change-of-support models,2007,MATHEMATICAL GEOLOGY,SCOPUS/ISI/UCH/VID,http://dx.doi.org/10.1007/s11004-006-9073-5,10.1007/s11004-006-9073-5
205,"Emery, X ; Gonzalez, KE",Incorporating the uncertainty in geological boundaries into mineral resources evaluation,2007,JOURNAL OF THE GEOLOGICAL SOCIETY OF INDIA,SCOPUS/ISI/UCH/VID,,
206,"Emery, X ; Ortiz, JM",Weighted sample variograms as a tool to better assess the spatial variability of soil properties,2007,GEODERMA,ISI/SCOPUS/UCH/VID,http://dx.doi.org/10.1016/j.geoderma.2007.03.002,10.1016/j.geoderma.2007.03.002
207,"Emery, X ; Ortiz, JM ; Rodriguez, JJ",Quantifying uncertainty in mineral resources by use of classification schemes and conditional simulations,2006,MATHEMATICAL GEOLOGY,SCOPUS/ISI/UCH/VID,http://dx.doi.org/10.1007/s11004-005-9021-9,10.1007/s11004-005-9021-9
208,"Emery, X ; Lantuejoul, C",TBSIM: A computer program for conditional simulation of three-dimensional Gaussian random fields via the turning bands method,2006,COMPUTERS & GEOSCIENCES,ISI/SCOPUS/UCH/VID,http://dx.doi.org/10.1016/j.cageo.2006.03.001,10.1016/j.cageo.2006.03.001
209,"Emery, X",Two ordinary kriging approaches to predicting block grade distributions,2006,MATHEMATICAL GEOLOGY,ISI/SCOPUS/UCH/VID,http://dx.doi.org/10.1007/s11004-006-9048-6,10.1007/s11004-006-9048-6
210,"Emery, X",A disjunctive kriging program for assessing point-support conditional distributions,2006,COMPUTERS & GEOSCIENCES,ISI/SCOPUS/UCH/VID,http://dx.doi.org/10.1016/j.cageo.2005.10.011,10.1016/j.cageo.2005.10.011
211,"Emery, X",Ordinary multigaussian kriging for mapping conditional probabilities of soil properties,2006,GEODERMA,ISI/SCOPUS/UCH/VID,http://dx.doi.org/10.1016/j.geoderma.2005.04.019,10.1016/j.geoderma.2005.04.019
212,"Jara, RM; Couble, A; Emery, X; Magri, EJ; Ortiz, JM",Block size selection and its impact on open-pit design and mine planning,2006,JOURNAL OF THE SOUTH AFRICAN INSTITUTE OF MINING AND METALLURGY,SCOPUS/ISI/UCH/VID,,
213,"Ortiz, JM ; Emery, X",Geostatistical estimation of mineral resources with soft geological boundaries: a comparative study,2006,JOURNAL OF THE SOUTH AFRICAN INSTITUTE OF MINING AND METALLURGY,SCOPUS/ISI/UCH/VID,,
214,"Emery, X",Multigaussian kriging for point-support estimation: incorporating constraints on the sum of the kriging weights,2006,STOCHASTIC ENVIRONMENTAL RESEARCH AND RISK ASSESSMENT,ISI/SCOPUS/UCH/VID,http://dx.doi.org/10.1007/s00477-005-0004-7,10.1007/s00477-005-0004-7
215,"Emery, X",Simple and ordinary multigaussian kriging for estimating recoverable reserves,2005,MATHEMATICAL GEOLOGY,SCOPUS/ISI/UCH/VID,http://dx.doi.org/10.1007/s11004-005-1560-6,10.1007/s11004-005-1560-6
216,"Emery, X",Variograms of order omega: A tool to validate a bivariate distribution model,2005,MATHEMATICAL GEOLOGY,SCOPUS/ISI/UCH/VID,http://dx.doi.org/10.1007/s11004-005-1307-4,10.1007/s11004-005-1307-4
217,"Emery, X",Geostatistical simulation of random fields with bivariate isofactorial distributions by adding mosaic models,2005,STOCHASTIC ENVIRONMENTAL RESEARCH AND RISK ASSESSMENT,SCOPUS/ISI/UCH/VID,http://dx.doi.org/10.1007/s00477-005-0240-x,10.1007/s00477-005-0240-x
218,"Emery, X; Ortiz, JM",Estimation of mineral resources using grade domains: critical analysis and a suggested methodology,2005,JOURNAL OF THE SOUTH AFRICAN INSTITUTE OF MINING AND METALLURGY,SCOPUS/ISI/UCH/VID,,
219,"Emery, X",Conditional simulation of random fields with bivariate gamma isofactorial distributions,2005,MATHEMATICAL GEOLOGY,SCOPUS/ISI/UCH/VID,http://dx.doi.org/10.1007/s11004-005-5956-0,10.1007/s11004-005-5956-0
220,"Emery, X; Torres, JFS",Models for support and information effects: A comparative study,2005,MATHEMATICAL GEOLOGY,SCOPUS/ISI/UCH/VID,http://dx.doi.org/10.1007/s11004-005-8747-8,10.1007/s11004-005-8747-8
221,"Emery, X; Ortiz, JM",Histogram and variogram inference in the multigaussian model,2005,STOCHASTIC ENVIRONMENTAL RESEARCH AND RISK ASSESSMENT,SCOPUS/ISI/UCH/VID,http://dx.doi.org/10.1007/s00477-004-0205-5,10.1007/s00477-004-0205-5
222,"Emery, Xavier; Ortiz Cabrera, Julián",Shortcomings of multiple indicator kriging for assessing local distributions,2004,TRANSACTIONS OF THE INSTITUTIONS OF MINING AND METALLURGY SECTION B-APPLIED EARTH SCIENCE,SCOPUS/UCH/VID,,
223,"Emery, X",Properties and limitations of sequential indicator simulation,2004,STOCHASTIC ENVIRONMENTAL RESEARCH AND RISK ASSESSMENT,SCOPUS/ISI/UCH/VID,http://dx.doi.org/10.1007/s00477-004-0213-5,10.1007/s00477-004-0213-5
224,"Emery, X",Testing the correctness of the sequential algorithm for simulating Gaussian random fields,2004,STOCHASTIC ENVIRONMENTAL RESEARCH AND RISK ASSESSMENT,SCOPUS/ISI/UCH/VID,http://dx.doi.org/10.1007/s00477-004-0211-7,10.1007/s00477-004-0211-7
225,"Emery, X",On the consistency of the indirect lognormal correction,2004,STOCHASTIC ENVIRONMENTAL RESEARCH AND RISK ASSESSMENT,SCOPUS/ISI/UCH/VID,http://dx.doi.org/10.1007/s00477-004-0188-2,10.1007/s00477-004-0188-2
226,"Emery, X",Disjunctive kriging with hard and imprecise data,2003,MATHEMATICAL GEOLOGY,SCOPUS/ISI/UCH/VID,http://dx.doi.org/10.1023/B:MATG.0000002985.94274.8c,10.1023/B:MATG.0000002985.94274.8c
227,"Emery, X",Conditional simulation of nongaussian random functions,2002,MATHEMATICAL GEOLOGY,SCOPUS/ISI/UCH/VID,http://dx.doi.org/10.1023/A:1014031528091,10.1023/A:1014031528091
228,"Garcia, A; Rodriguez, B; Rosales, M; Quintero, YM; Saiz, PG; Reizabal, A; Wuttke, S; Celaya-Azcoaga, L; Valverde, A; de Luis, RF",A State-of-the-Art of Metal-Organic Frameworks for Chromium Photoreduction vs. Photocatalytic Water Remediation,2022,NANOMATERIALS,ISI/SCOPUS/UCH/VID,http://dx.doi.org/10.3390/nano12234263,10.3390/nano12234263
229,"Xu, L; Li, C; Wei, GJ; Ji, J; Lichtfouse, E; Garcia, A; Zhang, YS","Degradation of sulfamethoxazole by chlorination in water distribution systems: Kinetics, toxicity, and antibiotic resistance genes",2022,WATER ENVIRONMENT RESEARCH,ISI/SCOPUS/UCH/VID,http://dx.doi.org/10.1002/wer.10817,10.1002/wer.10817
230,"Valverde, A; Tovar, GI; Rio-Lopez, NA; Torres, D; Rosales, M; Wuttke, S; Fidalgo-Marijuan, A; Porro, JM; Jimenez-Ruiz, M; Sakai, VG; Garcia, A; Laza, JM; Vilas-Vilela, JL; Lezama, L; Arriortua, MI; Copello, GJ; de Luis, RF",Designing Metal-Chelator-like Traps by Encoding Amino Acids in Zirconium-Based Metal-Organic Frameworks,2022,CHEMISTRY OF MATERIALS,ISI/SCOPUS/UCH/VID,http://dx.doi.org/10.1021/acs.chemmater.2c02431,10.1021/acs.chemmater.2c02431
231,"Mejia, HFG; Toledo-Alarcon, J; Rodriguez, B; Cifuentes, JR; Porre, FO; Haeger, MPL; Ovalle, NV; Astudillo, CL; Garcia, A",Direct recycling of discarded reverse osmosis membranes for domestic wastewater treatment with a focus on water reuse,2022,CHEMICAL ENGINEERING RESEARCH & DESIGN,ISI/SCOPUS/UCH/VID,http://dx.doi.org/10.1016/j.cherd.2022.06.0310263-8762,10.1016/j.cherd.2022.06.0310263-8762
232,"Santoro S., Estay H., Avci A.H., Pugliese L., Ruby-Figueroa R., Garcia A., Aquino M., Nasirov S., Straface S., Curcio E.",Membrane technology for a sustainable copper mining industry: The Chilean paradigm,2021,Cleaner Engineering and Technology,SCOPUS/UCH/VID,http://dx.doi.org/10.1016/j.clet.2021.100091,10.1016/j.clet.2021.100091
233,"Garcia, A; Rosales, M; Thomas, M; Golemme, G",Arsenic photocatalytic oxidation over TiO2-loaded SBA-15,2021,JOURNAL OF ENVIRONMENTAL CHEMICAL ENGINEERING,ISI/SCOPUS/UCH/VID,http://dx.doi.org/10.1016/j.jece.2021.106443,10.1016/j.jece.2021.106443
234,"Menzel, K; Barros, L; Garcia, A; Ruby-Figueroa, R; Estay, H",Metal sulfide precipitation coupled with membrane filtration process for recovering copper from acid mine drainage,2021,SEPARATION AND PURIFICATION TECHNOLOGY,ISI/SCOPUS/UCH/VID,http://dx.doi.org/10.1016/j.seppur.2021.118721,10.1016/j.seppur.2021.118721
235,"Rodriguez, B; Ramirez, S; Gutierrez, P; Silva, N; Diaz-Aburto, I; Garcia, A; Martinez, I",Oxide copper nanoparticles stabilized by acrylonitrile and methyl methacrylate polar monomers through a ligand exchange reaction,2021,MATERIALS RESEARCH EXPRESS,ISI/SCOPUS/UCH/VID,http://dx.doi.org/10.1088/2053-1591/abf0bb,10.1088/2053-1591/abf0bb
236,"Garcia, A; Rodriguez, B; Giraldo, H; Quintero, Y; Quezada, R; Hassan, N; Estay, H",Copper-Modified Polymeric Membranes for Water Treatment: A Comprehensive Review,2021,MEMBRANES,ISI/SCOPUS/UCH/VID,http://dx.doi.org/10.3390/membranes11020093,10.3390/membranes11020093
237,"Rosales M., Orive J., Espinoza-González R., Fernández de Luis R., Gauvin R., Brodusch N., Rodríguez B., Gracia F., García A.",Evaluating the bi-functional capacity for arsenic photo-oxidation and adsorption on anatase TiO2 nanostructures with tunable morphology,2021,CHEMICAL ENGINEERING JOURNAL,SCOPUS/ISI/UCH/VID,http://dx.doi.org/10.1016/j.cej.2021.128906,10.1016/j.cej.2021.128906
238,"Saiz, PG; Valverde, A; Gonzalez-Navarrete, B; Rosales, M; Quintero, YM; Fidalgo-Marijuan, A; Orive, J; Reizabal, A; Larrea, ES; Arriortua, MI; Lanceros-Mendez, S; Garcia, A; de Luis, RF",Modulation of the Bifunctional Cr-VI to Cr-III Photoreduction and Adsorption Capacity in Zr-IV and Ti-IV Benchmark Metal-Organic Frameworks,2021,CATALYSTS,ISI/SCOPUS/UCH/VID,http://dx.doi.org/10.3390/catal11010051,10.3390/catal11010051
239,"Dong, FL; Lin, QF; Li, C; Wang, LP; Garcia, A",UV/chlorination process of algal-laden water: Algal inactivation and disinfection byproducts attenuation,2021,SEPARATION AND PURIFICATION TECHNOLOGY,ISI/SCOPUS/UCH/VID,http://dx.doi.org/10.1016/j.seppur.2020.117896,10.1016/j.seppur.2020.117896
240,"Reizabal, A; Costa, CM; Saiz, PG; Gonzalez, B; Perez-Alvarez, L; de Luis, RF; Garcia, A; Vilas-Vilela, JL; Lanceros-Mendez, S",Processing Strategies to Obtain Highly Porous Silk Fibroin Structures with Tailored Microstructure and Molecular Characteristics and Their Applicability in Water Remediation,2021,JOURNAL OF HAZARDOUS MATERIALS,SCOPUS/ISI/UCH/VID,http://dx.doi.org/10.1016/j.jhazmat.2020.123675,10.1016/j.jhazmat.2020.123675
241,"Valverde A., Sainz P.G., Orive J., Edurne Larrea S., Reizabal-Para A., Tovar G., Copello G., Lázaro-Martinez J.M., Rodriguez B., Gonzalez-Navarrete B., Marcela Y.Q., Rosales M., García A., Arriortua M.I., de Luis R.F.","Porous, lightweight, metal organic materials: Environment sustainability",2020,Advanced Lightweight Multifunctional Materials,SCOPUS/UCH/VID,http://dx.doi.org/10.1016/B978-0-12-818501-8.00012-3,10.1016/B978-0-12-818501-8.00012-3
242,"Rodriguez, BE; Armendariz-Ontiveros, MM; Quezada, R; Huitron-Segovia, EA; Estay, H; Garcia, AG; Garcia, A",Influence of Multidimensional Graphene Oxide (GO) Sheets on Anti-Biofouling and Desalination Performance of Thin-Film Composite Membranes: Effects of GO Lateral Sizes and Oxidation Degree,2020,POLYMERS,ISI/SCOPUS/UCH/VID,http://dx.doi.org/10.3390/polym12122860,10.3390/polym12122860
243,"Saiz, PG; Iglesias, N; Navarrete, BG; Rosales, M; Quintero, YM; Reizabal, A; Orive, J; Marijuan, AF; Larrea, ES; Lopes, AC; Lezama, L; Garcia, A; Lanceros-Mendez, S; Arriortua, MI; de Luis, RF",Chromium Speciation in Zirconium-Based Metal-Organic Frameworks for Environmental Remediation,2020,CHEMISTRY-A EUROPEAN JOURNAL,ISI/SCOPUS/UCH/VID,http://dx.doi.org/10.1002/chem.202001435,10.1002/chem.202001435
244,"García A., Rodríguez B., Quintero Y., Montserrat S., Cardemil J.",Arsenic removal technology from water based on nanomaterials and sunlight,2020,Proceedings of the ISES Solar World Congress 2019 and IEA SHC International Conference on Solar Heating and Cooling for Buildings and Industry 2019,SCOPUS/UCH/VID,http://dx.doi.org/10.18086/swc.2019.47.01,10.18086/swc.2019.47.01
245,"Armendariz-Ontiveros, MM; Alvarez-Sanchez, J; Devora-Isiordia, GE; Garcia, A; Weihs, GAF",Effect of seawater variability on endemic bacterial biofouling of a reverse osmosis membrane coated with iron nanoparticles (FeNPs),2020,CHEMICAL ENGINEERING SCIENCE,SCOPUS/ISI/UCH/VID,http://dx.doi.org/10.1016/j.ces.2020.115753,10.1016/j.ces.2020.115753
246,"Rosales, M; Garcia, A; Fuenzalida, VM; Espinoza-Gonzalez, R; Song, GC; Wang, B, Yu, JH; Gracia, F; Rosenkranz, A",Unprecedented arsenic photo-oxidation behavior of few- and multi-layer Ti3C2Tx nano-sheets,2020,APPLIED MATERIALS TODAY,SCOPUS/ISI/UCH/VID,http://dx.doi.org/10.1016/j.apmt.2020.100769,10.1016/j.apmt.2020.100769
247,"Valenzuela-Diaz, MJ; Navarrete-Calvo, A; Caraballo, MA; McPhee, J; Garcia, A; Correa-Burrows, JP; Navarro-Valdivia, L","Hydrogeochemical and environmental water quality standards in the overlap between high mountainous natural protected areas and copper mining activities (Mapocho river upper basin, Santiago, Chile)",2020,JOURNAL OF HYDROLOGY,SCOPUS/ISI/UCH/VID,http://dx.doi.org/10.1016/j.jhydrol.2020.125063,10.1016/j.jhydrol.2020.125063
248,"Quezada, R; Quintero, Y; Salgado, JC; Estay, H; Garcia, A",Understanding the Phenomenon of Copper Ions Release from Copper-Modified TFC Membranes: A Mathematical and Experimental Methodology Using Shrinking Core Model,2020,NANOMATERIALS,ISI/SCOPUS/UCH/VID,http://dx.doi.org/10.3390/nano10061130,10.3390/nano10061130
249,"Quintero, Y; Mosquera, E; Diosa, J; Garcia, A","Ultrasonic-assisted sol-gel synthesis of TiO2 nanostructures: Influence of synthesis parameters on morphology, crystallinity, and photocatalytic performance",2020,JOURNAL OF SOL-GEL SCIENCE AND TECHNOLOGY,ISI/SCOPUS/UCH/VID,http://dx.doi.org/10.1007/s10971-020-05263-6,10.1007/s10971-020-05263-6
250,"Ontiveros, MA; Quintero, Y; Llanquilef, A; Morel, M; Martinez, LA; Garcia, AG; Garcia, A",Anti-Biofouling and Desalination Properties of Thin Film Composite Reverse Osmosis Membranes Modified with Copper and Iron Nanoparticles,2019,MATERIALS,ISI/SCOPUS/UCH/VID,http://dx.doi.org/10.3390/ma12132081,10.3390/ma12132081
251,"Silva, N; Ramirez, S; Diaz, I; Garcia, A; Hassan, N","Easy, Quick, and Reproducible Sonochemical Synthesis of CuO Nanoparticles",2019,MATERIALS,ISI/SCOPUS/UCH/VID,http://dx.doi.org/10.3390/ma12050804,10.3390/ma12050804
252,"Rosales, M; Zoltan, T; Yadarola, C; Mosquera, E; Gracia, F; Garcia, A",The influence of the morphology of 1D TiO 2 nanostructures on photogeneration of reactive oxygen species and enhanced photocatalytic activity,2019,JOURNAL OF MOLECULAR LIQUIDS,ISI/SCOPUS/UCH/VID,http://dx.doi.org/10.1016/j.molliq.2019.02.070,10.1016/j.molliq.2019.02.070
253,"Garcia, A; Rodriguez, B; Ozturk, D; Rosales, M; Diaz, DI; Mautner, A",Incorporation of CuO nanoparticles into thin-film composite reverse osmosis membranes (TFC-RO) for antibiofouling properties,2018,POLYMER BULLETIN,ISI/SCOPUS/UCH/VID,http://dx.doi.org/10.1007/s00289-017-2146-4,10.1007/s00289-017-2146-4
254,"Rodriguez, B; Ozturk, D; Rosales, M; Flores, M; Garcia, A",Antibiofouling thin-film composite membranes (TFC) by in situ formation of Cu-(m-phenylenediamine) oligomer complex,2018,JOURNAL OF MATERIALS SCIENCE,ISI/SCOPUS/UCH/VID,http://dx.doi.org/10.1007/s10853-018-2039-4,10.1007/s10853-018-2039-4
255,"Garcia, A; Quintero, Y; Vicencio, N; Rodriguez, B; Ozturk, D; Mosquera, E; Corrales, TP; Volkmann, UG",Influence of TiO2 nanostructures on anti-adhesion and photoinduced bactericidal properties of thin film composite membranes,2016,RSC ADVANCES,ISI/SCOPUS/UCH/VID,http://dx.doi.org/10.1039/c6ra17999a,10.1039/c6ra17999a
256,"Arellano, VM;Garcia, A","Evaluation of the quality of the water and its corrosive trend in the ""morichales"" ""Guaricongo"" and ""Los Caribes"", Heres municipality, Ciudad Bolivar, Bolivar state, Venezuela",2013,BOLETIN DE MALARIOLOGIA Y SALUD AMBIENTAL,ISI/SCOPUS/SCIELO-otros paises /UCH/VID,,
257,"Perea C., Restrepo O., Ihle C., Estay H.",USE OF AMINO ACIDS FOR COPPER DISSOLUTION,2022,SME Annual Conference and Expo 2022,SCOPUS/UCH/VID,,
258,"Reyes, Cristian; Apaz, Fernando; Nino, Yarko; Barraza, Belen; Arratia, Cristobal; Ihle, Christian F.",A review on steeply inclined settlers for water clarification,2022,MINERALS ENGINEERING,ISI/SCOPUS/UCH/VID,http://dx.doi.org/10.1016/j.mineng.2022.107639,10.1016/j.mineng.2022.107639
259,"Ihle, CF; Reyes, C",A new criterion to estimate the capacity of steeply inclined settlers of arbitrary cross-sectional shape,2022,POWDER TECHNOLOGY,ISI/SCOPUS/UCH/VID,http://dx.doi.org/10.1016/j.powtec.2021.11.048,10.1016/j.powtec.2021.11.048
260,"Lopez-Espejo, C; Ihle, CF","Technical Assessment of Secondary Sedimentation Process in Copper Sulphide Tailings with the Presence of Clays, in Continental and Sea Water",2022,MINERALS,ISI/SCOPUS/UCH/VID,http://dx.doi.org/10.3390/min12020257,10.3390/min12020257
261,"Perea C.G., Baena O.J.R., Ihle C.F., Estay H.",Copper leaching from wastes electrical and electronic equipment (WEEE) using alkaline monosodium glutamate: Thermodynamics and dissolution tests,2021,Cleaner Engineering and Technology,SCOPUS/UCH/VID,http://dx.doi.org/10.1016/j.clet.2021.100312,10.1016/j.clet.2021.100312
262,"Barros L., Gim-Krumm M., Seriche G., Quilaqueo M., Castillo C., Ihle C.F., Ruby-Figueroa R., Estay H.",In-situ and real-time aggregation size evolution of copper sulfide precipitates using focused beam reflectance measurement (FBRM),2021,POWDER TECHNOLOGY,SCOPUS/ISI/UCH/VID,http://dx.doi.org/10.1016/j.powtec.2020.11.038,10.1016/j.powtec.2020.11.038
263,"Ramos, JJ; Leiva, WH; Castillo, CN; Ihle, CF; Fawell, PD; Jeldres, RI",Seawater flocculation of clay-based mining tailings: Impact of calcium and magnesium precipitation,2020,MINERALS ENGINEERING,ISI/SCOPUS/UCH/VID,http://dx.doi.org/10.1016/j.mineng.2020.106417,10.1016/j.mineng.2020.106417
264,"Contreras, S; Castillo, C; Olivera-Nappa, A; Townley, B; Ihle, CF",A new statistically-based methodology for variability assessment of rheological parameters in mineral processing,2020,MINERALS ENGINEERING,SCOPUS/ISI/UCH/VID,http://dx.doi.org/10.1016/j.mineng.2020.106494,10.1016/j.mineng.2020.106494
265,"Ihle, CF",Economic pipe diameter of settling slurries,2020,JOURNAL OF CLEANER PRODUCTION,SCOPUS/ISI/UCH/VID,http://dx.doi.org/10.1016/j.jclepro.2020.121475,10.1016/j.jclepro.2020.121475
266,"Castillo, C; Ihle, CE; Jeldres, RI",Chemometric Optimisation of a Copper Sulphide Tailings Flocculation Process in the Presence of Clays,2019,MINERALS,ISI/SCOPUS/UCH/VID,http://dx.doi.org/10.3390/min9100582,10.3390/min9100582
267,"Reyes, C; Ihle, CF; Apaz, F; Cisternas, LA",Heat-Assisted Batch Settling of Mineral Suspensions in Inclined Containers,2019,MINERALS,ISI/SCOPUS/UCH/VID,http://dx.doi.org/10.3390/min9040228,10.3390/min9040228
268,"Castillo C., Ihle C., Fawell P.",Effect of salt water on the dynamics of flocculation of copper sulphide tailings containing kaolinite,2019,IMPC 2018 - 29th International Mineral Processing Congress,SCOPUS/UCH/VID,,
269,"Contreras S., Ihle C., Palza H.",FBRM measurements of fine solid flocculation performance using graphene oxide-doped industrial flocculants in high-clay tailings,2019,IMPC 2018 - 29th International Mineral Processing Congress,SCOPUS/UCH/VID,,
270,"Reyes, C; Alvarez, M; Ihle, CF; Contreras, M; Kracht, W",The influence of seawater on magnetite tailing rheology,2019,MINERALS ENGINEERING,SCOPUS/ISI/UCH/VID,http://dx.doi.org/10.1016/j.mineng.2018.11.037,10.1016/j.mineng.2018.11.037
271,"Zolezzi, C; Ihle, CF; Angulo, C; Palma, P; Palza, H","Effect of the Oxidation Degree of Graphene Oxides on their Adsorption, Flocculation, and Antibacterial Behavior",2018,INDUSTRIAL & ENGINEERING CHEMISTRY RESEARCH,ISI/SCOPUS/UCH/VID,http://dx.doi.org/10.1021/acs.iecr.8b03879,10.1021/acs.iecr.8b03879
272,"Ihle C.F., Tamburrino A.","Analytical solutions for the flow depth of steady laminar, Bingham plastic tailings down wide channels",2018,MINERALS ENGINEERING,SCOPUS/ISI/UCH/VID,http://dx.doi.org/10.1016/j.mineng.2018.09.010,10.1016/j.mineng.2018.09.010
273,"Palma, S; Ihle, CF; Tamburrino, A",Characterization of a sediment layer of concentrated fluid-solid mixtures in tilted ducts at low Reynolds numbers,2018,POWDER TECHNOLOGY,ISI/SCOPUS/UCH/VID,http://dx.doi.org/10.1016/j.powtec.2017.10.053,10.1016/j.powtec.2017.10.053
274,"Ihle C.F., Kracht W.",The relevance of water recirculation in large scale mineral processing plants with a remote water supply,2018,JOURNAL OF CLEANER PRODUCTION,ISI/SCOPUS/UCH/VID,http://dx.doi.org/10.1016/j.jclepro.2017.12.219,10.1016/j.jclepro.2017.12.219
275,"Reyes, C; Ihle, CF",Numerical simulation of cation exchange in fine-coarse seawater slurry pipeline flow,2018,MINERALS ENGINEERING,ISI/SCOPUS/UCH/VID,http://dx.doi.org/10.1016/j.mineng.2017.12.003,10.1016/j.mineng.2017.12.003
