,codigo,titulo,fecha_inicio,fecha_fin,investigadores,institucion,programa,fuente
0,11240231,Antropología de la salud: Experiencias del dolor y padecimiento en población envejecida chilena,01/05/2023,01/05/2023,M. Moya,Investigación,FONDECYT,Iniciación en Investigación
1,1241068,Reconfiguración de los espacios pesqueros globales: Desarrollo capitalista y cultura marítima en el norte grande de Chile durante los siglos XX y XXI,01/08/2023,01/08/2023,M. Moya,,FONDECYT,Regular
2,1230297,Etnogerontología del dolor: Experiencias del padecimiento en población envejecida chilena,01/07/2022,01/07/2022,M. Moya / X. Cea,Departamento de Nutrición Humana y Clínica,FONDECYT,Regular
3,NAM21I0052,"Standardized intervention with Modified Tai Chi on determinants of mobility, cognitive function, and depression, within the framework of Comprehensive Care for the elderly (ICOPE-WHO) for healthy aging",01/03/2021,01/03/2021,M. Moya,Secretarías,Desafío Global en Longevidad Saludable,Longevidad Saludable: Fase Internacional Catalizadora
4,1201956,Etnogerontología del dolor: Experiencias del padecimiento en el proceso de salud/enfermedad/atención en población envejecida chilena,01/08/2019,01/08/2019,M. Moya / X. Cea,Secretarías,FONDECYT,Regular
5,11200687,Etnogerontología del dolor: Experiencias del padecimiento en población envejecida chilena,01/05/2020,01/05/2020,M. Moya,Dirección,FONDECYT,Iniciación en Investigación
6,11181315,"Políticas en salud del Estado chileno para la vejez: Dispositivos de gobierno, gestión y procesos de subjetivación del envejecer",01/05/2018,01/05/2018,M. Moya,Dirección,FONDECYT,Iniciación en Investigación
7,11171142,"La producción de la dependencia: Conocimiento científico, gubernamentalización y medicalización de la vejez en Chile",01/06/2017,01/06/2017,M. Moya,Dirección,FONDECYT,Iniciación en Investigación
8,SA16I0261,El proceso de salud/enfermedad/atención en poblaicón envejecida Atacameña y Mapuche. Pasos para el desarrollo de una antropología de la salud en la observación etnogerontológica,01/10/2016,01/10/2016,M. Moya,Dirección,CONICYT/MINSAL,FONIS-Proyectos I&D
