,Autores,titulo_publicacion,ano,titulo_revistas,tipo_publicacion,link,doi
326,"Ahumada, P; Astorga, G; Bull-Herenu, K; Cabrera, R; Caputo, L; Carmona, C; Cecchi, MC; Cortes, N; Cortez, S; Dorador, C; Fredes, F; Guerrero-Bosagna, C; Henny, P; Libedinsky, C; Marcelo, W; Marquez, IN; Martinez, J; Medina, MC; Parra, D; Pohl, N; Pottstock, H; Ossandon, T; Razeto, P; Rubilar, D; Salas, C; Salinas, F; Sepulveda, E; Soto, C; Suarez, R; Vargas, A; Vega-Zuniga, T; Velasquez, N; Vidal, J; Villagra, CA; Villavicencio, CP",Undergraduate teaching of evolution in Chile: more than natural selection,2005,REVISTA CHILENA DE HISTORIA NATURAL,SCIELO-Chile/SCOPUS/ISI/UCH/VID,http://dx.doi.org/10.4067/S0716-078X2005000100013,10.4067/S0716-078X2005000100013
327,"Cabrera, R;Fischer, H;Trapani, S;Craievich, AF;Garratt, RC;Guixe, V;Babul, J",Domain motions and quaternary packing of phosphofructokinase-2 from Escherichia coli studied by small angle X-ray scattering and homology modeling,2003,JOURNAL OF BIOLOGICAL CHEMISTRY,ISI/SCOPUS/UCH/VID,http://dx.doi.org/10.1074/jbc.M212137200,10.1074/jbc.M212137200
328,"Guixe, V;Cabrera, R;Baez, M;Babul, J",Allosteric control of the oligomerization of phosphofructokinase-2 from E-coli.,2002,FASEB JOURNAL,ISI/UCH/VID,,
329,"Cabrera, R;Guixe, V;Alfaro, J;Rodriguez, PH;Babul, J",Ligand-dependent structural changes and limited proteolysis of Escherichia coli phosphofructokinase-2,2002,ARCHIVES OF BIOCHEMISTRY AND BIOPHYSICS,SCOPUS/ISI/UCH/VID,http://dx.doi.org/10.1016/S0003-9861(02)00435-6,10.1016/S0003-9861(02)00435-6
330,"Vallejos-Baccelliere, G; Herrera, SM; Castro-Fernandez, V",Kinetic characterization and evolutive trajectory of the allosteric regulation by AMP of archaeal ADP-dependent Sugar Kinases,2023,PROTEIN SCIENCE,ISI/UCH/VID,http://dx.doi.org/10.1016/j.abb.2023.109602,10.1016/j.abb.2023.109602
331,"Castro-Fernandez, V; Herrera, SM; Fuentes-Ugarte, N; Maturana, P; Guixe, V",Structural Insight into Halofilicity and Substrate Specificity of Glucose-6-phosphate Dehydrogenase from the Haloarchea Haloferax volcanii.,2023,PROTEIN SCIENCE,ISI/UCH/VID,http://dx.doi.org/.no tiene,.no tiene
332,"Gonzalez-Ordenes, F; Herrera-Soto, N; Uribe-Oporto, E; Castro-Fernandez, V; Guixe, V",Archaeal glycogen phosphorylase activity in the absence of pyridoxal 5 '-phosphate,2023,PROTEIN SCIENCE,ISI/UCH/VID,,
333,"Herrera-Morandé A., Vallejos-Baccelliere G., Cea P.A., Zamora R.A., Cid D., Maturana P., González-Ordenes F., Castro-Fernández V., Guixé V.",Kinetic characterization and phylogenetic analysis of human ADP-dependent glucokinase reveal new insights into its regulatory properties,2023,ARCHIVES OF BIOCHEMISTRY AND BIOPHYSICS,ISI/SCOPUS/UCH/VID,http://dx.doi.org/10.1016/j.abb.2023.109602,10.1016/j.abb.2023.109602
334,"Vallejos-Baccelliere, G; Kaufman, SB; Gonzalez-Lebrero, RM; Castro-Fernandez, V; Guixe, V","Characterisation of kinetics, substrate inhibition and product activation by AMP of bifunctional ADP-dependent glucokinase/phosphofructokinase from Methanococcus maripaludis",2022,FEBS JOURNAL,ISI/SCOPUS/UCH/VID,http://dx.doi.org/10.1111/febs.16557,10.1111/febs.16557
335,"Gil-Duran, C; Sepulveda, RV; Rojas, M; Castro-Fernandez, V; Guixe, V; Vaca, I; Levican, G; Gonzalez-Nilo, FD; Ravanal, MC; Chavez, R",The Emergence of New Catalytic Abilities in an Endoxylanase from Family GH10 by Removing an Intrinsically Disordered Region,2022,INTERNATIONAL JOURNAL OF MOLECULAR SCIENCES,ISI/SCOPUS/UCH/VID,http://dx.doi.org/10.3390/ijms23042315,10.3390/ijms23042315
336,"Fuentes-Ugarte, N; Herrera, SM; Maturana, P; Castro-Fernandez, V; Guixe, V",Structural and Kinetic Insights Into the Molecular Basis of Salt Tolerance of the Short-Chain Glucose-6-Phosphate Dehydrogenase From Haloferax volcanii,2021,FRONTIERS IN MICROBIOLOGY,ISI/SCOPUS/UCH/VID,http://dx.doi.org/10.3389/fmicb.2021.730429,10.3389/fmicb.2021.730429
337,"Maturana, P; Orellana, MS; Herrera, SM; Martinez, I; Figueroa, M; Martinez-Oyanedel, J; Castro-Fernandez, V; Uribe, E",Crystal Structure of Escherichia coli Agmatinase: Catalytic Mechanism and Residues Relevant for Substrate Specificity,2021,INTERNATIONAL JOURNAL OF MOLECULAR SCIENCES,ISI/SCOPUS/UCH/VID,http://dx.doi.org/10.3390/ijms22094769,10.3390/ijms22094769
338,"Munoz S.M., Fernandez V.C., Guixe V.","Structure of an ancestral ADP-dependent kinase with fructose-6P reveals key residues for binding, catalysis, and ligand-induced conformational changes",2021,JOURNAL OF BIOLOGICAL CHEMISTRY,SCOPUS/ISI/UCH/VID,http://dx.doi.org/10.1074/jbc.RA120.015376,10.1074/jbc.RA120.015376
339,"Gonzalez-Ordenes, F; Bravo-Moraga, F; Gonzalez, E; Hernandez-Cabello, L; Alzate-Morales, J; Guixe, V; Castro-Fernandez, V",Crystal structure and molecular dynamics simulations of a promiscuous ancestor reveal residues and an epistatic interaction involved in substrate binding and catalysis in the ATP-dependent vitamin kinase family members,2021,PROTEIN SCIENCE,ISI/SCOPUS/UCH/VID,http://dx.doi.org/10.1002/pro.4040,10.1002/pro.4040
340,"Zamora, RA; Ramirez-Sarmiento, CA; Castro-Fernandez, V; Villalobos, P; Maturana, P; Herrera-Morande, A; Komives, EA; Guixe, V",Tuning of Conformational Dynamics Through Evolution-Based Design Modulates the Catalytic Adaptability of an Extremophilic Kinase,2020,ACS CATALYSIS,ISI/SCOPUS/UCH/VID,http://dx.doi.org/10.1021/acscatal.0c01300,10.1021/acscatal.0c01300
341,"Cea, PA; Araya, G; Vallejos, G; Recabarren, R; Alzate-Morales, J; Babul, J; Guixe, V; Castro-Fernandez, V",Characterization of hydroxymethylpyrimidine phosphate kinase from mesophilic and thermophilic bacteria and structural insights into their differential thermal stability,2020,ARCHIVES OF BIOCHEMISTRY AND BIOPHYSICS,ISI/SCOPUS/UCH/VID,http://dx.doi.org/10.1016/j.abb.2020.108389,10.1016/j.abb.2020.108389
342,"Vallejos-Vidal, E; Reyes-Cerpa, S; Rivas-Pardo, JA; Maisey, K; Yanez, JM; Valenzuela, H; Cea, PA; Castro-Fernandez, V; Tort, L; Sandino, AM; Imarai, M; Reyes-Lopez, FE",Single-Nucleotide Polymorphisms (SNP) Mining and Their Effect on the Tridimensional Protein Structure Prediction in a Set of Immunity-Related Expressed Sequence Tags (EST) in Atlantic Salmon (Salmo salar),2020,FRONTIERS IN GENETICS,ISI/SCOPUS/UCH/VID,http://dx.doi.org/10.3389/fgene.2019.01406,10.3389/fgene.2019.01406
343,"Zamora, RA; Fuentes-Lemus, E; Barrias, P; Herrera-Morande, A; Mura, F; Guixe, V; Castro-Fernandez, V; Rojas, T; Lopez-Alarcon, C; Aguirre, P; Rivas-Aravena, A; Aspee, A",Free radicals derived from ¿-radiolysis of water and AAPH thermolysis mediate oxidative crosslinking of eGFP involving Tyr-Tyr and Tyr-Cys bonds: the fluorescence of the protein is conserved only towards peroxyl radicals,2020,FREE RADICAL BIOLOGY AND MEDICINE,SCOPUS/ISI/UCH/VID,http://dx.doi.org/10.1016/j.freeradbiomed.2020.02.006,10.1016/j.freeradbiomed.2020.02.006
344,"Vallejos, G; Guixe, V; Herrera, SM; Castro-Fernandez, V",AMP REGULATION OF BIFUNCTIONAL ADP-DEPENDENT SUGAR KINASES FROM ARCHAEA: EVOLUTIONARY HISTORY AND KINETIC CHARACTERIZATION,2019,PROTEIN SCIENCE,ISI/UCH/VID,http://dx.doi.org/10.1002/pro.3710,10.1002/pro.3710
345,"Guixe, V; Gonzalez-Ordenes, F; Cea, P; Fuentes, N; Munoz, S; Zamora, R; Leonardo, D; Garratt, RC; Castro-Fernandez, V; Guixe, V",ADP-Dependent Kinases from the Archaeal Order Methanosarcinales Adapt to Salt by a Non-Canonical Evolutionary Conserved Strategy,2018,PROTEIN SCIENCE,ISI/UCH/VID,,
346,"Herrera-Morande, A; Castro-Fernandez, V; Merino, F; Ramirez-Sarmiento, CA; Fernandez, FJ; Vega, MC; Guixe, V",Protein topology determines substrate-binding mechanism in homologous enzymes,2018,BIOCHIMICA ET BIOPHYSICA ACTA-GENERAL SUBJECTS,SCOPUS/ISI/UCH/VID,http://dx.doi.org/10.1016/j.bbagen.2018.09.007,10.1016/j.bbagen.2018.09.007
347,"Gonzalez-Ordenes, F; Cea, PA; Fuentes-Ugarte, N; Munoz, SM; Zamora, RA; Leonardo, D; Garratt, RC; Castro-Fernandez, V; Guixe, V",ADP-Dependent Kinases From the Archaeal Order Methanosarcinales Adapt to Salt by a Non-canonical Evolutionarily Conserved Strategy,2018,FRONTIERS IN MICROBIOLOGY,ISI/SCOPUS/UCH/VID,http://dx.doi.org/10.3389/fmicb.2018.01305,10.3389/fmicb.2018.01305
348,"Guixe, V; Zamora, RA; Ramirez-Sarmiento, CA; Castro-Fernandez, V; Villalobos, P; Komives, E",Cold-Adapted ADP-Dependent Sugar Kinase: Biophysical and Evolutionary Study of its Flexibility.,2017,PROTEIN SCIENCE,ISI/UCH/VID,,
349,"Zamora R.A., Gonzalez-Órdenes F., Castro-Fernández V., Guixé V.",ADP-dependent phosphofructokinases from the archaeal order Methanosarcinales display redundant glucokinase activity,2017,ARCHIVES OF BIOCHEMISTRY AND BIOPHYSICS,ISI/SCOPUS/UCH/VID,http://dx.doi.org/10.1016/j.abb.2017.09.008,10.1016/j.abb.2017.09.008
350,"Castro-Fernandez, V; Herrera-Morande, A; Zamora, R; Merino, F; Gonzalez-Ordenes, F; Padilla-Salinas, F; Pereira, HM; Brandao-Neto, J; Garratt, RC; Guixe, V",Reconstructed ancestral enzymes reveal that negative selection drove the evolution of substrate specificity in ADP-dependent kinases,2017,JOURNAL OF BIOLOGICAL CHEMISTRY,ISI/SCOPUS/UCH/VID,http://dx.doi.org/10.1074/jbc.M117.790865,10.1074/jbc.M117.790865
351,"Carvajal, AI; Vallejos, G; Komives, EA; Castro-Fernandez, V; Leonardo, DA; Garratt, RC; Ramirez-Sarmiento, CA; Babul, J",Unusual dimerization of a BcCsp mutant leads to reduced conformational dynamics,2017,FEBS JOURNAL,ISI/SCOPUS/UCH/VID,http://dx.doi.org/10.1111/febs.14093,10.1111/febs.14093
352,"Zamora, R; Castro-Fernandez, V; Ramirez-Sarmiento, CA; Komives, EA; Guixe, V",Biophysical and evolutionary study of the structural flexibility of ADP-dependent sugar kinases from mesophilic and psychrophilic archaea,2016,FEBS JOURNAL,ISI/UCH/VID,,
353,"Acuna, M; Castro-Fernandez, V; Latorre, M; Castro, J; Schuchman, EH; Guixe, V; Gonzalez, M; Zanlungo, S",Structural and functional analysis of the ASM p.Ala359Asp mutant that causes acid sphingomyelinase deficiency,2016,BIOCHEMICAL AND BIOPHYSICAL RESEARCH COMMUNICATIONS,ISI/SCOPUS/UCH/VID,http://dx.doi.org/10.1016/j.bbrc.2016.09.096,10.1016/j.bbrc.2016.09.096
354,"Herrera-Morande, A; Castro-Fernandez, V; Merino, F; Ramirez-Sarmiento, C; Fernandez, F; Vega, C; Guixe, V",Folding topology determines substrate binding order in the ribokinase superfamily,2015,PROTEIN SCIENCE,ISI/UCH/VID,,
355,"Castro-Fernandez, V;Bravo-Moraga, F;Ramirez-Sarmiento, CA;Guixe, V",Emergence of pyridoxal phosphorylation through a promiscuous ancestor during the evolution of hydroxymethyl pyrimidine kinases,2014,FEBS LETTERS,SCOPUS/ISI/UCH/VID,http://dx.doi.org/10.1016/j.febslet.2014.06.033,10.1016/j.febslet.2014.06.033
356,"Castro-Fernandez, V;Bravo-Moraga, F;Herrera-Morande, A;Guixe, V",Bifunctional ADP-dependent phosphofructokinase/ glucokinase activity in the order Methanococcales biochemical characterization of the mesophilic enzyme from Methanococcus maripaludis,2014,FEBS JOURNAL,ISI/SCOPUS/UCH/VID,http://dx.doi.org/10.1111/febs.12757,10.1111/febs.12757
357,"Rivas-Pardo, JA;Herrera-Morande, A;Castro-Fernandez, V;Fernandez, FJ;Vega, MC;Guixe, V","Crystal Structure, SAXS and Kinetic Mechanism of Hyperthermophilic ADP-Dependent Glucokinase from Thermococcus litoralis Reveal a Conserved Mechanism for Catalysis",2013,PLOS ONE,SCOPUS/ISI/UCH/VID,http://dx.doi.org/10.1371/journal.pone.0066687,10.1371/journal.pone.0066687
358,"Castro, VH;Guixe, V",Experimental paleogenetics and paleobiochemistry to study the evolutionary history of substrate specificity in archaeal ADP-dependent sugar kinases family,2012,FEBS JOURNAL,ISI/UCH/VID,,
359,"Marcoleta, AE; Arros, P; Varas, MA; Costa, J; Rojas-Salgado, J; Berrios-Pasten, C; Tapia-Fuentes, S; Silva, D; Fierro, J; Canales, N; Chavez, FP; Gaete, A; Gonzalez, M; Allende, ML; Lagos, R",The highly diverse Antarctic Peninsula soil microbiota as a source of novel resistance genes,2022,SCIENCE OF THE TOTAL ENVIRONMENT,ISI/SCOPUS/UCH/VID,http://dx.doi.org/10.1016/j.scitotenv.2021.152003,10.1016/j.scitotenv.2021.152003
360,"Ortiz-Severin, J; Tandberg, JI; Winther-Larsen, HC; Chavez, FP; Cambiazo, V",Comparative Analysis of Salmon Cell Lines and Zebrafish Primary Cell Cultures Infection with the Fish Pathogen Piscirickettsia salmonis,2021,MICROORGANISMS,SCOPUS/ISI/UCH/VID,http://dx.doi.org/10.3390/microorganisms9122516,10.3390/microorganisms9122516
361,"Ortiz-Severin, J; Travisany, D; Maass, A; Cambiazo, V; Chavez, FP",Global Proteomic Profiling of Piscirickettsia salmonis and Salmon Macrophage-Like Cells during Intracellular Infection,2020,MICROORGANISMS,ISI/SCOPUS/UCH/VID,http://dx.doi.org/10.3390/microorganisms8121845,10.3390/microorganisms8121845
362,"de la Paz, JF; Anguita-Salinas, C; Diaz-Celis, C; Chavez, FP; Allende, ML",The Zebrafish Perivitelline Fluid Provides Maternally-Inherited Defensive Immunity,2020,BIOMOLECULES,ISI/SCOPUS/UCH/VID,http://dx.doi.org/10.3390/biom10091274,10.3390/biom10091274
363,"Zuniga, A; Aravena, P; Pulgar, R; Travisany, D; Ortiz-Severin, J; Chavez, FP; Maass, A; Gonzalez, M; Cambiazo, V",Transcriptomic Changes of Piscirickettsia salmonis During Intracellular Growth in a Salmon Macrophage-Like Cell Line,2020,FRONTIERS IN CELLULAR AND INFECTION MICROBIOLOGY,ISI/SCOPUS/UCH/VID,http://dx.doi.org/10.3389/fcimb.2019.00426,10.3389/fcimb.2019.00426
364,"Ortiz-Severin, J; Travisany, D; Maass, A; Chavez, FP; Cambiazo, V",Piscirickettsia salmonis cryptic plasmids: Source of mobile DNA and virulence factors,2019,PATHOGENS,SCOPUS/ISI/UCH/VID,http://dx.doi.org/10.3390/pathogens8040269,10.3390/pathogens8040269
365,"Campos, F; Alvarez, JA; Ortiz-Severin, J; Varas, MA; Lagos, CF; Cabrera, R; Alvarez, SA; Chavez, FP",Fluorescence enzymatic assay for bacterial polyphosphate kinase 1 (PPK1) as a platform for screening antivirulence molecules,2019,INFECTION AND DRUG RESISTANCE,SCOPUS/ISI/UCH/VID,http://dx.doi.org/10.2147/IDR.S181906,10.2147/IDR.S181906
366,"Chávez F.P., Calixto A.",Use of C. elegans Diapause to Study Transgenerational Responses to Pathogen Infection,2019,Methods in Molecular Biology,SCOPUS/UCH/VID,http://dx.doi.org/10.1007/978-1-4939-9000-9_16,10.1007/978-1-4939-9000-9_16
367,"Varas M.A., Ortíz-Severín J., Marcoleta A.E., Santiviago C.A., Allende M.L., Chávez F.P.",Static Immersion and Injection Methods for Live Cell Imaging of Foodborne Pathogen Infections in Zebrafish Larvae,2019,Methods in Molecular Biology,SCOPUS/UCH/VID,http://dx.doi.org/10.1007/978-1-4939-9000-9_15,10.1007/978-1-4939-9000-9_15
368,"Villalobos, V; Leiva, A; Rios, HE; Pavez, J; Silva, CP; Ahmar, M; Queneau, Y; Blamey, JM; Chavez, FP; Urzua, MD",Inhibiting Pathogen Surface Adherence by Multilayer Polyelectrolyte Films Functionalized with Glucofuranose Derivatives,2018,ACS APPLIED MATERIALS & INTERFACES,ISI/SCOPUS/UCH/VID,http://dx.doi.org/10.1021/acsami.8b03605,10.1021/acsami.8b03605
369,"Varas, MA; Riquelme-Barrios, S; Valenzuela, C; Marcoleta, AE; Berrios-Pasten, C; Santiviago, CA; Chavez, FP",Inorganic Polyphosphate Is Essential for Salmonella Typhimurium Virulence and Survival in Dictyostelium discoideum,2018,FRONTIERS IN CELLULAR AND INFECTION MICROBIOLOGY,ISI/SCOPUS/UCH/VID,http://dx.doi.org/10.3389/fcimb.2018.00008,10.3389/fcimb.2018.00008
370,"Marcoleta, AE; Varas, MA; Ortiz-Severin, J; Vasquez, L; Berrios-Pasten, C; Sabag, AV; Chavez, FP; Allende, ML; Santiviago, CA; Monasterio, O; Lagos, R",Evaluating Different Virulence Traits of Klebsiella pneumoniae Using Dictyostelium discoideum and Zebrafish Larvae as Host Models,2018,FRONTIERS IN CELLULAR AND INFECTION MICROBIOLOGY,ISI/SCOPUS/UCH/VID,http://dx.doi.org/10.3389/fcimb.2018.00030,10.3389/fcimb.2018.00030
371,"Palominos, MF; Verdugo, L; Gabaldon, C; Pollak, B; Ortiz-Severin, J; Varas, MA; Chavez, FP; Calixto, A",Transgenerational diapause as an avoidance strategy against bacterial pathogens in Caenorhabditis elegans,2017,MBIO,SCOPUS/ISI/UCH/VID,http://dx.doi.org/10.1128/mBio.01234-17,10.1128/mBio.01234-17
372,"Diaz-Pascual, F; Ortiz-Severin, J; Varas, MA; Allende, ML; Chavez, FP",In vivo Host-Pathogen Interaction as Revealed by Global Proteomic Profiling of Zebrafish Larvae,2017,FRONTIERS IN CELLULAR AND INFECTION MICROBIOLOGY,ISI/SCOPUS/UCH/VID,http://dx.doi.org/10.3389/fcimb.2017.00334,10.3389/fcimb.2017.00334
373,"Varas, M; Ortiz-Severin, J; Marcoleta, AE; Diaz-Pascual, F; Allende, ML; Santiviago, CA; Chavez, FP",Salmonella Typhimurium induces cloacitis-like symptoms in zebrafish larvae,2017,MICROBIAL PATHOGENESIS,ISI/SCOPUS/UCH/VID,http://dx.doi.org/10.1016/j.micpath.2017.04.010,10.1016/j.micpath.2017.04.010
374,"Varas, M; Valdivieso, C; Mauriaca, C; Ortiz-Severin, J; Paradela, A; Poblete-Castro, I; Cabrera, R; Chavez, F","Datasets for transcriptomics, q-proteomics and phenotype microarrays of polyphosphate metabolism mutants from Escherichia coli",2017,DATA IN BRIEF,SCOPUS/ESCI/UCH/VID,http://dx.doi.org/10.1016/j.dib.2017.03.010,10.1016/j.dib.2017.03.010
375,"Varas, M; Farina, A; Diaz-Pascual, F; Ortiz-Severin, J; Marcoleta, AE; Allende, ML; Santiviago, CA; Chavez, FP",Live-cell imaging of Salmonella Typhimurium interaction with zebrafish larvae after injection and immersion delivery methods,2017,JOURNAL OF MICROBIOLOGICAL METHODS,SCOPUS/ISI/UCH/VID,http://dx.doi.org/10.1016/j.mimet.2017.01.020,10.1016/j.mimet.2017.01.020
376,"Varas, M; Valdivieso, C; Mauriaca, C; Ortiz-Severin, J; Paradela, A; Poblete-Castro, I; Cabrera, R; Chavez, FP","Multi-level evaluation of Escherichia coli polyphosphate related mutants using global transcriptomic, proteomic and phenomic analyses",2017,BIOCHIMICA ET BIOPHYSICA ACTA-GENERAL SUBJECTS,SCOPUS/ISI/UCH/VID,http://dx.doi.org/10.1016/j.bbagen.2017.01.007,10.1016/j.bbagen.2017.01.007
377,"Riquelme, S; Varas, M; Valenzuela, C; Velozo, P; Chahin, N; Aguilera, P; Sabag, A; Labra, B; Alvarez, SA; Chavez, FP; Santiviago, CA",Relevant Genes Linked to Virulence Are Required for Salmonella Typhimurium to Survive Intracellularly in the Social Amoeba Dictyostelium discoideum,2016,FRONTIERS IN MICROBIOLOGY,ISI/SCOPUS/UCH/VID,http://dx.doi.org/10.3389/fmicb.2016.01305,10.3389/fmicb.2016.01305
378,"Bravo-Toncio, C; Alvarez, JA; Campos, F; Ortiz-Severin, J; Varas, M; Cabrera, R; Lagos, CF; Chavez, FP",Dictyostelium discoideum as a surrogate host-microbe model for antivirulence screening in Pseudomonas aeruginosa PAO1,2016,INTERNATIONAL JOURNAL OF ANTIMICROBIAL AGENTS,ISI/SCOPUS/UCH/VID,http://dx.doi.org/10.1016/j.ijantimicag.2016.02.005,10.1016/j.ijantimicag.2016.02.005
379,"Ortiz-Severin, J; Varas, M; Bravo-Toncio, C; Guiliani, N; Chavez, FP",Multiple antibiotic susceptibility of polyphosphate kinase mutants (ppk1 and ppk2) from Pseudomonas aeruginosa PAO1 as revealed by global phenotypic analysis,2015,BIOLOGICAL RESEARCH,SCOPUS/ISI/SCIELO-Chile/UCH/VID,http://dx.doi.org/10.1186/s40659-015-0012-0,10.1186/s40659-015-0012-0
380,Chavez F.P; Lagos C.F; Reyes-Parada M; Guiliani N; Jerez C.A.,Polyphosphate synthesis as a target for novel antibiotics,2011,Current Enzyme Inhibition,SCOPUS/UCH/VID,http://dx.doi.org/10.2174/157340811798807605,10.2174/157340811798807605
381,"Varela, C; Mauriaca, C; Paradela, A; Albar, JP; Jerez, CA; Chavez, FP",New structural and functional defects in polyphosphate deficient bacteria: A cellular and proteomic study,2010,BMC MICROBIOLOGY,ISI/SCOPUS/UCH/VID,http://dx.doi.org/10.1186/1471-2180-10-7,10.1186/1471-2180-10-7
382,Chavez F.P; Mauriaca C; Jerez C.A.,Constitutive and regulated expression vectors to construct polyphosphate deficient bacteria,2009,BMC RESEARCH NOTES,SCOPUS/UCH/VID,http://dx.doi.org/10.1186/1756-0500-2-50,10.1186/1756-0500-2-50
383,"Gordillo, F; Chavez, FP; Jerez, CA",Motility and chemotaxis of Pseudomonas sp B4 towards polychlorobiphenyls and chlorobenzoates,2007,FEMS MICROBIOLOGY ECOLOGY,ISI/SCOPUS/UCH/VID,http://dx.doi.org/10.1111/j.1574-6941.2007.00293.x,10.1111/j.1574-6941.2007.00293.x
384,"Chavez, FP; Gordillo, F; Jerez, CA",Adaptive responses and cellular behaviour of biphenyl-degrading bacteria toward polychlorinated biphenyls,2006,BIOTECHNOLOGY ADVANCES,ISI/SCOPUS/UCH/VID,http://dx.doi.org/10.1016/j.biotechadv.2005.11.007,10.1016/j.biotechadv.2005.11.007
385,"Chavez, FP; Lunsdorf, H; Jerez, CA",Growth of polychlorinated-biphenyl-degirading bacteria in the presence of biphenyl and chlorobiphenyls generates oxidative stress and massive accumulation of inorganic polyphosphate,2004,APPLIED AND ENVIRONMENTAL MICROBIOLOGY,SCOPUS/ISI/UCH/VID,http://dx.doi.org/10.1128/AEM.70.5.3664-3072.2004,10.1128/AEM.70.5.3664-3072.2004
386,"Cardona, ST;Chavez, FP;Jerez, CA",The exopolyphosphatase gene from Sulfolobus solfataricus: Characterization of the first gene found to be involved in polyphosphate metabolism in Archaea,2002,APPLIED AND ENVIRONMENTAL MICROBIOLOGY,SCOPUS/ISI/UCH/VID,http://dx.doi.org/10.1128/AEM.68.10.4812.4819.2002,10.1128/AEM.68.10.4812.4819.2002
387,"Delgado, R; Delgado, MG; Bastin-Heline, L; Glavic, A; O'Day, PM; Bacigalupo, J",Light-Induced Opening of the TRP Channel in Isolated Membrane Patches Excised from Photosensitive Microvilli from Drosophila Photoreceptors,2019,NEUROSCIENCE,ISI/SCOPUS/UCH/VID,http://dx.doi.org/10.1016/j.neuroscience.2018.11.017,10.1016/j.neuroscience.2018.11.017
388,"Carvallo, C; Contreras, D; Ugarte, G; Delgado, R; Pancetti, F; Rozas, C; Pina, R; Constandil, L; Zeise, ML; Morales, B",Single and Repeated Administration of Methylphenidate Modulates Synaptic Plasticity in Opposite Directions via Insertion of AMPA Receptors in Rat Hippocampal Neurons,2018,FRONTIERS IN PHARMACOLOGY,ISI/SCOPUS/UCH/VID,http://dx.doi.org/10.3389/fphar.2018.01485,10.3389/fphar.2018.01485
389,"Delgado, MG; Oliva, C; Lopez, E; Ibacache, A; Galaz, A; Delgado, R; Barros, LF; Sierralta, J","Chaski, a novel Drosophila lactate/pyruvate transporter required in glia cells for survival under nutritional stress",2018,SCIENTIFIC REPORTS,ISI/SCOPUS/UCH/VID,http://dx.doi.org/10.1038/s41598-018-19595-5,10.1038/s41598-018-19595-5
390,"Mura, CV; Delgado, R; Delgado, MG; Restrepo, D; Bacigalupo, J",A CLCA regulatory protein present in the chemosensory cilia of olfactory sensory neurons induces a Ca2+ -activated Cl- current when transfected into HEK293,2017,BMC NEUROSCIENCE,ISI/SCOPUS/UCH/VID,http://dx.doi.org/10.1186/s12868-017-0379-7,10.1186/s12868-017-0379-7
391,"De Gregorio, C; Delgado, R; Ibacache, A; Sierralta, J; Couve, A",Drosophila Atlastin in motor neurons is required for locomotion and presynaptic function,2017,JOURNAL OF CELL SCIENCE,ISI/SCOPUS/UCH/VID,http://dx.doi.org/10.1242/jcs.201657,10.1242/jcs.201657
392,"Villar, PS; Delgado, R; Vergara, C; Reyes, JG; Bacigalupo, J",Energy Requirements of Odor Transduction in the Chemosensory Cilia of Olfactory Sensory Neurons Rely on Oxidative Phosphorylation and Glycolytic Processing of Extracellular Glucose,2017,JOURNAL OF NEUROSCIENCE,ISI/SCOPUS/UCH/VID,http://dx.doi.org/10.1523/JNEUROSCI.2640-16.2017,10.1523/JNEUROSCI.2640-16.2017
393,"Delgado, R; Mura, CV; Restrepo, D; Bacigalupo, J",Novel Ca2+-activated Cl-Channel of the chemosensory cilia of rat olfactory sensory neurons,2017,CHEMICAL SENSES,ISI/UCH/VID,http://dx.doi.org/10.1093/chemse/bjw120,10.1093/chemse/bjw120
394,"Delgado, R; Mura, CV; Bacigalupo, J",Single Ca2+-activated Cl- channel currents recorded from toad olfactory cilia,2016,BMC NEUROSCIENCE,ISI/SCOPUS/UCH/VID,http://dx.doi.org/10.1186/s12868-016-0252-0,10.1186/s12868-016-0252-0
395,"Astorga, C; Jorquera, RA; Ramirez, M; Kohler, A; Lopez, E; Delgado, R; Cordova, A; Olguin, P; Sierralta, J",Presynaptic DLG regulates synaptic function through the localization of voltage-activated Ca2+ Channels,2016,SCIENTIFIC REPORTS,ISI/SCOPUS/UCH/VID,http://dx.doi.org/10.1038/srep32132,10.1038/srep32132
396,"Juan, B; Villar, P; Blanchard, K; Villalobos, D; Delgado, R; Vergara, C; Reyes, JG",The cilia of rat olfactory sensory neurons incorporate glucose and may take it from the mucus to use as complementary energy source for odor transduction.,2016,CHEMICAL SENSES,ISI/UCH/VID,,
397,"Bacigalupo J., Delgado R., Muñoz Y., O'Day P.",TRP channels in visual transduction,2015,TRP Channels in Sensory Transduction,SCOPUS/UCH/VID,http://dx.doi.org/10.1007/978-3-319-18705-1_4,10.1007/978-3-319-18705-1_4
398,"Maureira, C;Letelier, JC;Alvarez, O;Delgado, R;Vergara, C","Copper enhances cellular and network excitabilities, and improves temporal processing in the rat hippocampus",2015,EUROPEAN JOURNAL OF NEUROSCIENCE,ISI/SCOPUS/UCH/VID,http://dx.doi.org/10.1111/ejn.13104,10.1111/ejn.13104
399,"Mura, C;Delgado, R;Restrepo, D;Bacigalupo, J",Cloning and Characterization of the Ca2+-activated Cl- Channel ClCa4l from Rat Olfactory Sensory Neurons,2014,JOURNAL OF GENERAL PHYSIOLOGY,ISI/UCH/VID,,
400,"Delgado, R;Munoz, Y;Pena-Cortes, H;Giavalisko, P;Bacigalupo, J",Diacylglycerol Activates the Light-dependent Channels TRP and TRPL in Drosophila Photoreceptors,2014,JOURNAL OF GENERAL PHYSIOLOGY,ISI/UCH/VID,,
401,"Delgado, R;Munoz, Y;Pena-Cortes, H;Giavalisco, P;Bacigalupo, J",Diacylglycerol Activates the Light-Dependent Channel TRP in the Photosensitive Microvilli of Drosophila melanogaster Photoreceptors,2014,JOURNAL OF NEUROSCIENCE,ISI/SCOPUS/UCH/VID,http://dx.doi.org/10.1523/JNEUROSCI.0513-14.2014,10.1523/JNEUROSCI.0513-14.2014
402,"Rivera-Meza, M;Quintanilla, ME;Bustamante, D;Delgado, R;Buscaglia, M;Herrera-Marschitz, M",Overexpression of Hyperpolarization-Activated Cyclic Nucleotide-Gated Channels into the Ventral Tegmental Area Increases the Rewarding Effects of Ethanol in UChB Drinking Rats,2014,ALCOHOLISM-CLINICAL AND EXPERIMENTAL RESEARCH,SCOPUS/ISI/UCH/VID,http://dx.doi.org/10.1111/acer.12344,10.1111/acer.12344
403,"Lopez, F;Delgado, R;Lopez, R;Bacigalupo, J;Restrepo, D",Transduction for Pheromones in the Main Olfactory Epithelium Is Mediated by the Ca2+-Activated Channel TRPM5,2014,JOURNAL OF NEUROSCIENCE,ISI/SCOPUS/UCH/VID,http://dx.doi.org/10.1523/JNEUROSCI.4903-13.2014,10.1523/JNEUROSCI.4903-13.2014
