,Autores,titulo_publicacion,ano,titulo_revistas,tipo_publicacion,link,doi
1151,"Urrutia, P;Esparza, A;Aguirre, P;Tapia, V;Gonzalez-Billault, C;Nunez, MT",Inflammatory stimuli and iron accumulation in neurons: two processes linked by hepcidin,2013,JOURNAL OF NEUROCHEMISTRY,ISI/UCH/VID,,
1152,"Paula-Lima, AC;SanMartin, CD;Adasme, T;Nunez, MT;Hidalgo, C",Abeta oligomers and iron stimulate calcium and ROS-dependent mitochondrial fragmentation in primary hippocampal neurons,2013,JOURNAL OF NEUROCHEMISTRY,ISI/UCH/VID,,
1153,"Urrutia, P;Aguirre, P;Esparza, A;Tapia, V;Mena, NP;Arredondo, M;Gonzalez-Billault, C;Nunez, MT","Inflammation alters the expression of DMT1, FPN1 and hepcidin, and it causes iron accumulation in central nervous system cells",2013,JOURNAL OF NEUROCHEMISTRY,ISI/SCOPUS/UCH/VID,http://dx.doi.org/10.1111/jnc.12244,10.1111/jnc.12244
1154,"Antileo, E;Garri, C;Tapia, V;Munoz, JP;Chiong, M;Nualart, F;Lavandero, S;Fernandez, J;Nunez, MT",Endocytic pathway of exogenous iron-loaded ferritin in intestinal epithelial (Caco-2) cells,2013,AMERICAN JOURNAL OF PHYSIOLOGY-GASTROINTESTINAL AND LIVER PHYSIOLOGY,SCOPUS/ISI/UCH/VID,http://dx.doi.org/10.1152/ajpgi.00472.2012,10.1152/ajpgi.00472.2012
1155,Mena N;Aliaga ME;Berrios TA;Castro EA;Cassels BK;Garcia-Beltran O;Nunez MT,A selective fluorescent probe for the detection of mercury (II) in aqueous media and its applications in living cells,2012,TETRAHEDRON LETTERS,SCOPUS/ISI/UCH/VID,http://dx.doi.org/10.1016/j.tetlet.2012.09.111,10.1016/j.tetlet.2012.09.111
1156,Vargas V;Garcia-Beltran O;Quina FH;Mena N;Nunez MT;Friedrich LC;Cassels BK;Netto-Ferreira JC,Design and synthesis of a new coumarin-based 'turn-on' fluorescent probe selective for Cu+2,2012,TETRAHEDRON LETTERS,ISI/SCOPUS/UCH/VID,http://dx.doi.org/10.1016/j.tetlet.2012.07.082,10.1016/j.tetlet.2012.07.082
1157,"Nunez, MT;Urrutia, P;Mena, N;Aguirre, P;Tapia, V;Salazar, J",Iron toxicity in neurodegeneration,2012,BIOMETALS,SCOPUS/ISI/UCH/VID,http://dx.doi.org/10.1007/s10534-012-9523-0,10.1007/s10534-012-9523-0
1158,"Theil, EC;Chen, HJ;Miranda, C;Janser, H;Elsenhans, B;Nunez, MT;Pizarro, F;Schumann, K",Absorption of Iron from Ferritin Is Independent of Heme Iron and Ferrous Salts in Women and Rat Intestinal Segments,2012,JOURNAL OF NUTRITION,SCOPUS/ISI/UCH/VID,http://dx.doi.org/10.3945/jn.111.145854,10.3945/jn.111.145854
1159,"SanMartin, CD;Paula-Lima, AC;Hidalgo, C;Nunez, MT",Sub-lethal levels of amyloid beta-peptide oligomers decrease non-transferrin-bound iron uptake and do not potentiate iron toxicity in primary hippocampal neurons,2012,BIOMETALS,ISI/SCOPUS/UCH/VID,http://dx.doi.org/10.1007/s10534-012-9545-7,10.1007/s10534-012-9545-7
1160,"Aguirre, P;Urrutia, P;Tapia, V;Villa, M;Paris, I;Segura-Aguilar, J;Nunez, MT",The dopamine metabolite aminochrome inhibits mitochondrial complex I and modifies the expression of iron transporters DMT1 and FPN1,2012,BIOMETALS,ISI/SCOPUS/UCH/VID,http://dx.doi.org/10.1007/s10534-012-9525-y,10.1007/s10534-012-9525-y
1161,"Garcia-Beltran, O;Mena, N;Perez, EG;Cassels, BK;Nunez, MT;Werlinger, F;Zavala, D;Aliaga, ME;Pavez, P","The development of a fluorescence turn-on sensor for cysteine, glutathione and other biothiols. A kinetic study",2011,TETRAHEDRON LETTERS,ISI/SCOPUS/UCH/VID,http://dx.doi.org/10.1016/j.tetlet.2011.09.137,10.1016/j.tetlet.2011.09.137
1162,"Mena, NP ; Bulteau, AL ; Salazar, J ; Hirsch, EC ; Nunez, MT",Effect of mitochondrial complex I inhibition on Fe-S cluster protein activity,2011,BIOCHEMICAL AND BIOPHYSICAL RESEARCH COMMUNICATIONS,ISI/SCOPUS/UCH/VID,http://dx.doi.org/10.1016/j.bbrc.2011.04.137,10.1016/j.bbrc.2011.04.137
1163,"Gomez, FJ ; Aguirre, P ; Gonzalez-Billault, C ; Nunez, MT",Iron mediates neuritic tree collapse in mesencephalic neurons treated with 1-methyl-4-phenylpyridinium (MPP+),2011,JOURNAL OF NEURAL TRANSMISSION,ISI/SCOPUS/UCH/VID,http://dx.doi.org/10.1007/s00702-010-0489-1,10.1007/s00702-010-0489-1
1164,"Munoz, P ; Humeres, A ; Elgueta, C ; Kirkwood, A ; Hidalgo, C ; Nunez, MT",Iron Mediates N-Methyl-D-aspartate Receptor-dependent Stimulation of Calcium-induced Pathways and Hippocampal Synaptic Plasticity,2011,JOURNAL OF BIOLOGICAL CHEMISTRY,ISI/SCOPUS/UCH/VID,http://dx.doi.org/10.1074/jbc.M110.213785,10.1074/jbc.M110.213785
1165,"Salgado, JC ; Olivera-Nappa, A ; Gerdtzen, ZP ; Tapia, V ; Theil, EC ; Conca, C ; Nunez, MT",Mathematical modeling of the dynamic storage of iron in ferritin,2010,BMC SYSTEMS BIOLOGY,ISI/SCOPUS/UCH/VID,http://dx.doi.org/10.1186/1752-0509-4-147,10.1186/1752-0509-4-147
1166,"Nunez, MT; Tapia, V; Rojas, A; Aguirre, P; Gomez, F; Nualart, F",Iron supply determines apical/basolateral membrane distribution of intestinal iron transporters DMT1 and ferroportin 1,2010,AMERICAN JOURNAL OF PHYSIOLOGY-CELL PHYSIOLOGY,ISI/SCOPUS/UCH/VID,http://dx.doi.org/10.1152/ajpcell.00168.2009,10.1152/ajpcell.00168.2009
1167,"Munoz, JP; Chiong, M; Garcia, L; Troncoso, R; Toro, B; Pedrozo, Z; Diaz-Elizondo, J; Salas, D; Parra, V; Nunez, MT; Hidalgo, C; Lavandero, S",Iron induces protection and necrosis in cultured cardiomyocytes: Role of reactive oxygen species and nitric oxide,2010,FREE RADICAL BIOLOGY AND MEDICINE,ISI/SCOPUS/UCH/VID,http://dx.doi.org/10.1016/j.freeradbiomed.2009.11.017,10.1016/j.freeradbiomed.2009.11.017
1168,"Haeger, P; Alvarez, A; Leal, N; Adasme, T; Nunez, MT; Hidalgo, C",Increased Hippocampal Expression of the Divalent Metal Transporter 1 (DMT1) mRNA Variants 1B and +IRE and DMT1 Protein After NMDA-Receptor Stimulation or Spatial Memory Training,2010,NEUROTOXICITY RESEARCH,ISI/SCOPUS/UCH/VID,http://dx.doi.org/10.1007/s12640-009-9096-z,10.1007/s12640-009-9096-z
1169,"Nunez, MT",Regulatory mechanisms of intestinal iron absorption-Uncovering of a fast-response mechanism based on DMT1 and ferroportin endocytosis,2010,BIOFACTORS,ISI/SCOPUS/UCH/VID,http://dx.doi.org/10.1002/biof.84,10.1002/biof.84
1170," Barbeito, AG ; Garringer, HJ ; Baraibar, MA ; Gao, XY ; Arredondo, M ; Nunez, MT ; Smith, MA ; Ghetti, B ; Vidal, R ",Abnormal iron metabolism and oxidative stress in mice expressing a mutant form of the ferritin light polypeptide gene,2009,JOURNAL OF NEUROCHEMISTRY,ISI/SCOPUS/UCH/VID,http://dx.doi.org/10.1111/j.1471-4159.2009.06028.x,10.1111/j.1471-4159.2009.06028.x
1171,"Nunez, MT; Tapia, V; Rojas, A; Aguirre, P; Gomez, F; Nualart, F",SHORT-TERM REGULATION OF INTESTINAL IRON ABSORPTION BY TRANSPORTERS RELOCALIZATION,2009,JOURNAL OF PHYSIOLOGICAL SCIENCES,ISI/UCH/VID,,
1172,"Nunez, MT ; Tapia, V ; Gomez, F ; Rojas, A ; Valdes, P",Apical-basolateral membrane distribution of DMT1 and ferroportin determines intestinal iron absorption,2008,FEBS JOURNAL,ISI/UCH/VID,,
1173,"Martin, CDS; Garri, C; Pizarro, F; Walter, T; Theil, EC; Nunez, MT",Caco-2 intestinal epithelial cells absorb soybean ferritin by mu(2) (AP2)-dependent endocytosis,2008,JOURNAL OF NUTRITION,SCOPUS/ISI/UCH/VID,,
1174,"Mena, NP ; Esparza, A ; Tapia, V ; Valdes, P ; Nunez, MT",Hepcidin inhibits apical iron uptake in intestinal cells,2008,AMERICAN JOURNAL OF PHYSIOLOGY-GASTROINTESTINAL AND LIVER PHYSIOLOGY,SCOPUS/ISI/UCH/VID,http://dx.doi.org/10.1152/ajpgi.00122.2007,10.1152/ajpgi.00122.2007
1175,"Salazar, J ; Mena, N ; Hunot, S ; Prigent, A ; Alvarez-Fischer, D ; Arredondo, M ; Duyckaerts, C ; Sazdovitch, V ; Zhao, L ; Garrick, LM ; Nunez, MT ; Garrick, MD ; Raisman-Vozari, R ; Hirsch, EC",Divalent metal transporter 1 (DMT1) contributes to neurodegeneration in animal models of Parkinson's disease,2008,PROCEEDINGS OF THE NATIONAL ACADEMY OF SCIENCES OF THE UNITED STATES OF AMERICA,SCOPUS/ISI/UCH/VID,http://dx.doi.org/10.1073/pnas.0804373105,10.1073/pnas.0804373105
1176,"Salazar, J ; Mena, N ; Zhao, L ; Nunez, MT ; Garrick, L ; Garrick, MD ; Hirsch, EC ; Raisman-Vozari, R",Role of divalent metal transporter 1 (DMT 1) in the progression of parkinsonian syndromes,2007,AMERICAN JOURNAL OF HEMATOLOGY,ISI/UCH/VID,,
1177,"SanMartin, C; Garri, C; Pizarro, F; Walter, T; Theil, E; Nunez, MT","Ferritin endocytosis in Caco-2 cells, a gut iron absorption model, is mediated by assembly peptide-2",2007,AMERICAN JOURNAL OF HEMATOLOGY,ISI/UCH/VID,,
1178,"Aguirre, P ; Valdes, P ; Aracena-Parks, P ; Tapia, V ; Nunez, MT",Upregulation of gamma-glutamate-cysteine ligase as part of the long-term adaptation process to iron accumulation in neuronal SH-SY5Y cells,2007,AMERICAN JOURNAL OF PHYSIOLOGY-CELL PHYSIOLOGY,SCOPUS/ISI/UCH/VID,http://dx.doi.org/10.1152/ajpcell.00620.2006,10.1152/ajpcell.00620.2006
1179,"Hidalgo, C ; Carrasco, MA ; Munoz, P ; Nunez, MT",A role for reactive oxygen/nitrogen species and iron on neuronal synaptic plasticity,2007,ANTIOXIDANTS & REDOX SIGNALING,SCOPUS/ISI/UCH/VID,http://dx.doi.org/10.1089/ars.2007.9.245,10.1089/ars.2007.9.245
1180,"Mena, NP ; Tapia, V ; Valdes, P ; Nunez, M",Hepcidin promotes a differential effect on iron transport in cells from intestinal and macrophage origin,2007,AMERICAN JOURNAL OF HEMATOLOGY,ISI/UCH/VID,,
1181,"Hidalgo, C ; Nunez, MT","Calcium, iron and neuronal function",2007,IUBMB LIFE,ISI/SCOPUS/UCH/VID,http://dx.doi.org/10.1080/15216540701222906,10.1080/15216540701222906
1182,"Hidalgo, C ; Munoz, P ; Nunez, MT","A role for iron, calcium and reactive oxygen species on hippocampal synaptic plasticity",2007,AMERICAN JOURNAL OF HEMATOLOGY,ISI/UCH/VID,,
1183,"Munoz, P; Zavala, G; Castillo, K; Aguirre, P; Hidalgo, C; Nunez, MT",Effect of iron on the activation of the MAPK/ERK pathway in PC12 neuroblastoma cells,2006,BIOLOGICAL RESEARCH,ISI/SCIELO-Chile/SCOPUS/UCH/VID,http://dx.doi.org/10.4067/S0716-97602006000100021,10.4067/S0716-97602006000100021
1184,"Aguirre, P; Mena, N; Tapia, V; Rojas, A; Arredondo, M; Nunez, MT",Antioxidant responses of cortex neurons to iron loading,2006,BIOLOGICAL RESEARCH,ISI/SCIELO-Chile/SCOPUS/UCH/VID,http://dx.doi.org/10.4067/S0716-97602006000100012,10.4067/S0716-97602006000100012
1185,"Aracena, P; Aguirre, P; Munoz, P; Nunez, MT",Iron and glutathione at the crossroad of redox metabolism in neurons,2006,BIOLOGICAL RESEARCH,ISI/SCIELO-Chile/SCOPUS/UCH/VID,http://dx.doi.org/10.4067/S0716-97602006000100017,10.4067/S0716-97602006000100017
1186,"Mura, CV; Delgado, R; Aguirre, P; Bacigalupo, J; Nunez, MT",Quiescence induced by iron challenge protects neuroblastoma cells from oxidative stress,2006,JOURNAL OF NEUROCHEMISTRY,ISI/SCOPUS/UCH/VID,http://dx.doi.org/10.1111/j.1471-4159.2006.03798.x,10.1111/j.1471-4159.2006.03798.x
1187,"Salazar, J ; Mena, N ; Nunez, MT",Iron dyshomeostasis in Parkinson's disease,2006,JOURNAL OF NEURAL TRANSMISSION-SUPPLEMENT,ISI/SCOPUS/UCH/VID,,
1188,"Mazariegos, DI; Cabantchik, ZI; Cassels, BK; Nunez, MT",Characterization of mitochondrial iron uptake in HepG2 cells,2006,BIOLOGICAL RESEARCH,ISI/SCIELO-Chile/SCOPUS/UCH/VID,http://dx.doi.org/10.4067/S0716-97602006000100024,10.4067/S0716-97602006000100024
1189,"Mena, NP; Esparza, AL; Nunez, MT",Regulation of transepithelial transport of iron by hepcidin,2006,BIOLOGICAL RESEARCH,ISI/SCIELO-Chile/SCOPUS/UCH/VID,http://dx.doi.org/10.4067/S0716-97602006000100022,10.4067/S0716-97602006000100022
1190,"Ezquer, F; Nunez, MT; Rojas, A; Asenjo, J; Israel, Y",Hereditary hemochromatosis: An opportunity for gene therapy,2006,BIOLOGICAL RESEARCH,ISI/SCIELO-Chile/SCOPUS/UCH/VID,http://dx.doi.org/10.4067/S0716-97602006000100014,10.4067/S0716-97602006000100014
1191,"Walter, T; Martin, CS; Theil, EC; Pizarro, F; Garri, C; Nunez, MT",Clathrin-mediated endocytosis of soybean ferritin by caco-2 cells.,2006,BLOOD,ISI/UCH/VID,,
1192,"Arredondo, M ; Tapia, V ; Rojas, A ; Aguirre, P ; Reyes, F ; Marzolo, MP ; Nunez, MT",Apical distribution of HFE-beta 2-microglobulin is associated with inhibition of apical iron uptake in intestinal epithelia cells,2006,BIOMETALS,ISI/SCOPUS/UCH/VID,http://dx.doi.org/10.1007/s10534-005-6687-x,10.1007/s10534-005-6687-x
1193,"Nunez, MT; Garrick, MD",Summary of the third international workshop on iron and copper homeostasis,2006,BIOLOGICAL RESEARCH,ISI/SCIELO-Chile/SCOPUS/UCH/VID,http://dx.doi.org/10.4067/S0716-97602006000100001,10.4067/S0716-97602006000100001
1194,"Arredondo, M; Nunez, MT",Hereditary hemochromatosis: A disease of iron and copper metabolism,2006,PLACENTA,ISI/UCH/VID,,
1195,"Munoz, P; Aguirre, P; Hidalgo, C; Nunez, MT",Physiology and pathology of iron in neuronal function,2006,PLACENTA,ISI/UCH/VID,,
1196,"Arredondo, M; Martinez, R; Nunez, MT; Ruz, M; Olivares, M","Inhibition of iron and copper uptake by iron, copper and zinc",2006,BIOLOGICAL RESEARCH,ISI/SCIELO-Chile/SCOPUS/UCH/VID,http://dx.doi.org/10.4067/S0716-97602006000100011,10.4067/S0716-97602006000100011
1197,"Aguirre, P; Mena, N; Tapia, V; Arredondo, M; Nunez, MT",Iron homeostasis in neuronal cells: a role for IREGI,2005,BMC NEUROSCIENCE,ISI/SCOPUS/UCH/VID,http://dx.doi.org/10.1186/1471-2202-6-3,10.1186/1471-2202-6-3
1198,"Ezquer, F; Nunez, MT; Israel, Y",Antisense gene delivered by an adenoassociated viral vector inhibits iron uptake in human intestinal cells: Potential application in hemochromatosis,2005,BIOCHEMICAL PHARMACOLOGY,ISI/SCOPUS/UCH/VID,http://dx.doi.org/10.1016/j.bcp.2005.03.016,10.1016/j.bcp.2005.03.016
1199,Arredondo M; Nunez M.T.,Iron and copper metabolism,2005,MOLECULAR ASPECTS OF MEDICINE,SCOPUS/UCH/VID,http://dx.doi.org/10.1016/j.mam.2005.07.010,10.1016/j.mam.2005.07.010
1200,"Ezquer, FE;Nunez, MT;Israel, Y",Hemochromatosis: AAV coding an antisense gene against DIVIT-1 iron transporter in intestinal epithelial cells acts as RNAL and inhibits iron transport,2004,MOLECULAR THERAPY,ISI/UCH/VID,,
1201,"Morgan, C;Colombres, M;Nunez, MT;Inestrosa, NC",Structure and function of amyloid in Alzheimer's disease,2004,PROGRESS IN NEUROBIOLOGY,SCOPUS/ISI/UCH/VID,http://dx.doi.org/10.1016/j.pneurobio.2004.10.004,10.1016/j.pneurobio.2004.10.004
1202,"Nunez, MT;Gallardo, V;Munoz, P;Tapia, V;Aguirre, R;Esparza, A;Speisky, H",Cross-talk between iron and GSH homeostasis in neuronal cells,2004,FREE RADICAL BIOLOGY AND MEDICINE,ISI/UCH/VID,,
1203,"Rodriguez, DA; Moncada, C; Nunez, MT; Lavandero, S; Ponnappa, BC; Israel, Y","Ethanol increases tumor necrosis factor-alpha receptor-1 (TNF-R1) levels in hepatic, intestinal, and cardiac cells",2004,ALCOHOL,SCOPUS/ISI/UCH/VID,http://dx.doi.org/10.1016/j.alcohol.2004.03.001,10.1016/j.alcohol.2004.03.001
1204,"Mazariegos, DI; Pizarro, F; Olivares, M; Nunez, MT; Arredondo, M",The mechanisms for regulating absorption of Fe bis-glycine chelate and Fe-ascorbate in Caco-2 cells are similar,2004,JOURNAL OF NUTRITION,SCOPUS/ISI/UCH/VID,,
1205,"Zambrano, CA; Egana, JT; Nunez, MT; Maccioni, RB; Gonzalez-Billault, C",Oxidative stress promotes T dephosphorylation in neuronal cells: The roles of cdk5 and pp1,2004,FREE RADICAL BIOLOGY AND MEDICINE,ISI/SCOPUS/UCH/VID,http://dx.doi.org/10.1016/j.freeradbiomed.2004.03.007,10.1016/j.freeradbiomed.2004.03.007
1206,"Arredondo, M; Cambiazo, V; Tapia, L; Gonzalez-Aguero, M; Nunez, MT; Uauy, R; Gonzalez, M",Copper overload affects copper and iron metabolism in Hep-G2 cells,2004,AMERICAN JOURNAL OF PHYSIOLOGY-GASTROINTESTINAL AND LIVER PHYSIOLOGY,ISI/SCOPUS/UCH/VID,http://dx.doi.org/ 10.1152/ajpgi.00297.2003, 10.1152/ajpgi.00297.2003
1207,"Nunez, MT; Gallardo, V; Munoz, P; Tapia, V; Esparza, A; Salazar, J; Speisky, H",Progressive iron accumulation induces a biphasic change in the glutathione content of neuroblastoma cells,2004,FREE RADICAL BIOLOGY AND MEDICINE,ISI/SCOPUS/UCH/VID,http://dx.doi.org/10.1016/j.freeradbioomed.2004.06.005,10.1016/j.freeradbioomed.2004.06.005
1208,"Arredondo, M;Munoz, P;Mura, CV;Nunez, MT","DMT1, a physiologically relevant apical Cu1+ transporter of intestinal cells",2003,AMERICAN JOURNAL OF PHYSIOLOGY-CELL PHYSIOLOGY,SCOPUS/ISI/UCH/VID,http://dx.doi.org/10.1152/ajpcell.00480.2002,10.1152/ajpcell.00480.2002
1209,"Lopez, M;Rios, E;Schlesinger, L;Olivares, M;Nunez, MT;Munoz, C",Tumour necrosis factor-alpha transcription in transferrin-stimulated human blood mononuclear cells: is transferrin receptor involved in the signalling mechanism?,2003,BRITISH JOURNAL OF HAEMATOLOGY,ISI/SCOPUS/UCH/VID,http://dx.doi.org/10.1046/j.1365-2141.2003.04186.x,10.1046/j.1365-2141.2003.04186.x
1210,"Carrasco, MA;Kemmerling, U;Muller, M;Hernandez, CS;Nunez, MT;Hidalgo, C",CREB phosphorylation induced by hydrogen peroxide in N2A neurons,2003,BIOPHYSICAL JOURNAL,ISI/UCH/VID,,
1211,"Garrick, MD;Nunez, MT;Olivares, M;Harris, ED",Parallels and contrasts between iron and copper metabolism,2003,BIOMETALS,ISI/SCOPUS/UCH/VID,http://dx.doi.org/10.1023/A:1020735401734,10.1023/A:1020735401734
1212,"Nunez, MT;Nunez-Millacura, C;Tapia, V;Munoz, P;Mazariegos, D;Arredondo, M;Munoz, P;Mura, C;Maccioni, RB",Iron-activated iron uptake: A positive feedback loop mediated by iron regulatory protein 1,2003,BIOMETALS,ISI/SCOPUS/UCH/VID,http://dx.doi.org/10.1023/A:1020743405347,10.1023/A:1020743405347
1213,"Nunez-Millacura, C;Munoz, P;Tapai, V;Nunez, MT",Iron-dependent oxidative damage and iron homeostasis in hippocampal neurons,2003,BIOMETALS,ISI/UCH/VID,,
1214,"Arredondo, M;Munoz, P;Mazariegos, DI;Nunez, MT",Iron and copper transportes by DMT1 in CACO-2 cells,2003,BIOMETALS,ISI/UCH/VID,,
1215,"Egana, JT;Zambrano, C;Nunez, MT;Gonzalez-Billault, C;Maccioni, RB",Iron-induced oxidative stress modify tau phosphorylation patterns in hippocampal cell cultures,2003,BIOMETALS,ISI/SCOPUS/UCH/VID,http://dx.doi.org/10.1023/A:1020727218493,10.1023/A:1020727218493
1216,"Zambrano, C;Egana, T;Gonzalez-Billault, C;Nunez, MT;Maccioni, RB",Regulation of brain tau phosphorylation by the CDK5/P35 system under oxidative stress and iron overload conditions,2002,FREE RADICAL BIOLOGY AND MEDICINE,ISI/UCH/VID,,
1217,"Nunez-Millacura, C;Tapia, V;Munoz, P;Maccioni, RB;Nunez, MT",An oxidative stress-mediated positive-feedback iron uptake loop in neuronal cells,2002,JOURNAL OF NEUROCHEMISTRY,ISI/SCOPUS/UCH/VID,http://dx.doi.org/10.1046/j.1471-4159.2002.00971.x,10.1046/j.1471-4159.2002.00971.x
1218,"Nunez-Millacura, C;Tapia, V;Munoz, P;Maccioni, RB;Nunez, MT",Iron and oxidative stress: A positive-feedback iron uptake loop in neuronal cells.,2002,FREE RADICAL BIOLOGY AND MEDICINE,ISI/UCH/VID,,
1219,"Arredondo, M;Munoz, P;Mura, CV;Nunez, MT",HFE inhibits apical iron uptake by intestinal epithelial (Caco-2) cells,2001,FASEB JOURNAL,ISI/SCOPUS/UCH/VID,http://dx.doi.org/10.1096/fj.00-0578fje,10.1096/fj.00-0578fje
1220,"Nunez, MT; Osorio, A; Tapia, V; Vergara, A; Mura, CV",Iron-induced oxidative stress up-regulates calreticulin levels in intestinal epithelial (Caco-2) cells,2001,JOURNAL OF CELLULAR BIOCHEMISTRY,ISI/SCOPUS/UCH/VID,http://dx.doi.org/10.1002/jcb.1194,10.1002/jcb.1194
1221,"Nunez, MT;Tapia, V;Toyokuni, S;Okada, S",Iron-induced oxidative damage in colon carcinoma (Caco-2) cells,2001,FREE RADICAL RESEARCH,ISI/SCOPUS/UCH/VID,http://dx.doi.org/10.1080/10715760100300061,10.1080/10715760100300061
1222,"Munoz, C;Rios, E;Lopez, M;Olivares, M;Schlesinger, L;Nunez, MT",Iron-transferrin modulates TNF-alpha secretion: Influence of iron status,2000,FASEB JOURNAL,ISI/UCH/VID,,
1223,"Nunez, MT; Garate, MA; Arredondo, M; Tapia, V; Munoz, P",The cellular mechanisms of body iron homeostasis,2000,BIOLOGICAL RESEARCH,ISI/SCIELO-Chile/SCOPUS/UCH/VID,http://dx.doi.org/10.4067/S0716-97602000000200013,10.4067/S0716-97602000000200013
1224,"Garate, MA; Nunez, MT",Overexpression of the ferritin iron-responsive element decreases the labile iron pool and abolishes the regulation of iron absorption by intestinal epithelial (Caco-2) cells,2000,JOURNAL OF BIOLOGICAL CHEMISTRY,SCOPUS/ISI/UCH/VID,http://dx.doi.org/10.1074/jbc.275.3.1651,10.1074/jbc.275.3.1651
1225,"Ohla, K; Veldhuizen, MG; Green, T; Hannum, ME; Bakke, AJ; Moein, ST; Tognetti, A; Postma, EM; Pellegrino, R; Hwang, DLD; Albayay, J; Koyama, S; Nolden, AA; Thomas-Danguin, T; Mucignat-Caretta, C; Menger, NS; Croijmans, I; Ozturk, L; Yanik, H; Pierron, D; Pereda-Loth, V; Nunez-Parra, A; Pineda, AMM; Gillespie, D; Farruggia, MC; Cecchetto, C; Fornazieri, MA; Philpott, C; Voznessenskaya, V; Cooper, KW; Dominguez, PR; Calcinoni, O; de Groot, J; Boesveldt, S; Bhutani, S; Weir, EM; Exten, C; Joseph, PV; Parma, V; Hayes, JE; Niv, MY",A follow-up on quantitative and qualitative olfactory dysfunction and other symptoms in patients recovering from COVID-19 smell loss,2022,RHINOLOGY,ISI/SCOPUS/UCH/VID,http://dx.doi.org/10.4193/Rhin21.415,10.4193/Rhin21.415
1226,"Parma, V; Ohla, K; Veldhuizen, MG; Niv, MY; Kelly, CE; Bakke, AJ; Cooper, KW; Bouysset, C; Pirastu, N; Dibattista, M; Kaur, R; Liuzza, MT; Pepino, MY; Schopf, V; Pereda-Loth, V; Olsson, SB; Gerkin, RC; Dominguez, PR; Albayay, J; Farruggia, MC; Bhutani, S; Fjaeldstad, AW; Kumar, R; Menini, A; Bensafi, M; Sandell, M; Konstantinidis, I; Di Pizio, A; Genovese, F; Ozturk, L; Thomas-Danguin, T; Frasnelli, J; Boesveldt, S; Saatci, O; Saraiva, LR; Lin, CL; Golebiowski, JM; Hwang, LD; Ozdener, MH; Guardia, MD; Laudamiel, C; Ritchie, M; Havlicek, J; Pierron, D; Roura, E; Navarro, M; Nolden, AA; Lim, J; Whitcroft, KL; Colquitt, LR; Ferdenzi, C; Brindha, EV; Altundag, A; Macchi, A; Nunez-Parra, A; Patel, ZM; Fiorucci, S; Philpott, CM; Smith, BC; Lundstrom, JN; Mucignat, C; Parker, JK; van den Brink, M; Schmuker, M; Fischmeister, FPS; Heinbockel, T; Shields, VDC; Faraji, F; Santamaria, E; Fredborg, WEA; Morini, G; Olofsson, JK; Jalessi, M; Karni, N; D'Errico, A; Alizadeh, R; Pellegrino, R; Meyer, P; Huart, C; Chen, B; Soler, GM; Alwashahi, MK; Welge-Lussen, A; Freiherr, J; de Groot, JHB; Klein, H; Okamoto, M; Singh, PB; Hsieh, JW; Reed, DR; Hummel, T; Munger, SD; Hayes, JE","More Than Smell-COVID-19 Is Associated With Severe Impairment of Smell, Taste, and Chemesthesis (vol 45, pg 609, 2020)",2021,CHEMICAL SENSES,ISI/SCOPUS/UCH/VID,http://dx.doi.org/10.1093/chemse/bjab050,10.1093/chemse/bjab050
1227,"Gerkin, RC; Ohla, K; Veldhuizen, MG; Joseph, PV; Kelly, CE; Bakke, AJ; Steele, KE; Farruggia, MC; Pellegrino, R; Pepino, MY; Bouysset, C; Soler, GM; Pereda-Loth, V; Dibattista, M; Cooper, KW; Croijmans, I; Di Pizio, A; Ozdener, MH; Fjaeldstad, AW; Lin, CL; Sandell, MA; Singh, PB; Brindha, VE; Olsson, SB; Saraiva, LR; Ahuja, G; Alwashahi, MK; Bhutani, S; D'Errico, A; Fornazieri, MA; Golebiowski, J; Hwang, LD; Ozturk, L; Roura, E; Spinelli, S; Whitcroft, KL; Faraji, F; Fischmeister, FPS; Heinbockel, T; Hsieh, JW; Huart, C; Konstantinidis, I; Menini, A; Morini, G; Olofsson, JK; Philpott, CM; Pierron, D; Shields, VDC; Voznessenskaya, VV; Albayay, J; Altundag, A; Bensafi, M; Bock, MA; Calcinoni, O; Fredborg, W; Laudamiel, C; Lim, J; Lundstrom, JN; Macchi, A; Meyer, P; Moein, ST; Santamaria, E; Sengupta, D; Dominguez, PR; Yanik, H; Hummel, T; Hayes, JE; Reed, DR; Niv, MY; Munger, SD; Parma, V",Recent Smell Loss Is the Best Predictor of COVID-19 Among Individuals With Recent Respiratory Symptoms,2021,CHEMICAL SENSES,ISI/SCOPUS/UCH/VID,http://dx.doi.org/10.1093/chemse/bjaa081,10.1093/chemse/bjaa081
1228,"Parma V., Ohla K., Veldhuizen M.G., Niv M.Y., Kelly C.E., Bakke A.J., Cooper K.W., Bouysset C., Pirastu N., Dibattista M., Kaur R., Liuzza M.T., Pepino M.Y., Schöpf V., Pereda-Loth V., Olsson S.B., Gerkin R.C., Rohlfs Domínguez P., Albayay J., Farruggia M.C., Bhutani S., Fjaeldstad A.W., Kumar R., Menini A., Bensafi M., Sandell M., Konstantinidis I., Di Pizio A., Genovese F., Öztürk L., Thomas-Danguin T., Frasnelli J., Boesveldt S., Saatci Ö., Saraiva L.R., Lin C., Golebiowski J., Hwang L.-D., Ozdener M.H., Guàrdia M.D., Laudamiel C., Ritchie M., Havlícek J., Pierron D., Roura E., Navarro M., Nolden A.A., Lim J., Whitcroft K.L., Colquitt L.R., Ferdenzi C., Brindha E.V., Altundag A., Macchi A., Nunez-Parra A., Patel Z.M., Fiorucci S., Philpott C.M., Smith B.C., Lundström J.N., Mucignat C., Parker J.K., van den Brink M., Schmuker M., Fischmeister F.P.S., Heinbockel T., Shields V.D.C., Faraji F., Santamaría E., Fredborg W.E.A., Morini G., Olofsson J.K., Jalessi M., Karni N., D'Errico A., Alizadeh R., Pellegrino R., Meyer P., Huart C., Chen B., Soler G.M., Alwashahi M.K., Welge-Lüssen A., Freiherr J., de Groot J.H.B., Klein H., Okamoto M., Singh P.B., Hsieh J.W., Reed D.R., Hummel T., Munger S.D., Hayes J.E., GCCR Group Author","More Than Smell - COVID-19 Is Associated With Severe Impairment of Smell,Taste, and Chemesthesis",2020,CHEMICAL SENSES,SCOPUS/ISI/UCH/VID,http://dx.doi.org/10.1093/chemse/bjaa041,10.1093/chemse/bjaa041
1229,"Cea-Del Rio, CA; Nunez-Parra, A; Freedman, SM; Kushner, JK; Alexander, AL; Restrepo, D; Huntsman, MM",Disrupted inhibitory plasticity and homeostasis in Fragile X syndrome,2020,NEUROBIOLOGY OF DISEASE,ISI/SCOPUS/UCH/VID,http://dx.doi.org/10.1016/j.nbd.2020.104959,10.1016/j.nbd.2020.104959
1230,"Nunez-Parra, A; Cea-Del Rio, CA; Huntsman, MM; Restrepo, D",The Basal Forebrain Modulates Neuronal Response in an Active Olfactory Discrimination Task,2020,FRONTIERS IN CELLULAR NEUROSCIENCE,ISI/SCOPUS/UCH/VID,http://dx.doi.org/10.3389/fncel.2020.00141,10.3389/fncel.2020.00141
1231,"Bodaleo, F; Tapia-Monsalves, C; Cea-Del Rio, C; Gonzalez-Billault, C; Nunez-Parra, A",Structural and Functional Abnormalities in the Olfactory System of Fragile X Syndrome Models,2019,FRONTIERS IN MOLECULAR NEUROSCIENCE,ISI/SCOPUS/UCH/VID,http://dx.doi.org/10.3389/fnmol.2019.00135,10.3389/fnmol.2019.00135
1232,"Carrillo, D; Edwards, N; Arancibia-Altamirano, D; Otarola, F; Villarroel, C; Prieto, CP; Villamizar-Sarmiento, MG; Sauma, D; Valenzuela, F; Lattus, J; Oyarzun-Ampuero, F; Palma, V",Efficacy of stem cell secretome loaded in hyaluronate sponge for topical treatment of psoriasis,2023,BIOENGINEERING & TRANSLATIONAL MEDICINE,ISI/SCOPUS/UCH/VID,http://dx.doi.org/10.1002/btm2.10443,10.1002/btm2.10443
