,Autores,titulo_publicacion,ano,titulo_revistas,tipo_publicacion,link,doi
716,"Stange, C ; Fuentes, P ; Handford, M ; Pizarro, L",Daucus carota as a novel model to evaluate the effect of light on carotenogenic gene expression,2008,BIOLOGICAL RESEARCH,SCIELO-Chile/SCOPUS/ISI/UCH/VID,http://dx.doi.org/10.4067/S0716-97602008000300006,10.4067/S0716-97602008000300006
717,"Handford, MG ; Carr, JP",A defect in carbohydrate metabolism ameliorates symptom severity in virus-infected Arabidopsis thaliana,2007,JOURNAL OF GENERAL VIROLOGY,ISI/SCOPUS/UCH/VID,http://dx.doi.org/10.1099/vir.0.82376-0,10.1099/vir.0.82376-0
718,"Handford, M ; Rodriguez-Furlan, C ; Orellana, A","Nucleotide-sugar transporters: structure, function and roles in vivo",2006,BRAZILIAN JOURNAL OF MEDICAL AND BIOLOGICAL RESEARCH,ISI/SCIELO-otros paises /SCOPUS/UCH/VID,http://dx.doi.org/10.1590/S0100-879X2006000900002,10.1590/S0100-879X2006000900002
719,"Norambuena, L; Nilo, R; Handford, M; Reyes, F; Marchant, L; Meisel, L; Orellana, A",AtUTr2 is an Arabidopsis thaliana nucleotide sugar transporter located in the Golgi apparatus capable of transporting UDP-galactose,2005,PLANTA,ISI/SCOPUS/UCH/VID,http://dx.doi.org/10.1007/s00425-005-1557-x,10.1007/s00425-005-1557-x
720,"Baldwin, TC;Handford, MG;Yuseff, MI;Orellana, A;Dupree, P","Identification and characterization of GONST1, a Golgi-localized GDP-mannose transporter in Arabidopsis",2001,PLANT CELL,SCOPUS/ISI/UCH/VID,http://dx.doi.org/10.1105/tpc.13.10.2283,10.1105/tpc.13.10.2283
721,"Martinez-Bellange, P; von Bernath, D; Navarro, CA; Jerez, CA",Biomining of metals: new challenges for the next 15 years,2022,MICROBIAL BIOTECHNOLOGY,ISI/SCOPUS/UCH/VID,http://dx.doi.org/10.1111/1751-7915.13985,10.1111/1751-7915.13985
722,"Recalde, A; van Wolferen, M; Sivabalasarma, S; Albers, SV; Navarro, CA; Jerez, CA","The Role of Polyphosphate in Motility, Adhesion, and Biofilm Formation in Sulfolobales",2021,MICROORGANISMS,ISI/SCOPUS/UCH/VID,http://dx.doi.org/10.3390/microorganisms9010193,10.3390/microorganisms9010193
723,"Vargas-Straube, MJ; Beard, S; Norambuena, R; Paradela, A; Vera, M; Jerez, CA",High copper concentration reduces biofilm formation in Acidithiobacillus ferrooxidans by decreasing production of extracellular polymeric substances and its adherence to elemental sulfur,2020,JOURNAL OF PROTEOMICS,ISI/SCOPUS/UCH/VID,http://dx.doi.org/10.1016/j.jprot.2020.103874,10.1016/j.jprot.2020.103874
724,Jerez C.A.,Bioleaching and biomining for the industrial recovery of metals,2019,"Comprehensive Biotechnology, Second Edition",SCOPUS/UCH/VID,http://dx.doi.org/10.1016/B978-0-12-809633-8.09185-8,10.1016/B978-0-12-809633-8.09185-8
725,Jerez C.A.,Metal extraction and biomining,2019,Encyclopedia of Microbiology,SCOPUS/UCH/VID,http://dx.doi.org/10.1016/B978-0-12-809633-8.13077-839-52,10.1016/B978-0-12-809633-8.13077-839-52
726,"Ramos-Zuniga, J; Gallardo, S; Martinez-Bussenius, C; Norambuena, R; Navarro, CA; Paradela, A; Jerez, CA",Response of the biomining Acidithiobacillus ferrooxidans to high cadmium concentrations,2019,JOURNAL OF PROTEOMICS,ISI/SCOPUS/UCH/VID,http://dx.doi.org/10.1016/j.jprot.2018.12.013,10.1016/j.jprot.2018.12.013
727,"Soto, DF; Recalde, A; Orell, A; Albers, SV; Paradela, A; Navarro, CA; Jerez, CA",Global effect of the lack of inorganic polyphosphate in the extremophilic archaeon Sulfolobus solfataricus: A proteomic approach,2019,JOURNAL OF PROTEOMICS,SCOPUS/ISI/UCH/VID,http://dx.doi.org/10.1016/j.jprot.2018.02.024,10.1016/j.jprot.2018.02.024
728,"Oetiker, N; Norambuena, R; Martinez-Bussenius, C; Navarro, CA; Amaya, F; Alvarez, SA; Paradela, A; Jerez, CA",Possible role of envelope components in the extreme copper resistance of the biomining Acidithiobacillus ferrooxidans,2018,GENES,ISI/SCOPUS/UCH/VID,http://dx.doi.org/10.3390/genes9070347,10.3390/genes9070347
729,"Rivero, M; Torres-Paris, C; Munoz, R; Cabrera, R; Navarro, CA; Jerez, CA","Inorganic Polyphosphate, Exopolyphosphatase, and Pho84-Like Transporters May Be Involved in Copper Resistance in Metallosphaera sedula DSM 5348(T)",2018,ARCHAEA-AN INTERNATIONAL MICROBIOLOGICAL JOURNAL,ISI/SCOPUS/UCH/VID,http://dx.doi.org/10.1155/2018/5251061,10.1155/2018/5251061
730,"Jerez, CA",Biomining of metals: how to access and exploit natural resource sustainably,2017,MICROBIAL BIOTECHNOLOGY,ISI/SCOPUS/UCH/VID,http://dx.doi.org/10.1111/1751-7915.12792,10.1111/1751-7915.12792
731,"Martinez-Bussenius, C; Navarro, CA; Jerez, CA",Microbial copper resistance: importance in biohydrometallurgy,2017,MICROBIAL BIOTECHNOLOGY,SCOPUS/ISI/UCH/VID,http://dx.doi.org/10.1111/1751-7915.12450,10.1111/1751-7915.12450
732,"Martinez-Bussenius, C; Navarro, CA; Orellana, L; Paradela, A; Jerez, CA",Global response of Acidithiobacillus ferrooxidans ATCC 53993 to high concentrations of copper: A quantitative proteomics approach,2016,JOURNAL OF PROTEOMICS,ISI/SCOPUS/UCH/VID,http://dx.doi.org/10.1016/j.jprot.2016.03.039,10.1016/j.jprot.2016.03.039
733,"Navarro, CA;von Bernath, D;Martinez-Bussenius, C;Castillo, RA;Jerez, CA",Cytoplasmic CopZ-Like Protein and Periplasmic Rusticyanin and AcoP Proteins as Possible Copper Resistance Determinants in Acidithiobacillus ferrooxidans ATCC 23270,2016,APPLIED AND ENVIRONMENTAL MICROBIOLOGY,ISI/SCOPUS/UCH/VID,http://dx.doi.org/10.1128/AEM.02810-15,10.1128/AEM.02810-15
734,"Almarcegui, RJ; Navarro, CA; Paradela, A; Albar, JP; von Bernath, D; Jerez, CA",Response to copper of Acidithiobacillus ferrooxidans ATCC 23270 grown in elemental sulfur,2014,RESEARCH IN MICROBIOLOGY,ISI/SCOPUS/UCH/VID,http://dx.doi.org/10.1016/j.resmic.2014.07.005,10.1016/j.resmic.2014.07.005
735,"Almarcegui, RJ;Navarro, CA;Paradela, A;Albar, JP;von Bernath, D;Jerez, CA",New Copper Resistance Determinants in the Extremophile Acidithiobacillus ferrooxidans: A Quantitative Proteomic Analysis,2014,JOURNAL OF PROTEOME RESEARCH,ISI/SCOPUS/UCH/VID,http://dx.doi.org/10.1021/pr4009833,10.1021/pr4009833
736,"Almárcegui Zamorano, Rodrigo; Navarro Martínez, Claudio; Paradela, Alberto; Von Bernath Preece, Diego; Jerez Guevara, Carlos",Novel cell envelope proteins related to copper resistance in acidithiobacillus ferrooxidans,2013,Advanced Materials Research,SCOPUS/UCH/VID,,
737,"Jerez Guevara, Carlos",The Use of Extremophilic Microorganisms in the Industrial Recovery of Metals,2013,Extremophiles: Sustainable Resources and Biotechnological Implications,SCOPUS/UCH/VID,http://dx.doi.org/10.1002/9781118394144.ch12,10.1002/9781118394144.ch12
738,"Navarro, CA;von Bernath, D;Jerez, CA",Heavy Metal Resistance Strategies of Acidophilic Bacteria and Their Acquisition: Importance for Biomining and Bioremediation,2013,BIOLOGICAL RESEARCH,SCOPUS/ISI/SCIELO-Chile/UCH/VID,http://dx.doi.org/10.4067/S0716-97602013000400008,10.4067/S0716-97602013000400008
739,"Orell, A;Remonsellez, F;Arancibia, R;Jerez, CA",Molecular Characterization of Copper and Cadmium Resistance Determinants in the Biomining Thermoacidophilic Archaeon Sulfolobus metallicus,2013,ARCHAEA-AN INTERNATIONAL MICROBIOLOGICAL JOURNAL,SCOPUS/ISI/UCH/VID,http://dx.doi.org/10.1155/2013/289236,10.1155/2013/289236
740,"Orell, A;Navarro, CA;Rivero, M;Aguilar, JS;Jerez, CA",Inorganic polyphosphates in extremophiles and their possible functions,2012,EXTREMOPHILES,SCOPUS/ISI/UCH/VID,http://dx.doi.org/10.1007/s00792-012-0457-9,10.1007/s00792-012-0457-9
741,"Ruiz, LM; Castro, M; Barriga, A; Jerez, CA; Guiliani, N",The extremophile Acidithiobacillus ferrooxidans possesses a c-di-GMP signalling pathway that could play a significant role during bioleaching of minerals,2012,LETTERS IN APPLIED MICROBIOLOGY,ISI/SCOPUS/UCH/VID,http://dx.doi.org/10.1111/j.1472-765X.2011.03180.x,10.1111/j.1472-765X.2011.03180.x
742,Jerez C.A.,Bioleaching and Biomining for the Industrial Recovery of Metals,2011,"Comprehensive Biotechnology, Second Edition",SCOPUS/UCH/VID,http://dx.doi.org/10.1016/B978-0-08-088504-9.00234-8,10.1016/B978-0-08-088504-9.00234-8
743,"Beard, S; Paradela, A; Albar, JP; Jerez, CA",Growth of Acidithiobacillus ferrooxidans ATCC 23270 in thiosulfate under oxygen-limiting conditions generates extracellular sulfur globules by means of a secreted tetrathionate hydrolase,2011,FRONTIERS IN MICROBIOLOGY,ISI/SCOPUS/UCH/VID,http://dx.doi.org/10.3389/fmicb.2011.00079,10.3389/fmicb.2011.00079
744,Chavez F.P; Lagos C.F; Reyes-Parada M; Guiliani N; Jerez C.A.,Polyphosphate synthesis as a target for novel antibiotics,2011,Current Enzyme Inhibition,SCOPUS/UCH/VID,http://dx.doi.org/10.2174/157340811798807605,10.2174/157340811798807605
745,"Orellana, LH;Jerez, CA",A genomic island provides Acidithiobacillus ferrooxidans ATCC 53993 additional copper resistance: a possible competitive advantage,2011,APPLIED MICROBIOLOGY AND BIOTECHNOLOGY,ISI/SCOPUS/UCH/VID,http://dx.doi.org/10.1007/s00253-011-3494-x,10.1007/s00253-011-3494-x
746,"Orell, A; Navarro, CA; Arancibia, R; Mobarec, JC; Jerez, CA",Life in blue: Copper resistance mechanisms of bacteria and Archaea used in industrial biomining of minerals,2010,BIOTECHNOLOGY ADVANCES,ISI/SCOPUS/UCH/VID,http://dx.doi.org/10.1016/j.biotechadv.2010.07.003,10.1016/j.biotechadv.2010.07.003
747,"Varela, C; Mauriaca, C; Paradela, A; Albar, JP; Jerez, CA; Chavez, FP",New structural and functional defects in polyphosphate deficient bacteria: A cellular and proteomic study,2010,BMC MICROBIOLOGY,ISI/SCOPUS/UCH/VID,http://dx.doi.org/10.1186/1471-2180-10-7,10.1186/1471-2180-10-7
748,Chavez F.P; Mauriaca C; Jerez C.A.,Constitutive and regulated expression vectors to construct polyphosphate deficient bacteria,2009,BMC RESEARCH NOTES,SCOPUS/UCH/VID,http://dx.doi.org/10.1186/1756-0500-2-50,10.1186/1756-0500-2-50
749,Castro M; Ruiz L.M; Barriga A; Jerez C.A; Holmes D; Guiliani N.,C-di-GMP pathway in biomining bacteria,2009,Advanced Materials Research,SCOPUS/UCH/VID,http://dx.doi.org/10.4028/www.scientific.net/AMR.71-73.223,10.4028/www.scientific.net/AMR.71-73.223
750,Pagliai F.A; Jerez C.A.,The secretome of the extremophilic Acidithiobacillus ferrooxidans ATCC 23270,2009,Advanced Materials Research,SCOPUS/UCH/VID,http://dx.doi.org/10.4028/www.scientific.net/AMR.71-73.183,10.4028/www.scientific.net/AMR.71-73.183
751,Orell A; Navarro C.A; Jerez C.A.,Copper resistance mechanisms of biomining bacteria and archaea living under extremely high concentrations of metals,2009,Advanced Materials Research,SCOPUS/UCH/VID,http://dx.doi.org/10.4028/www.scientific.net/AMR.71-73.279,10.4028/www.scientific.net/AMR.71-73.279
752," Navarro, CA ; Orellana, LH ; Mauriaca, C ; Jerez, CA ",Transcriptional and Functional Studies of Acidithiobacillus ferrooxidans Genes Related to Survival in the Presence of Copper,2009,APPLIED AND ENVIRONMENTAL MICROBIOLOGY,SCOPUS/ISI/UCH/VID,http://dx.doi.org/10.1128/AEM.00308-09,10.1128/AEM.00308-09
753,"Jerez, CA","The use of genomics, proteomics and other OMICS technologies for the global understanding of biomining microorganisms",2008,HYDROMETALLURGY,ISI/SCOPUS/UCH/VID,http://dx.doi.org/10.1016/j.hydromet.2008.05.032,10.1016/j.hydromet.2008.05.032
754,"Ruiz, LM; Valenzuela, S; Castro, M; Gonzalez, A; Frezza, M; Soulere, L; Rohwerder, T; Queneau, Y; Doutheau, A; Sand, W; Jerez, CA; Guiliani, N",AHL communication is a widespread phenomenon in biomining bacteria and seems to be involved in mineral-adhesion efficiency,2008,HYDROMETALLURGY,ISI/SCOPUS/UCH/VID,http://dx.doi.org/10.1016/j.hydromet.2008.05.028,10.1016/j.hydromet.2008.05.028
755,"Frezza, M ; Soulere, L ; Reverchon, S ; Guiliani, N ; Jerez, C ; Queneau, Y ; Doutheau, A",Synthetic homoserine lactone-derived sulfonylureas as inhibitors of Vibrio fischeri quorum sensing regulator,2008,BIOORGANIC & MEDICINAL CHEMISTRY,ISI/SCOPUS/UCH/VID,http://dx.doi.org/10.1016/j.bmc.2008.02.023,10.1016/j.bmc.2008.02.023
756,"Vera, M ; Pagliai, F ; Guiliani, N ; Jerez, CA",The chemolithoautotroph Acidithiobacillus ferrooxidans can survive under phosphate-limiting conditions by expressing a C-P lyase operon that allows it to grow on phosphonates,2008,APPLIED AND ENVIRONMENTAL MICROBIOLOGY,SCOPUS/ISI/UCH/VID,http://dx.doi.org/10.1128/AEM.02101-07,10.1128/AEM.02101-07
757,"Soulere, L ; Guiliani, N ; Queneau, Y ; Jerez, CA ; Doutheau, A",Molecular insights into quorum sensing in Acidithiobacillus ferrooxidans bacteria via molecular modelling of the transcriptional regulator AfeR and of the binding mode of long-chain acyl homoserine lactones,2008,JOURNAL OF MOLECULAR MODELING,ISI/SCOPUS/UCH/VID,http://dx.doi.org/10.1007/s00894-008-0315-y,10.1007/s00894-008-0315-y
758,"Jerez Guevara, Carlos",Proteomics and metaproteomics applied to biomining microorganisms,2007,Microbial Processing of Metal Sulfides,SCOPUS/UCH/VID,,
759,"Valenzuela, S., Banderas, A., Jerez, C.A., Guiliani, N.",Cell-cell communication in bacteria: A promising new approach to improve bioleaching efficiency?,2007,Microbial Processing of Metal Sulfides,SCOPUS/UCH/VID,,
760,Jerez C.A.,Biomining in the post-genomic age: Advances and perspectives,2007,Advanced Materials Research,SCOPUS/UCH/VID,,
761,Ruiz L.M; Gonzalez A; Frezza M; Soulere L; Queneau Y; Doutheau A; Rohwerder T; Sand W; Jerez C.A; Guiliani N.,Is the quorum sensing type AI-1 system of Acidithiobacillus ferrooxidans involved in its attachment to mineral surfaces?,2007,Advanced Materials Research,SCOPUS/UCH/VID,,
762,Ruiz L.M; Sand W; Jerez C.A; Guiliani N.,C-di-GMP pathway in Acidithiobacillus ferrooxidans: Analysis of putative diguanylate cyclases (DGCs) and phosphodiesterases (PDEs) bifunctional proteins,2007,Advanced Materials Research,SCOPUS/UCH/VID,,
763,"Chi, A; Valenzuela, L; Beard, S; Mackey, AJ; Shabanowitz, J; Hunt, DF; Jerez, CA",Periplasmic proteins of the extremophile Acidithiobacillus ferrooxidans,2007,MOLECULAR & CELLULAR PROTEOMICS,SCOPUS/ISI/UCH/VID,http://dx.doi.org/10.1074/mcp.M700042-MCP200,10.1074/mcp.M700042-MCP200
764,"Gordillo, F; Chavez, FP; Jerez, CA",Motility and chemotaxis of Pseudomonas sp B4 towards polychlorobiphenyls and chlorobenzoates,2007,FEMS MICROBIOLOGY ECOLOGY,ISI/SCOPUS/UCH/VID,http://dx.doi.org/10.1111/j.1574-6941.2007.00293.x,10.1111/j.1574-6941.2007.00293.x
765,"Remonsellez, F; Orell, A; Jerez, CA",Copper tolerance of the thermoacidophilic archaeon Sulfolobus metallicus: possible role of polyphosphate metabolism,2006,MICROBIOLOGY-SGM,SCOPUS/ISI/UCH/VID,http://dx.doi.org/10.1099/mic.0.28241-0,10.1099/mic.0.28241-0
766,"Valenzuela, L; Chi, A; Beard, S; Orell, A; Guiliani, N; Shabanowitz, J; Hunt, DF; Jerez, CA","Genomics, metagenomics and proteomics in biomining microorganisms",2006,BIOTECHNOLOGY ADVANCES,ISI/SCOPUS/UCH/VID,http://dx.doi.org/10.1016/j.biotechadv.2005.09.004,10.1016/j.biotechadv.2005.09.004
767,"Chavez, FP; Gordillo, F; Jerez, CA",Adaptive responses and cellular behaviour of biphenyl-degrading bacteria toward polychlorinated biphenyls,2006,BIOTECHNOLOGY ADVANCES,ISI/SCOPUS/UCH/VID,http://dx.doi.org/10.1016/j.biotechadv.2005.11.007,10.1016/j.biotechadv.2005.11.007
768,"Farah, C; Vera, M; Morin, D; Haras, D; Jerez, CA; Guiliani, N",Evidence for a functional quorum-sensing type AI-1 system in the extremophilic bacterium Acidithiobacillus ferrooxidans,2005,APPLIED AND ENVIRONMENTAL MICROBIOLOGY,SCOPUS/ISI/UCH/VID,http://dx.doi.org/10.1128/AEM.71.11.7033-7040.2005,10.1128/AEM.71.11.7033-7040.2005
769,"Leyton, P; Lizama-Vergara, PA; Campos-Vallette, MM; Becker, MI; Clavijo, E; Reyes, IC; Vera, M; Jerez, CA",Surface enhanced Raman spectrum of nanometric molecular systems,2005,JOURNAL OF THE CHILEAN CHEMICAL SOCIETY,SCIELO-Chile/SCOPUS/ISI/UCH/VID,http://dx.doi.org/10.4067/S0717-97072005000400014,10.4067/S0717-97072005000400014
770,"Acosta, M; Beard, S; Ponce, J; Vera, M; Mobarec, JC; Jerez, CA",Identification of putative sulfurtransferase genes in the extremophilic Acidithiobacillus ferrooxidans ATCC 23270 genome: Structural and functional characterization of the proteins,2005,OMICS-A JOURNAL OF INTEGRATIVE BIOLOGY,SCOPUS/ISI/UCH/VID,http://dx.doi.org/10.1089/omi.2005.9.13,10.1089/omi.2005.9.13
771,"Alvarez, S; Jerez, CA",Copper ions stimulate polyphosphate degradation and phosphate efflux in Acidithiobacillus ferrooxidans,2004,APPLIED AND ENVIRONMENTAL MICROBIOLOGY,SCOPUS/ISI/UCH/VID,http://dx.doi.org/10.1128/AEM.70.9.5177-5182.2004,10.1128/AEM.70.9.5177-5182.2004
772,"Chavez, FP; Lunsdorf, H; Jerez, CA",Growth of polychlorinated-biphenyl-degirading bacteria in the presence of biphenyl and chlorobiphenyls generates oxidative stress and massive accumulation of inorganic polyphosphate,2004,APPLIED AND ENVIRONMENTAL MICROBIOLOGY,SCOPUS/ISI/UCH/VID,http://dx.doi.org/10.1128/AEM.70.5.3664-3072.2004,10.1128/AEM.70.5.3664-3072.2004
773,"Ramirez, P; Guiliani, N; Valenzuela, L; Beard, S; Jerez, CA","Differential protein expression during growth of Acidithiobacillus ferrooxidans on ferrous iron, sulfur compounds, or metal sulfides",2004,APPLIED AND ENVIRONMENTAL MICROBIOLOGY,SCOPUS/ISI/UCH/VID,http://dx.doi.org/10.1128/AEM.70.8.4491-4498.2004,10.1128/AEM.70.8.4491-4498.2004
774,"Vera, M;Guiliani, N;Jerez, CA",Proteomic and genomic analysis of the phosphate starvation response of Acidithiobacillus ferrooxidans,2003,HYDROMETALLURGY,ISI/SCOPUS/UCH/VID,http://dx.doi.org/10.1016/S0304-386X(03)00148-8,10.1016/S0304-386X(03)00148-8
775,"Toledo, H;Valenzuela, M;Rivas, A;Jerez, CA",Acid stress response in Helicobacter pylori,2002,FEMS MICROBIOLOGY LETTERS,ISI/SCOPUS/UCH/VID,http://dx.doi.org/10.1016/S0378-1097(02)00789-9,10.1016/S0378-1097(02)00789-9
776,"Cardona, ST;Chavez, FP;Jerez, CA",The exopolyphosphatase gene from Sulfolobus solfataricus: Characterization of the first gene found to be involved in polyphosphate metabolism in Archaea,2002,APPLIED AND ENVIRONMENTAL MICROBIOLOGY,SCOPUS/ISI/UCH/VID,http://dx.doi.org/10.1128/AEM.68.10.4812.4819.2002,10.1128/AEM.68.10.4812.4819.2002
777,"Ramirez, P;Toledo, H;Guiliani, N;Jerez, CA",An exported rhodanese-like protein is induced during growth of Acidithiobacillus ferrooxidans in metal sulfides and different sulfur compounds,2002,APPLIED AND ENVIRONMENTAL MICROBIOLOGY,SCOPUS/ISI/UCH/VID,http://dx.doi.org/10.1128/AEM.68.4.1837-1845.2002,10.1128/AEM.68.4.1837-1845.2002
778,"Jerez, CA",Chemotactic transduction in biomining microorganisms,2001,HYDROMETALLURGY,SCOPUS/ISI/UCH/VID,http://dx.doi.org/10.1016/S0304-386X(00)00177-8,10.1016/S0304-386X(00)00177-8
779,"Cardona, S;Remonsellez, F;Guiliani, N;Jerez, CA",The glycogen-bound polyphosphate kinase from Sulfolobus acidocaldarius is actually a glycogen synthase,2001,APPLIED AND ENVIRONMENTAL MICROBIOLOGY,SCOPUS/ISI/UCH/VID,http://dx.doi.org/10.1128/AEM.67.10.4773-4780.2001,10.1128/AEM.67.10.4773-4780.2001
780,"Guiliani, N; Jerez, CA","Molecular cloning, sequencing, and expression of omp-40, the gene coding for the major outer membrane protein from the acidophilic bacterium Thiobacillus ferrooxidans",2000,APPLIED AND ENVIRONMENTAL MICROBIOLOGY,SCOPUS/ISI/UCH/VID,http://dx.doi.org/10.1128/AEM.66.6.2318-2324.2000,10.1128/AEM.66.6.2318-2324.2000
781,"Marín J., Aguilera P., Lagos R., Marcoleta A.",Assessment of Intracellular Amyloid Formation in Fixed and Live Bacteria Using Fluorescence Microscopy,2022,Methods in Molecular Biology,SCOPUS/UCH/VID,http://dx.doi.org/10.1007/978-1-0716-2529-3_17,10.1007/978-1-0716-2529-3_17
782,"Aguilera P., Marín J., Lagos R., Marcoleta A.",Identification of Aggregation-Prone and Gatekeeper Residues in Bacterial Amyloids Using Site-Directed Mutagenesis and Flow Cytometry,2022,Methods in Molecular Biology,SCOPUS/UCH/VID,http://dx.doi.org/10.1007/978-1-0716-2529-3_18,10.1007/978-1-0716-2529-3_18
783,"Marcoleta, AE; Arros, P; Varas, MA; Costa, J; Rojas-Salgado, J; Berrios-Pasten, C; Tapia-Fuentes, S; Silva, D; Fierro, J; Canales, N; Chavez, FP; Gaete, A; Gonzalez, M; Allende, ML; Lagos, R",The highly diverse Antarctic Peninsula soil microbiota as a source of novel resistance genes,2022,SCIENCE OF THE TOTAL ENVIRONMENT,ISI/SCOPUS/UCH/VID,http://dx.doi.org/10.1016/j.scitotenv.2021.152003,10.1016/j.scitotenv.2021.152003
784,"Varas, MA; Munoz-Montecinos, C; Kallens, V; Simon, V; Allende, ML; Marcoleta, AE; Lagos, R",Exploiting Zebrafish Xenografts for Testing the in vivo Antitumorigenic Activity of Microcin E492 Against Human Colorectal Cancer Cells,2020,FRONTIERS IN MICROBIOLOGY,ISI/SCOPUS/UCH/VID,http://dx.doi.org/10.3389/fmicb.2020.00405,10.3389/fmicb.2020.00405
785,"Araya, G; Benites, J; Reyes, JS; Marcoleta, AE; Valderrama, JA; Lagos, R; Monasterio, O",Inhibition of Escherichia coli and Bacillus subtilis FtsZ Polymerization and Bacillus subtilis Growth by Dihydroxynaphtyl Aryl Ketones,2019,FRONTIERS IN MICROBIOLOGY,ISI/SCOPUS/UCH/VID,http://dx.doi.org/10.3389/fmicb.2019.01225,10.3389/fmicb.2019.01225
786,"Marcoleta, AE; Gutierrez-Cortez, S; Hurtado, F; Argandona, Y; Corsini, G; Monasterio, O; Lagos, R",The Ferric uptake regulator (Fur) and iron availability control the production and maturation of the antibacterial peptide microcin E492,2018,PLOS ONE,ISI/SCOPUS/UCH/VID,http://dx.doi.org/10.1371/journal.pone.0200835,10.1371/journal.pone.0200835
787,"Marcoleta, AE; Varas, MA; Ortiz-Severin, J; Vasquez, L; Berrios-Pasten, C; Sabag, AV; Chavez, FP; Allende, ML; Santiviago, CA; Monasterio, O; Lagos, R",Evaluating Different Virulence Traits of Klebsiella pneumoniae Using Dictyostelium discoideum and Zebrafish Larvae as Host Models,2018,FRONTIERS IN CELLULAR AND INFECTION MICROBIOLOGY,ISI/SCOPUS/UCH/VID,http://dx.doi.org/10.3389/fcimb.2018.00030,10.3389/fcimb.2018.00030
788,"Márquez I.F., Mateos-Gil P., Shin J.Y., Lagos R., Monasterio O., Vélez M.",Mutations on FtsZ lateral helix H3 that disrupt cell viability hamper reorganization of polymers on lipid surfaces,2017,BIOCHIMICA ET BIOPHYSICA ACTA-BIOMEMBRANES,ISI/SCOPUS/UCH/VID,http://dx.doi.org/10.1016/j.bbamem.2017.06.009,10.1016/j.bbamem.2017.06.009
789,"Araya, G; Lagos, R; Monasterio, O",Phosphoenol pyruvate increases the stability of Escherichia coli and Bacillus subtillis FtsZ polymers by inhibition of the GTPase activity,2017,FEBS JOURNAL,ISI/UCH/VID,,
790,"Diaz-Celis, C; Risca, VI; Hurtado, F; Polka, JK; Hansen, SD; Maturana, D; Lagos, R; Mullins, RD; Monasterio, O","Bacterial Tubulins A and B Exhibit Polarized Growth, Mixed-Polarity Bundling, and Destabilization by GTP Hydrolysis",2017,JOURNAL OF BACTERIOLOGY,ISI/SCOPUS/UCH/VID,http://dx.doi.org/10.1128/JB.00211-17,10.1128/JB.00211-17
791,"Concha-Marambio, L; Maldonado, P; Lagos, R; Monasterio, O; Montecinos-Franjola, F",Thermal adaptation of mesophilic and thermophilic FtsZ assembly by modulation of the critical concentration,2017,PLOS ONE,ISI/SCOPUS/UCH/VID,http://dx.doi.org/10.1371/journal.pone.0185707,10.1371/journal.pone.0185707
792,"Benites, J; Valderrama, JA; Rios, D; Lagos, R; Monasterio, O; Calderon, PB",Inhibition of cancer cell growth and migration by dihydroxynaphthyl aryl ketones,2016,MOLECULAR & CELLULAR TOXICOLOGY,ISI/SCOPUS/UCH/VID,http://dx.doi.org/10.1007/s13273-016-0028-8,10.1007/s13273-016-0028-8
793,"Marcoleta, AE; Berrios-Pasten, C; Nunez, G; Monasterio, O; Lagos, R",Klebsiella pneumoniae Asparagine tDNAs Are Integration Hotspots for Different Genomic Islands Encoding Microcin E492 Production Determinants and Other Putative Virulence Factors Present in Hypervirulent Strains,2016,FRONTIERS IN MICROBIOLOGY,ISI/SCOPUS/UCH/VID,http://dx.doi.org/10.3389/fmicb.2016.00849,10.3389/fmicb.2016.00849
794,"Aguilera, P; Marcoleta, A; Lobus-Ruiz, P; Arranz, R; Valpuesta, JM; Monasterio, O; Lagos, R",Identification of Key Amino Acid Residues Modulating Intracellular and In vitro Microcin E492 Amyloid Formation,2016,FRONTIERS IN MICROBIOLOGY,ISI/SCOPUS/UCH/VID,http://dx.doi.org/10.3389/fmicb.2016.00035,10.3389/fmicb.2016.00035
795,"Gutierrez, E; Benites, J; Valderrama, JA; Calderon, PB; Verrax, J; Nova, E; Villanelo, F; Maturana, D; Escobar, C; Lagos, R; Monasterio, O",Binding of dihydroxynaphthyl aryl ketones to tubulin colchicine site inhibits microtubule assembly,2015,BIOCHEMICAL AND BIOPHYSICAL RESEARCH COMMUNICATIONS,ISI/SCOPUS/UCH/VID,http://dx.doi.org/10.1016/j.bbrc.2015.09.041,10.1016/j.bbrc.2015.09.041
796,"Monasterio, O;Gutierrez, E;Benites, J;Valderrama, JA;Calderon, PB;Verrax, J;Nova, E;Villanelo, F;Maturana, D;Lagos, R",Dihydroxynaphthyl aryl ketones as tubulin polymerization and cancer cell growth inhibitors,2014,FEBS JOURNAL,ISI/UCH/VID,,
797,"Lagos, R",From genes to applications in antibacterial next generation therapy,2014,FEBS JOURNAL,ISI/UCH/VID,,
798,"Marcoleta, A;Nunez, G;Monasterio, O;Lagos, R",Characterization of the genomic island harboring the gene cluster for production of the antibacterial peptide microcin E492,2014,FEBS JOURNAL,ISI/UCH/VID,,
799,"Montecinos-Franjola, F;James, NG;Concha-Marambio, L;Brunet, JE;Lagos, R;Monasterio, O;Jameson, DM",Single tryptophan mutants of FtsZ: Nucleotide binding/exchange and conformational transitions,2014,BIOCHIMICA ET BIOPHYSICA ACTA-PROTEINS AND PROTEOMICS,ISI/SCOPUS/UCH/VID,http://dx.doi.org/10.1016/j.bbapap.2014.03.012,10.1016/j.bbapap.2014.03.012
800,"Marcoleta A., Gutiérrez-Cortez S., Maturana D., Monasterio O., Lagos R.",Whole-genome sequence of the microcin E492-producing strain Klebsiella pneumoniae RYC492,2013,Genome Announcements,SCOPUS/UCH/VID,http://dx.doi.org/10.1128/genomeA.00178-13,10.1128/genomeA.00178-13
801,"Marcoleta, A;Marin, M;Mercado, G;Valpuesta, JM;Monasterio, O;Lagos, R",Microcin E492 Amyloid Formation Is Retarded by Posttranslational Modification,2013,JOURNAL OF BACTERIOLOGY,SCOPUS/ISI/UCH/VID,http://dx.doi.org/10.1128/JB.00564-13,10.1128/JB.00564-13
802,"Shin, JY;Vollmer, W;Lagos, R;Monasterio, O","Glutamate 83 and arginine 85 of helix H3 bend are key residues for FtsZ polymerization, GTPase activity and cellular viability of Escherichia coli: lateral mutations affect FtsZ polymerization and E. coli viability",2013,BMC MICROBIOLOGY,ISI/SCOPUS/UCH/VID,http://dx.doi.org/10.1186/1471-2180-13-26,10.1186/1471-2180-13-26
803,"Lagos, R;Poch, A;Villanelo, F;Monasterio, O",Protease Engineering,2012,PROTEIN SCIENCE,ISI/UCH/VID,,
